2026-02-11 21:09:31,191 - INFO - Device: cpu
2026-02-11 21:09:31,191 - INFO - Config: {'device': 'cpu', 'lr': 0.005, 'epochs_per_task': 4, 'batch_size': 128, 'lambda_slice': 2.0, 'lambda_feat': 0.5, 'lambda_ldc': 1.0}
2026-02-11 21:09:31,194 - INFO - ========== Task 0: classes [0, 1] ==========
2026-02-11 21:09:38,297 - INFO - [Task 0 | ep 0 | step 0] loss=0.8702 c=0.8702 r=0.0000 | CI_T0=96.58%
2026-02-11 21:09:42,254 - INFO - [Task 0 | ep 0 | step 25] loss=0.0026 c=0.0026 r=0.0000 | CI_T0=99.32%
2026-02-11 21:09:46,241 - INFO - [Task 0 | ep 0 | step 50] loss=0.0172 c=0.0172 r=0.0000 | CI_T0=99.89%
2026-02-11 21:09:50,256 - INFO - [Task 0 | ep 0 | step 75] loss=0.0007 c=0.0007 r=0.0000 | CI_T0=99.77%
2026-02-11 21:09:57,800 - INFO - [Task 0 | ep 1 | step 100] loss=0.0006 c=0.0006 r=0.0000 | CI_T0=99.95%
2026-02-11 21:10:01,785 - INFO - [Task 0 | ep 1 | step 125] loss=0.0004 c=0.0004 r=0.0000 | CI_T0=99.95%
2026-02-11 21:10:05,745 - INFO - [Task 0 | ep 1 | step 150] loss=0.0024 c=0.0024 r=0.0000 | CI_T0=99.95%
2026-02-11 21:10:09,723 - INFO - [Task 0 | ep 1 | step 175] loss=0.0002 c=0.0002 r=0.0000 | CI_T0=99.90%
2026-02-11 21:10:17,200 - INFO - [Task 0 | ep 2 | step 200] loss=0.0286 c=0.0286 r=0.0000 | CI_T0=99.88%
2026-02-11 21:10:21,180 - INFO - [Task 0 | ep 2 | step 225] loss=0.0112 c=0.0112 r=0.0000 | CI_T0=99.93%
2026-02-11 21:10:25,145 - INFO - [Task 0 | ep 2 | step 250] loss=0.0027 c=0.0027 r=0.0000 | CI_T0=99.95%
2026-02-11 21:10:29,122 - INFO - [Task 0 | ep 2 | step 275] loss=0.0002 c=0.0002 r=0.0000 | CI_T0=99.97%
2026-02-11 21:10:36,628 - INFO - [Task 0 | ep 3 | step 300] loss=0.0002 c=0.0002 r=0.0000 | CI_T0=99.98%
2026-02-11 21:10:40,592 - INFO - [Task 0 | ep 3 | step 325] loss=0.0001 c=0.0001 r=0.0000 | CI_T0=99.98%
2026-02-11 21:10:44,543 - INFO - [Task 0 | ep 3 | step 350] loss=0.0001 c=0.0001 r=0.0000 | CI_T0=99.94%
2026-02-11 21:10:48,508 - INFO - [Task 0 | ep 3 | step 375] loss=0.0001 c=0.0001 r=0.0000 | CI_T0=99.99%
2026-02-11 21:10:52,876 - INFO - [After Task 0] Task-IL : T0=99.95% | Avg=99.95%
2026-02-11 21:10:52,876 - INFO - [After Task 0] Class-IL: T0=99.95% | Avg=99.95%
2026-02-11 21:10:52,877 - INFO - ========== GROUP DIFFERENCES ==========
2026-02-11 21:10:52,877 - INFO - Seen tasks: 0..0 | valid_out_dim=2
2026-02-11 21:10:54,885 - INFO - [Group=Task0] CI_acc=99.95% | corr_slice_max=4.967 | best_other_max=nan | gap=nan
2026-02-11 21:10:54,886 - INFO - [Group=Task0] winner_task_dist: W0=100.0%
2026-02-11 21:10:54,886 - INFO - [Group=Task0] slice_strength : S0=4.97
2026-02-11 21:10:54,886 - INFO - ======================================
2026-02-11 21:10:54,886 - INFO - ========== Task 1: classes [2, 3] ==========
2026-02-11 21:11:05,852 - INFO - [Task 1 | ep 0 | step 0] loss=6.8779 c=4.1845 r=2.3773 | ldc=0.3160 | CI_T0=99.93% | CI_T1=10.58%
2026-02-11 21:11:13,749 - INFO - [Task 1 | ep 0 | step 25] loss=1.2878 c=0.1559 r=1.1051 | ldc=0.0269 | CI_T0=27.42% | CI_T1=96.72%
2026-02-11 21:11:21,661 - INFO - [Task 1 | ep 0 | step 50] loss=1.0863 c=0.1305 r=0.9448 | ldc=0.0109 | CI_T0=3.57% | CI_T1=97.52%
2026-02-11 21:11:29,523 - INFO - [Task 1 | ep 0 | step 75] loss=1.0911 c=0.1461 r=0.9356 | ldc=0.0094 | CI_T0=0.54% | CI_T1=98.04%
2026-02-11 21:11:41,031 - INFO - [Task 1 | ep 1 | step 100] loss=0.7102 c=0.0912 r=0.6110 | ldc=0.0080 | CI_T0=1.76% | CI_T1=98.01%
2026-02-11 21:11:49,002 - INFO - [Task 1 | ep 1 | step 125] loss=0.9407 c=0.1052 r=0.8245 | ldc=0.0110 | CI_T0=4.71% | CI_T1=98.48%
2026-02-11 21:11:56,970 - INFO - [Task 1 | ep 1 | step 150] loss=0.9127 c=0.1096 r=0.7920 | ldc=0.0112 | CI_T0=0.00% | CI_T1=98.68%
2026-02-11 21:12:04,988 - INFO - [Task 1 | ep 1 | step 175] loss=0.9593 c=0.0791 r=0.8737 | ldc=0.0065 | CI_T0=9.32% | CI_T1=98.77%
2026-02-11 21:12:16,478 - INFO - [Task 1 | ep 2 | step 200] loss=0.9339 c=0.0942 r=0.8327 | ldc=0.0071 | CI_T0=1.91% | CI_T1=98.13%
2026-02-11 21:12:24,405 - INFO - [Task 1 | ep 2 | step 225] loss=1.0575 c=0.1489 r=0.9012 | ldc=0.0074 | CI_T0=0.03% | CI_T1=98.95%
2026-02-11 21:12:32,324 - INFO - [Task 1 | ep 2 | step 250] loss=0.7035 c=0.0815 r=0.6147 | ldc=0.0072 | CI_T0=1.32% | CI_T1=99.01%
2026-02-11 21:12:40,272 - INFO - [Task 1 | ep 2 | step 275] loss=0.8649 c=0.0979 r=0.7596 | ldc=0.0075 | CI_T0=2.49% | CI_T1=98.80%
2026-02-11 21:12:51,681 - INFO - [Task 1 | ep 3 | step 300] loss=0.9299 c=0.0715 r=0.8518 | ldc=0.0067 | CI_T0=1.75% | CI_T1=98.99%
2026-02-11 21:12:59,564 - INFO - [Task 1 | ep 3 | step 325] loss=0.7521 c=0.0705 r=0.6748 | ldc=0.0068 | CI_T0=3.33% | CI_T1=99.05%
2026-02-11 21:13:07,496 - INFO - [Task 1 | ep 3 | step 350] loss=0.8141 c=0.0694 r=0.7383 | ldc=0.0064 | CI_T0=0.25% | CI_T1=98.75%
2026-02-11 21:13:15,426 - INFO - [Task 1 | ep 3 | step 375] loss=1.7920 c=0.0464 r=1.7335 | ldc=0.0121 | CI_T0=2.26% | CI_T1=99.16%
2026-02-11 21:13:23,672 - INFO - [After Task 1] Task-IL : T0=99.95% | T1=99.17% | Avg=99.56%
2026-02-11 21:13:23,672 - INFO - [After Task 1] Class-IL: T0=2.41% | T1=99.17% | Avg=50.79%
2026-02-11 21:13:23,672 - INFO - ========== GROUP DIFFERENCES ==========
2026-02-11 21:13:23,672 - INFO - Seen tasks: 0..1 | valid_out_dim=4
2026-02-11 21:13:25,657 - INFO - [Group=Task0] CI_acc=2.41% | corr_slice_max=4.739 | best_other_max=5.949 | gap=-1.210
2026-02-11 21:13:25,657 - INFO - [Group=Task0] winner_task_dist: W0=2.4% | W1=97.6%
2026-02-11 21:13:25,657 - INFO - [Group=Task0] slice_strength : S0=4.74 | S1=5.95
2026-02-11 21:13:27,655 - INFO - [Group=Task1] CI_acc=99.17% | corr_slice_max=7.378 | best_other_max=2.892 | gap=4.486
2026-02-11 21:13:27,655 - INFO - [Group=Task1] winner_task_dist: W0=0.0% | W1=100.0%
2026-02-11 21:13:27,655 - INFO - [Group=Task1] slice_strength : S0=2.89 | S1=7.38
2026-02-11 21:13:27,655 - INFO - ======================================
2026-02-11 21:13:27,656 - INFO - ========== Task 2: classes [4, 5] ==========
2026-02-11 21:13:42,533 - INFO - [Task 2 | ep 0 | step 0] loss=9.3000 c=6.5096 r=2.3836 | ldc=0.4068 | CI_T0=1.00% | CI_T1=99.14% | CI_T2=0.00%
2026-02-11 21:13:54,292 - INFO - [Task 2 | ep 0 | step 25] loss=1.5853 c=0.3617 r=1.1902 | ldc=0.0334 | CI_T0=3.05% | CI_T1=34.92% | CI_T2=93.83%
2026-02-11 21:14:06,123 - INFO - [Task 2 | ep 0 | step 50] loss=1.2608 c=0.2866 r=0.9512 | ldc=0.0231 | CI_T0=0.92% | CI_T1=33.52% | CI_T2=97.85%
2026-02-11 21:14:18,054 - INFO - [Task 2 | ep 0 | step 75] loss=0.9632 c=0.2331 r=0.7130 | ldc=0.0172 | CI_T0=12.22% | CI_T1=39.01% | CI_T2=97.79%
2026-02-11 21:14:33,428 - INFO - [Task 2 | ep 1 | step 100] loss=0.8079 c=0.1978 r=0.5966 | ldc=0.0135 | CI_T0=0.30% | CI_T1=36.93% | CI_T2=98.54%
2026-02-11 21:14:45,451 - INFO - [Task 2 | ep 1 | step 125] loss=0.7909 c=0.1484 r=0.6261 | ldc=0.0164 | CI_T0=0.15% | CI_T1=32.16% | CI_T2=99.02%
2026-02-11 21:14:57,367 - INFO - [Task 2 | ep 1 | step 150] loss=0.7956 c=0.1467 r=0.6329 | ldc=0.0161 | CI_T0=0.03% | CI_T1=32.95% | CI_T2=98.96%
2026-02-11 21:15:12,627 - INFO - [Task 2 | ep 2 | step 175] loss=0.8562 c=0.1574 r=0.6861 | ldc=0.0127 | CI_T0=0.18% | CI_T1=29.10% | CI_T2=99.49%
2026-02-11 21:15:24,367 - INFO - [Task 2 | ep 2 | step 200] loss=1.4357 c=0.1876 r=1.2215 | ldc=0.0265 | CI_T0=1.59% | CI_T1=28.41% | CI_T2=99.41%
2026-02-11 21:15:36,108 - INFO - [Task 2 | ep 2 | step 225] loss=1.0340 c=0.1157 r=0.9013 | ldc=0.0169 | CI_T0=0.06% | CI_T1=33.12% | CI_T2=99.39%
2026-02-11 21:15:47,962 - INFO - [Task 2 | ep 2 | step 250] loss=0.7779 c=0.1494 r=0.6109 | ldc=0.0176 | CI_T0=0.05% | CI_T1=30.96% | CI_T2=99.52%
2026-02-11 21:16:03,343 - INFO - [Task 2 | ep 3 | step 275] loss=0.7141 c=0.1067 r=0.5939 | ldc=0.0135 | CI_T0=0.12% | CI_T1=29.06% | CI_T2=99.66%
2026-02-11 21:16:15,143 - INFO - [Task 2 | ep 3 | step 300] loss=0.6287 c=0.0990 r=0.5195 | ldc=0.0103 | CI_T0=0.02% | CI_T1=31.46% | CI_T2=99.56%
2026-02-11 21:16:26,892 - INFO - [Task 2 | ep 3 | step 325] loss=0.6374 c=0.0967 r=0.5253 | ldc=0.0154 | CI_T0=0.00% | CI_T1=25.67% | CI_T2=99.78%
2026-02-11 21:16:39,422 - INFO - [After Task 2] Task-IL : T0=99.95% | T1=98.92% | T2=99.95% | Avg=99.61%
2026-02-11 21:16:39,422 - INFO - [After Task 2] Class-IL: T0=0.00% | T1=29.09% | T2=99.73% | Avg=42.94%
2026-02-11 21:16:39,422 - INFO - ========== GROUP DIFFERENCES ==========
2026-02-11 21:16:39,422 - INFO - Seen tasks: 0..2 | valid_out_dim=6
2026-02-11 21:16:41,426 - INFO - [Group=Task0] CI_acc=0.00% | corr_slice_max=4.889 | best_other_max=6.948 | gap=-2.058
2026-02-11 21:16:41,426 - INFO - [Group=Task0] winner_task_dist: W0=0.0% | W1=17.7% | W2=82.3%
2026-02-11 21:16:41,427 - INFO - [Group=Task0] slice_strength : S0=4.89 | S1=6.01 | S2=6.90
2026-02-11 21:16:43,426 - INFO - [Group=Task1] CI_acc=29.09% | corr_slice_max=7.247 | best_other_max=8.112 | gap=-0.865
2026-02-11 21:16:43,426 - INFO - [Group=Task1] winner_task_dist: W0=0.0% | W1=29.1% | W2=70.9%
2026-02-11 21:16:43,426 - INFO - [Group=Task1] slice_strength : S0=2.84 | S1=7.25 | S2=8.11
2026-02-11 21:16:45,444 - INFO - [Group=Task2] CI_acc=99.73% | corr_slice_max=9.330 | best_other_max=6.385 | gap=2.945
2026-02-11 21:16:45,444 - INFO - [Group=Task2] winner_task_dist: W0=0.0% | W1=0.3% | W2=99.7%
2026-02-11 21:16:45,444 - INFO - [Group=Task2] slice_strength : S0=3.16 | S1=6.39 | S2=9.33
2026-02-11 21:16:45,444 - INFO - ======================================
2026-02-11 21:16:45,445 - INFO - ========== Task 3: classes [6, 7] ==========
2026-02-11 21:17:04,071 - INFO - [Task 3 | ep 0 | step 0] loss=10.1433 c=8.6769 r=1.1880 | ldc=0.2784 | CI_T0=0.00% | CI_T1=30.12% | CI_T2=99.55% | CI_T3=0.00%
2026-02-11 21:17:19,723 - INFO - [Task 3 | ep 0 | step 25] loss=1.6939 c=0.3762 r=1.2965 | ldc=0.0212 | CI_T0=0.07% | CI_T1=19.80% | CI_T2=69.97% | CI_T3=96.54%
2026-02-11 21:17:35,506 - INFO - [Task 3 | ep 0 | step 50] loss=1.4870 c=0.4043 r=1.0693 | ldc=0.0134 | CI_T0=0.00% | CI_T1=12.55% | CI_T2=82.93% | CI_T3=95.72%
2026-02-11 21:17:51,316 - INFO - [Task 3 | ep 0 | step 75] loss=1.2427 c=0.2690 r=0.9617 | ldc=0.0120 | CI_T0=0.02% | CI_T1=14.66% | CI_T2=82.60% | CI_T3=97.25%
2026-02-11 21:18:10,667 - INFO - [Task 3 | ep 1 | step 100] loss=1.0652 c=0.2367 r=0.8162 | ldc=0.0124 | CI_T0=0.22% | CI_T1=16.66% | CI_T2=80.48% | CI_T3=97.70%
2026-02-11 21:18:26,484 - INFO - [Task 3 | ep 1 | step 125] loss=1.2327 c=0.2535 r=0.9669 | ldc=0.0124 | CI_T0=0.04% | CI_T1=13.23% | CI_T2=79.23% | CI_T3=98.15%
2026-02-11 21:18:42,267 - INFO - [Task 3 | ep 1 | step 150] loss=0.8688 c=0.2187 r=0.6399 | ldc=0.0101 | CI_T0=1.09% | CI_T1=13.85% | CI_T2=78.78% | CI_T3=98.17%
2026-02-11 21:18:58,054 - INFO - [Task 3 | ep 1 | step 175] loss=1.1482 c=0.1898 r=0.9440 | ldc=0.0144 | CI_T0=0.00% | CI_T1=11.47% | CI_T2=74.57% | CI_T3=99.01%
2026-02-11 21:19:17,400 - INFO - [Task 3 | ep 2 | step 200] loss=0.7639 c=0.1714 r=0.5832 | ldc=0.0093 | CI_T0=0.01% | CI_T1=9.78% | CI_T2=74.64% | CI_T3=99.28%
2026-02-11 21:19:33,207 - INFO - [Task 3 | ep 2 | step 225] loss=0.7712 c=0.1918 r=0.5678 | ldc=0.0116 | CI_T0=0.03% | CI_T1=12.45% | CI_T2=73.27% | CI_T3=99.42%
2026-02-11 21:19:49,056 - INFO - [Task 3 | ep 2 | step 250] loss=0.9088 c=0.1875 r=0.7076 | ldc=0.0137 | CI_T0=0.02% | CI_T1=10.70% | CI_T2=70.10% | CI_T3=99.53%
2026-02-11 21:20:04,913 - INFO - [Task 3 | ep 2 | step 275] loss=0.8788 c=0.1520 r=0.7179 | ldc=0.0089 | CI_T0=0.03% | CI_T1=11.84% | CI_T2=70.53% | CI_T3=99.62%
2026-02-11 21:20:24,277 - INFO - [Task 3 | ep 3 | step 300] loss=0.9711 c=0.1685 r=0.7912 | ldc=0.0114 | CI_T0=0.02% | CI_T1=11.23% | CI_T2=71.48% | CI_T3=99.65%
2026-02-11 21:20:40,082 - INFO - [Task 3 | ep 3 | step 325] loss=0.7794 c=0.1417 r=0.6295 | ldc=0.0082 | CI_T0=0.05% | CI_T1=13.13% | CI_T2=66.54% | CI_T3=99.70%
2026-02-11 21:20:55,761 - INFO - [Task 3 | ep 3 | step 350] loss=1.1814 c=0.1635 r=1.0079 | ldc=0.0100 | CI_T0=0.01% | CI_T1=8.24% | CI_T2=65.33% | CI_T3=99.78%
2026-02-11 21:21:11,456 - INFO - [Task 3 | ep 3 | step 375] loss=0.6731 c=0.1725 r=0.4919 | ldc=0.0087 | CI_T0=0.00% | CI_T1=7.19% | CI_T2=64.10% | CI_T3=99.79%
2026-02-11 21:21:27,687 - INFO - [After Task 3] Task-IL : T0=99.95% | T1=98.92% | T2=99.79% | T3=100.00% | Avg=99.67%
2026-02-11 21:21:27,687 - INFO - [After Task 3] Class-IL: T0=0.00% | T1=8.03% | T2=63.29% | T3=99.45% | Avg=42.69%
2026-02-11 21:21:27,687 - INFO - ========== GROUP DIFFERENCES ==========
2026-02-11 21:21:27,687 - INFO - Seen tasks: 0..3 | valid_out_dim=8
2026-02-11 21:21:29,675 - INFO - [Group=Task0] CI_acc=0.00% | corr_slice_max=5.214 | best_other_max=8.657 | gap=-3.443
2026-02-11 21:21:29,675 - INFO - [Group=Task0] winner_task_dist: W0=0.0% | W1=0.3% | W2=10.5% | W3=89.1%
2026-02-11 21:21:29,675 - INFO - [Group=Task0] slice_strength : S0=5.21 | S1=6.18 | S2=7.29 | S3=8.56
2026-02-11 21:21:31,677 - INFO - [Group=Task1] CI_acc=8.03% | corr_slice_max=7.288 | best_other_max=9.253 | gap=-1.966
2026-02-11 21:21:31,677 - INFO - [Group=Task1] winner_task_dist: W0=0.0% | W1=8.0% | W2=42.6% | W3=49.4%
2026-02-11 21:21:31,677 - INFO - [Group=Task1] slice_strength : S0=2.85 | S1=7.29 | S2=8.15 | S3=8.44
2026-02-11 21:21:33,665 - INFO - [Group=Task2] CI_acc=63.29% | corr_slice_max=9.366 | best_other_max=8.888 | gap=0.478
2026-02-11 21:21:33,665 - INFO - [Group=Task2] winner_task_dist: W0=0.0% | W1=0.1% | W2=63.3% | W3=36.6%
2026-02-11 21:21:33,665 - INFO - [Group=Task2] slice_strength : S0=3.23 | S1=6.37 | S2=9.37 | S3=8.79
2026-02-11 21:21:35,683 - INFO - [Group=Task3] CI_acc=99.45% | corr_slice_max=10.739 | best_other_max=8.227 | gap=2.512
2026-02-11 21:21:35,683 - INFO - [Group=Task3] winner_task_dist: W0=0.0% | W1=0.0% | W2=0.6% | W3=99.4%
2026-02-11 21:21:35,683 - INFO - [Group=Task3] slice_strength : S0=3.20 | S1=6.23 | S2=8.21 | S3=10.74
2026-02-11 21:21:35,683 - INFO - ======================================
2026-02-11 21:21:35,684 - INFO - ========== Task 4: classes [8, 9] ==========
2026-02-11 21:21:58,355 - INFO - [Task 4 | ep 0 | step 0] loss=11.9711 c=9.7642 r=1.9353 | ldc=0.2716 | CI_T0=0.02% | CI_T1=8.79% | CI_T2=66.50% | CI_T3=99.78% | CI_T4=0.00%
2026-02-11 21:22:17,900 - INFO - [Task 4 | ep 0 | step 25] loss=2.2489 c=0.4868 r=1.7411 | ldc=0.0210 | CI_T0=0.00% | CI_T1=2.84% | CI_T2=9.62% | CI_T3=40.51% | CI_T4=92.89%
2026-02-11 21:22:37,380 - INFO - [Task 4 | ep 0 | step 50] loss=1.3870 c=0.4477 r=0.9294 | ldc=0.0099 | CI_T0=0.00% | CI_T1=0.12% | CI_T2=12.19% | CI_T3=44.70% | CI_T4=94.09%
2026-02-11 21:22:56,956 - INFO - [Task 4 | ep 0 | step 75] loss=1.1699 c=0.3552 r=0.8067 | ldc=0.0080 | CI_T0=0.00% | CI_T1=0.07% | CI_T2=7.54% | CI_T3=44.63% | CI_T4=95.48%
2026-02-11 21:23:20,190 - INFO - [Task 4 | ep 1 | step 100] loss=1.1125 c=0.3801 r=0.7232 | ldc=0.0092 | CI_T0=0.00% | CI_T1=0.08% | CI_T2=8.92% | CI_T3=40.87% | CI_T4=96.14%
2026-02-11 21:23:39,846 - INFO - [Task 4 | ep 1 | step 125] loss=1.1456 c=0.3241 r=0.8131 | ldc=0.0084 | CI_T0=0.00% | CI_T1=0.05% | CI_T2=8.85% | CI_T3=40.98% | CI_T4=97.28%
2026-02-11 21:23:59,586 - INFO - [Task 4 | ep 1 | step 150] loss=0.9388 c=0.2897 r=0.6408 | ldc=0.0084 | CI_T0=0.00% | CI_T1=0.02% | CI_T2=6.00% | CI_T3=41.93% | CI_T4=97.59%
2026-02-11 21:24:19,268 - INFO - [Task 4 | ep 1 | step 175] loss=1.0122 c=0.2968 r=0.7075 | ldc=0.0079 | CI_T0=0.00% | CI_T1=0.02% | CI_T2=7.96% | CI_T3=38.23% | CI_T4=97.91%
2026-02-11 21:24:42,373 - INFO - [Task 4 | ep 2 | step 200] loss=0.7841 c=0.2267 r=0.5492 | ldc=0.0081 | CI_T0=0.00% | CI_T1=0.00% | CI_T2=5.85% | CI_T3=35.86% | CI_T4=97.76%
2026-02-11 21:25:01,930 - INFO - [Task 4 | ep 2 | step 225] loss=0.8971 c=0.2519 r=0.6378 | ldc=0.0075 | CI_T0=0.00% | CI_T1=0.00% | CI_T2=10.08% | CI_T3=38.30% | CI_T4=98.34%
2026-02-11 21:25:21,528 - INFO - [Task 4 | ep 2 | step 250] loss=0.9120 c=0.2107 r=0.6955 | ldc=0.0058 | CI_T0=0.00% | CI_T1=0.00% | CI_T2=6.32% | CI_T3=35.99% | CI_T4=98.79%
2026-02-11 21:25:41,179 - INFO - [Task 4 | ep 2 | step 275] loss=0.8944 c=0.1709 r=0.7160 | ldc=0.0076 | CI_T0=0.00% | CI_T1=0.00% | CI_T2=7.83% | CI_T3=31.81% | CI_T4=99.13%
2026-02-11 21:26:04,389 - INFO - [Task 4 | ep 3 | step 300] loss=0.7610 c=0.2112 r=0.5421 | ldc=0.0077 | CI_T0=0.00% | CI_T1=0.00% | CI_T2=6.10% | CI_T3=32.52% | CI_T4=98.97%
2026-02-11 21:26:24,073 - INFO - [Task 4 | ep 3 | step 325] loss=0.7528 c=0.1708 r=0.5750 | ldc=0.0071 | CI_T0=0.00% | CI_T1=0.00% | CI_T2=6.47% | CI_T3=30.04% | CI_T4=99.13%
2026-02-11 21:26:43,684 - INFO - [Task 4 | ep 3 | step 350] loss=0.6370 c=0.1471 r=0.4825 | ldc=0.0074 | CI_T0=0.00% | CI_T1=0.00% | CI_T2=8.31% | CI_T3=28.72% | CI_T4=99.20%
2026-02-11 21:27:03,997 - INFO - [After Task 4] Task-IL : T0=99.95% | T1=98.73% | T2=99.84% | T3=99.90% | T4=98.74% | Avg=99.43%
2026-02-11 21:27:03,997 - INFO - [After Task 4] Class-IL: T0=0.00% | T1=0.00% | T2=5.55% | T3=30.31% | T4=98.59% | Avg=26.89%
2026-02-11 21:27:03,997 - INFO - ========== GROUP DIFFERENCES ==========
2026-02-11 21:27:03,997 - INFO - Seen tasks: 0..4 | valid_out_dim=10
2026-02-11 21:27:05,981 - INFO - [Group=Task0] CI_acc=0.00% | corr_slice_max=5.167 | best_other_max=10.084 | gap=-4.917
2026-02-11 21:27:05,981 - INFO - [Group=Task0] winner_task_dist: W0=0.0% | W1=0.0% | W2=0.2% | W3=5.2% | W4=94.6%
2026-02-11 21:27:05,981 - INFO - [Group=Task0] slice_strength : S0=5.17 | S1=6.09 | S2=6.97 | S3=8.60 | S4=10.07
2026-02-11 21:27:07,958 - INFO - [Group=Task1] CI_acc=0.00% | corr_slice_max=7.128 | best_other_max=10.637 | gap=-3.509
2026-02-11 21:27:07,958 - INFO - [Group=Task1] winner_task_dist: W0=0.0% | W1=0.0% | W2=5.7% | W3=8.6% | W4=85.7%
2026-02-11 21:27:07,958 - INFO - [Group=Task1] slice_strength : S0=2.68 | S1=7.13 | S2=7.98 | S3=8.48 | S4=10.54
2026-02-11 21:27:09,964 - INFO - [Group=Task2] CI_acc=5.55% | corr_slice_max=9.296 | best_other_max=11.450 | gap=-2.155
2026-02-11 21:27:09,965 - INFO - [Group=Task2] winner_task_dist: W0=0.0% | W1=0.0% | W2=5.5% | W3=0.5% | W4=93.9%
2026-02-11 21:27:09,965 - INFO - [Group=Task2] slice_strength : S0=3.02 | S1=6.35 | S2=9.30 | S3=9.01 | S4=11.45
2026-02-11 21:27:11,948 - INFO - [Group=Task3] CI_acc=30.31% | corr_slice_max=10.564 | best_other_max=11.009 | gap=-0.446
2026-02-11 21:27:11,948 - INFO - [Group=Task3] winner_task_dist: W0=0.0% | W1=0.0% | W2=0.1% | W3=30.3% | W4=69.6%
2026-02-11 21:27:11,949 - INFO - [Group=Task3] slice_strength : S0=3.03 | S1=6.27 | S2=7.93 | S3=10.56 | S4=10.98
2026-02-11 21:27:13,949 - INFO - [Group=Task4] CI_acc=98.59% | corr_slice_max=12.074 | best_other_max=9.889 | gap=2.185
2026-02-11 21:27:13,949 - INFO - [Group=Task4] winner_task_dist: W0=0.0% | W1=0.0% | W2=0.0% | W3=0.4% | W4=99.6%
2026-02-11 21:27:13,949 - INFO - [Group=Task4] slice_strength : S0=2.72 | S1=6.36 | S2=8.31 | S3=9.75 | S4=12.07
2026-02-11 21:27:13,949 - INFO - ======================================
2026-02-11 21:27:13,949 - INFO - ========== FINAL METRICS (Class-IL) ==========
2026-02-11 21:27:13,949 - INFO - Forgetting per task: T0=99.95%, T1=99.17%, T2=94.18%, T3=69.13%, T4=0.00%
2026-02-11 21:27:13,949 - INFO - BWT: -90.61%
2026-02-11 21:27:13,950 - INFO - Final average Class-IL accuracy: 26.89%
