2026-02-12 23:10:03,168 - INFO - Device: cuda
2026-02-12 23:10:03,168 - INFO - Config: {'device': 'cuda', 'lr': 0.005, 'epochs_per_task': 4, 'batch_size': 128, 'lambda_slice': 2.0, 'lambda_feat': 0.5, 'vae_epochs': 8, 'vae_n_fake_per_task': 64, 'fake_cap': 256, 'lambda_adv_feat': 0.1, 'lambda_adv_slice': 0.1}
2026-02-12 23:10:03,253 - INFO - ========== Task 0: classes [0, 1] ==========
2026-02-12 23:10:45,871 - INFO - [Task 0 | ep 0 | step 0] loss=0.8599 | CI_T0=97.54%
2026-02-12 23:10:50,274 - INFO - [Task 0 | ep 0 | step 25] loss=0.0012 | CI_T0=99.66%
2026-02-12 23:10:54,665 - INFO - [Task 0 | ep 0 | step 50] loss=0.0005 | CI_T0=99.90%
2026-02-12 23:10:59,079 - INFO - [Task 0 | ep 0 | step 75] loss=0.0007 | CI_T0=99.96%
2026-02-12 23:11:07,407 - INFO - [Task 0 | ep 1 | step 100] loss=0.0051 | CI_T0=99.92%
2026-02-12 23:11:11,826 - INFO - [Task 0 | ep 1 | step 125] loss=0.0004 | CI_T0=99.97%
2026-02-12 23:11:16,236 - INFO - [Task 0 | ep 1 | step 150] loss=0.0005 | CI_T0=99.97%
2026-02-12 23:11:20,716 - INFO - [Task 0 | ep 1 | step 175] loss=0.0177 | CI_T0=99.93%
2026-02-12 23:11:28,949 - INFO - [Task 0 | ep 2 | step 200] loss=0.0182 | CI_T0=99.91%
2026-02-12 23:11:33,330 - INFO - [Task 0 | ep 2 | step 225] loss=0.0001 | CI_T0=99.94%
2026-02-12 23:11:37,722 - INFO - [Task 0 | ep 2 | step 250] loss=0.0002 | CI_T0=99.84%
2026-02-12 23:11:42,129 - INFO - [Task 0 | ep 2 | step 275] loss=0.0004 | CI_T0=99.96%
2026-02-12 23:11:50,339 - INFO - [Task 0 | ep 3 | step 300] loss=0.0001 | CI_T0=99.97%
2026-02-12 23:11:54,745 - INFO - [Task 0 | ep 3 | step 325] loss=0.0021 | CI_T0=99.98%
2026-02-12 23:11:59,121 - INFO - [Task 0 | ep 3 | step 350] loss=0.0001 | CI_T0=99.94%
2026-02-12 23:12:03,488 - INFO - [Task 0 | ep 3 | step 375] loss=0.0002 | CI_T0=99.94%
2026-02-12 23:12:08,202 - INFO - [After Task 0] Task-IL : T0=99.91% | Avg=99.91%
2026-02-12 23:12:08,204 - INFO - [After Task 0] Class-IL: T0=99.91% | Avg=99.91%
2026-02-12 23:12:08,204 - INFO - ========== GROUP DIFFERENCES ==========
2026-02-12 23:12:08,204 - INFO - Seen tasks: 0..0 | valid_out_dim=2
2026-02-12 23:12:10,380 - INFO - [Group=Task0] CI_acc=99.91% | corr_slice_max=4.891 | best_other_max=nan | gap=nan
2026-02-12 23:12:10,380 - INFO - [Group=Task0] winner_task_dist: W0=100.0%
2026-02-12 23:12:10,380 - INFO - [Group=Task0] slice_strength : S0=4.89
2026-02-12 23:12:10,381 - INFO - ======================================
2026-02-12 23:12:10,381 - INFO - ========== Task 1: classes [2, 3] ==========
2026-02-12 23:12:57,251 - INFO - [Task 1 | ep 0 | step 0] loss=7.9826 | CI_T0=99.94% | CI_T1=5.87%
2026-02-12 23:13:06,068 - INFO - [Task 1 | ep 0 | step 25] loss=1.8885 | CI_T0=36.70% | CI_T1=91.97%
2026-02-12 23:13:14,898 - INFO - [Task 1 | ep 0 | step 50] loss=2.0342 | CI_T0=38.42% | CI_T1=68.57%
2026-02-12 23:13:23,801 - INFO - [Task 1 | ep 0 | step 75] loss=2.5134 | CI_T0=27.35% | CI_T1=82.43%
2026-02-12 23:13:36,366 - INFO - [Task 1 | ep 1 | step 100] loss=1.9949 | CI_T0=31.73% | CI_T1=77.27%
2026-02-12 23:13:45,124 - INFO - [Task 1 | ep 1 | step 125] loss=2.3778 | CI_T0=57.56% | CI_T1=89.38%
2026-02-12 23:13:54,025 - INFO - [Task 1 | ep 1 | step 150] loss=2.4160 | CI_T0=55.71% | CI_T1=81.27%
2026-02-12 23:14:02,834 - INFO - [Task 1 | ep 1 | step 175] loss=2.8337 | CI_T0=51.20% | CI_T1=61.97%
2026-02-12 23:14:15,473 - INFO - [Task 1 | ep 2 | step 200] loss=3.0284 | CI_T0=47.07% | CI_T1=69.61%
2026-02-12 23:14:24,336 - INFO - [Task 1 | ep 2 | step 225] loss=2.6265 | CI_T0=47.51% | CI_T1=41.12%
2026-02-12 23:14:33,259 - INFO - [Task 1 | ep 2 | step 250] loss=2.6473 | CI_T0=50.73% | CI_T1=59.23%
2026-02-12 23:14:42,170 - INFO - [Task 1 | ep 2 | step 275] loss=3.1289 | CI_T0=34.64% | CI_T1=71.91%
2026-02-12 23:14:54,855 - INFO - [Task 1 | ep 3 | step 300] loss=2.5019 | CI_T0=45.85% | CI_T1=73.95%
2026-02-12 23:15:03,628 - INFO - [Task 1 | ep 3 | step 325] loss=2.5962 | CI_T0=47.66% | CI_T1=66.63%
2026-02-12 23:15:12,481 - INFO - [Task 1 | ep 3 | step 350] loss=2.6303 | CI_T0=46.23% | CI_T1=67.77%
2026-02-12 23:15:21,267 - INFO - [Task 1 | ep 3 | step 375] loss=2.6458 | CI_T0=69.27% | CI_T1=63.15%
2026-02-12 23:15:30,213 - INFO - [After Task 1] Task-IL : T0=80.05% | T1=85.85% | Avg=82.95%
2026-02-12 23:15:30,214 - INFO - [After Task 1] Class-IL: T0=70.12% | T1=62.10% | Avg=66.11%
2026-02-12 23:15:30,214 - INFO - ========== GROUP DIFFERENCES ==========
2026-02-12 23:15:30,214 - INFO - Seen tasks: 0..1 | valid_out_dim=4
2026-02-12 23:15:32,409 - INFO - [Group=Task0] CI_acc=70.12% | corr_slice_max=2.255 | best_other_max=1.374 | gap=0.881
2026-02-12 23:15:32,410 - INFO - [Group=Task0] winner_task_dist: W0=86.9% | W1=13.1%
2026-02-12 23:15:32,410 - INFO - [Group=Task0] slice_strength : S0=2.25 | S1=1.37
2026-02-12 23:15:34,591 - INFO - [Group=Task1] CI_acc=62.10% | corr_slice_max=1.505 | best_other_max=1.296 | gap=0.209
2026-02-12 23:15:34,593 - INFO - [Group=Task1] winner_task_dist: W0=37.1% | W1=62.9%
2026-02-12 23:15:34,593 - INFO - [Group=Task1] slice_strength : S0=1.30 | S1=1.51
2026-02-12 23:15:34,593 - INFO - ======================================
2026-02-12 23:15:34,593 - INFO - ========== Task 2: classes [4, 5] ==========
2026-02-12 23:16:25,058 - INFO - [Task 2 | ep 0 | step 0] loss=7.6116 | CI_T0=65.19% | CI_T1=56.57% | CI_T2=1.27%
2026-02-12 23:16:38,144 - INFO - [Task 2 | ep 0 | step 25] loss=2.2918 | CI_T0=80.47% | CI_T1=20.74% | CI_T2=94.90%
2026-02-12 23:16:51,116 - INFO - [Task 2 | ep 0 | step 50] loss=2.1071 | CI_T0=45.32% | CI_T1=7.49% | CI_T2=95.17%
2026-02-12 23:17:04,310 - INFO - [Task 2 | ep 0 | step 75] loss=2.5452 | CI_T0=25.75% | CI_T1=17.97% | CI_T2=63.95%
2026-02-12 23:17:21,173 - INFO - [Task 2 | ep 1 | step 100] loss=2.4262 | CI_T0=61.45% | CI_T1=21.79% | CI_T2=82.67%
2026-02-12 23:17:34,233 - INFO - [Task 2 | ep 1 | step 125] loss=2.5807 | CI_T0=68.22% | CI_T1=23.26% | CI_T2=80.18%
2026-02-12 23:17:47,166 - INFO - [Task 2 | ep 1 | step 150] loss=2.6455 | CI_T0=64.74% | CI_T1=22.66% | CI_T2=79.64%
2026-02-12 23:18:03,867 - INFO - [Task 2 | ep 2 | step 175] loss=2.5980 | CI_T0=49.93% | CI_T1=10.97% | CI_T2=86.00%
2026-02-12 23:18:16,956 - INFO - [Task 2 | ep 2 | step 200] loss=2.5953 | CI_T0=63.02% | CI_T1=15.53% | CI_T2=85.09%
2026-02-12 23:18:29,925 - INFO - [Task 2 | ep 2 | step 225] loss=3.0220 | CI_T0=44.33% | CI_T1=10.43% | CI_T2=76.23%
2026-02-12 23:18:43,042 - INFO - [Task 2 | ep 2 | step 250] loss=2.6709 | CI_T0=68.66% | CI_T1=9.04% | CI_T2=87.56%
2026-02-12 23:18:59,915 - INFO - [Task 2 | ep 3 | step 275] loss=2.5096 | CI_T0=68.58% | CI_T1=10.50% | CI_T2=87.17%
2026-02-12 23:19:12,953 - INFO - [Task 2 | ep 3 | step 300] loss=2.4608 | CI_T0=49.93% | CI_T1=15.75% | CI_T2=81.35%
2026-02-12 23:19:26,062 - INFO - [Task 2 | ep 3 | step 325] loss=2.4836 | CI_T0=45.71% | CI_T1=11.92% | CI_T2=81.54%
2026-02-12 23:19:39,694 - INFO - [After Task 2] Task-IL : T0=97.73% | T1=81.83% | T2=97.55% | Avg=92.37%
2026-02-12 23:19:39,695 - INFO - [After Task 2] Class-IL: T0=52.34% | T1=17.14% | T2=88.74% | Avg=52.74%
2026-02-12 23:19:39,695 - INFO - ========== GROUP DIFFERENCES ==========
2026-02-12 23:19:39,695 - INFO - Seen tasks: 0..2 | valid_out_dim=6
2026-02-12 23:19:41,865 - INFO - [Group=Task0] CI_acc=52.34% | corr_slice_max=3.177 | best_other_max=2.926 | gap=0.252
2026-02-12 23:19:41,867 - INFO - [Group=Task0] winner_task_dist: W0=52.3% | W1=5.2% | W2=42.5%
2026-02-12 23:19:41,867 - INFO - [Group=Task0] slice_strength : S0=3.18 | S1=1.18 | S2=2.79
2026-02-12 23:19:44,035 - INFO - [Group=Task1] CI_acc=17.14% | corr_slice_max=1.808 | best_other_max=3.331 | gap=-1.523
2026-02-12 23:19:44,036 - INFO - [Group=Task1] winner_task_dist: W0=16.6% | W1=17.6% | W2=65.8%
2026-02-12 23:19:44,036 - INFO - [Group=Task1] slice_strength : S0=1.78 | S1=1.81 | S2=3.09
2026-02-12 23:19:46,176 - INFO - [Group=Task2] CI_acc=88.74% | corr_slice_max=4.428 | best_other_max=2.618 | gap=1.810
2026-02-12 23:19:46,178 - INFO - [Group=Task2] winner_task_dist: W0=7.5% | W1=3.0% | W2=89.5%
2026-02-12 23:19:46,178 - INFO - [Group=Task2] slice_strength : S0=2.41 | S1=1.61 | S2=4.43
2026-02-12 23:19:46,178 - INFO - ======================================
2026-02-12 23:19:46,178 - INFO - ========== Task 3: classes [6, 7] ==========
2026-02-12 23:20:41,447 - INFO - [Task 3 | ep 0 | step 0] loss=7.1042 | CI_T0=47.95% | CI_T1=18.26% | CI_T2=85.60% | CI_T3=0.04%
2026-02-12 23:20:58,660 - INFO - [Task 3 | ep 0 | step 25] loss=2.0270 | CI_T0=49.75% | CI_T1=5.68% | CI_T2=37.07% | CI_T3=97.83%
2026-02-12 23:21:16,020 - INFO - [Task 3 | ep 0 | step 50] loss=2.0426 | CI_T0=56.27% | CI_T1=15.50% | CI_T2=43.32% | CI_T3=99.01%
2026-02-12 23:21:33,551 - INFO - [Task 3 | ep 0 | step 75] loss=2.0747 | CI_T0=47.35% | CI_T1=14.70% | CI_T2=43.92% | CI_T3=99.20%
2026-02-12 23:21:54,558 - INFO - [Task 3 | ep 1 | step 100] loss=2.1590 | CI_T0=47.83% | CI_T1=22.53% | CI_T2=43.29% | CI_T3=98.88%
2026-02-12 23:22:11,889 - INFO - [Task 3 | ep 1 | step 125] loss=2.3184 | CI_T0=32.42% | CI_T1=24.48% | CI_T2=41.12% | CI_T3=98.69%
2026-02-12 23:22:29,250 - INFO - [Task 3 | ep 1 | step 150] loss=2.4769 | CI_T0=55.33% | CI_T1=10.42% | CI_T2=42.42% | CI_T3=98.33%
2026-02-12 23:22:46,545 - INFO - [Task 3 | ep 1 | step 175] loss=2.5808 | CI_T0=47.72% | CI_T1=7.90% | CI_T2=31.22% | CI_T3=96.10%
2026-02-12 23:23:07,738 - INFO - [Task 3 | ep 2 | step 200] loss=2.6111 | CI_T0=57.86% | CI_T1=6.18% | CI_T2=31.86% | CI_T3=97.44%
2026-02-12 23:23:25,106 - INFO - [Task 3 | ep 2 | step 225] loss=2.7472 | CI_T0=52.17% | CI_T1=15.71% | CI_T2=31.94% | CI_T3=97.53%
2026-02-12 23:23:42,439 - INFO - [Task 3 | ep 2 | step 250] loss=2.7017 | CI_T0=38.05% | CI_T1=18.82% | CI_T2=32.51% | CI_T3=95.90%
2026-02-12 23:23:59,771 - INFO - [Task 3 | ep 2 | step 275] loss=2.8091 | CI_T0=30.80% | CI_T1=15.63% | CI_T2=60.44% | CI_T3=97.80%
2026-02-12 23:24:20,864 - INFO - [Task 3 | ep 3 | step 300] loss=2.9565 | CI_T0=52.34% | CI_T1=11.03% | CI_T2=40.76% | CI_T3=98.55%
2026-02-12 23:24:38,154 - INFO - [Task 3 | ep 3 | step 325] loss=2.7335 | CI_T0=64.86% | CI_T1=13.54% | CI_T2=29.48% | CI_T3=95.80%
2026-02-12 23:24:55,460 - INFO - [Task 3 | ep 3 | step 350] loss=2.6224 | CI_T0=77.56% | CI_T1=12.42% | CI_T2=37.63% | CI_T3=97.88%
2026-02-12 23:25:12,907 - INFO - [Task 3 | ep 3 | step 375] loss=2.6032 | CI_T0=68.42% | CI_T1=6.36% | CI_T2=37.86% | CI_T3=99.22%
2026-02-12 23:25:30,816 - INFO - [After Task 3] Task-IL : T0=99.15% | T1=85.99% | T2=95.20% | T3=99.80% | Avg=95.03%
2026-02-12 23:25:30,817 - INFO - [After Task 3] Class-IL: T0=67.09% | T1=7.54% | T2=42.90% | T3=98.79% | Avg=54.08%
2026-02-12 23:25:30,817 - INFO - ========== GROUP DIFFERENCES ==========
2026-02-12 23:25:30,817 - INFO - Seen tasks: 0..3 | valid_out_dim=8
2026-02-12 23:25:32,991 - INFO - [Group=Task0] CI_acc=67.09% | corr_slice_max=4.219 | best_other_max=3.696 | gap=0.523
2026-02-12 23:25:32,993 - INFO - [Group=Task0] winner_task_dist: W0=67.1% | W1=0.2% | W2=2.3% | W3=30.4%
2026-02-12 23:25:32,993 - INFO - [Group=Task0] slice_strength : S0=4.22 | S1=1.83 | S2=2.17 | S3=3.55
2026-02-12 23:25:35,185 - INFO - [Group=Task1] CI_acc=7.54% | corr_slice_max=1.869 | best_other_max=4.162 | gap=-2.293
2026-02-12 23:25:35,186 - INFO - [Group=Task1] winner_task_dist: W0=8.2% | W1=7.5% | W2=24.1% | W3=60.1%
2026-02-12 23:25:35,186 - INFO - [Group=Task1] slice_strength : S0=1.72 | S1=1.87 | S2=2.68 | S3=3.62
2026-02-12 23:25:37,385 - INFO - [Group=Task2] CI_acc=42.90% | corr_slice_max=3.956 | best_other_max=4.011 | gap=-0.055
2026-02-12 23:25:37,385 - INFO - [Group=Task2] winner_task_dist: W0=4.5% | W1=2.0% | W2=43.2% | W3=50.3%
2026-02-12 23:25:37,385 - INFO - [Group=Task2] slice_strength : S0=1.86 | S1=1.81 | S2=3.96 | S3=3.69
2026-02-12 23:25:39,560 - INFO - [Group=Task3] CI_acc=98.79% | corr_slice_max=6.469 | best_other_max=4.339 | gap=2.130
2026-02-12 23:25:39,562 - INFO - [Group=Task3] winner_task_dist: W0=0.4% | W1=0.0% | W2=0.8% | W3=98.8%
2026-02-12 23:25:39,562 - INFO - [Group=Task3] slice_strength : S0=2.88 | S1=2.15 | S2=4.01 | S3=6.47
2026-02-12 23:25:39,562 - INFO - ======================================
2026-02-12 23:25:39,562 - INFO - ========== Task 4: classes [8, 9] ==========
2026-02-12 23:26:38,744 - INFO - [Task 4 | ep 0 | step 0] loss=8.8583 | CI_T0=83.87% | CI_T1=13.13% | CI_T2=48.09% | CI_T3=98.82% | CI_T4=0.01%
2026-02-12 23:27:00,262 - INFO - [Task 4 | ep 0 | step 25] loss=3.1786 | CI_T0=25.32% | CI_T1=0.19% | CI_T2=6.81% | CI_T3=42.87% | CI_T4=86.19%
2026-02-12 23:27:21,856 - INFO - [Task 4 | ep 0 | step 50] loss=2.7614 | CI_T0=17.07% | CI_T1=3.03% | CI_T2=9.20% | CI_T3=39.66% | CI_T4=94.96%
2026-02-12 23:27:43,392 - INFO - [Task 4 | ep 0 | step 75] loss=2.6594 | CI_T0=27.37% | CI_T1=1.61% | CI_T2=14.35% | CI_T3=39.69% | CI_T4=94.23%
2026-02-12 23:28:08,910 - INFO - [Task 4 | ep 1 | step 100] loss=2.5419 | CI_T0=25.51% | CI_T1=3.46% | CI_T2=25.96% | CI_T3=40.79% | CI_T4=91.07%
2026-02-12 23:28:30,656 - INFO - [Task 4 | ep 1 | step 125] loss=2.6089 | CI_T0=32.09% | CI_T1=2.57% | CI_T2=16.86% | CI_T3=40.35% | CI_T4=94.67%
2026-02-12 23:28:52,279 - INFO - [Task 4 | ep 1 | step 150] loss=2.6560 | CI_T0=59.70% | CI_T1=3.08% | CI_T2=14.39% | CI_T3=34.59% | CI_T4=94.74%
2026-02-12 23:29:14,034 - INFO - [Task 4 | ep 1 | step 175] loss=2.8189 | CI_T0=68.26% | CI_T1=4.65% | CI_T2=19.55% | CI_T3=39.17% | CI_T4=96.93%
2026-02-12 23:29:39,587 - INFO - [Task 4 | ep 2 | step 200] loss=2.9607 | CI_T0=53.72% | CI_T1=9.38% | CI_T2=27.67% | CI_T3=39.36% | CI_T4=95.34%
2026-02-12 23:30:01,255 - INFO - [Task 4 | ep 2 | step 225] loss=2.8597 | CI_T0=42.07% | CI_T1=10.15% | CI_T2=32.14% | CI_T3=42.40% | CI_T4=95.48%
2026-02-12 23:30:22,741 - INFO - [Task 4 | ep 2 | step 250] loss=2.9278 | CI_T0=48.23% | CI_T1=9.55% | CI_T2=33.98% | CI_T3=45.20% | CI_T4=95.56%
2026-02-12 23:30:44,468 - INFO - [Task 4 | ep 2 | step 275] loss=3.0327 | CI_T0=40.53% | CI_T1=6.52% | CI_T2=32.96% | CI_T3=47.62% | CI_T4=95.98%
2026-02-12 23:31:09,919 - INFO - [Task 4 | ep 3 | step 300] loss=2.8345 | CI_T0=29.75% | CI_T1=6.63% | CI_T2=20.51% | CI_T3=42.90% | CI_T4=96.27%
2026-02-12 23:31:31,540 - INFO - [Task 4 | ep 3 | step 325] loss=2.8774 | CI_T0=49.90% | CI_T1=12.74% | CI_T2=20.82% | CI_T3=32.85% | CI_T4=95.75%
2026-02-12 23:31:53,196 - INFO - [Task 4 | ep 3 | step 350] loss=2.8610 | CI_T0=36.49% | CI_T1=16.74% | CI_T2=24.07% | CI_T3=42.05% | CI_T4=94.56%
2026-02-12 23:32:15,346 - INFO - [After Task 4] Task-IL : T0=99.95% | T1=78.84% | T2=93.97% | T3=96.42% | T4=97.88% | Avg=93.41%
2026-02-12 23:32:15,346 - INFO - [After Task 4] Class-IL: T0=63.45% | T1=15.18% | T2=23.11% | T3=39.12% | T4=92.99% | Avg=46.77%
2026-02-12 23:32:15,346 - INFO - ========== GROUP DIFFERENCES ==========
2026-02-12 23:32:15,346 - INFO - Seen tasks: 0..4 | valid_out_dim=10
2026-02-12 23:32:17,521 - INFO - [Group=Task0] CI_acc=63.45% | corr_slice_max=4.404 | best_other_max=4.280 | gap=0.124
2026-02-12 23:32:17,522 - INFO - [Group=Task0] winner_task_dist: W0=63.5% | W1=0.1% | W2=1.9% | W3=1.8% | W4=32.7%
2026-02-12 23:32:17,522 - INFO - [Group=Task0] slice_strength : S0=4.40 | S1=1.19 | S2=2.81 | S3=2.58 | S4=4.15
2026-02-12 23:32:19,714 - INFO - [Group=Task1] CI_acc=15.18% | corr_slice_max=1.829 | best_other_max=4.117 | gap=-2.288
2026-02-12 23:32:19,716 - INFO - [Group=Task1] winner_task_dist: W0=4.7% | W1=15.2% | W2=8.2% | W3=17.9% | W4=54.0%
2026-02-12 23:32:19,716 - INFO - [Group=Task1] slice_strength : S0=1.51 | S1=1.83 | S2=1.93 | S3=2.65 | S4=3.74
2026-02-12 23:32:21,876 - INFO - [Group=Task2] CI_acc=23.11% | corr_slice_max=4.014 | best_other_max=5.327 | gap=-1.313
2026-02-12 23:32:21,876 - INFO - [Group=Task2] winner_task_dist: W0=2.0% | W1=1.7% | W2=23.3% | W3=5.6% | W4=67.5%
2026-02-12 23:32:21,876 - INFO - [Group=Task2] slice_strength : S0=1.47 | S1=1.55 | S2=4.01 | S3=3.11 | S4=5.20
2026-02-12 23:32:24,063 - INFO - [Group=Task3] CI_acc=39.12% | corr_slice_max=5.673 | best_other_max=6.046 | gap=-0.373
2026-02-12 23:32:24,064 - INFO - [Group=Task3] winner_task_dist: W0=1.4% | W1=1.5% | W2=2.2% | W3=39.1% | W4=55.8%
2026-02-12 23:32:24,064 - INFO - [Group=Task3] slice_strength : S0=1.81 | S1=1.24 | S2=2.84 | S3=5.67 | S4=5.98
2026-02-12 23:32:26,233 - INFO - [Group=Task4] CI_acc=92.99% | corr_slice_max=6.894 | best_other_max=4.949 | gap=1.945
2026-02-12 23:32:26,234 - INFO - [Group=Task4] winner_task_dist: W0=1.4% | W1=0.7% | W2=0.7% | W3=3.9% | W4=93.4%
2026-02-12 23:32:26,234 - INFO - [Group=Task4] slice_strength : S0=1.97 | S1=1.44 | S2=3.49 | S3=4.63 | S4=6.89
2026-02-12 23:32:26,234 - INFO - ======================================
2026-02-12 23:32:26,234 - INFO - ========== FINAL METRICS (Class-IL) ==========
2026-02-12 23:32:26,235 - INFO - Forgetting per task: T0=36.45%, T1=46.91%, T2=65.64%, T3=59.67%, T4=0.00%
2026-02-12 23:32:26,235 - INFO - BWT: -52.17%
2026-02-12 23:32:26,235 - INFO - Final average Class-IL accuracy: 46.77%
