2026-02-11 17:14:37,232 - INFO - Device: cpu
2026-02-11 17:14:37,232 - INFO - Config: {'device': 'cpu', 'lr': 0.005, 'epochs_per_task': 4, 'batch_size': 128, 'lambda_slice': 2.0, 'lambda_feat': 0.5, 'use_cosine_head': True, 'seed': 42, 'freeze_backbone_after_task': -1, 'ewc_lambda': 0.0, 'si_lambda': 0.0, 'use_attention_backbone': True, 'use_adapters': False, 'lambda_slice_balance': 0.0, 'lambda_slice_margin': 0.0, 'slice_margin': 0.5, 'use_task_inference': False, 'lambda_task_inference': 1.0}
2026-02-11 17:14:37,236 - INFO - ========== Training Task 0: classes [0, 1] ==========
2026-02-11 17:14:44,631 - INFO - [Task 0 | ep 0 | step 0] loss=0.6816 c=0.6816 r=0.0000 | CI_T0=89.80%
2026-02-11 17:14:49,176 - INFO - [Task 0 | ep 0 | step 25] loss=0.0193 c=0.0193 r=0.0000 | CI_T0=99.76%
2026-02-11 17:14:53,625 - INFO - [Task 0 | ep 0 | step 50] loss=0.0024 c=0.0024 r=0.0000 | CI_T0=99.90%
2026-02-11 17:14:58,072 - INFO - [Task 0 | ep 0 | step 75] loss=0.0009 c=0.0009 r=0.0000 | CI_T0=99.89%
2026-02-11 17:15:06,090 - INFO - [Task 0 | ep 1 | step 100] loss=0.0006 c=0.0006 r=0.0000 | CI_T0=99.90%
2026-02-11 17:15:10,540 - INFO - [Task 0 | ep 1 | step 125] loss=0.0006 c=0.0006 r=0.0000 | CI_T0=99.82%
2026-02-11 17:15:15,012 - INFO - [Task 0 | ep 1 | step 150] loss=0.0006 c=0.0006 r=0.0000 | CI_T0=99.86%
2026-02-11 17:15:19,380 - INFO - [Task 0 | ep 1 | step 175] loss=0.0044 c=0.0044 r=0.0000 | CI_T0=99.59%
2026-02-11 17:15:27,330 - INFO - [Task 0 | ep 2 | step 200] loss=0.0002 c=0.0002 r=0.0000 | CI_T0=99.86%
2026-02-11 17:15:31,805 - INFO - [Task 0 | ep 2 | step 225] loss=0.0021 c=0.0021 r=0.0000 | CI_T0=99.94%
2026-02-11 17:15:36,198 - INFO - [Task 0 | ep 2 | step 250] loss=0.0003 c=0.0003 r=0.0000 | CI_T0=99.93%
2026-02-11 17:15:40,568 - INFO - [Task 0 | ep 2 | step 275] loss=0.0008 c=0.0008 r=0.0000 | CI_T0=99.90%
2026-02-11 17:15:48,513 - INFO - [Task 0 | ep 3 | step 300] loss=0.0004 c=0.0004 r=0.0000 | CI_T0=99.08%
2026-02-11 17:15:52,922 - INFO - [Task 0 | ep 3 | step 325] loss=0.0002 c=0.0002 r=0.0000 | CI_T0=99.91%
2026-02-11 17:15:57,293 - INFO - [Task 0 | ep 3 | step 350] loss=0.0007 c=0.0007 r=0.0000 | CI_T0=99.93%
2026-02-11 17:16:01,715 - INFO - [Task 0 | ep 3 | step 375] loss=0.0002 c=0.0002 r=0.0000 | CI_T0=99.97%
2026-02-11 17:16:06,328 - INFO - [After Task 0] Task-IL : T0=99.95% | Avg=99.95%
2026-02-11 17:16:06,328 - INFO - [After Task 0] Class-IL: T0=99.95% | Avg=99.95%
2026-02-11 17:16:06,328 - INFO - ========== GROUP DIFFERENCES ==========
2026-02-11 17:16:06,328 - INFO - Seen tasks: 0..0 | valid_out_dim=2
2026-02-11 17:16:08,371 - INFO - [Group=Task0] CI_acc=99.95% | corr_slice_max=4.844 | best_other_max=nan | gap=nan
2026-02-11 17:16:08,371 - INFO - [Group=Task0] winner_task_dist: W0=100.0%
2026-02-11 17:16:08,371 - INFO - [Group=Task0] slice_strength : S0=4.84
2026-02-11 17:16:08,371 - INFO - ======================================
2026-02-11 17:16:08,371 - INFO - ========== Training Task 1: classes [2, 3] ==========
2026-02-11 17:16:19,600 - INFO - [Task 1 | ep 0 | step 0] loss=5.9274 c=4.1716 r=1.7557 | CI_T0=99.75% | CI_T1=11.69%
2026-02-11 17:16:28,415 - INFO - [Task 1 | ep 0 | step 25] loss=1.4927 c=0.2297 r=1.2630 | CI_T0=0.00% | CI_T1=91.90%
2026-02-11 17:16:36,938 - INFO - [Task 1 | ep 0 | step 50] loss=1.0519 c=0.2236 r=0.8283 | CI_T0=0.00% | CI_T1=92.36%
2026-02-11 17:16:45,416 - INFO - [Task 1 | ep 0 | step 75] loss=1.0176 c=0.2066 r=0.8111 | CI_T0=0.00% | CI_T1=96.68%
2026-02-11 17:16:57,271 - INFO - [Task 1 | ep 1 | step 100] loss=1.2458 c=0.2162 r=1.0297 | CI_T0=0.00% | CI_T1=97.49%
2026-02-11 17:17:05,663 - INFO - [Task 1 | ep 1 | step 125] loss=1.0443 c=0.1619 r=0.8824 | CI_T0=0.05% | CI_T1=96.63%
2026-02-11 17:17:14,076 - INFO - [Task 1 | ep 1 | step 150] loss=0.8020 c=0.1933 r=0.6087 | CI_T0=0.14% | CI_T1=97.18%
2026-02-11 17:17:22,481 - INFO - [Task 1 | ep 1 | step 175] loss=1.2375 c=0.1680 r=1.0695 | CI_T0=0.57% | CI_T1=97.61%
2026-02-11 17:17:34,424 - INFO - [Task 1 | ep 2 | step 200] loss=0.8609 c=0.1913 r=0.6696 | CI_T0=0.14% | CI_T1=97.77%
2026-02-11 17:17:42,893 - INFO - [Task 1 | ep 2 | step 225] loss=0.7803 c=0.1982 r=0.5821 | CI_T0=0.27% | CI_T1=97.76%
2026-02-11 17:17:51,424 - INFO - [Task 1 | ep 2 | step 250] loss=0.7908 c=0.2141 r=0.5767 | CI_T0=0.41% | CI_T1=97.58%
2026-02-11 17:17:59,866 - INFO - [Task 1 | ep 2 | step 275] loss=1.4192 c=0.1452 r=1.2740 | CI_T0=0.02% | CI_T1=94.57%
2026-02-11 17:18:11,851 - INFO - [Task 1 | ep 3 | step 300] loss=0.9047 c=0.1152 r=0.7895 | CI_T0=0.18% | CI_T1=97.55%
2026-02-11 17:18:20,285 - INFO - [Task 1 | ep 3 | step 325] loss=0.9025 c=0.1346 r=0.7679 | CI_T0=0.38% | CI_T1=98.06%
2026-02-11 17:18:28,770 - INFO - [Task 1 | ep 3 | step 350] loss=0.7654 c=0.1987 r=0.5667 | CI_T0=0.22% | CI_T1=97.90%
2026-02-11 17:18:37,151 - INFO - [Task 1 | ep 3 | step 375] loss=1.0383 c=0.1691 r=0.8692 | CI_T0=1.35% | CI_T1=97.91%
2026-02-11 17:18:45,525 - INFO - [After Task 1] Task-IL : T0=99.95% | T1=98.04% | Avg=99.00%
2026-02-11 17:18:45,525 - INFO - [After Task 1] Class-IL: T0=0.99% | T1=98.04% | Avg=49.52%
2026-02-11 17:18:45,525 - INFO - ========== GROUP DIFFERENCES ==========
2026-02-11 17:18:45,525 - INFO - Seen tasks: 0..1 | valid_out_dim=4
2026-02-11 17:18:47,562 - INFO - [Group=Task0] CI_acc=0.99% | corr_slice_max=4.892 | best_other_max=6.197 | gap=-1.305
2026-02-11 17:18:47,562 - INFO - [Group=Task0] winner_task_dist: W0=1.0% | W1=99.0%
2026-02-11 17:18:47,562 - INFO - [Group=Task0] slice_strength : S0=4.89 | S1=6.20
2026-02-11 17:18:49,591 - INFO - [Group=Task1] CI_acc=98.04% | corr_slice_max=6.887 | best_other_max=3.644 | gap=3.242
2026-02-11 17:18:49,591 - INFO - [Group=Task1] winner_task_dist: W0=0.0% | W1=100.0%
2026-02-11 17:18:49,591 - INFO - [Group=Task1] slice_strength : S0=3.64 | S1=6.89
2026-02-11 17:18:49,591 - INFO - ======================================
2026-02-11 17:18:49,592 - INFO - ========== Training Task 2: classes [4, 5] ==========
2026-02-11 17:19:04,782 - INFO - [Task 2 | ep 0 | step 0] loss=8.4683 c=6.7233 r=1.7450 | CI_T0=0.38% | CI_T1=97.07% | CI_T2=0.00%
2026-02-11 17:19:17,260 - INFO - [Task 2 | ep 0 | step 25] loss=1.4970 c=0.4809 r=1.0161 | CI_T0=0.00% | CI_T1=12.35% | CI_T2=93.78%
2026-02-11 17:19:29,778 - INFO - [Task 2 | ep 0 | step 50] loss=1.0651 c=0.3664 r=0.6987 | CI_T0=0.00% | CI_T1=17.78% | CI_T2=93.32%
2026-02-11 17:19:42,278 - INFO - [Task 2 | ep 0 | step 75] loss=1.1419 c=0.2824 r=0.8595 | CI_T0=0.00% | CI_T1=14.20% | CI_T2=96.48%
2026-02-11 17:19:58,209 - INFO - [Task 2 | ep 1 | step 100] loss=1.0247 c=0.2621 r=0.7626 | CI_T0=0.00% | CI_T1=22.76% | CI_T2=96.81%
2026-02-11 17:20:10,666 - INFO - [Task 2 | ep 1 | step 125] loss=0.8894 c=0.2416 r=0.6478 | CI_T0=0.02% | CI_T1=23.83% | CI_T2=95.70%
2026-02-11 17:20:23,130 - INFO - [Task 2 | ep 1 | step 150] loss=0.9303 c=0.2149 r=0.7154 | CI_T0=0.00% | CI_T1=14.64% | CI_T2=97.67%
2026-02-11 17:20:39,077 - INFO - [Task 2 | ep 2 | step 175] loss=0.8180 c=0.2306 r=0.5874 | CI_T0=0.00% | CI_T1=18.97% | CI_T2=96.70%
2026-02-11 17:20:51,458 - INFO - [Task 2 | ep 2 | step 200] loss=0.9602 c=0.2471 r=0.7131 | CI_T0=0.00% | CI_T1=22.71% | CI_T2=96.88%
2026-02-11 17:21:03,860 - INFO - [Task 2 | ep 2 | step 225] loss=0.9715 c=0.2251 r=0.7464 | CI_T0=0.00% | CI_T1=20.71% | CI_T2=98.16%
2026-02-11 17:21:16,196 - INFO - [Task 2 | ep 2 | step 250] loss=0.6215 c=0.1998 r=0.4217 | CI_T0=0.00% | CI_T1=17.95% | CI_T2=98.55%
2026-02-11 17:21:32,149 - INFO - [Task 2 | ep 3 | step 275] loss=0.7054 c=0.1588 r=0.5466 | CI_T0=0.00% | CI_T1=17.81% | CI_T2=99.00%
2026-02-11 17:21:44,611 - INFO - [Task 2 | ep 3 | step 300] loss=0.7823 c=0.1631 r=0.6193 | CI_T0=0.00% | CI_T1=22.59% | CI_T2=98.72%
2026-02-11 17:21:57,112 - INFO - [Task 2 | ep 3 | step 325] loss=0.9394 c=0.1742 r=0.7652 | CI_T0=0.00% | CI_T1=16.47% | CI_T2=94.50%
2026-02-11 17:22:09,990 - INFO - [After Task 2] Task-IL : T0=99.95% | T1=97.65% | T2=99.31% | Avg=98.97%
2026-02-11 17:22:09,990 - INFO - [After Task 2] Class-IL: T0=0.00% | T1=13.66% | T2=98.88% | Avg=37.51%
2026-02-11 17:22:09,990 - INFO - ========== GROUP DIFFERENCES ==========
2026-02-11 17:22:09,990 - INFO - Seen tasks: 0..2 | valid_out_dim=6
2026-02-11 17:22:12,010 - INFO - [Group=Task0] CI_acc=0.00% | corr_slice_max=4.994 | best_other_max=6.863 | gap=-1.869
2026-02-11 17:22:12,010 - INFO - [Group=Task0] winner_task_dist: W0=0.0% | W1=3.0% | W2=97.0%
2026-02-11 17:22:12,010 - INFO - [Group=Task0] slice_strength : S0=4.99 | S1=6.06 | S2=6.86
2026-02-11 17:22:14,044 - INFO - [Group=Task1] CI_acc=13.66% | corr_slice_max=6.685 | best_other_max=7.875 | gap=-1.190
2026-02-11 17:22:14,044 - INFO - [Group=Task1] winner_task_dist: W0=0.0% | W1=13.7% | W2=86.3%
2026-02-11 17:22:14,044 - INFO - [Group=Task1] slice_strength : S0=3.68 | S1=6.68 | S2=7.87
2026-02-11 17:22:16,058 - INFO - [Group=Task2] CI_acc=98.88% | corr_slice_max=8.756 | best_other_max=6.300 | gap=2.457
2026-02-11 17:22:16,058 - INFO - [Group=Task2] winner_task_dist: W0=0.0% | W1=0.5% | W2=99.5%
2026-02-11 17:22:16,058 - INFO - [Group=Task2] slice_strength : S0=3.62 | S1=6.30 | S2=8.76
2026-02-11 17:22:16,058 - INFO - ======================================
2026-02-11 17:22:16,058 - INFO - ========== Training Task 3: classes [6, 7] ==========
2026-02-11 17:22:35,158 - INFO - [Task 3 | ep 0 | step 0] loss=9.5294 c=8.3512 r=1.1782 | CI_T0=0.00% | CI_T1=15.07% | CI_T2=95.59% | CI_T3=0.00%
2026-02-11 17:22:51,661 - INFO - [Task 3 | ep 0 | step 25] loss=1.6206 c=0.3575 r=1.2631 | CI_T0=0.00% | CI_T1=11.86% | CI_T2=19.11% | CI_T3=97.76%
2026-02-11 17:23:08,129 - INFO - [Task 3 | ep 0 | step 50] loss=1.4529 c=0.3565 r=1.0964 | CI_T0=0.01% | CI_T1=9.08% | CI_T2=61.85% | CI_T3=96.27%
2026-02-11 17:23:24,675 - INFO - [Task 3 | ep 0 | step 75] loss=0.9328 c=0.2708 r=0.6620 | CI_T0=0.00% | CI_T1=6.97% | CI_T2=64.09% | CI_T3=94.78%
2026-02-11 17:23:44,784 - INFO - [Task 3 | ep 1 | step 100] loss=1.0273 c=0.2673 r=0.7600 | CI_T0=0.00% | CI_T1=5.82% | CI_T2=69.22% | CI_T3=98.04%
2026-02-11 17:24:01,416 - INFO - [Task 3 | ep 1 | step 125] loss=0.8335 c=0.3002 r=0.5333 | CI_T0=0.00% | CI_T1=8.46% | CI_T2=64.20% | CI_T3=92.71%
2026-02-11 17:24:17,905 - INFO - [Task 3 | ep 1 | step 150] loss=0.7828 c=0.2255 r=0.5573 | CI_T0=0.00% | CI_T1=4.77% | CI_T2=65.98% | CI_T3=97.06%
2026-02-11 17:24:34,336 - INFO - [Task 3 | ep 1 | step 175] loss=1.1056 c=0.2068 r=0.8988 | CI_T0=0.00% | CI_T1=3.44% | CI_T2=61.18% | CI_T3=96.66%
2026-02-11 17:24:54,392 - INFO - [Task 3 | ep 2 | step 200] loss=0.8491 c=0.1925 r=0.6566 | CI_T0=0.00% | CI_T1=2.06% | CI_T2=65.28% | CI_T3=98.12%
2026-02-11 17:25:10,931 - INFO - [Task 3 | ep 2 | step 225] loss=0.7588 c=0.2018 r=0.5569 | CI_T0=0.00% | CI_T1=3.49% | CI_T2=51.04% | CI_T3=98.91%
2026-02-11 17:25:27,479 - INFO - [Task 3 | ep 2 | step 250] loss=0.7899 c=0.1714 r=0.6185 | CI_T0=0.00% | CI_T1=0.71% | CI_T2=53.18% | CI_T3=99.28%
2026-02-11 17:25:43,987 - INFO - [Task 3 | ep 2 | step 275] loss=0.9468 c=0.1380 r=0.8088 | CI_T0=0.00% | CI_T1=1.40% | CI_T2=54.62% | CI_T3=99.24%
2026-02-11 17:26:04,153 - INFO - [Task 3 | ep 3 | step 300] loss=1.1186 c=0.1479 r=0.9707 | CI_T0=0.00% | CI_T1=0.85% | CI_T2=44.84% | CI_T3=99.26%
2026-02-11 17:26:20,680 - INFO - [Task 3 | ep 3 | step 325] loss=0.6723 c=0.1348 r=0.5375 | CI_T0=0.00% | CI_T1=5.44% | CI_T2=40.61% | CI_T3=99.28%
2026-02-11 17:26:37,221 - INFO - [Task 3 | ep 3 | step 350] loss=0.8633 c=0.1437 r=0.7195 | CI_T0=0.00% | CI_T1=1.39% | CI_T2=47.46% | CI_T3=99.55%
2026-02-11 17:26:53,596 - INFO - [Task 3 | ep 3 | step 375] loss=0.7147 c=0.1212 r=0.5935 | CI_T0=0.00% | CI_T1=0.75% | CI_T2=42.12% | CI_T3=99.65%
2026-02-11 17:27:10,051 - INFO - [After Task 3] Task-IL : T0=99.95% | T1=97.75% | T2=99.25% | T3=99.80% | Avg=99.19%
2026-02-11 17:27:10,051 - INFO - [After Task 3] Class-IL: T0=0.00% | T1=0.73% | T2=48.61% | T3=99.60% | Avg=37.24%
2026-02-11 17:27:10,051 - INFO - ========== GROUP DIFFERENCES ==========
2026-02-11 17:27:10,051 - INFO - Seen tasks: 0..3 | valid_out_dim=8
2026-02-11 17:27:12,068 - INFO - [Group=Task0] CI_acc=0.00% | corr_slice_max=4.858 | best_other_max=8.423 | gap=-3.565
2026-02-11 17:27:12,068 - INFO - [Group=Task0] winner_task_dist: W0=0.0% | W1=0.0% | W2=6.1% | W3=93.9%
2026-02-11 17:27:12,068 - INFO - [Group=Task0] slice_strength : S0=4.86 | S1=6.31 | S2=7.00 | S3=8.38
2026-02-11 17:27:14,090 - INFO - [Group=Task1] CI_acc=0.73% | corr_slice_max=6.667 | best_other_max=9.120 | gap=-2.452
2026-02-11 17:27:14,090 - INFO - [Group=Task1] winner_task_dist: W0=0.0% | W1=0.7% | W2=30.5% | W3=68.8%
2026-02-11 17:27:14,090 - INFO - [Group=Task1] slice_strength : S0=3.43 | S1=6.67 | S2=7.79 | S3=8.75
2026-02-11 17:27:16,103 - INFO - [Group=Task2] CI_acc=48.61% | corr_slice_max=8.755 | best_other_max=8.842 | gap=-0.087
2026-02-11 17:27:16,103 - INFO - [Group=Task2] winner_task_dist: W0=0.0% | W1=0.0% | W2=48.6% | W3=51.4%
2026-02-11 17:27:16,103 - INFO - [Group=Task2] slice_strength : S0=3.47 | S1=6.31 | S2=8.76 | S3=8.81
2026-02-11 17:27:18,125 - INFO - [Group=Task3] CI_acc=99.60% | corr_slice_max=10.503 | best_other_max=7.893 | gap=2.610
2026-02-11 17:27:18,125 - INFO - [Group=Task3] winner_task_dist: W0=0.0% | W1=0.0% | W2=0.2% | W3=99.8%
2026-02-11 17:27:18,125 - INFO - [Group=Task3] slice_strength : S0=3.58 | S1=6.23 | S2=7.87 | S3=10.50
2026-02-11 17:27:18,125 - INFO - ======================================
2026-02-11 17:27:18,125 - INFO - ========== Training Task 4: classes [8, 9] ==========
2026-02-11 17:27:41,198 - INFO - [Task 4 | ep 0 | step 0] loss=12.3385 c=9.7213 r=2.6172 | CI_T0=0.00% | CI_T1=0.97% | CI_T2=41.23% | CI_T3=99.54% | CI_T4=0.00%
2026-02-11 17:28:01,837 - INFO - [Task 4 | ep 0 | step 25] loss=1.7786 c=0.4056 r=1.3730 | CI_T0=0.00% | CI_T1=0.04% | CI_T2=0.02% | CI_T3=21.07% | CI_T4=93.95%
2026-02-11 17:28:22,439 - INFO - [Task 4 | ep 0 | step 50] loss=1.1777 c=0.3878 r=0.7899 | CI_T0=0.00% | CI_T1=0.02% | CI_T2=0.39% | CI_T3=36.17% | CI_T4=95.83%
2026-02-11 17:28:42,973 - INFO - [Task 4 | ep 0 | step 75] loss=1.1411 c=0.4691 r=0.6720 | CI_T0=0.00% | CI_T1=0.00% | CI_T2=0.55% | CI_T3=42.01% | CI_T4=95.58%
2026-02-11 17:29:06,963 - INFO - [Task 4 | ep 1 | step 100] loss=0.9899 c=0.3375 r=0.6524 | CI_T0=0.00% | CI_T1=0.00% | CI_T2=1.38% | CI_T3=38.50% | CI_T4=96.54%
2026-02-11 17:29:27,507 - INFO - [Task 4 | ep 1 | step 125] loss=1.4898 c=0.3606 r=1.1292 | CI_T0=0.00% | CI_T1=0.00% | CI_T2=1.56% | CI_T3=38.08% | CI_T4=97.27%
2026-02-11 17:29:48,033 - INFO - [Task 4 | ep 1 | step 150] loss=0.8900 c=0.2779 r=0.6121 | CI_T0=0.00% | CI_T1=0.00% | CI_T2=0.05% | CI_T3=40.94% | CI_T4=97.49%
2026-02-11 17:30:08,563 - INFO - [Task 4 | ep 1 | step 175] loss=0.7686 c=0.2761 r=0.4925 | CI_T0=0.00% | CI_T1=0.00% | CI_T2=0.10% | CI_T3=38.67% | CI_T4=97.38%
2026-02-11 17:30:32,672 - INFO - [Task 4 | ep 2 | step 200] loss=0.8710 c=0.2134 r=0.6576 | CI_T0=0.00% | CI_T1=0.00% | CI_T2=0.37% | CI_T3=38.70% | CI_T4=97.78%
2026-02-11 17:30:53,255 - INFO - [Task 4 | ep 2 | step 225] loss=0.6838 c=0.2229 r=0.4609 | CI_T0=0.00% | CI_T1=0.00% | CI_T2=0.07% | CI_T3=38.96% | CI_T4=97.80%
2026-02-11 17:31:13,784 - INFO - [Task 4 | ep 2 | step 250] loss=0.7655 c=0.1659 r=0.5995 | CI_T0=0.00% | CI_T1=0.00% | CI_T2=0.04% | CI_T3=34.47% | CI_T4=98.17%
2026-02-11 17:31:34,341 - INFO - [Task 4 | ep 2 | step 275] loss=0.8546 c=0.1919 r=0.6628 | CI_T0=0.00% | CI_T1=0.00% | CI_T2=0.18% | CI_T3=43.51% | CI_T4=97.35%
2026-02-11 17:31:58,500 - INFO - [Task 4 | ep 3 | step 300] loss=0.9871 c=0.1913 r=0.7958 | CI_T0=0.00% | CI_T1=0.00% | CI_T2=0.04% | CI_T3=38.91% | CI_T4=97.94%
2026-02-11 17:32:19,043 - INFO - [Task 4 | ep 3 | step 325] loss=0.6361 c=0.2124 r=0.4237 | CI_T0=0.00% | CI_T1=0.00% | CI_T2=0.02% | CI_T3=35.28% | CI_T4=98.06%
2026-02-11 17:32:39,646 - INFO - [Task 4 | ep 3 | step 350] loss=0.9284 c=0.1513 r=0.7771 | CI_T0=0.00% | CI_T1=0.00% | CI_T2=0.03% | CI_T3=31.05% | CI_T4=98.40%
2026-02-11 17:33:00,492 - INFO - [After Task 4] Task-IL : T0=99.95% | T1=97.45% | T2=98.19% | T3=99.65% | T4=97.73% | Avg=98.59%
2026-02-11 17:33:00,492 - INFO - [After Task 4] Class-IL: T0=0.00% | T1=0.00% | T2=0.05% | T3=34.14% | T4=97.18% | Avg=26.27%
2026-02-11 17:33:00,492 - INFO - ========== GROUP DIFFERENCES ==========
2026-02-11 17:33:00,492 - INFO - Seen tasks: 0..4 | valid_out_dim=10
2026-02-11 17:33:02,512 - INFO - [Group=Task0] CI_acc=0.00% | corr_slice_max=4.876 | best_other_max=10.496 | gap=-5.619
2026-02-11 17:33:02,512 - INFO - [Group=Task0] winner_task_dist: W0=0.0% | W1=0.0% | W2=0.0% | W3=1.8% | W4=98.2%
2026-02-11 17:33:02,513 - INFO - [Group=Task0] slice_strength : S0=4.88 | S1=6.28 | S2=6.97 | S3=8.33 | S4=10.49
2026-02-11 17:33:04,515 - INFO - [Group=Task1] CI_acc=0.00% | corr_slice_max=6.734 | best_other_max=10.939 | gap=-4.205
2026-02-11 17:33:04,515 - INFO - [Group=Task1] winner_task_dist: W0=0.0% | W1=0.0% | W2=0.0% | W3=10.0% | W4=90.0%
2026-02-11 17:33:04,515 - INFO - [Group=Task1] slice_strength : S0=3.45 | S1=6.73 | S2=7.72 | S3=8.68 | S4=10.85
2026-02-11 17:33:06,526 - INFO - [Group=Task2] CI_acc=0.05% | corr_slice_max=8.752 | best_other_max=11.428 | gap=-2.677
2026-02-11 17:33:06,527 - INFO - [Group=Task2] winner_task_dist: W0=0.0% | W1=0.0% | W2=0.1% | W3=1.1% | W4=98.8%
2026-02-11 17:33:06,527 - INFO - [Group=Task2] slice_strength : S0=3.66 | S1=6.47 | S2=8.75 | S3=8.71 | S4=11.42
2026-02-11 17:33:08,521 - INFO - [Group=Task3] CI_acc=34.14% | corr_slice_max=10.282 | best_other_max=10.970 | gap=-0.687
2026-02-11 17:33:08,521 - INFO - [Group=Task3] winner_task_dist: W0=0.0% | W1=0.0% | W2=0.2% | W3=34.1% | W4=65.7%
2026-02-11 17:33:08,521 - INFO - [Group=Task3] slice_strength : S0=3.74 | S1=6.13 | S2=7.96 | S3=10.28 | S4=10.96
2026-02-11 17:33:10,530 - INFO - [Group=Task4] CI_acc=97.18% | corr_slice_max=11.732 | best_other_max=9.156 | gap=2.577
2026-02-11 17:33:10,531 - INFO - [Group=Task4] winner_task_dist: W0=0.0% | W1=0.0% | W2=0.0% | W3=0.8% | W4=99.2%
2026-02-11 17:33:10,531 - INFO - [Group=Task4] slice_strength : S0=3.79 | S1=6.47 | S2=7.92 | S3=9.04 | S4=11.73
2026-02-11 17:33:10,531 - INFO - ======================================
2026-02-11 17:33:10,531 - INFO - ========== FINAL METRICS (Class-IL) ==========
2026-02-11 17:33:10,531 - INFO - Forgetting per task: T0=99.95%, T1=98.04%, T2=98.83%, T3=65.46%, T4=0.00%
2026-02-11 17:33:10,531 - INFO - BWT: -90.57%
2026-02-11 17:33:10,531 - INFO - Final average Class-IL accuracy: 26.27%
