2026-02-13 17:40:47,111 - INFO - Device: cuda
2026-02-13 17:40:47,111 - INFO - Config: {'device': 'cuda', 'lr': 0.001, 'epochs_per_task': 8, 'batch_size': 128, 'lambda_slice': 2.0, 'lambda_feat': 0.5, 'ewc_lambda': 0.0, 'si_lambda': 0.0, 'seed': 42}
2026-02-13 17:40:47,191 - INFO - ========== Training Task 0: classes [0, 1] ==========
2026-02-13 17:40:56,361 - INFO - [Task 0 | ep 0 | step 0] loss=0.8618 c=0.8618 r=0.0000 | CI_T0=69.05%
2026-02-13 17:41:01,700 - INFO - [Task 0 | ep 0 | step 50] loss=0.2535 c=0.2535 r=0.0000 | CI_T0=88.43%
2026-02-13 17:41:11,462 - INFO - [Task 0 | ep 1 | step 100] loss=0.2254 c=0.2254 r=0.0000 | CI_T0=86.87%
2026-02-13 17:41:16,761 - INFO - [Task 0 | ep 1 | step 150] loss=0.2290 c=0.2290 r=0.0000 | CI_T0=91.61%
2026-02-13 17:41:26,418 - INFO - [Task 0 | ep 2 | step 200] loss=0.1431 c=0.1431 r=0.0000 | CI_T0=92.74%
2026-02-13 17:41:36,076 - INFO - [Task 0 | ep 3 | step 250] loss=0.1203 c=0.1203 r=0.0000 | CI_T0=93.73%
2026-02-13 17:41:41,205 - INFO - [Task 0 | ep 3 | step 300] loss=0.1329 c=0.1329 r=0.0000 | CI_T0=91.52%
2026-02-13 17:41:50,628 - INFO - [Task 0 | ep 4 | step 350] loss=0.1727 c=0.1727 r=0.0000 | CI_T0=92.24%
2026-02-13 17:42:00,105 - INFO - [Task 0 | ep 5 | step 400] loss=0.1287 c=0.1287 r=0.0000 | CI_T0=95.59%
2026-02-13 17:42:05,231 - INFO - [Task 0 | ep 5 | step 450] loss=0.1498 c=0.1498 r=0.0000 | CI_T0=96.01%
2026-02-13 17:42:14,815 - INFO - [Task 0 | ep 6 | step 500] loss=0.1233 c=0.1233 r=0.0000 | CI_T0=95.83%
2026-02-13 17:42:24,376 - INFO - [Task 0 | ep 7 | step 550] loss=0.1380 c=0.1380 r=0.0000 | CI_T0=96.47%
2026-02-13 17:42:29,559 - INFO - [Task 0 | ep 7 | step 600] loss=0.0940 c=0.0940 r=0.0000 | CI_T0=95.56%
2026-02-13 17:42:37,970 - INFO - [After Task 0] Task-IL : T0=96.40% | Avg=96.40%
2026-02-13 17:42:37,970 - INFO - [After Task 0] Class-IL: T0=96.40% | Avg=96.40%
2026-02-13 17:42:37,970 - INFO - ========== GROUP DIFFERENCES ==========
2026-02-13 17:42:37,970 - INFO - Seen tasks: 0..0 | valid_out_dim=2
2026-02-13 17:42:41,950 - INFO - [Group=Task0] CI_acc=96.40% | corr_slice_max=2.526 | best_other_max=nan | gap=nan
2026-02-13 17:42:41,950 - INFO - [Group=Task0] winner_task_dist: W0=100.0%
2026-02-13 17:42:41,950 - INFO - [Group=Task0] slice_strength : S0=2.53
2026-02-13 17:42:41,950 - INFO - ======================================
2026-02-13 17:42:41,950 - INFO - ========== Training Task 1: classes [2, 3] ==========
2026-02-13 17:42:55,647 - INFO - [Task 1 | ep 0 | step 0] loss=5.0526 c=2.0705 r=2.9821 | CI_T0=86.63% | CI_T1=7.03%
2026-02-13 17:43:05,689 - INFO - [Task 1 | ep 0 | step 50] loss=1.3484 c=0.6634 r=0.6850 | CI_T0=10.91% | CI_T1=78.35%
2026-02-13 17:43:20,087 - INFO - [Task 1 | ep 1 | step 100] loss=1.0971 c=0.4359 r=0.6611 | CI_T0=2.85% | CI_T1=82.10%
2026-02-13 17:43:30,117 - INFO - [Task 1 | ep 1 | step 150] loss=1.1220 c=0.5157 r=0.6063 | CI_T0=1.52% | CI_T1=80.51%
2026-02-13 17:43:44,507 - INFO - [Task 1 | ep 2 | step 200] loss=0.9959 c=0.4131 r=0.5828 | CI_T0=1.02% | CI_T1=82.15%
2026-02-13 17:43:58,673 - INFO - [Task 1 | ep 3 | step 250] loss=1.0747 c=0.4241 r=0.6506 | CI_T0=1.11% | CI_T1=83.48%
2026-02-13 17:44:08,865 - INFO - [Task 1 | ep 3 | step 300] loss=1.0192 c=0.4784 r=0.5408 | CI_T0=0.48% | CI_T1=84.09%
2026-02-13 17:44:23,107 - INFO - [Task 1 | ep 4 | step 350] loss=0.9142 c=0.3458 r=0.5683 | CI_T0=0.41% | CI_T1=83.32%
2026-02-13 17:44:37,525 - INFO - [Task 1 | ep 5 | step 400] loss=0.9541 c=0.4030 r=0.5511 | CI_T0=0.42% | CI_T1=83.68%
2026-02-13 17:44:47,667 - INFO - [Task 1 | ep 5 | step 450] loss=0.9910 c=0.4111 r=0.5799 | CI_T0=1.23% | CI_T1=85.89%
2026-02-13 17:45:02,060 - INFO - [Task 1 | ep 6 | step 500] loss=0.8681 c=0.3354 r=0.5326 | CI_T0=3.11% | CI_T1=85.20%
2026-02-13 17:45:16,456 - INFO - [Task 1 | ep 7 | step 550] loss=0.8210 c=0.3215 r=0.4995 | CI_T0=1.47% | CI_T1=84.75%
2026-02-13 17:45:26,517 - INFO - [Task 1 | ep 7 | step 600] loss=0.8946 c=0.3588 r=0.5358 | CI_T0=1.04% | CI_T1=82.86%
2026-02-13 17:45:42,917 - INFO - [After Task 1] Task-IL : T0=96.10% | T1=84.40% | Avg=90.25%
2026-02-13 17:45:42,917 - INFO - [After Task 1] Class-IL: T0=2.90% | T1=84.35% | Avg=43.62%
2026-02-13 17:45:42,917 - INFO - ========== GROUP DIFFERENCES ==========
2026-02-13 17:45:42,917 - INFO - Seen tasks: 0..1 | valid_out_dim=4
2026-02-13 17:45:47,114 - INFO - [Group=Task0] CI_acc=2.90% | corr_slice_max=2.135 | best_other_max=4.749 | gap=-2.614
2026-02-13 17:45:47,114 - INFO - [Group=Task0] winner_task_dist: W0=2.9% | W1=97.1%
2026-02-13 17:45:47,114 - INFO - [Group=Task0] slice_strength : S0=2.14 | S1=4.75
2026-02-13 17:45:51,088 - INFO - [Group=Task1] CI_acc=84.35% | corr_slice_max=5.623 | best_other_max=1.329 | gap=4.294
2026-02-13 17:45:51,088 - INFO - [Group=Task1] winner_task_dist: W0=0.1% | W1=100.0%
2026-02-13 17:45:51,088 - INFO - [Group=Task1] slice_strength : S0=1.33 | S1=5.62
2026-02-13 17:45:51,088 - INFO - ======================================
2026-02-13 17:45:51,088 - INFO - ========== Training Task 2: classes [4, 5] ==========
2026-02-13 17:46:09,416 - INFO - [Task 2 | ep 0 | step 0] loss=6.0650 c=5.4427 r=0.6223 | CI_T0=2.70% | CI_T1=84.99% | CI_T2=0.00%
2026-02-13 17:46:24,260 - INFO - [Task 2 | ep 0 | step 50] loss=2.2074 c=1.2460 r=0.9614 | CI_T0=1.94% | CI_T1=55.06% | CI_T2=54.09%
2026-02-13 17:46:43,253 - INFO - [Task 2 | ep 1 | step 100] loss=1.5520 c=0.8539 r=0.6981 | CI_T0=0.27% | CI_T1=25.08% | CI_T2=78.34%
2026-02-13 17:46:58,042 - INFO - [Task 2 | ep 1 | step 150] loss=1.3603 c=0.6181 r=0.7423 | CI_T0=0.33% | CI_T1=14.63% | CI_T2=84.07%
2026-02-13 17:47:17,124 - INFO - [Task 2 | ep 2 | step 200] loss=1.0542 c=0.4710 r=0.5832 | CI_T0=0.18% | CI_T1=8.27% | CI_T2=87.67%
2026-02-13 17:47:36,231 - INFO - [Task 2 | ep 3 | step 250] loss=1.0459 c=0.5269 r=0.5189 | CI_T0=0.06% | CI_T1=6.56% | CI_T2=87.20%
2026-02-13 17:47:51,023 - INFO - [Task 2 | ep 3 | step 300] loss=1.1091 c=0.4816 r=0.6275 | CI_T0=0.21% | CI_T1=3.74% | CI_T2=88.50%
2026-02-13 17:48:09,893 - INFO - [Task 2 | ep 4 | step 350] loss=0.9523 c=0.4265 r=0.5258 | CI_T0=0.07% | CI_T1=4.51% | CI_T2=88.45%
2026-02-13 17:48:28,814 - INFO - [Task 2 | ep 5 | step 400] loss=1.0296 c=0.5062 r=0.5234 | CI_T0=0.36% | CI_T1=2.32% | CI_T2=88.22%
2026-02-13 17:48:43,466 - INFO - [Task 2 | ep 5 | step 450] loss=1.0146 c=0.4246 r=0.5900 | CI_T0=0.16% | CI_T1=3.91% | CI_T2=89.11%
2026-02-13 17:49:02,416 - INFO - [Task 2 | ep 6 | step 500] loss=0.9821 c=0.4165 r=0.5656 | CI_T0=0.33% | CI_T1=2.50% | CI_T2=89.84%
2026-02-13 17:49:21,271 - INFO - [Task 2 | ep 7 | step 550] loss=0.9001 c=0.3474 r=0.5527 | CI_T0=0.52% | CI_T1=2.98% | CI_T2=90.69%
2026-02-13 17:49:35,993 - INFO - [Task 2 | ep 7 | step 600] loss=1.0272 c=0.4308 r=0.5964 | CI_T0=0.62% | CI_T1=2.04% | CI_T2=90.13%
2026-02-13 17:49:59,835 - INFO - [After Task 2] Task-IL : T0=96.20% | T1=82.80% | T2=90.55% | Avg=89.85%
2026-02-13 17:49:59,836 - INFO - [After Task 2] Class-IL: T0=1.30% | T1=2.40% | T2=90.25% | Avg=31.32%
2026-02-13 17:49:59,836 - INFO - ========== GROUP DIFFERENCES ==========
2026-02-13 17:49:59,836 - INFO - Seen tasks: 0..2 | valid_out_dim=6
2026-02-13 17:50:03,731 - INFO - [Group=Task0] CI_acc=1.30% | corr_slice_max=2.319 | best_other_max=6.035 | gap=-3.716
2026-02-13 17:50:03,731 - INFO - [Group=Task0] winner_task_dist: W0=1.3% | W1=2.1% | W2=96.6%
2026-02-13 17:50:03,731 - INFO - [Group=Task0] slice_strength : S0=2.32 | S1=4.56 | S2=6.03
2026-02-13 17:50:07,829 - INFO - [Group=Task1] CI_acc=2.40% | corr_slice_max=5.466 | best_other_max=7.091 | gap=-1.625
2026-02-13 17:50:07,829 - INFO - [Group=Task1] winner_task_dist: W0=0.0% | W1=2.5% | W2=97.5%
2026-02-13 17:50:07,829 - INFO - [Group=Task1] slice_strength : S0=1.38 | S1=5.47 | S2=7.09
2026-02-13 17:50:11,685 - INFO - [Group=Task2] CI_acc=90.25% | corr_slice_max=7.546 | best_other_max=5.284 | gap=2.262
2026-02-13 17:50:11,685 - INFO - [Group=Task2] winner_task_dist: W0=0.0% | W1=0.5% | W2=99.5%
2026-02-13 17:50:11,685 - INFO - [Group=Task2] slice_strength : S0=1.15 | S1=5.28 | S2=7.55
2026-02-13 17:50:11,685 - INFO - ======================================
2026-02-13 17:50:11,685 - INFO - ========== Training Task 3: classes [6, 7] ==========
2026-02-13 17:50:35,012 - INFO - [Task 3 | ep 0 | step 0] loss=8.4231 c=7.4070 r=1.0161 | CI_T0=0.22% | CI_T1=1.51% | CI_T2=80.19% | CI_T3=0.00%
2026-02-13 17:50:54,779 - INFO - [Task 3 | ep 0 | step 50] loss=2.4840 c=1.3163 r=1.1677 | CI_T0=0.66% | CI_T1=13.80% | CI_T2=60.94% | CI_T3=48.80%
2026-02-13 17:51:18,573 - INFO - [Task 3 | ep 1 | step 100] loss=1.6687 c=0.6621 r=1.0066 | CI_T0=1.33% | CI_T1=3.44% | CI_T2=35.20% | CI_T3=85.23%
2026-02-13 17:51:38,304 - INFO - [Task 3 | ep 1 | step 150] loss=1.5247 c=0.6665 r=0.8582 | CI_T0=0.69% | CI_T1=2.77% | CI_T2=29.26% | CI_T3=90.94%
2026-02-13 17:52:02,054 - INFO - [Task 3 | ep 2 | step 200] loss=1.1484 c=0.3278 r=0.8206 | CI_T0=1.44% | CI_T1=1.22% | CI_T2=22.53% | CI_T3=88.94%
2026-02-13 17:52:25,950 - INFO - [Task 3 | ep 3 | step 250] loss=1.0294 c=0.3211 r=0.7084 | CI_T0=1.29% | CI_T1=1.21% | CI_T2=23.86% | CI_T3=93.70%
2026-02-13 17:52:45,532 - INFO - [Task 3 | ep 3 | step 300] loss=0.9984 c=0.3293 r=0.6692 | CI_T0=1.08% | CI_T1=0.58% | CI_T2=20.38% | CI_T3=94.08%
2026-02-13 17:53:09,243 - INFO - [Task 3 | ep 4 | step 350] loss=0.9089 c=0.2467 r=0.6622 | CI_T0=1.20% | CI_T1=1.11% | CI_T2=18.62% | CI_T3=94.90%
2026-02-13 17:53:33,195 - INFO - [Task 3 | ep 5 | step 400] loss=1.0223 c=0.3383 r=0.6840 | CI_T0=0.34% | CI_T1=0.31% | CI_T2=12.82% | CI_T3=92.42%
2026-02-13 17:53:52,905 - INFO - [Task 3 | ep 5 | step 450] loss=0.9730 c=0.2582 r=0.7147 | CI_T0=1.25% | CI_T1=0.41% | CI_T2=11.39% | CI_T3=95.75%
2026-02-13 17:54:16,709 - INFO - [Task 3 | ep 6 | step 500] loss=0.9450 c=0.2702 r=0.6748 | CI_T0=0.73% | CI_T1=0.34% | CI_T2=10.48% | CI_T3=94.48%
2026-02-13 17:54:40,819 - INFO - [Task 3 | ep 7 | step 550] loss=1.0016 c=0.3550 r=0.6466 | CI_T0=1.16% | CI_T1=0.31% | CI_T2=8.20% | CI_T3=94.58%
2026-02-13 17:55:00,630 - INFO - [Task 3 | ep 7 | step 600] loss=0.9105 c=0.2570 r=0.6535 | CI_T0=0.51% | CI_T1=0.33% | CI_T2=9.85% | CI_T3=96.05%
2026-02-13 17:55:32,343 - INFO - [After Task 3] Task-IL : T0=95.15% | T1=82.75% | T2=89.25% | T3=96.95% | Avg=91.03%
2026-02-13 17:55:32,343 - INFO - [After Task 3] Class-IL: T0=1.75% | T1=1.00% | T2=16.25% | T3=96.00% | Avg=28.75%
2026-02-13 17:55:32,343 - INFO - ========== GROUP DIFFERENCES ==========
2026-02-13 17:55:32,344 - INFO - Seen tasks: 0..3 | valid_out_dim=8
2026-02-13 17:55:36,331 - INFO - [Group=Task0] CI_acc=1.75% | corr_slice_max=2.468 | best_other_max=7.160 | gap=-4.692
2026-02-13 17:55:36,331 - INFO - [Group=Task0] winner_task_dist: W0=1.8% | W1=1.3% | W2=5.0% | W3=92.0%
2026-02-13 17:55:36,331 - INFO - [Group=Task0] slice_strength : S0=2.47 | S1=4.79 | S2=5.80 | S3=7.13
2026-02-13 17:55:40,159 - INFO - [Group=Task1] CI_acc=1.00% | corr_slice_max=5.579 | best_other_max=8.271 | gap=-2.692
2026-02-13 17:55:40,159 - INFO - [Group=Task1] winner_task_dist: W0=0.0% | W1=1.0% | W2=6.1% | W3=92.9%
2026-02-13 17:55:40,159 - INFO - [Group=Task1] slice_strength : S0=1.47 | S1=5.58 | S2=6.87 | S3=8.24
2026-02-13 17:55:44,130 - INFO - [Group=Task2] CI_acc=16.25% | corr_slice_max=7.316 | best_other_max=8.291 | gap=-0.975
2026-02-13 17:55:44,130 - INFO - [Group=Task2] winner_task_dist: W0=0.0% | W1=0.1% | W2=16.5% | W3=83.5%
2026-02-13 17:55:44,130 - INFO - [Group=Task2] slice_strength : S0=1.26 | S1=5.39 | S2=7.32 | S3=8.29
2026-02-13 17:55:47,980 - INFO - [Group=Task3] CI_acc=96.00% | corr_slice_max=8.839 | best_other_max=6.565 | gap=2.275
2026-02-13 17:55:47,980 - INFO - [Group=Task3] winner_task_dist: W0=0.0% | W1=0.0% | W2=1.2% | W3=98.8%
2026-02-13 17:55:47,980 - INFO - [Group=Task3] slice_strength : S0=1.05 | S1=4.92 | S2=6.56 | S3=8.84
2026-02-13 17:55:47,980 - INFO - ======================================
2026-02-13 17:55:47,981 - INFO - ========== Training Task 4: classes [8, 9] ==========
2026-02-13 17:56:16,281 - INFO - [Task 4 | ep 0 | step 0] loss=9.9816 c=8.7070 r=1.2745 | CI_T0=1.36% | CI_T1=0.59% | CI_T2=12.02% | CI_T3=94.23% | CI_T4=0.00%
2026-02-13 17:56:41,005 - INFO - [Task 4 | ep 0 | step 50] loss=3.0597 c=1.5888 r=1.4709 | CI_T0=0.80% | CI_T1=1.60% | CI_T2=34.89% | CI_T3=50.11% | CI_T4=57.83%
2026-02-13 17:57:09,716 - INFO - [Task 4 | ep 1 | step 100] loss=2.1053 c=0.9267 r=1.1787 | CI_T0=0.52% | CI_T1=0.39% | CI_T2=15.43% | CI_T3=49.11% | CI_T4=79.90%
2026-02-13 17:57:34,255 - INFO - [Task 4 | ep 1 | step 150] loss=1.6723 c=0.5620 r=1.1103 | CI_T0=0.16% | CI_T1=0.22% | CI_T2=9.03% | CI_T3=35.74% | CI_T4=86.54%
2026-02-13 17:58:03,143 - INFO - [Task 4 | ep 2 | step 200] loss=1.5477 c=0.6008 r=0.9469 | CI_T0=0.14% | CI_T1=0.09% | CI_T2=6.43% | CI_T3=34.20% | CI_T4=90.09%
2026-02-13 17:58:31,821 - INFO - [Task 4 | ep 3 | step 250] loss=1.4040 c=0.4731 r=0.9310 | CI_T0=0.06% | CI_T1=0.05% | CI_T2=5.28% | CI_T3=37.25% | CI_T4=91.28%
2026-02-13 17:58:56,421 - INFO - [Task 4 | ep 3 | step 300] loss=1.2561 c=0.4621 r=0.7939 | CI_T0=0.01% | CI_T1=0.02% | CI_T2=2.15% | CI_T3=28.72% | CI_T4=89.62%
2026-02-13 17:59:25,286 - INFO - [Task 4 | ep 4 | step 350] loss=1.1792 c=0.3524 r=0.8269 | CI_T0=0.08% | CI_T1=0.04% | CI_T2=2.49% | CI_T3=37.00% | CI_T4=92.32%
2026-02-13 17:59:53,999 - INFO - [Task 4 | ep 5 | step 400] loss=1.1581 c=0.3839 r=0.7742 | CI_T0=0.07% | CI_T1=0.02% | CI_T2=2.90% | CI_T3=35.78% | CI_T4=93.08%
2026-02-13 18:00:18,395 - INFO - [Task 4 | ep 5 | step 450] loss=1.3690 c=0.3844 r=0.9846 | CI_T0=0.01% | CI_T1=0.01% | CI_T2=0.79% | CI_T3=23.69% | CI_T4=93.35%
2026-02-13 18:00:47,379 - INFO - [Task 4 | ep 6 | step 500] loss=1.0947 c=0.3297 r=0.7650 | CI_T0=0.02% | CI_T1=0.00% | CI_T2=0.87% | CI_T3=29.42% | CI_T4=93.39%
2026-02-13 18:01:16,407 - INFO - [Task 4 | ep 7 | step 550] loss=1.0492 c=0.2953 r=0.7540 | CI_T0=0.01% | CI_T1=0.00% | CI_T2=1.19% | CI_T3=36.43% | CI_T4=93.25%
2026-02-13 18:01:41,166 - INFO - [Task 4 | ep 7 | step 600] loss=1.0860 c=0.3412 r=0.7448 | CI_T0=0.09% | CI_T1=0.00% | CI_T2=1.65% | CI_T3=32.74% | CI_T4=93.91%
2026-02-13 18:02:20,601 - INFO - [After Task 4] Task-IL : T0=96.25% | T1=82.95% | T2=89.70% | T3=96.55% | T4=94.50% | Avg=91.99%
2026-02-13 18:02:20,601 - INFO - [After Task 4] Class-IL: T0=0.15% | T1=0.10% | T2=3.45% | T3=37.90% | T4=93.80% | Avg=27.08%
2026-02-13 18:02:20,601 - INFO - ========== GROUP DIFFERENCES ==========
2026-02-13 18:02:20,601 - INFO - Seen tasks: 0..4 | valid_out_dim=10
2026-02-13 18:02:24,464 - INFO - [Group=Task0] CI_acc=0.15% | corr_slice_max=2.390 | best_other_max=8.853 | gap=-6.463
2026-02-13 18:02:24,465 - INFO - [Group=Task0] winner_task_dist: W0=0.1% | W1=0.0% | W2=0.1% | W3=2.9% | W4=96.8%
2026-02-13 18:02:24,465 - INFO - [Group=Task0] slice_strength : S0=2.39 | S1=4.71 | S2=5.92 | S3=6.87 | S4=8.84
2026-02-13 18:02:28,402 - INFO - [Group=Task1] CI_acc=0.10% | corr_slice_max=5.428 | best_other_max=9.264 | gap=-3.836
2026-02-13 18:02:28,402 - INFO - [Group=Task1] winner_task_dist: W0=0.0% | W1=0.1% | W2=0.9% | W3=5.9% | W4=93.0%
2026-02-13 18:02:28,403 - INFO - [Group=Task1] slice_strength : S0=1.26 | S1=5.43 | S2=6.89 | S3=7.85 | S4=9.23
2026-02-13 18:02:32,269 - INFO - [Group=Task2] CI_acc=3.45% | corr_slice_max=7.317 | best_other_max=9.226 | gap=-1.909
2026-02-13 18:02:32,269 - INFO - [Group=Task2] winner_task_dist: W0=0.0% | W1=0.0% | W2=3.5% | W3=5.2% | W4=91.3%
2026-02-13 18:02:32,269 - INFO - [Group=Task2] slice_strength : S0=1.04 | S1=5.22 | S2=7.32 | S3=7.90 | S4=9.21
2026-02-13 18:02:36,205 - INFO - [Group=Task3] CI_acc=37.90% | corr_slice_max=8.279 | best_other_max=8.630 | gap=-0.351
2026-02-13 18:02:36,205 - INFO - [Group=Task3] winner_task_dist: W0=0.0% | W1=0.0% | W2=0.3% | W3=38.0% | W4=61.8%
2026-02-13 18:02:36,205 - INFO - [Group=Task3] slice_strength : S0=0.88 | S1=4.74 | S2=6.45 | S3=8.28 | S4=8.63
2026-02-13 18:02:40,059 - INFO - [Group=Task4] CI_acc=93.80% | corr_slice_max=9.572 | best_other_max=7.395 | gap=2.177
2026-02-13 18:02:40,059 - INFO - [Group=Task4] winner_task_dist: W0=0.0% | W1=0.0% | W2=0.0% | W3=1.0% | W4=99.0%
2026-02-13 18:02:40,059 - INFO - [Group=Task4] slice_strength : S0=1.35 | S1=4.83 | S2=6.23 | S3=7.37 | S4=9.57
2026-02-13 18:02:40,059 - INFO - ======================================
2026-02-13 18:02:40,060 - INFO - ========== FINAL METRICS (Class-IL) ==========
2026-02-13 18:02:40,060 - INFO - Forgetting per task: T0=96.25%, T1=84.25%, T2=86.80%, T3=58.10%, T4=0.00%
2026-02-13 18:02:40,060 - INFO - BWT: -81.35%
2026-02-13 18:02:40,060 - INFO - Final average Class-IL accuracy: 27.08%
