2026-02-11 18:10:46,285 - INFO - Device: cpu
2026-02-11 18:10:46,285 - INFO - Config: {'device': 'cpu', 'lr': 0.005, 'epochs_per_task': 4, 'batch_size': 128, 'lambda_slice': 2.0, 'lambda_feat': 0.5, 'use_cosine_head': True, 'seed': 42, 'vae_epochs': 5, 'vae_n_fake_per_task': 32}
2026-02-11 18:10:46,287 - INFO - ========== Task 0: classes [0, 1] ==========
2026-02-11 18:11:13,543 - INFO - [Task 0 | ep 0 | step 0] loss=0.8023 c=0.8023 r=0.0000 | CI_T0=97.84%
2026-02-11 18:11:17,580 - INFO - [Task 0 | ep 0 | step 25] loss=0.0324 c=0.0324 r=0.0000 | CI_T0=99.87%
2026-02-11 18:11:21,694 - INFO - [Task 0 | ep 0 | step 50] loss=0.0017 c=0.0017 r=0.0000 | CI_T0=99.84%
2026-02-11 18:11:25,710 - INFO - [Task 0 | ep 0 | step 75] loss=0.0007 c=0.0007 r=0.0000 | CI_T0=99.94%
2026-02-11 18:11:33,289 - INFO - [Task 0 | ep 1 | step 100] loss=0.0008 c=0.0008 r=0.0000 | CI_T0=99.97%
2026-02-11 18:11:37,308 - INFO - [Task 0 | ep 1 | step 125] loss=0.0002 c=0.0002 r=0.0000 | CI_T0=99.96%
2026-02-11 18:11:41,395 - INFO - [Task 0 | ep 1 | step 150] loss=0.0087 c=0.0087 r=0.0000 | CI_T0=99.96%
2026-02-11 18:11:45,446 - INFO - [Task 0 | ep 1 | step 175] loss=0.0002 c=0.0002 r=0.0000 | CI_T0=99.98%
2026-02-11 18:11:53,088 - INFO - [Task 0 | ep 2 | step 200] loss=0.0002 c=0.0002 r=0.0000 | CI_T0=99.82%
2026-02-11 18:11:57,155 - INFO - [Task 0 | ep 2 | step 225] loss=0.0004 c=0.0004 r=0.0000 | CI_T0=99.98%
2026-02-11 18:12:01,199 - INFO - [Task 0 | ep 2 | step 250] loss=0.0001 c=0.0001 r=0.0000 | CI_T0=99.95%
2026-02-11 18:12:05,231 - INFO - [Task 0 | ep 2 | step 275] loss=0.0002 c=0.0002 r=0.0000 | CI_T0=99.94%
2026-02-11 18:12:13,053 - INFO - [Task 0 | ep 3 | step 300] loss=0.0003 c=0.0003 r=0.0000 | CI_T0=99.97%
2026-02-11 18:12:17,162 - INFO - [Task 0 | ep 3 | step 325] loss=0.0001 c=0.0001 r=0.0000 | CI_T0=99.98%
2026-02-11 18:12:21,371 - INFO - [Task 0 | ep 3 | step 350] loss=0.0001 c=0.0001 r=0.0000 | CI_T0=99.90%
2026-02-11 18:12:25,454 - INFO - [Task 0 | ep 3 | step 375] loss=0.0108 c=0.0108 r=0.0000 | CI_T0=99.79%
2026-02-11 18:12:29,940 - INFO - [After Task 0] Task-IL : T0=99.91% | Avg=99.91%
2026-02-11 18:12:29,940 - INFO - [After Task 0] Class-IL: T0=99.91% | Avg=99.91%
2026-02-11 18:12:29,940 - INFO - ========== GROUP DIFFERENCES ==========
2026-02-11 18:12:29,940 - INFO - Seen tasks: 0..0 | valid_out_dim=2
2026-02-11 18:12:32,015 - INFO - [Group=Task0] CI_acc=99.91% | corr_slice_max=5.066 | best_other_max=nan | gap=nan
2026-02-11 18:12:32,015 - INFO - [Group=Task0] winner_task_dist: W0=100.0%
2026-02-11 18:12:32,015 - INFO - [Group=Task0] slice_strength : S0=5.07
2026-02-11 18:12:32,015 - INFO - ======================================
2026-02-11 18:12:32,015 - INFO - ========== Task 1: classes [2, 3] ==========
2026-02-11 18:13:03,898 - INFO - [Task 1 | ep 0 | step 0] loss=7.3085 c=4.3643 r=2.9374 | CI_T0=99.71% | CI_T1=3.27%
2026-02-11 18:13:12,119 - INFO - [Task 1 | ep 0 | step 25] loss=1.6214 c=0.3958 r=1.0015 | CI_T0=60.08% | CI_T1=89.63%
2026-02-11 18:13:20,369 - INFO - [Task 1 | ep 0 | step 50] loss=1.4287 c=0.1947 r=1.1092 | CI_T0=59.57% | CI_T1=88.42%
2026-02-11 18:13:28,593 - INFO - [Task 1 | ep 0 | step 75] loss=0.9723 c=0.1603 r=0.7356 | CI_T0=48.82% | CI_T1=95.96%
2026-02-11 18:13:40,782 - INFO - [Task 1 | ep 1 | step 100] loss=1.0024 c=0.1538 r=0.7859 | CI_T0=48.84% | CI_T1=96.97%
2026-02-11 18:13:49,100 - INFO - [Task 1 | ep 1 | step 125] loss=0.9246 c=0.1379 r=0.7321 | CI_T0=52.91% | CI_T1=90.17%
2026-02-11 18:13:57,260 - INFO - [Task 1 | ep 1 | step 150] loss=1.7128 c=0.1551 r=1.5036 | CI_T0=44.50% | CI_T1=97.58%
2026-02-11 18:14:05,334 - INFO - [Task 1 | ep 1 | step 175] loss=0.8648 c=0.1246 r=0.6854 | CI_T0=47.09% | CI_T1=97.63%
2026-02-11 18:14:17,045 - INFO - [Task 1 | ep 2 | step 200] loss=1.1204 c=0.1315 r=0.9344 | CI_T0=47.72% | CI_T1=97.02%
2026-02-11 18:14:25,288 - INFO - [Task 1 | ep 2 | step 225] loss=1.1137 c=0.1458 r=0.9250 | CI_T0=54.60% | CI_T1=92.35%
2026-02-11 18:14:33,390 - INFO - [Task 1 | ep 2 | step 250] loss=0.8017 c=0.0799 r=0.6719 | CI_T0=43.86% | CI_T1=97.99%
2026-02-11 18:14:41,481 - INFO - [Task 1 | ep 2 | step 275] loss=1.0349 c=0.1394 r=0.8531 | CI_T0=43.26% | CI_T1=97.61%
2026-02-11 18:14:53,436 - INFO - [Task 1 | ep 3 | step 300] loss=0.8970 c=0.1491 r=0.6988 | CI_T0=36.19% | CI_T1=98.45%
2026-02-11 18:15:01,440 - INFO - [Task 1 | ep 3 | step 325] loss=0.8629 c=0.1372 r=0.6854 | CI_T0=40.55% | CI_T1=98.35%
2026-02-11 18:15:09,521 - INFO - [Task 1 | ep 3 | step 350] loss=1.1108 c=0.1395 r=0.9246 | CI_T0=38.83% | CI_T1=98.76%
2026-02-11 18:15:17,753 - INFO - [Task 1 | ep 3 | step 375] loss=0.7240 c=0.0895 r=0.5977 | CI_T0=42.10% | CI_T1=97.77%
2026-02-11 18:15:26,268 - INFO - [After Task 1] Task-IL : T0=99.91% | T1=98.33% | Avg=99.12%
2026-02-11 18:15:26,268 - INFO - [After Task 1] Class-IL: T0=41.51% | T1=97.16% | Avg=69.34%
2026-02-11 18:15:26,268 - INFO - ========== GROUP DIFFERENCES ==========
2026-02-11 18:15:26,268 - INFO - Seen tasks: 0..1 | valid_out_dim=4
2026-02-11 18:15:28,297 - INFO - [Group=Task0] CI_acc=41.51% | corr_slice_max=5.163 | best_other_max=5.457 | gap=-0.294
2026-02-11 18:15:28,297 - INFO - [Group=Task0] winner_task_dist: W0=41.5% | W1=58.5%
2026-02-11 18:15:28,297 - INFO - [Group=Task0] slice_strength : S0=5.16 | S1=5.46
2026-02-11 18:15:30,326 - INFO - [Group=Task1] CI_acc=97.16% | corr_slice_max=6.343 | best_other_max=2.593 | gap=3.750
2026-02-11 18:15:30,326 - INFO - [Group=Task1] winner_task_dist: W0=1.6% | W1=98.4%
2026-02-11 18:15:30,326 - INFO - [Group=Task1] slice_strength : S0=2.59 | S1=6.34
2026-02-11 18:15:30,326 - INFO - ======================================
2026-02-11 18:15:30,326 - INFO - ========== Task 2: classes [4, 5] ==========
2026-02-11 18:16:05,446 - INFO - [Task 2 | ep 0 | step 0] loss=11.1062 c=6.0062 r=4.9859 | CI_T0=53.60% | CI_T1=92.68% | CI_T2=0.00%
2026-02-11 18:16:17,473 - INFO - [Task 2 | ep 0 | step 25] loss=1.7300 c=0.3673 r=1.2373 | CI_T0=65.47% | CI_T1=21.68% | CI_T2=90.36%
2026-02-11 18:16:30,477 - INFO - [Task 2 | ep 0 | step 50] loss=1.2991 c=0.1863 r=1.0556 | CI_T0=56.98% | CI_T1=27.09% | CI_T2=95.88%
2026-02-11 18:16:45,749 - INFO - [Task 2 | ep 0 | step 75] loss=1.1851 c=0.1744 r=0.9692 | CI_T0=57.20% | CI_T1=25.90% | CI_T2=96.57%
2026-02-11 18:17:01,655 - INFO - [Task 2 | ep 1 | step 100] loss=1.1078 c=0.1607 r=0.9065 | CI_T0=44.96% | CI_T1=22.45% | CI_T2=97.92%
2026-02-11 18:17:13,863 - INFO - [Task 2 | ep 1 | step 125] loss=0.8531 c=0.0976 r=0.7159 | CI_T0=60.90% | CI_T1=23.56% | CI_T2=96.75%
2026-02-11 18:17:26,052 - INFO - [Task 2 | ep 1 | step 150] loss=0.9259 c=0.0882 r=0.8064 | CI_T0=58.89% | CI_T1=25.47% | CI_T2=97.66%
2026-02-11 18:17:41,501 - INFO - [Task 2 | ep 2 | step 175] loss=0.7570 c=0.0993 r=0.6210 | CI_T0=57.61% | CI_T1=24.21% | CI_T2=97.42%
2026-02-11 18:17:53,427 - INFO - [Task 2 | ep 2 | step 200] loss=0.7551 c=0.1005 r=0.6296 | CI_T0=54.18% | CI_T1=19.41% | CI_T2=98.00%
2026-02-11 18:18:05,291 - INFO - [Task 2 | ep 2 | step 225] loss=0.6911 c=0.0733 r=0.5950 | CI_T0=59.34% | CI_T1=24.05% | CI_T2=97.66%
2026-02-11 18:18:17,144 - INFO - [Task 2 | ep 2 | step 250] loss=0.8091 c=0.0847 r=0.7023 | CI_T0=45.47% | CI_T1=22.42% | CI_T2=97.83%
2026-02-11 18:18:32,584 - INFO - [Task 2 | ep 3 | step 275] loss=0.6841 c=0.0616 r=0.6023 | CI_T0=48.54% | CI_T1=24.41% | CI_T2=97.73%
2026-02-11 18:18:44,489 - INFO - [Task 2 | ep 3 | step 300] loss=0.9760 c=0.0915 r=0.8644 | CI_T0=37.73% | CI_T1=22.58% | CI_T2=97.29%
2026-02-11 18:18:56,317 - INFO - [Task 2 | ep 3 | step 325] loss=1.1090 c=0.0747 r=1.0160 | CI_T0=39.48% | CI_T1=23.18% | CI_T2=96.05%
2026-02-11 18:19:08,794 - INFO - [After Task 2] Task-IL : T0=99.15% | T1=91.87% | T2=98.93% | Avg=96.65%
2026-02-11 18:19:08,794 - INFO - [After Task 2] Class-IL: T0=35.65% | T1=19.39% | T2=98.45% | Avg=51.17%
2026-02-11 18:19:08,794 - INFO - ========== GROUP DIFFERENCES ==========
2026-02-11 18:19:08,794 - INFO - Seen tasks: 0..2 | valid_out_dim=6
2026-02-11 18:19:10,795 - INFO - [Group=Task0] CI_acc=35.65% | corr_slice_max=5.613 | best_other_max=6.277 | gap=-0.664
2026-02-11 18:19:10,795 - INFO - [Group=Task0] winner_task_dist: W0=35.7% | W1=14.8% | W2=49.6%
2026-02-11 18:19:10,795 - INFO - [Group=Task0] slice_strength : S0=5.61 | S1=4.43 | S2=6.19
2026-02-11 18:19:12,809 - INFO - [Group=Task1] CI_acc=19.39% | corr_slice_max=5.886 | best_other_max=7.644 | gap=-1.758
2026-02-11 18:19:12,809 - INFO - [Group=Task1] winner_task_dist: W0=0.7% | W1=19.7% | W2=79.6%
2026-02-11 18:19:12,809 - INFO - [Group=Task1] slice_strength : S0=2.95 | S1=5.89 | S2=7.64
2026-02-11 18:19:14,788 - INFO - [Group=Task2] CI_acc=98.45% | corr_slice_max=8.891 | best_other_max=5.113 | gap=3.778
2026-02-11 18:19:14,788 - INFO - [Group=Task2] winner_task_dist: W0=0.5% | W1=0.4% | W2=99.1%
2026-02-11 18:19:14,788 - INFO - [Group=Task2] slice_strength : S0=4.03 | S1=4.92 | S2=8.89
2026-02-11 18:19:14,788 - INFO - ======================================
2026-02-11 18:19:14,788 - INFO - ========== Task 3: classes [6, 7] ==========
2026-02-11 18:19:53,550 - INFO - [Task 3 | ep 0 | step 0] loss=11.0842 c=7.8879 r=2.8706 | CI_T0=57.58% | CI_T1=27.73% | CI_T2=98.39% | CI_T3=0.00%
2026-02-11 18:20:09,381 - INFO - [Task 3 | ep 0 | step 25] loss=1.9827 c=0.2791 r=1.6116 | CI_T0=64.13% | CI_T1=35.51% | CI_T2=71.96% | CI_T3=91.42%
2026-02-11 18:20:25,137 - INFO - [Task 3 | ep 0 | step 50] loss=1.5572 c=0.2802 r=1.2279 | CI_T0=60.61% | CI_T1=47.57% | CI_T2=76.03% | CI_T3=97.48%
2026-02-11 18:20:40,888 - INFO - [Task 3 | ep 0 | step 75] loss=1.2065 c=0.2006 r=0.9636 | CI_T0=45.65% | CI_T1=45.43% | CI_T2=73.05% | CI_T3=98.46%
2026-02-11 18:21:00,184 - INFO - [Task 3 | ep 1 | step 100] loss=1.0913 c=0.2164 r=0.8416 | CI_T0=56.05% | CI_T1=39.13% | CI_T2=76.04% | CI_T3=98.41%
2026-02-11 18:21:15,883 - INFO - [Task 3 | ep 1 | step 125] loss=1.2221 c=0.2033 r=0.9896 | CI_T0=46.04% | CI_T1=32.43% | CI_T2=75.84% | CI_T3=98.59%
2026-02-11 18:21:31,550 - INFO - [Task 3 | ep 1 | step 150] loss=1.0374 c=0.2055 r=0.8016 | CI_T0=34.77% | CI_T1=42.35% | CI_T2=73.60% | CI_T3=98.73%
2026-02-11 18:21:47,334 - INFO - [Task 3 | ep 1 | step 175] loss=0.8252 c=0.1426 r=0.6585 | CI_T0=30.84% | CI_T1=38.21% | CI_T2=72.89% | CI_T3=99.24%
2026-02-11 18:22:06,646 - INFO - [Task 3 | ep 2 | step 200] loss=0.8938 c=0.1805 r=0.6883 | CI_T0=32.11% | CI_T1=31.87% | CI_T2=75.97% | CI_T3=99.09%
2026-02-11 18:22:22,399 - INFO - [Task 3 | ep 2 | step 225] loss=1.0045 c=0.1474 r=0.8368 | CI_T0=23.45% | CI_T1=36.95% | CI_T2=70.70% | CI_T3=99.36%
2026-02-11 18:22:38,203 - INFO - [Task 3 | ep 2 | step 250] loss=0.8863 c=0.1608 r=0.7063 | CI_T0=31.43% | CI_T1=39.30% | CI_T2=70.15% | CI_T3=99.47%
2026-02-11 18:22:54,238 - INFO - [Task 3 | ep 2 | step 275] loss=0.8716 c=0.1385 r=0.7139 | CI_T0=13.72% | CI_T1=38.50% | CI_T2=67.23% | CI_T3=99.62%
2026-02-11 18:23:13,871 - INFO - [Task 3 | ep 3 | step 300] loss=0.9143 c=0.1119 r=0.7842 | CI_T0=18.81% | CI_T1=37.91% | CI_T2=66.67% | CI_T3=99.38%
2026-02-11 18:23:29,780 - INFO - [Task 3 | ep 3 | step 325] loss=0.7721 c=0.0886 r=0.6653 | CI_T0=17.81% | CI_T1=32.86% | CI_T2=64.83% | CI_T3=99.60%
2026-02-11 18:23:45,544 - INFO - [Task 3 | ep 3 | step 350] loss=0.7943 c=0.0991 r=0.6798 | CI_T0=13.56% | CI_T1=33.46% | CI_T2=67.26% | CI_T3=99.66%
2026-02-11 18:24:01,351 - INFO - [Task 3 | ep 3 | step 375] loss=0.7107 c=0.0925 r=0.6021 | CI_T0=16.82% | CI_T1=39.01% | CI_T2=62.83% | CI_T3=99.64%
2026-02-11 18:24:17,625 - INFO - [After Task 3] Task-IL : T0=99.81% | T1=97.50% | T2=96.48% | T3=99.95% | Avg=98.44%
2026-02-11 18:24:17,625 - INFO - [After Task 3] Class-IL: T0=17.26% | T1=38.44% | T2=66.06% | T3=99.45% | Avg=55.30%
2026-02-11 18:24:17,625 - INFO - ========== GROUP DIFFERENCES ==========
2026-02-11 18:24:17,626 - INFO - Seen tasks: 0..3 | valid_out_dim=8
2026-02-11 18:24:19,637 - INFO - [Group=Task0] CI_acc=17.26% | corr_slice_max=6.077 | best_other_max=7.803 | gap=-1.726
2026-02-11 18:24:19,637 - INFO - [Group=Task0] winner_task_dist: W0=17.3% | W1=4.3% | W2=7.0% | W3=71.4%
2026-02-11 18:24:19,637 - INFO - [Group=Task0] slice_strength : S0=6.08 | S1=5.13 | S2=5.90 | S3=7.60
2026-02-11 18:24:21,640 - INFO - [Group=Task1] CI_acc=38.44% | corr_slice_max=6.901 | best_other_max=7.649 | gap=-0.748
2026-02-11 18:24:21,640 - INFO - [Group=Task1] winner_task_dist: W0=0.1% | W1=38.4% | W2=22.7% | W3=38.7%
2026-02-11 18:24:21,640 - INFO - [Group=Task1] slice_strength : S0=2.70 | S1=6.90 | S2=6.51 | S3=7.13
2026-02-11 18:24:23,641 - INFO - [Group=Task2] CI_acc=66.06% | corr_slice_max=8.751 | best_other_max=8.042 | gap=0.709
2026-02-11 18:24:23,641 - INFO - [Group=Task2] winner_task_dist: W0=0.0% | W1=0.4% | W2=66.1% | W3=33.5%
2026-02-11 18:24:23,641 - INFO - [Group=Task2] slice_strength : S0=3.63 | S1=4.94 | S2=8.75 | S3=7.90
2026-02-11 18:24:25,644 - INFO - [Group=Task3] CI_acc=99.45% | corr_slice_max=10.681 | best_other_max=7.802 | gap=2.880
2026-02-11 18:24:25,644 - INFO - [Group=Task3] winner_task_dist: W0=0.0% | W1=0.1% | W2=0.5% | W3=99.5%
2026-02-11 18:24:25,644 - INFO - [Group=Task3] slice_strength : S0=3.67 | S1=4.91 | S2=7.77 | S3=10.68
2026-02-11 18:24:25,644 - INFO - ======================================
2026-02-11 18:24:25,644 - INFO - ========== Task 4: classes [8, 9] ==========
2026-02-11 18:25:08,218 - INFO - [Task 4 | ep 0 | step 0] loss=12.8663 c=9.3027 r=3.5163 | CI_T0=54.97% | CI_T1=34.87% | CI_T2=65.90% | CI_T3=98.91% | CI_T4=0.00%
2026-02-11 18:25:27,963 - INFO - [Task 4 | ep 0 | step 25] loss=2.5716 c=0.4352 r=1.9600 | CI_T0=59.40% | CI_T1=29.51% | CI_T2=18.78% | CI_T3=65.57% | CI_T4=80.96%
2026-02-11 18:25:47,973 - INFO - [Task 4 | ep 0 | step 50] loss=1.7374 c=0.4666 r=1.1685 | CI_T0=57.87% | CI_T1=38.04% | CI_T2=40.33% | CI_T3=70.70% | CI_T4=90.24%
2026-02-11 18:26:07,783 - INFO - [Task 4 | ep 0 | step 75] loss=1.8438 c=0.4287 r=1.3456 | CI_T0=38.79% | CI_T1=25.12% | CI_T2=51.76% | CI_T3=77.10% | CI_T4=93.86%
2026-02-11 18:26:31,016 - INFO - [Task 4 | ep 1 | step 100] loss=1.4177 c=0.3554 r=1.0158 | CI_T0=16.39% | CI_T1=29.70% | CI_T2=42.96% | CI_T3=77.65% | CI_T4=93.56%
2026-02-11 18:26:50,650 - INFO - [Task 4 | ep 1 | step 125] loss=1.5230 c=0.3246 r=1.1554 | CI_T0=36.14% | CI_T1=29.75% | CI_T2=39.54% | CI_T3=70.24% | CI_T4=93.55%
2026-02-11 18:27:10,150 - INFO - [Task 4 | ep 1 | step 150] loss=1.2822 c=0.3147 r=0.9257 | CI_T0=51.04% | CI_T1=28.68% | CI_T2=36.23% | CI_T3=67.92% | CI_T4=93.49%
2026-02-11 18:27:29,833 - INFO - [Task 4 | ep 1 | step 175] loss=1.2100 c=0.3184 r=0.8516 | CI_T0=43.99% | CI_T1=28.03% | CI_T2=35.79% | CI_T3=60.04% | CI_T4=93.51%
2026-02-11 18:27:53,042 - INFO - [Task 4 | ep 2 | step 200] loss=1.0901 c=0.2108 r=0.8525 | CI_T0=9.34% | CI_T1=26.56% | CI_T2=33.60% | CI_T3=64.25% | CI_T4=96.25%
2026-02-11 18:28:12,711 - INFO - [Task 4 | ep 2 | step 225] loss=1.0773 c=0.2833 r=0.7692 | CI_T0=21.46% | CI_T1=23.82% | CI_T2=33.85% | CI_T3=56.58% | CI_T4=96.45%
2026-02-11 18:28:32,283 - INFO - [Task 4 | ep 2 | step 250] loss=1.2852 c=0.2860 r=0.9745 | CI_T0=7.30% | CI_T1=20.60% | CI_T2=33.28% | CI_T3=58.47% | CI_T4=97.05%
2026-02-11 18:28:51,819 - INFO - [Task 4 | ep 2 | step 275] loss=1.0108 c=0.1994 r=0.7892 | CI_T0=8.66% | CI_T1=22.23% | CI_T2=30.01% | CI_T3=49.09% | CI_T4=95.69%
2026-02-11 18:29:14,972 - INFO - [Task 4 | ep 3 | step 300] loss=0.8488 c=0.1793 r=0.6512 | CI_T0=27.37% | CI_T1=23.83% | CI_T2=31.73% | CI_T3=50.00% | CI_T4=96.96%
2026-02-11 18:29:34,895 - INFO - [Task 4 | ep 3 | step 325] loss=0.7624 c=0.1552 r=0.5868 | CI_T0=6.32% | CI_T1=22.14% | CI_T2=29.27% | CI_T3=47.25% | CI_T4=96.81%
2026-02-11 18:29:55,365 - INFO - [Task 4 | ep 3 | step 350] loss=0.7997 c=0.1827 r=0.5992 | CI_T0=6.68% | CI_T1=14.16% | CI_T2=26.27% | CI_T3=62.92% | CI_T4=98.12%
2026-02-11 18:30:16,363 - INFO - [After Task 4] Task-IL : T0=99.95% | T1=93.73% | T2=98.19% | T3=96.17% | T4=97.23% | Avg=97.05%
2026-02-11 18:30:16,364 - INFO - [After Task 4] Class-IL: T0=19.39% | T1=20.62% | T2=32.60% | T3=36.86% | T4=92.28% | Avg=40.35%
2026-02-11 18:30:16,364 - INFO - ========== GROUP DIFFERENCES ==========
2026-02-11 18:30:16,364 - INFO - Seen tasks: 0..4 | valid_out_dim=10
2026-02-11 18:30:18,425 - INFO - [Group=Task0] CI_acc=19.39% | corr_slice_max=6.489 | best_other_max=8.420 | gap=-1.932
2026-02-11 18:30:18,425 - INFO - [Group=Task0] winner_task_dist: W0=19.4% | W1=0.5% | W2=5.8% | W3=13.0% | W4=61.3%
2026-02-11 18:30:18,425 - INFO - [Group=Task0] slice_strength : S0=6.49 | S1=5.08 | S2=5.93 | S3=7.09 | S4=8.24
2026-02-11 18:30:20,485 - INFO - [Group=Task1] CI_acc=20.62% | corr_slice_max=6.812 | best_other_max=8.635 | gap=-1.823
2026-02-11 18:30:20,485 - INFO - [Group=Task1] winner_task_dist: W0=0.0% | W1=20.6% | W2=20.0% | W3=6.5% | W4=52.8%
2026-02-11 18:30:20,485 - INFO - [Group=Task1] slice_strength : S0=2.82 | S1=6.81 | S2=6.80 | S3=6.56 | S4=8.28
2026-02-11 18:30:22,617 - INFO - [Group=Task2] CI_acc=32.60% | corr_slice_max=9.113 | best_other_max=10.286 | gap=-1.173
2026-02-11 18:30:22,617 - INFO - [Group=Task2] winner_task_dist: W0=0.0% | W1=0.1% | W2=32.6% | W3=1.3% | W4=66.0%
2026-02-11 18:30:22,617 - INFO - [Group=Task2] slice_strength : S0=3.26 | S1=5.07 | S2=9.11 | S3=7.80 | S4=10.27
2026-02-11 18:30:24,730 - INFO - [Group=Task3] CI_acc=36.86% | corr_slice_max=10.031 | best_other_max=10.393 | gap=-0.361
2026-02-11 18:30:24,730 - INFO - [Group=Task3] winner_task_dist: W0=0.0% | W1=0.1% | W2=0.4% | W3=36.9% | W4=62.7%
2026-02-11 18:30:24,730 - INFO - [Group=Task3] slice_strength : S0=3.20 | S1=4.90 | S2=7.14 | S3=10.03 | S4=10.38
2026-02-11 18:30:26,792 - INFO - [Group=Task4] CI_acc=92.28% | corr_slice_max=11.539 | best_other_max=9.519 | gap=2.021
2026-02-11 18:30:26,792 - INFO - [Group=Task4] winner_task_dist: W0=0.2% | W1=0.0% | W2=1.2% | W3=4.9% | W4=93.7%
2026-02-11 18:30:26,792 - INFO - [Group=Task4] slice_strength : S0=3.22 | S1=5.72 | S2=7.99 | S3=9.11 | S4=11.54
2026-02-11 18:30:26,793 - INFO - ======================================
2026-02-11 18:30:26,793 - INFO - ========== FINAL METRICS (Class-IL) ==========
2026-02-11 18:30:26,793 - INFO - Forgetting per task: T0=80.52%, T1=76.54%, T2=65.85%, T3=62.59%, T4=0.00%
2026-02-11 18:30:26,793 - INFO - BWT: -71.37%
2026-02-11 18:30:26,793 - INFO - Final average Class-IL accuracy: 40.35%
