2026-02-11 19:06:57,934 - INFO - Device: cpu
2026-02-11 19:06:57,934 - INFO - Config: {'device': 'cpu', 'lr': 0.005, 'epochs_per_task': 4, 'batch_size': 128, 'lambda_slice': 2.0, 'lambda_feat': 0.5, 'use_cosine_head': True, 'seed': 42, 'freeze_backbone_after_task': -1, 'ewc_lambda': 0.0, 'si_lambda': 0.0, 'use_attention_backbone': False, 'use_adapters': False, 'lambda_slice_balance': 0.0, 'lambda_slice_margin': 1.0, 'slice_margin': 0.5, 'use_task_inference': False, 'lambda_task_inference': 1.0}
2026-02-11 19:06:57,936 - INFO - ========== Training Task 0: classes [0, 1] ==========
2026-02-11 19:07:05,039 - INFO - [Task 0 | ep 0 | step 0] loss=0.8633 c=0.8633 r=0.0000 | CI_T0=95.74%
2026-02-11 19:07:09,012 - INFO - [Task 0 | ep 0 | step 25] loss=0.0014 c=0.0014 r=0.0000 | CI_T0=99.93%
2026-02-11 19:07:12,955 - INFO - [Task 0 | ep 0 | step 50] loss=0.0007 c=0.0007 r=0.0000 | CI_T0=99.85%
2026-02-11 19:07:16,915 - INFO - [Task 0 | ep 0 | step 75] loss=0.0003 c=0.0003 r=0.0000 | CI_T0=99.97%
2026-02-11 19:07:24,323 - INFO - [Task 0 | ep 1 | step 100] loss=0.0003 c=0.0003 r=0.0000 | CI_T0=99.94%
2026-02-11 19:07:28,266 - INFO - [Task 0 | ep 1 | step 125] loss=0.0005 c=0.0005 r=0.0000 | CI_T0=99.94%
2026-02-11 19:07:32,228 - INFO - [Task 0 | ep 1 | step 150] loss=0.0003 c=0.0003 r=0.0000 | CI_T0=99.92%
2026-02-11 19:07:36,157 - INFO - [Task 0 | ep 1 | step 175] loss=0.0002 c=0.0002 r=0.0000 | CI_T0=99.94%
2026-02-11 19:07:43,563 - INFO - [Task 0 | ep 2 | step 200] loss=0.0001 c=0.0001 r=0.0000 | CI_T0=99.97%
2026-02-11 19:07:47,482 - INFO - [Task 0 | ep 2 | step 225] loss=0.0001 c=0.0001 r=0.0000 | CI_T0=99.94%
2026-02-11 19:07:51,425 - INFO - [Task 0 | ep 2 | step 250] loss=0.0003 c=0.0003 r=0.0000 | CI_T0=99.96%
2026-02-11 19:07:55,476 - INFO - [Task 0 | ep 2 | step 275] loss=0.0003 c=0.0003 r=0.0000 | CI_T0=99.97%
2026-02-11 19:08:03,088 - INFO - [Task 0 | ep 3 | step 300] loss=0.0001 c=0.0001 r=0.0000 | CI_T0=99.96%
2026-02-11 19:08:07,216 - INFO - [Task 0 | ep 3 | step 325] loss=0.0001 c=0.0001 r=0.0000 | CI_T0=99.96%
2026-02-11 19:08:11,291 - INFO - [Task 0 | ep 3 | step 350] loss=0.0005 c=0.0005 r=0.0000 | CI_T0=99.98%
2026-02-11 19:08:15,252 - INFO - [Task 0 | ep 3 | step 375] loss=0.0008 c=0.0008 r=0.0000 | CI_T0=99.98%
2026-02-11 19:08:19,615 - INFO - [After Task 0] Task-IL : T0=99.91% | Avg=99.91%
2026-02-11 19:08:19,615 - INFO - [After Task 0] Class-IL: T0=99.91% | Avg=99.91%
2026-02-11 19:08:19,615 - INFO - ========== GROUP DIFFERENCES ==========
2026-02-11 19:08:19,615 - INFO - Seen tasks: 0..0 | valid_out_dim=2
2026-02-11 19:08:21,640 - INFO - [Group=Task0] CI_acc=99.91% | corr_slice_max=5.001 | best_other_max=nan | gap=nan
2026-02-11 19:08:21,640 - INFO - [Group=Task0] winner_task_dist: W0=100.0%
2026-02-11 19:08:21,640 - INFO - [Group=Task0] slice_strength : S0=5.00
2026-02-11 19:08:21,640 - INFO - ======================================
2026-02-11 19:08:21,641 - INFO - ========== Training Task 1: classes [2, 3] ==========
2026-02-11 19:08:32,592 - INFO - [Task 1 | ep 0 | step 0] loss=11.0092 c=4.1526 r=2.5354 | mrg=4.3211 | CI_T0=99.98% | CI_T1=9.10%
2026-02-11 19:08:40,429 - INFO - [Task 1 | ep 0 | step 25] loss=1.6506 c=0.1940 r=1.4553 | mrg=0.0013 | CI_T0=29.15% | CI_T1=96.06%
2026-02-11 19:08:48,257 - INFO - [Task 1 | ep 0 | step 50] loss=1.2082 c=0.1268 r=1.0814 | CI_T0=16.89% | CI_T1=97.28%
2026-02-11 19:08:56,089 - INFO - [Task 1 | ep 0 | step 75] loss=1.0997 c=0.1179 r=0.9792 | mrg=0.0026 | CI_T0=6.35% | CI_T1=97.62%
2026-02-11 19:09:07,746 - INFO - [Task 1 | ep 1 | step 100] loss=1.0043 c=0.1306 r=0.8626 | mrg=0.0110 | CI_T0=16.85% | CI_T1=98.10%
2026-02-11 19:09:15,792 - INFO - [Task 1 | ep 1 | step 125] loss=0.7868 c=0.1278 r=0.6590 | CI_T0=0.57% | CI_T1=98.47%
2026-02-11 19:09:23,663 - INFO - [Task 1 | ep 1 | step 150] loss=0.8913 c=0.0942 r=0.7972 | CI_T0=0.02% | CI_T1=98.16%
2026-02-11 19:09:31,807 - INFO - [Task 1 | ep 1 | step 175] loss=0.9888 c=0.0826 r=0.9062 | CI_T0=7.44% | CI_T1=98.67%
2026-02-11 19:09:43,774 - INFO - [Task 1 | ep 2 | step 200] loss=1.0920 c=0.1227 r=0.9693 | CI_T0=2.97% | CI_T1=98.83%
2026-02-11 19:09:52,027 - INFO - [Task 1 | ep 2 | step 225] loss=1.0211 c=0.0640 r=0.9541 | mrg=0.0029 | CI_T0=1.20% | CI_T1=99.03%
2026-02-11 19:09:59,951 - INFO - [Task 1 | ep 2 | step 250] loss=0.6940 c=0.0782 r=0.6157 | CI_T0=8.57% | CI_T1=99.00%
2026-02-11 19:10:07,828 - INFO - [Task 1 | ep 2 | step 275] loss=0.6599 c=0.0799 r=0.5800 | CI_T0=3.49% | CI_T1=99.14%
2026-02-11 19:10:19,327 - INFO - [Task 1 | ep 3 | step 300] loss=0.6817 c=0.0759 r=0.6058 | CI_T0=13.37% | CI_T1=98.98%
2026-02-11 19:10:27,456 - INFO - [Task 1 | ep 3 | step 325] loss=0.7154 c=0.0724 r=0.6431 | CI_T0=1.54% | CI_T1=99.18%
2026-02-11 19:10:35,531 - INFO - [Task 1 | ep 3 | step 350] loss=0.6895 c=0.0924 r=0.5972 | CI_T0=2.14% | CI_T1=99.14%
2026-02-11 19:10:43,683 - INFO - [Task 1 | ep 3 | step 375] loss=1.1931 c=0.0540 r=1.1390 | CI_T0=7.27% | CI_T1=99.33%
2026-02-11 19:10:52,337 - INFO - [After Task 1] Task-IL : T0=99.91% | T1=98.97% | Avg=99.44%
2026-02-11 19:10:52,338 - INFO - [After Task 1] Class-IL: T0=6.05% | T1=98.97% | Avg=52.51%
2026-02-11 19:10:52,338 - INFO - ========== GROUP DIFFERENCES ==========
2026-02-11 19:10:52,338 - INFO - Seen tasks: 0..1 | valid_out_dim=4
2026-02-11 19:10:54,422 - INFO - [Group=Task0] CI_acc=6.05% | corr_slice_max=4.976 | best_other_max=6.042 | gap=-1.066
2026-02-11 19:10:54,422 - INFO - [Group=Task0] winner_task_dist: W0=6.1% | W1=93.9%
2026-02-11 19:10:54,422 - INFO - [Group=Task0] slice_strength : S0=4.98 | S1=6.04
2026-02-11 19:10:56,497 - INFO - [Group=Task1] CI_acc=98.97% | corr_slice_max=7.067 | best_other_max=2.706 | gap=4.360
2026-02-11 19:10:56,497 - INFO - [Group=Task1] winner_task_dist: W0=0.0% | W1=100.0%
2026-02-11 19:10:56,497 - INFO - [Group=Task1] slice_strength : S0=2.71 | S1=7.07
2026-02-11 19:10:56,497 - INFO - ======================================
2026-02-11 19:10:56,497 - INFO - ========== Training Task 2: classes [4, 5] ==========
2026-02-11 19:11:11,462 - INFO - [Task 2 | ep 0 | step 0] loss=14.9746 c=6.3821 r=2.2205 | mrg=6.3720 | CI_T0=6.26% | CI_T1=99.13% | CI_T2=0.00%
2026-02-11 19:11:23,489 - INFO - [Task 2 | ep 0 | step 25] loss=1.9580 c=0.3076 r=1.6473 | mrg=0.0031 | CI_T0=3.19% | CI_T1=0.34% | CI_T2=97.50%
2026-02-11 19:11:35,612 - INFO - [Task 2 | ep 0 | step 50] loss=1.6565 c=0.3257 r=1.3083 | mrg=0.0226 | CI_T0=2.56% | CI_T1=13.51% | CI_T2=97.40%
2026-02-11 19:11:47,750 - INFO - [Task 2 | ep 0 | step 75] loss=1.0902 c=0.2628 r=0.8187 | mrg=0.0088 | CI_T0=0.14% | CI_T1=19.86% | CI_T2=98.83%
2026-02-11 19:12:03,752 - INFO - [Task 2 | ep 1 | step 100] loss=1.1700 c=0.2012 r=0.9649 | mrg=0.0038 | CI_T0=1.79% | CI_T1=14.64% | CI_T2=99.05%
2026-02-11 19:12:15,643 - INFO - [Task 2 | ep 1 | step 125] loss=1.0039 c=0.2007 r=0.8028 | mrg=0.0003 | CI_T0=0.20% | CI_T1=19.51% | CI_T2=99.03%
2026-02-11 19:12:27,517 - INFO - [Task 2 | ep 1 | step 150] loss=0.8462 c=0.1528 r=0.6916 | mrg=0.0019 | CI_T0=1.13% | CI_T1=19.09% | CI_T2=99.50%
2026-02-11 19:12:42,949 - INFO - [Task 2 | ep 2 | step 175] loss=0.8275 c=0.1553 r=0.6669 | mrg=0.0053 | CI_T0=3.83% | CI_T1=18.64% | CI_T2=99.37%
2026-02-11 19:12:54,895 - INFO - [Task 2 | ep 2 | step 200] loss=0.6678 c=0.1405 r=0.5192 | mrg=0.0081 | CI_T0=0.53% | CI_T1=20.16% | CI_T2=99.65%
2026-02-11 19:13:06,861 - INFO - [Task 2 | ep 2 | step 225] loss=0.6774 c=0.1414 r=0.5346 | mrg=0.0014 | CI_T0=3.64% | CI_T1=15.23% | CI_T2=99.73%
2026-02-11 19:13:18,933 - INFO - [Task 2 | ep 2 | step 250] loss=0.8811 c=0.1428 r=0.7370 | mrg=0.0013 | CI_T0=3.91% | CI_T1=15.87% | CI_T2=99.79%
2026-02-11 19:13:34,625 - INFO - [Task 2 | ep 3 | step 275] loss=0.7087 c=0.1210 r=0.5877 | CI_T0=0.74% | CI_T1=16.44% | CI_T2=99.86%
2026-02-11 19:13:46,693 - INFO - [Task 2 | ep 3 | step 300] loss=1.0166 c=0.1102 r=0.9064 | CI_T0=0.84% | CI_T1=15.74% | CI_T2=99.83%
2026-02-11 19:13:58,612 - INFO - [Task 2 | ep 3 | step 325] loss=0.7830 c=0.0880 r=0.6950 | CI_T0=2.60% | CI_T1=17.88% | CI_T2=99.86%
2026-02-11 19:14:11,288 - INFO - [After Task 2] Task-IL : T0=99.91% | T1=97.65% | T2=99.89% | Avg=99.15%
2026-02-11 19:14:11,289 - INFO - [After Task 2] Class-IL: T0=1.80% | T1=13.42% | T2=99.84% | Avg=38.35%
2026-02-11 19:14:11,289 - INFO - ========== GROUP DIFFERENCES ==========
2026-02-11 19:14:11,289 - INFO - Seen tasks: 0..2 | valid_out_dim=6
2026-02-11 19:14:13,356 - INFO - [Group=Task0] CI_acc=1.80% | corr_slice_max=5.138 | best_other_max=7.261 | gap=-2.123
2026-02-11 19:14:13,356 - INFO - [Group=Task0] winner_task_dist: W0=1.8% | W1=4.1% | W2=94.1%
2026-02-11 19:14:13,356 - INFO - [Group=Task0] slice_strength : S0=5.14 | S1=6.02 | S2=7.25
2026-02-11 19:14:15,399 - INFO - [Group=Task1] CI_acc=13.42% | corr_slice_max=6.893 | best_other_max=8.302 | gap=-1.409
2026-02-11 19:14:15,399 - INFO - [Group=Task1] winner_task_dist: W0=0.0% | W1=13.4% | W2=86.5%
2026-02-11 19:14:15,399 - INFO - [Group=Task1] slice_strength : S0=2.60 | S1=6.89 | S2=8.30
2026-02-11 19:14:17,457 - INFO - [Group=Task2] CI_acc=99.84% | corr_slice_max=9.009 | best_other_max=6.068 | gap=2.941
2026-02-11 19:14:17,457 - INFO - [Group=Task2] winner_task_dist: W0=0.0% | W1=0.1% | W2=99.9%
2026-02-11 19:14:17,457 - INFO - [Group=Task2] slice_strength : S0=2.55 | S1=6.07 | S2=9.01
2026-02-11 19:14:17,457 - INFO - ======================================
2026-02-11 19:14:17,457 - INFO - ========== Training Task 3: classes [6, 7] ==========
2026-02-11 19:14:36,907 - INFO - [Task 3 | ep 0 | step 0] loss=17.8717 c=8.3333 r=1.3061 | mrg=8.2323 | CI_T0=0.51% | CI_T1=14.82% | CI_T2=99.87% | CI_T3=0.00%
2026-02-11 19:14:53,001 - INFO - [Task 3 | ep 0 | step 25] loss=2.3266 c=0.2790 r=2.0447 | mrg=0.0029 | CI_T0=5.28% | CI_T1=15.47% | CI_T2=25.36% | CI_T3=98.99%
2026-02-11 19:15:08,558 - INFO - [Task 3 | ep 0 | step 50] loss=1.4452 c=0.2483 r=1.1922 | mrg=0.0047 | CI_T0=4.58% | CI_T1=10.79% | CI_T2=41.91% | CI_T3=99.24%
2026-02-11 19:15:24,216 - INFO - [Task 3 | ep 0 | step 75] loss=1.3318 c=0.2719 r=1.0386 | mrg=0.0214 | CI_T0=0.37% | CI_T1=8.67% | CI_T2=65.59% | CI_T3=98.92%
2026-02-11 19:15:43,616 - INFO - [Task 3 | ep 1 | step 100] loss=1.1435 c=0.2357 r=0.8801 | mrg=0.0277 | CI_T0=0.26% | CI_T1=11.05% | CI_T2=68.53% | CI_T3=99.24%
2026-02-11 19:15:59,818 - INFO - [Task 3 | ep 1 | step 125] loss=1.1377 c=0.2114 r=0.9174 | mrg=0.0089 | CI_T0=0.34% | CI_T1=7.49% | CI_T2=70.07% | CI_T3=99.40%
2026-02-11 19:16:16,013 - INFO - [Task 3 | ep 1 | step 150] loss=1.3500 c=0.2039 r=1.1373 | mrg=0.0088 | CI_T0=0.53% | CI_T1=8.13% | CI_T2=71.85% | CI_T3=99.47%
2026-02-11 19:16:32,139 - INFO - [Task 3 | ep 1 | step 175] loss=0.9632 c=0.1953 r=0.7535 | mrg=0.0144 | CI_T0=0.09% | CI_T1=7.01% | CI_T2=69.74% | CI_T3=99.63%
2026-02-11 19:16:51,732 - INFO - [Task 3 | ep 2 | step 200] loss=0.8030 c=0.1668 r=0.6266 | mrg=0.0096 | CI_T0=0.35% | CI_T1=5.67% | CI_T2=65.56% | CI_T3=99.74%
2026-02-11 19:17:07,405 - INFO - [Task 3 | ep 2 | step 225] loss=0.9647 c=0.1745 r=0.7841 | mrg=0.0062 | CI_T0=0.37% | CI_T1=6.42% | CI_T2=70.21% | CI_T3=99.75%
2026-02-11 19:17:23,357 - INFO - [Task 3 | ep 2 | step 250] loss=0.7191 c=0.1439 r=0.5752 | CI_T0=0.26% | CI_T1=6.37% | CI_T2=65.62% | CI_T3=99.84%
2026-02-11 19:17:39,383 - INFO - [Task 3 | ep 2 | step 275] loss=0.8096 c=0.1626 r=0.6377 | mrg=0.0093 | CI_T0=0.16% | CI_T1=6.15% | CI_T2=62.09% | CI_T3=99.84%
2026-02-11 19:17:59,324 - INFO - [Task 3 | ep 3 | step 300] loss=0.8901 c=0.1616 r=0.7194 | mrg=0.0091 | CI_T0=0.17% | CI_T1=3.31% | CI_T2=61.04% | CI_T3=99.88%
2026-02-11 19:18:15,489 - INFO - [Task 3 | ep 3 | step 325] loss=0.6890 c=0.1346 r=0.5544 | CI_T0=0.14% | CI_T1=7.83% | CI_T2=60.50% | CI_T3=99.86%
2026-02-11 19:18:31,610 - INFO - [Task 3 | ep 3 | step 350] loss=0.8395 c=0.1099 r=0.7296 | CI_T0=0.04% | CI_T1=6.06% | CI_T2=59.79% | CI_T3=99.92%
2026-02-11 19:18:47,926 - INFO - [Task 3 | ep 3 | step 375] loss=0.6975 c=0.1129 r=0.5843 | mrg=0.0003 | CI_T0=0.21% | CI_T1=7.34% | CI_T2=62.19% | CI_T3=99.91%
2026-02-11 19:19:04,684 - INFO - [After Task 3] Task-IL : T0=99.91% | T1=98.14% | T2=99.73% | T3=100.00% | Avg=99.44%
2026-02-11 19:19:04,684 - INFO - [After Task 3] Class-IL: T0=0.09% | T1=7.44% | T2=62.33% | T3=99.45% | Avg=42.33%
2026-02-11 19:19:04,684 - INFO - ========== GROUP DIFFERENCES ==========
2026-02-11 19:19:04,684 - INFO - Seen tasks: 0..3 | valid_out_dim=8
2026-02-11 19:19:06,663 - INFO - [Group=Task0] CI_acc=0.09% | corr_slice_max=5.351 | best_other_max=8.701 | gap=-3.351
2026-02-11 19:19:06,663 - INFO - [Group=Task0] winner_task_dist: W0=0.1% | W1=0.0% | W2=9.6% | W3=90.3%
2026-02-11 19:19:06,663 - INFO - [Group=Task0] slice_strength : S0=5.35 | S1=6.38 | S2=7.54 | S3=8.64
2026-02-11 19:19:08,750 - INFO - [Group=Task1] CI_acc=7.44% | corr_slice_max=7.105 | best_other_max=8.905 | gap=-1.801
2026-02-11 19:19:08,750 - INFO - [Group=Task1] winner_task_dist: W0=0.0% | W1=7.4% | W2=42.0% | W3=50.5%
2026-02-11 19:19:08,750 - INFO - [Group=Task1] slice_strength : S0=2.76 | S1=7.10 | S2=7.94 | S3=8.20
2026-02-11 19:19:10,747 - INFO - [Group=Task2] CI_acc=62.33% | corr_slice_max=8.868 | best_other_max=8.493 | gap=0.375
2026-02-11 19:19:10,747 - INFO - [Group=Task2] winner_task_dist: W0=0.0% | W1=0.2% | W2=62.3% | W3=37.5%
2026-02-11 19:19:10,748 - INFO - [Group=Task2] slice_strength : S0=2.68 | S1=6.16 | S2=8.87 | S3=8.37
2026-02-11 19:19:12,823 - INFO - [Group=Task3] CI_acc=99.45% | corr_slice_max=10.500 | best_other_max=8.035 | gap=2.466
2026-02-11 19:19:12,823 - INFO - [Group=Task3] winner_task_dist: W0=0.0% | W1=0.0% | W2=0.6% | W3=99.4%
2026-02-11 19:19:12,823 - INFO - [Group=Task3] slice_strength : S0=2.79 | S1=5.95 | S2=8.00 | S3=10.50
2026-02-11 19:19:12,823 - INFO - ======================================
2026-02-11 19:19:12,823 - INFO - ========== Training Task 4: classes [8, 9] ==========
2026-02-11 19:19:35,797 - INFO - [Task 4 | ep 0 | step 0] loss=20.9981 c=9.3740 r=2.4346 | mrg=9.1895 | CI_T0=0.04% | CI_T1=9.79% | CI_T2=66.42% | CI_T3=99.87% | CI_T4=0.00%
2026-02-11 19:19:55,845 - INFO - [Task 4 | ep 0 | step 25] loss=2.7880 c=0.3274 r=2.4596 | mrg=0.0011 | CI_T0=0.00% | CI_T1=7.72% | CI_T2=2.25% | CI_T3=1.07% | CI_T4=95.75%
2026-02-11 19:20:16,081 - INFO - [Task 4 | ep 0 | step 50] loss=1.8318 c=0.5651 r=1.2655 | mrg=0.0012 | CI_T0=0.00% | CI_T1=0.85% | CI_T2=3.34% | CI_T3=11.46% | CI_T4=97.00%
2026-02-11 19:20:36,127 - INFO - [Task 4 | ep 0 | step 75] loss=1.5083 c=0.4097 r=1.0897 | mrg=0.0089 | CI_T0=0.00% | CI_T1=0.22% | CI_T2=6.27% | CI_T3=28.22% | CI_T4=97.43%
2026-02-11 19:20:59,101 - INFO - [Task 4 | ep 1 | step 100] loss=1.1866 c=0.3463 r=0.8341 | mrg=0.0061 | CI_T0=0.00% | CI_T1=0.07% | CI_T2=6.11% | CI_T3=26.64% | CI_T4=97.83%
2026-02-11 19:21:18,462 - INFO - [Task 4 | ep 1 | step 125] loss=1.2446 c=0.2852 r=0.9548 | mrg=0.0046 | CI_T0=0.00% | CI_T1=0.07% | CI_T2=7.58% | CI_T3=29.27% | CI_T4=97.71%
2026-02-11 19:21:37,852 - INFO - [Task 4 | ep 1 | step 150] loss=1.0772 c=0.3007 r=0.7742 | mrg=0.0024 | CI_T0=0.00% | CI_T1=0.07% | CI_T2=6.86% | CI_T3=17.85% | CI_T4=98.11%
2026-02-11 19:21:57,227 - INFO - [Task 4 | ep 1 | step 175] loss=0.9503 c=0.2462 r=0.7030 | mrg=0.0011 | CI_T0=0.01% | CI_T1=0.08% | CI_T2=6.21% | CI_T3=21.13% | CI_T4=98.64%
2026-02-11 19:22:20,475 - INFO - [Task 4 | ep 2 | step 200] loss=0.9510 c=0.2648 r=0.6759 | mrg=0.0103 | CI_T0=0.00% | CI_T1=0.06% | CI_T2=6.32% | CI_T3=19.10% | CI_T4=98.59%
2026-02-11 19:22:40,698 - INFO - [Task 4 | ep 2 | step 225] loss=1.0177 c=0.2954 r=0.7115 | mrg=0.0107 | CI_T0=0.00% | CI_T1=0.06% | CI_T2=6.15% | CI_T3=22.66% | CI_T4=98.68%
2026-02-11 19:23:00,905 - INFO - [Task 4 | ep 2 | step 250] loss=0.7679 c=0.2172 r=0.5481 | mrg=0.0026 | CI_T0=0.00% | CI_T1=0.02% | CI_T2=4.45% | CI_T3=18.54% | CI_T4=98.78%
2026-02-11 19:23:21,244 - INFO - [Task 4 | ep 2 | step 275] loss=1.2009 c=0.2561 r=0.9328 | mrg=0.0121 | CI_T0=0.00% | CI_T1=0.04% | CI_T2=5.38% | CI_T3=21.27% | CI_T4=98.96%
2026-02-11 19:23:48,306 - INFO - [Task 4 | ep 3 | step 300] loss=1.0028 c=0.2811 r=0.7106 | mrg=0.0111 | CI_T0=0.00% | CI_T1=0.11% | CI_T2=6.62% | CI_T3=28.96% | CI_T4=99.13%
2026-02-11 19:24:07,988 - INFO - [Task 4 | ep 3 | step 325] loss=0.7246 c=0.1825 r=0.5413 | mrg=0.0009 | CI_T0=0.00% | CI_T1=0.02% | CI_T2=4.47% | CI_T3=21.42% | CI_T4=99.17%
2026-02-11 19:24:27,570 - INFO - [Task 4 | ep 3 | step 350] loss=0.7676 c=0.1554 r=0.6116 | mrg=0.0006 | CI_T0=0.00% | CI_T1=0.02% | CI_T2=9.47% | CI_T3=21.53% | CI_T4=99.30%
2026-02-11 19:24:48,311 - INFO - [After Task 4] Task-IL : T0=99.91% | T1=98.24% | T2=99.84% | T3=99.50% | T4=98.94% | Avg=99.28%
2026-02-11 19:24:48,311 - INFO - [After Task 4] Class-IL: T0=0.00% | T1=0.00% | T2=4.22% | T3=28.75% | T4=98.59% | Avg=26.31%
2026-02-11 19:24:48,313 - INFO - ========== GROUP DIFFERENCES ==========
2026-02-11 19:24:48,313 - INFO - Seen tasks: 0..4 | valid_out_dim=10
2026-02-11 19:24:50,327 - INFO - [Group=Task0] CI_acc=0.00% | corr_slice_max=5.401 | best_other_max=9.792 | gap=-4.392
2026-02-11 19:24:50,327 - INFO - [Group=Task0] winner_task_dist: W0=0.0% | W1=0.0% | W2=0.2% | W3=1.0% | W4=98.8%
2026-02-11 19:24:50,327 - INFO - [Group=Task0] slice_strength : S0=5.40 | S1=6.22 | S2=7.27 | S3=8.01 | S4=9.79
2026-02-11 19:24:52,338 - INFO - [Group=Task1] CI_acc=0.00% | corr_slice_max=6.840 | best_other_max=10.115 | gap=-3.275
2026-02-11 19:24:52,338 - INFO - [Group=Task1] winner_task_dist: W0=0.0% | W1=0.0% | W2=4.8% | W3=6.1% | W4=89.1%
2026-02-11 19:24:52,338 - INFO - [Group=Task1] slice_strength : S0=2.67 | S1=6.84 | S2=8.06 | S3=7.96 | S4=10.07
2026-02-11 19:24:54,336 - INFO - [Group=Task2] CI_acc=4.22% | corr_slice_max=8.931 | best_other_max=10.912 | gap=-1.981
2026-02-11 19:24:54,336 - INFO - [Group=Task2] winner_task_dist: W0=0.0% | W1=0.0% | W2=4.2% | W3=0.7% | W4=95.0%
2026-02-11 19:24:54,336 - INFO - [Group=Task2] slice_strength : S0=2.58 | S1=5.98 | S2=8.93 | S3=8.53 | S4=10.91
2026-02-11 19:24:56,344 - INFO - [Group=Task3] CI_acc=28.75% | corr_slice_max=9.713 | best_other_max=10.415 | gap=-0.702
2026-02-11 19:24:56,344 - INFO - [Group=Task3] winner_task_dist: W0=0.0% | W1=0.0% | W2=1.8% | W3=28.8% | W4=69.5%
2026-02-11 19:24:56,344 - INFO - [Group=Task3] slice_strength : S0=2.73 | S1=5.77 | S2=7.59 | S3=9.71 | S4=10.39
2026-02-11 19:24:58,341 - INFO - [Group=Task4] CI_acc=98.59% | corr_slice_max=11.696 | best_other_max=9.460 | gap=2.236
2026-02-11 19:24:58,341 - INFO - [Group=Task4] winner_task_dist: W0=0.0% | W1=0.0% | W2=0.0% | W3=0.5% | W4=99.5%
2026-02-11 19:24:58,341 - INFO - [Group=Task4] slice_strength : S0=2.93 | S1=6.21 | S2=8.10 | S3=9.29 | S4=11.70
2026-02-11 19:24:58,341 - INFO - ======================================
2026-02-11 19:24:58,341 - INFO - ========== FINAL METRICS (Class-IL) ==========
2026-02-11 19:24:58,341 - INFO - Forgetting per task: T0=99.91%, T1=98.97%, T2=95.62%, T3=70.69%, T4=0.00%
2026-02-11 19:24:58,341 - INFO - BWT: -91.30%
2026-02-11 19:24:58,341 - INFO - Final average Class-IL accuracy: 26.31%
