2026-02-11 13:51:48,705 - INFO - Device: cuda
2026-02-11 13:51:48,705 - INFO - Config: {'device': 'cuda', 'lr': 0.005, 'epochs_per_task': 4, 'batch_size': 128, 'lambda_slice': 8.0, 'lambda_feat': 2.0, 'use_cosine_head': True, 'seed': 42, 'freeze_backbone_after_task': -1, 'ewc_lambda': 0.0}
2026-02-11 13:51:49,050 - INFO - ========== Training Task 0: classes [0, 1] ==========
2026-02-11 13:51:58,707 - INFO - [Task 0 | ep 0 | step 0] loss=0.8633 c=0.8633 r=0.0000 | CI_T0=96.97%
2026-02-11 13:52:03,274 - INFO - [Task 0 | ep 0 | step 25] loss=0.0014 c=0.0014 r=0.0000 | CI_T0=99.93%
2026-02-11 13:52:07,803 - INFO - [Task 0 | ep 0 | step 50] loss=0.0007 c=0.0007 r=0.0000 | CI_T0=99.85%
2026-02-11 13:52:12,272 - INFO - [Task 0 | ep 0 | step 75] loss=0.0003 c=0.0003 r=0.0000 | CI_T0=99.97%
2026-02-11 13:52:20,503 - INFO - [Task 0 | ep 1 | step 100] loss=0.0003 c=0.0003 r=0.0000 | CI_T0=99.94%
2026-02-11 13:52:25,024 - INFO - [Task 0 | ep 1 | step 125] loss=0.0005 c=0.0005 r=0.0000 | CI_T0=99.94%
2026-02-11 13:52:29,363 - INFO - [Task 0 | ep 1 | step 150] loss=0.0003 c=0.0003 r=0.0000 | CI_T0=99.92%
2026-02-11 13:52:33,705 - INFO - [Task 0 | ep 1 | step 175] loss=0.0002 c=0.0002 r=0.0000 | CI_T0=99.94%
2026-02-11 13:52:41,935 - INFO - [Task 0 | ep 2 | step 200] loss=0.0001 c=0.0001 r=0.0000 | CI_T0=99.98%
2026-02-11 13:52:46,296 - INFO - [Task 0 | ep 2 | step 225] loss=0.0001 c=0.0001 r=0.0000 | CI_T0=99.97%
2026-02-11 13:52:50,658 - INFO - [Task 0 | ep 2 | step 250] loss=0.0003 c=0.0003 r=0.0000 | CI_T0=99.97%
2026-02-11 13:52:55,104 - INFO - [Task 0 | ep 2 | step 275] loss=0.0003 c=0.0003 r=0.0000 | CI_T0=99.98%
2026-02-11 13:53:03,301 - INFO - [Task 0 | ep 3 | step 300] loss=0.0001 c=0.0001 r=0.0000 | CI_T0=99.95%
2026-02-11 13:53:07,700 - INFO - [Task 0 | ep 3 | step 325] loss=0.0001 c=0.0001 r=0.0000 | CI_T0=99.98%
2026-02-11 13:53:12,078 - INFO - [Task 0 | ep 3 | step 350] loss=0.0004 c=0.0004 r=0.0000 | CI_T0=99.97%
2026-02-11 13:53:16,403 - INFO - [Task 0 | ep 3 | step 375] loss=0.0007 c=0.0007 r=0.0000 | CI_T0=99.98%
2026-02-11 13:53:21,215 - INFO - [After Task 0] Task-IL : T0=99.95% | Avg=99.95%
2026-02-11 13:53:21,215 - INFO - [After Task 0] Class-IL: T0=99.95% | Avg=99.95%
2026-02-11 13:53:21,215 - INFO - ========== GROUP DIFFERENCES ==========
2026-02-11 13:53:21,215 - INFO - Seen tasks: 0..0 | valid_out_dim=2
2026-02-11 13:53:23,443 - INFO - [Group=Task0] CI_acc=99.95% | corr_slice_max=5.008 | best_other_max=nan | gap=nan
2026-02-11 13:53:23,443 - INFO - [Group=Task0] winner_task_dist: W0=100.0%
2026-02-11 13:53:23,443 - INFO - [Group=Task0] slice_strength : S0=5.01
2026-02-11 13:53:23,443 - INFO - ======================================
2026-02-11 13:53:23,443 - INFO - ========== Training Task 1: classes [2, 3] ==========
2026-02-11 13:53:35,373 - INFO - [Task 1 | ep 0 | step 0] loss=13.7974 c=4.1620 r=9.6354 | CI_T0=99.94% | CI_T1=8.73%
2026-02-11 13:53:43,894 - INFO - [Task 1 | ep 0 | step 25] loss=4.0613 c=0.2880 r=3.7733 | CI_T0=31.06% | CI_T1=93.13%
2026-02-11 13:53:52,518 - INFO - [Task 1 | ep 0 | step 50] loss=5.0709 c=0.2057 r=4.8652 | CI_T0=37.25% | CI_T1=96.11%
2026-02-11 13:54:01,101 - INFO - [Task 1 | ep 0 | step 75] loss=4.1201 c=0.2287 r=3.8914 | CI_T0=28.71% | CI_T1=94.51%
2026-02-11 13:54:13,413 - INFO - [Task 1 | ep 1 | step 100] loss=3.6615 c=0.2051 r=3.4564 | CI_T0=34.94% | CI_T1=95.35%
2026-02-11 13:54:22,002 - INFO - [Task 1 | ep 1 | step 125] loss=3.0182 c=0.2230 r=2.7952 | CI_T0=17.47% | CI_T1=97.05%
2026-02-11 13:54:30,611 - INFO - [Task 1 | ep 1 | step 150] loss=3.6656 c=0.1572 r=3.5084 | CI_T0=8.05% | CI_T1=96.93%
2026-02-11 13:54:39,295 - INFO - [Task 1 | ep 1 | step 175] loss=4.2841 c=0.1551 r=4.1290 | CI_T0=24.90% | CI_T1=96.99%
2026-02-11 13:54:51,633 - INFO - [Task 1 | ep 2 | step 200] loss=4.4196 c=0.2134 r=4.2062 | CI_T0=22.71% | CI_T1=97.48%
2026-02-11 13:55:00,173 - INFO - [Task 1 | ep 2 | step 225] loss=3.8928 c=0.1425 r=3.7504 | CI_T0=8.59% | CI_T1=97.46%
2026-02-11 13:55:08,697 - INFO - [Task 1 | ep 2 | step 250] loss=2.9491 c=0.1537 r=2.7955 | CI_T0=23.33% | CI_T1=97.49%
2026-02-11 13:55:17,197 - INFO - [Task 1 | ep 2 | step 275] loss=2.3305 c=0.1761 r=2.1544 | CI_T0=23.17% | CI_T1=97.75%
2026-02-11 13:55:29,480 - INFO - [Task 1 | ep 3 | step 300] loss=2.6888 c=0.1594 r=2.5294 | CI_T0=32.40% | CI_T1=96.77%
2026-02-11 13:55:38,151 - INFO - [Task 1 | ep 3 | step 325] loss=2.4279 c=0.1642 r=2.2637 | CI_T0=15.98% | CI_T1=98.04%
2026-02-11 13:55:46,725 - INFO - [Task 1 | ep 3 | step 350] loss=2.0183 c=0.1830 r=1.8353 | CI_T0=19.28% | CI_T1=98.07%
2026-02-11 13:55:55,322 - INFO - [Task 1 | ep 3 | step 375] loss=5.3580 c=0.1239 r=5.2341 | CI_T0=22.66% | CI_T1=98.04%
2026-02-11 13:56:04,385 - INFO - [After Task 1] Task-IL : T0=99.91% | T1=98.33% | Avg=99.12%
2026-02-11 13:56:04,385 - INFO - [After Task 1] Class-IL: T0=21.18% | T1=98.33% | Avg=59.76%
2026-02-11 13:56:04,385 - INFO - ========== GROUP DIFFERENCES ==========
2026-02-11 13:56:04,386 - INFO - Seen tasks: 0..1 | valid_out_dim=4
2026-02-11 13:56:06,570 - INFO - [Group=Task0] CI_acc=21.18% | corr_slice_max=5.019 | best_other_max=5.675 | gap=-0.656
2026-02-11 13:56:06,570 - INFO - [Group=Task0] winner_task_dist: W0=21.2% | W1=78.8%
2026-02-11 13:56:06,570 - INFO - [Group=Task0] slice_strength : S0=5.02 | S1=5.67
2026-02-11 13:56:08,834 - INFO - [Group=Task1] CI_acc=98.33% | corr_slice_max=6.527 | best_other_max=3.002 | gap=3.525
2026-02-11 13:56:08,834 - INFO - [Group=Task1] winner_task_dist: W0=0.0% | W1=100.0%
2026-02-11 13:56:08,834 - INFO - [Group=Task1] slice_strength : S0=3.00 | S1=6.53
2026-02-11 13:56:08,834 - INFO - ======================================
2026-02-11 13:56:08,835 - INFO - ========== Training Task 2: classes [4, 5] ==========
2026-02-11 13:56:25,113 - INFO - [Task 2 | ep 0 | step 0] loss=13.0938 c=6.0539 r=7.0399 | CI_T0=22.25% | CI_T1=97.04% | CI_T2=0.00%
2026-02-11 13:56:38,978 - INFO - [Task 2 | ep 0 | step 25] loss=3.6101 c=0.7872 r=2.8229 | CI_T0=2.69% | CI_T1=63.61% | CI_T2=64.78%
2026-02-11 13:56:53,229 - INFO - [Task 2 | ep 0 | step 50] loss=4.8737 c=0.5832 r=4.2905 | CI_T0=14.69% | CI_T1=48.22% | CI_T2=90.24%
2026-02-11 13:57:07,724 - INFO - [Task 2 | ep 0 | step 75] loss=3.0057 c=0.5035 r=2.5022 | CI_T0=6.82% | CI_T1=43.86% | CI_T2=92.40%
2026-02-11 13:57:26,277 - INFO - [Task 2 | ep 1 | step 100] loss=3.4601 c=0.4875 r=2.9725 | CI_T0=7.83% | CI_T1=41.67% | CI_T2=90.68%
2026-02-11 13:57:41,530 - INFO - [Task 2 | ep 1 | step 125] loss=3.2342 c=0.4590 r=2.7752 | CI_T0=6.57% | CI_T1=34.94% | CI_T2=93.90%
2026-02-11 13:57:55,691 - INFO - [Task 2 | ep 1 | step 150] loss=2.7482 c=0.3962 r=2.3520 | CI_T0=6.93% | CI_T1=30.25% | CI_T2=96.97%
2026-02-11 13:58:13,723 - INFO - [Task 2 | ep 2 | step 175] loss=2.7023 c=0.3864 r=2.3160 | CI_T0=15.07% | CI_T1=29.85% | CI_T2=95.28%
2026-02-11 13:58:28,194 - INFO - [Task 2 | ep 2 | step 200] loss=2.1242 c=0.3769 r=1.7473 | CI_T0=4.05% | CI_T1=39.12% | CI_T2=94.78%
2026-02-11 13:58:44,039 - INFO - [Task 2 | ep 2 | step 225] loss=2.0955 c=0.3792 r=1.7163 | CI_T0=17.27% | CI_T1=28.48% | CI_T2=97.26%
2026-02-11 13:59:00,089 - INFO - [Task 2 | ep 2 | step 250] loss=3.1759 c=0.3578 r=2.8180 | CI_T0=21.06% | CI_T1=21.57% | CI_T2=97.95%
2026-02-11 13:59:17,377 - INFO - [Task 2 | ep 3 | step 275] loss=2.5429 c=0.3300 r=2.2129 | CI_T0=2.68% | CI_T1=29.40% | CI_T2=98.04%
2026-02-11 13:59:30,724 - INFO - [Task 2 | ep 3 | step 300] loss=3.8183 c=0.3335 r=3.4849 | CI_T0=0.63% | CI_T1=30.44% | CI_T2=97.57%
2026-02-11 13:59:43,991 - INFO - [Task 2 | ep 3 | step 325] loss=2.6108 c=0.2847 r=2.3260 | CI_T0=5.27% | CI_T1=25.02% | CI_T2=98.62%
2026-02-11 13:59:57,899 - INFO - [After Task 2] Task-IL : T0=99.91% | T1=97.85% | T2=99.68% | Avg=99.14%
2026-02-11 13:59:57,899 - INFO - [After Task 2] Class-IL: T0=4.96% | T1=23.85% | T2=98.56% | Avg=42.46%
2026-02-11 13:59:57,899 - INFO - ========== GROUP DIFFERENCES ==========
2026-02-11 13:59:57,899 - INFO - Seen tasks: 0..2 | valid_out_dim=6
2026-02-11 14:00:00,187 - INFO - [Group=Task0] CI_acc=4.96% | corr_slice_max=5.098 | best_other_max=6.282 | gap=-1.184
2026-02-11 14:00:00,187 - INFO - [Group=Task0] winner_task_dist: W0=5.0% | W1=3.4% | W2=91.7%
2026-02-11 14:00:00,187 - INFO - [Group=Task0] slice_strength : S0=5.10 | S1=5.68 | S2=6.28
2026-02-11 14:00:02,405 - INFO - [Group=Task1] CI_acc=23.85% | corr_slice_max=6.446 | best_other_max=7.108 | gap=-0.662
2026-02-11 14:00:02,405 - INFO - [Group=Task1] winner_task_dist: W0=0.1% | W1=23.8% | W2=76.1%
2026-02-11 14:00:02,405 - INFO - [Group=Task1] slice_strength : S0=2.88 | S1=6.45 | S2=7.11
2026-02-11 14:00:04,609 - INFO - [Group=Task2] CI_acc=98.56% | corr_slice_max=7.579 | best_other_max=5.764 | gap=1.814
2026-02-11 14:00:04,610 - INFO - [Group=Task2] winner_task_dist: W0=0.0% | W1=1.2% | W2=98.8%
2026-02-11 14:00:04,610 - INFO - [Group=Task2] slice_strength : S0=2.82 | S1=5.76 | S2=7.58
2026-02-11 14:00:04,610 - INFO - ======================================
2026-02-11 14:00:04,610 - INFO - ========== Training Task 3: classes [6, 7] ==========
2026-02-11 14:00:25,288 - INFO - [Task 3 | ep 0 | step 0] loss=11.9612 c=7.5173 r=4.4439 | CI_T0=0.53% | CI_T1=23.65% | CI_T2=98.71% | CI_T3=0.00%
2026-02-11 14:00:43,774 - INFO - [Task 3 | ep 0 | step 25] loss=3.4851 c=0.9577 r=2.5274 | CI_T0=6.29% | CI_T1=11.90% | CI_T2=88.24% | CI_T3=63.29%
2026-02-11 14:01:02,206 - INFO - [Task 3 | ep 0 | step 50] loss=2.6711 c=0.6560 r=2.0151 | CI_T0=6.04% | CI_T1=11.98% | CI_T2=76.96% | CI_T3=87.58%
2026-02-11 14:01:19,507 - INFO - [Task 3 | ep 0 | step 75] loss=2.8493 c=0.6106 r=2.2387 | CI_T0=0.01% | CI_T1=10.55% | CI_T2=68.48% | CI_T3=89.00%
2026-02-11 14:01:41,229 - INFO - [Task 3 | ep 1 | step 100] loss=2.4043 c=0.5526 r=1.8518 | CI_T0=0.31% | CI_T1=12.50% | CI_T2=70.64% | CI_T3=92.69%
2026-02-11 14:01:58,873 - INFO - [Task 3 | ep 1 | step 125] loss=2.8917 c=0.5503 r=2.3414 | CI_T0=0.57% | CI_T1=14.07% | CI_T2=71.06% | CI_T3=94.61%
2026-02-11 14:02:16,777 - INFO - [Task 3 | ep 1 | step 150] loss=3.5590 c=0.4681 r=3.0909 | CI_T0=0.20% | CI_T1=11.45% | CI_T2=68.08% | CI_T3=94.98%
2026-02-11 14:02:35,289 - INFO - [Task 3 | ep 1 | step 175] loss=2.4382 c=0.4319 r=2.0062 | CI_T0=0.02% | CI_T1=12.35% | CI_T2=66.24% | CI_T3=96.11%
2026-02-11 14:02:57,168 - INFO - [Task 3 | ep 2 | step 200] loss=2.1960 c=0.4189 r=1.7771 | CI_T0=0.14% | CI_T1=10.84% | CI_T2=62.61% | CI_T3=96.46%
2026-02-11 14:03:14,847 - INFO - [Task 3 | ep 2 | step 225] loss=2.4422 c=0.3706 r=2.0717 | CI_T0=0.52% | CI_T1=10.77% | CI_T2=67.09% | CI_T3=96.48%
2026-02-11 14:03:33,781 - INFO - [Task 3 | ep 2 | step 250] loss=1.9637 c=0.3135 r=1.6502 | CI_T0=0.10% | CI_T1=9.90% | CI_T2=59.10% | CI_T3=98.59%
2026-02-11 14:03:52,193 - INFO - [Task 3 | ep 2 | step 275] loss=2.1375 c=0.3318 r=1.8057 | CI_T0=0.69% | CI_T1=14.35% | CI_T2=58.41% | CI_T3=97.73%
2026-02-11 14:04:14,697 - INFO - [Task 3 | ep 3 | step 300] loss=2.1241 c=0.2879 r=1.8362 | CI_T0=0.23% | CI_T1=7.24% | CI_T2=57.55% | CI_T3=99.13%
2026-02-11 14:04:32,489 - INFO - [Task 3 | ep 3 | step 325] loss=2.0071 c=0.2715 r=1.7356 | CI_T0=0.07% | CI_T1=11.49% | CI_T2=56.09% | CI_T3=98.58%
2026-02-11 14:04:50,309 - INFO - [Task 3 | ep 3 | step 350] loss=2.5239 c=0.2470 r=2.2769 | CI_T0=0.05% | CI_T1=9.28% | CI_T2=57.10% | CI_T3=99.06%
2026-02-11 14:05:09,719 - INFO - [Task 3 | ep 3 | step 375] loss=2.0997 c=0.2320 r=1.8676 | CI_T0=0.04% | CI_T1=9.55% | CI_T2=57.30% | CI_T3=98.40%
2026-02-11 14:05:27,858 - INFO - [After Task 3] Task-IL : T0=99.95% | T1=97.75% | T2=99.47% | T3=99.60% | Avg=99.19%
2026-02-11 14:05:27,859 - INFO - [After Task 3] Class-IL: T0=0.14% | T1=9.79% | T2=56.30% | T3=98.64% | Avg=41.22%
2026-02-11 14:05:27,859 - INFO - ========== GROUP DIFFERENCES ==========
2026-02-11 14:05:27,859 - INFO - Seen tasks: 0..3 | valid_out_dim=8
2026-02-11 14:05:30,027 - INFO - [Group=Task0] CI_acc=0.14% | corr_slice_max=5.058 | best_other_max=7.457 | gap=-2.400
2026-02-11 14:05:30,027 - INFO - [Group=Task0] winner_task_dist: W0=0.1% | W1=0.0% | W2=5.4% | W3=94.4%
2026-02-11 14:05:30,027 - INFO - [Group=Task0] slice_strength : S0=5.06 | S1=5.82 | S2=6.41 | S3=7.43
2026-02-11 14:05:32,180 - INFO - [Group=Task1] CI_acc=9.79% | corr_slice_max=6.454 | best_other_max=7.892 | gap=-1.438
2026-02-11 14:05:32,180 - INFO - [Group=Task1] winner_task_dist: W0=0.0% | W1=9.8% | W2=38.6% | W3=51.6%
2026-02-11 14:05:32,181 - INFO - [Group=Task1] slice_strength : S0=2.78 | S1=6.45 | S2=7.07 | S3=7.29
2026-02-11 14:05:34,328 - INFO - [Group=Task2] CI_acc=56.30% | corr_slice_max=7.691 | best_other_max=7.477 | gap=0.214
2026-02-11 14:05:34,328 - INFO - [Group=Task2] winner_task_dist: W0=0.0% | W1=0.2% | W2=56.3% | W3=43.5%
2026-02-11 14:05:34,328 - INFO - [Group=Task2] slice_strength : S0=2.80 | S1=5.82 | S2=7.69 | S3=7.36
2026-02-11 14:05:36,459 - INFO - [Group=Task3] CI_acc=98.64% | corr_slice_max=8.827 | best_other_max=6.920 | gap=1.907
2026-02-11 14:05:36,459 - INFO - [Group=Task3] winner_task_dist: W0=0.0% | W1=0.1% | W2=1.2% | W3=98.8%
2026-02-11 14:05:36,459 - INFO - [Group=Task3] slice_strength : S0=2.88 | S1=5.61 | S2=6.87 | S3=8.83
2026-02-11 14:05:36,459 - INFO - ======================================
2026-02-11 14:05:36,459 - INFO - ========== Training Task 4: classes [8, 9] ==========
2026-02-11 14:06:02,270 - INFO - [Task 4 | ep 0 | step 0] loss=16.1644 c=8.3102 r=7.8542 | CI_T0=0.00% | CI_T1=17.11% | CI_T2=54.05% | CI_T3=99.27% | CI_T4=0.00%
2026-02-11 14:06:23,424 - INFO - [Task 4 | ep 0 | step 25] loss=3.9327 c=1.2267 r=2.7060 | CI_T0=3.69% | CI_T1=0.54% | CI_T2=54.78% | CI_T3=80.67% | CI_T4=40.89%
2026-02-11 14:06:45,090 - INFO - [Task 4 | ep 0 | step 50] loss=3.0679 c=0.9430 r=2.1250 | CI_T0=0.21% | CI_T1=0.02% | CI_T2=30.64% | CI_T3=67.03% | CI_T4=69.82%
2026-02-11 14:07:07,645 - INFO - [Task 4 | ep 0 | step 75] loss=3.2076 c=0.7898 r=2.4178 | CI_T0=1.11% | CI_T1=0.02% | CI_T2=31.52% | CI_T3=62.52% | CI_T4=80.15%
2026-02-11 14:07:33,294 - INFO - [Task 4 | ep 1 | step 100] loss=2.5405 c=0.7039 r=1.8366 | CI_T0=0.38% | CI_T1=0.02% | CI_T2=17.08% | CI_T3=61.47% | CI_T4=81.89%
2026-02-11 14:07:56,609 - INFO - [Task 4 | ep 1 | step 125] loss=3.0193 c=0.6006 r=2.4186 | CI_T0=0.82% | CI_T1=0.00% | CI_T2=19.62% | CI_T3=61.29% | CI_T4=80.40%
2026-02-11 14:08:17,943 - INFO - [Task 4 | ep 1 | step 150] loss=2.6480 c=0.6209 r=2.0271 | CI_T0=1.35% | CI_T1=0.00% | CI_T2=15.27% | CI_T3=55.47% | CI_T4=89.73%
2026-02-11 14:08:39,457 - INFO - [Task 4 | ep 1 | step 175] loss=2.1719 c=0.5442 r=1.6277 | CI_T0=1.41% | CI_T1=0.01% | CI_T2=17.52% | CI_T3=49.17% | CI_T4=91.98%
2026-02-11 14:09:05,013 - INFO - [Task 4 | ep 2 | step 200] loss=2.3342 c=0.5956 r=1.7386 | CI_T0=0.02% | CI_T1=0.00% | CI_T2=6.14% | CI_T3=48.50% | CI_T4=92.18%
2026-02-11 14:09:26,204 - INFO - [Task 4 | ep 2 | step 225] loss=2.4485 c=0.5348 r=1.9137 | CI_T0=0.77% | CI_T1=0.00% | CI_T2=7.06% | CI_T3=46.91% | CI_T4=94.95%
2026-02-11 14:09:47,139 - INFO - [Task 4 | ep 2 | step 250] loss=1.8349 c=0.4886 r=1.3463 | CI_T0=1.23% | CI_T1=0.00% | CI_T2=5.50% | CI_T3=46.97% | CI_T4=94.79%
2026-02-11 14:10:08,249 - INFO - [Task 4 | ep 2 | step 275] loss=3.6102 c=0.4792 r=3.1311 | CI_T0=0.61% | CI_T1=0.00% | CI_T2=7.77% | CI_T3=46.01% | CI_T4=94.54%
2026-02-11 14:10:33,309 - INFO - [Task 4 | ep 3 | step 300] loss=2.2565 c=0.5387 r=1.7179 | CI_T0=0.20% | CI_T1=0.00% | CI_T2=4.41% | CI_T3=43.09% | CI_T4=95.60%
2026-02-11 14:10:54,801 - INFO - [Task 4 | ep 3 | step 325] loss=1.7157 c=0.4147 r=1.3010 | CI_T0=0.04% | CI_T1=0.00% | CI_T2=3.85% | CI_T3=42.52% | CI_T4=96.68%
2026-02-11 14:11:16,305 - INFO - [Task 4 | ep 3 | step 350] loss=2.0823 c=0.3580 r=1.7243 | CI_T0=0.00% | CI_T1=0.00% | CI_T2=4.80% | CI_T3=41.04% | CI_T4=97.18%
2026-02-11 14:11:37,940 - INFO - [After Task 4] Task-IL : T0=99.95% | T1=98.24% | T2=99.63% | T3=99.35% | T4=97.93% | Avg=99.02%
2026-02-11 14:11:37,940 - INFO - [After Task 4] Class-IL: T0=0.28% | T1=0.00% | T2=6.14% | T3=44.01% | T4=96.42% | Avg=29.37%
2026-02-11 14:11:37,940 - INFO - ========== GROUP DIFFERENCES ==========
2026-02-11 14:11:37,940 - INFO - Seen tasks: 0..4 | valid_out_dim=10
2026-02-11 14:11:40,080 - INFO - [Group=Task0] CI_acc=0.28% | corr_slice_max=5.249 | best_other_max=7.951 | gap=-2.702
2026-02-11 14:11:40,080 - INFO - [Group=Task0] winner_task_dist: W0=0.3% | W1=0.0% | W2=0.7% | W3=30.9% | W4=68.1%
2026-02-11 14:11:40,080 - INFO - [Group=Task0] slice_strength : S0=5.25 | S1=5.71 | S2=6.22 | S3=7.35 | S4=7.80
2026-02-11 14:11:42,202 - INFO - [Group=Task1] CI_acc=0.00% | corr_slice_max=6.348 | best_other_max=8.905 | gap=-2.557
2026-02-11 14:11:42,202 - INFO - [Group=Task1] winner_task_dist: W0=0.0% | W1=0.0% | W2=3.6% | W3=19.3% | W4=77.1%
2026-02-11 14:11:42,202 - INFO - [Group=Task1] slice_strength : S0=2.88 | S1=6.35 | S2=7.09 | S3=7.26 | S4=8.68
2026-02-11 14:11:44,320 - INFO - [Group=Task2] CI_acc=6.14% | corr_slice_max=7.603 | best_other_max=9.098 | gap=-1.495
2026-02-11 14:11:44,320 - INFO - [Group=Task2] winner_task_dist: W0=0.0% | W1=0.0% | W2=6.1% | W3=2.8% | W4=91.0%
2026-02-11 14:11:44,320 - INFO - [Group=Task2] slice_strength : S0=2.83 | S1=5.71 | S2=7.60 | S3=7.33 | S4=9.08
2026-02-11 14:11:46,429 - INFO - [Group=Task3] CI_acc=44.01% | corr_slice_max=8.699 | best_other_max=8.678 | gap=0.021
2026-02-11 14:11:46,429 - INFO - [Group=Task3] winner_task_dist: W0=0.0% | W1=0.0% | W2=0.0% | W3=44.0% | W4=56.0%
2026-02-11 14:11:46,429 - INFO - [Group=Task3] slice_strength : S0=2.92 | S1=5.43 | S2=6.68 | S3=8.70 | S4=8.61
2026-02-11 14:11:48,538 - INFO - [Group=Task4] CI_acc=96.42% | corr_slice_max=9.746 | best_other_max=8.109 | gap=1.637
2026-02-11 14:11:48,538 - INFO - [Group=Task4] winner_task_dist: W0=0.0% | W1=0.0% | W2=0.0% | W3=1.7% | W4=98.3%
2026-02-11 14:11:48,538 - INFO - [Group=Task4] slice_strength : S0=3.20 | S1=5.90 | S2=7.03 | S3=8.00 | S4=9.75
2026-02-11 14:11:48,538 - INFO - ======================================
2026-02-11 14:11:48,538 - INFO - ========== FINAL METRICS (Class-IL) ==========
2026-02-11 14:11:48,540 - INFO - Forgetting per task: T0=99.67%, T1=98.33%, T2=92.42%, T3=54.63%, T4=0.00%
2026-02-11 14:11:48,540 - INFO - BWT: -86.26%
2026-02-11 14:11:48,540 - INFO - Final average Class-IL accuracy: 29.37%
