2026-02-11 17:51:42,594 - INFO - Device: cpu
2026-02-11 17:51:42,594 - INFO - Config: {'device': 'cpu', 'lr': 0.005, 'epochs_per_task': 4, 'batch_size': 128, 'lambda_slice': 2.0, 'lambda_feat': 0.5, 'use_cosine_head': True, 'seed': 42, 'freeze_backbone_after_task': -1, 'ewc_lambda': 0.0, 'si_lambda': 1.0, 'use_attention_backbone': True, 'use_adapters': False, 'lambda_slice_balance': 0.0, 'lambda_slice_margin': 0.0, 'slice_margin': 0.5, 'use_task_inference': False, 'lambda_task_inference': 1.0}
2026-02-11 17:51:42,598 - INFO - ========== Training Task 0: classes [0, 1] ==========
2026-02-11 17:51:49,861 - INFO - [Task 0 | ep 0 | step 0] loss=0.6816 c=0.6816 r=0.0000 | CI_T0=89.80%
2026-02-11 17:51:54,418 - INFO - [Task 0 | ep 0 | step 25] loss=0.0193 c=0.0193 r=0.0000 | CI_T0=99.76%
2026-02-11 17:51:58,952 - INFO - [Task 0 | ep 0 | step 50] loss=0.0024 c=0.0024 r=0.0000 | CI_T0=99.90%
2026-02-11 17:52:03,456 - INFO - [Task 0 | ep 0 | step 75] loss=0.0009 c=0.0009 r=0.0000 | CI_T0=99.89%
2026-02-11 17:52:11,519 - INFO - [Task 0 | ep 1 | step 100] loss=0.0006 c=0.0006 r=0.0000 | CI_T0=99.90%
2026-02-11 17:52:16,013 - INFO - [Task 0 | ep 1 | step 125] loss=0.0006 c=0.0006 r=0.0000 | CI_T0=99.82%
2026-02-11 17:52:20,441 - INFO - [Task 0 | ep 1 | step 150] loss=0.0006 c=0.0006 r=0.0000 | CI_T0=99.86%
2026-02-11 17:52:24,854 - INFO - [Task 0 | ep 1 | step 175] loss=0.0044 c=0.0044 r=0.0000 | CI_T0=99.59%
2026-02-11 17:52:32,805 - INFO - [Task 0 | ep 2 | step 200] loss=0.0002 c=0.0002 r=0.0000 | CI_T0=99.86%
2026-02-11 17:52:37,243 - INFO - [Task 0 | ep 2 | step 225] loss=0.0021 c=0.0021 r=0.0000 | CI_T0=99.94%
2026-02-11 17:52:41,647 - INFO - [Task 0 | ep 2 | step 250] loss=0.0003 c=0.0003 r=0.0000 | CI_T0=99.93%
2026-02-11 17:52:46,119 - INFO - [Task 0 | ep 2 | step 275] loss=0.0008 c=0.0008 r=0.0000 | CI_T0=99.90%
2026-02-11 17:52:54,038 - INFO - [Task 0 | ep 3 | step 300] loss=0.0004 c=0.0004 r=0.0000 | CI_T0=99.08%
2026-02-11 17:52:58,418 - INFO - [Task 0 | ep 3 | step 325] loss=0.0002 c=0.0002 r=0.0000 | CI_T0=99.91%
2026-02-11 17:53:02,817 - INFO - [Task 0 | ep 3 | step 350] loss=0.0007 c=0.0007 r=0.0000 | CI_T0=99.93%
2026-02-11 17:53:07,237 - INFO - [Task 0 | ep 3 | step 375] loss=0.0002 c=0.0002 r=0.0000 | CI_T0=99.97%
2026-02-11 17:53:07,796 - INFO - SI: stored omega for task 0
2026-02-11 17:53:11,884 - INFO - [After Task 0] Task-IL : T0=99.95% | Avg=99.95%
2026-02-11 17:53:11,884 - INFO - [After Task 0] Class-IL: T0=99.95% | Avg=99.95%
2026-02-11 17:53:11,884 - INFO - ========== GROUP DIFFERENCES ==========
2026-02-11 17:53:11,884 - INFO - Seen tasks: 0..0 | valid_out_dim=2
2026-02-11 17:53:13,920 - INFO - [Group=Task0] CI_acc=99.95% | corr_slice_max=4.844 | best_other_max=nan | gap=nan
2026-02-11 17:53:13,920 - INFO - [Group=Task0] winner_task_dist: W0=100.0%
2026-02-11 17:53:13,920 - INFO - [Group=Task0] slice_strength : S0=4.84
2026-02-11 17:53:13,920 - INFO - ======================================
2026-02-11 17:53:13,920 - INFO - ========== Training Task 1: classes [2, 3] ==========
2026-02-11 17:53:25,167 - INFO - [Task 1 | ep 0 | step 0] loss=5.9274 c=4.1716 r=1.7557 | CI_T0=99.75% | CI_T1=11.69%
2026-02-11 17:53:33,760 - INFO - [Task 1 | ep 0 | step 25] loss=1.4052 c=0.2334 r=1.1682 | si=0.0036 | CI_T0=0.00% | CI_T1=88.84%
2026-02-11 17:53:42,277 - INFO - [Task 1 | ep 0 | step 50] loss=1.0713 c=0.2260 r=0.8399 | si=0.0055 | CI_T0=0.00% | CI_T1=95.69%
2026-02-11 17:53:50,870 - INFO - [Task 1 | ep 0 | step 75] loss=1.0364 c=0.1932 r=0.8366 | si=0.0065 | CI_T0=0.00% | CI_T1=97.45%
2026-02-11 17:54:03,027 - INFO - [Task 1 | ep 1 | step 100] loss=1.1134 c=0.2068 r=0.8994 | si=0.0072 | CI_T0=0.01% | CI_T1=96.70%
2026-02-11 17:54:11,555 - INFO - [Task 1 | ep 1 | step 125] loss=1.1213 c=0.1578 r=0.9556 | si=0.0078 | CI_T0=0.00% | CI_T1=97.65%
2026-02-11 17:54:20,062 - INFO - [Task 1 | ep 1 | step 150] loss=0.7349 c=0.1912 r=0.5353 | si=0.0083 | CI_T0=1.16% | CI_T1=96.60%
2026-02-11 17:54:28,564 - INFO - [Task 1 | ep 1 | step 175] loss=1.2638 c=0.1621 r=1.0929 | si=0.0088 | CI_T0=0.17% | CI_T1=97.17%
2026-02-11 17:54:40,690 - INFO - [Task 1 | ep 2 | step 200] loss=0.9977 c=0.1852 r=0.8032 | si=0.0093 | CI_T0=0.66% | CI_T1=97.74%
2026-02-11 17:54:49,226 - INFO - [Task 1 | ep 2 | step 225] loss=0.7702 c=0.1961 r=0.5644 | si=0.0098 | CI_T0=0.15% | CI_T1=97.66%
2026-02-11 17:54:57,735 - INFO - [Task 1 | ep 2 | step 250] loss=0.8579 c=0.2058 r=0.6417 | si=0.0104 | CI_T0=0.03% | CI_T1=97.66%
2026-02-11 17:55:06,267 - INFO - [Task 1 | ep 2 | step 275] loss=1.4477 c=0.1504 r=1.2865 | si=0.0108 | CI_T0=0.18% | CI_T1=97.69%
2026-02-11 17:55:18,380 - INFO - [Task 1 | ep 3 | step 300] loss=0.7980 c=0.1151 r=0.6717 | si=0.0113 | CI_T0=0.73% | CI_T1=97.72%
2026-02-11 17:55:26,945 - INFO - [Task 1 | ep 3 | step 325] loss=0.9738 c=0.1266 r=0.8354 | si=0.0119 | CI_T0=0.65% | CI_T1=97.63%
2026-02-11 17:55:35,514 - INFO - [Task 1 | ep 3 | step 350] loss=0.8501 c=0.1840 r=0.6536 | si=0.0124 | CI_T0=0.18% | CI_T1=97.92%
2026-02-11 17:55:44,073 - INFO - [Task 1 | ep 3 | step 375] loss=1.0153 c=0.1573 r=0.8451 | si=0.0129 | CI_T0=1.00% | CI_T1=97.49%
2026-02-11 17:55:44,362 - INFO - SI: stored omega for task 1
2026-02-11 17:55:52,570 - INFO - [After Task 1] Task-IL : T0=99.95% | T1=97.36% | Avg=98.65%
2026-02-11 17:55:52,570 - INFO - [After Task 1] Class-IL: T0=0.76% | T1=97.36% | Avg=49.06%
2026-02-11 17:55:52,570 - INFO - ========== GROUP DIFFERENCES ==========
2026-02-11 17:55:52,570 - INFO - Seen tasks: 0..1 | valid_out_dim=4
2026-02-11 17:55:54,594 - INFO - [Group=Task0] CI_acc=0.76% | corr_slice_max=4.897 | best_other_max=6.273 | gap=-1.376
2026-02-11 17:55:54,594 - INFO - [Group=Task0] winner_task_dist: W0=0.8% | W1=99.2%
2026-02-11 17:55:54,594 - INFO - [Group=Task0] slice_strength : S0=4.90 | S1=6.27
2026-02-11 17:55:56,630 - INFO - [Group=Task1] CI_acc=97.36% | corr_slice_max=6.913 | best_other_max=3.623 | gap=3.290
2026-02-11 17:55:56,630 - INFO - [Group=Task1] winner_task_dist: W0=0.0% | W1=100.0%
2026-02-11 17:55:56,630 - INFO - [Group=Task1] slice_strength : S0=3.62 | S1=6.91
2026-02-11 17:55:56,631 - INFO - ======================================
2026-02-11 17:55:56,631 - INFO - ========== Training Task 2: classes [4, 5] ==========
2026-02-11 17:56:11,902 - INFO - [Task 2 | ep 0 | step 0] loss=8.3395 c=6.7092 r=1.6173 | si=0.0129 | CI_T0=0.03% | CI_T1=96.18% | CI_T2=0.00%
2026-02-11 17:56:24,598 - INFO - [Task 2 | ep 0 | step 25] loss=1.5621 c=0.4932 r=0.9693 | si=0.0997 | CI_T0=0.00% | CI_T1=15.72% | CI_T2=93.04%
2026-02-11 17:56:37,182 - INFO - [Task 2 | ep 0 | step 50] loss=1.1470 c=0.3686 r=0.6617 | si=0.1168 | CI_T0=0.00% | CI_T1=25.21% | CI_T2=94.69%
2026-02-11 17:56:49,653 - INFO - [Task 2 | ep 0 | step 75] loss=1.1883 c=0.2960 r=0.7666 | si=0.1256 | CI_T0=0.00% | CI_T1=27.32% | CI_T2=95.65%
2026-02-11 17:57:05,714 - INFO - [Task 2 | ep 1 | step 100] loss=1.1975 c=0.2765 r=0.7879 | si=0.1330 | CI_T0=0.00% | CI_T1=33.03% | CI_T2=95.59%
2026-02-11 17:57:18,285 - INFO - [Task 2 | ep 1 | step 125] loss=1.0563 c=0.2592 r=0.6581 | si=0.1391 | CI_T0=0.01% | CI_T1=26.68% | CI_T2=96.27%
2026-02-11 17:57:30,766 - INFO - [Task 2 | ep 1 | step 150] loss=1.1209 c=0.2385 r=0.7416 | si=0.1407 | CI_T0=0.00% | CI_T1=17.32% | CI_T2=95.47%
2026-02-11 17:57:46,835 - INFO - [Task 2 | ep 2 | step 175] loss=1.0027 c=0.2473 r=0.6172 | si=0.1383 | CI_T0=0.00% | CI_T1=27.60% | CI_T2=96.96%
2026-02-11 17:57:59,442 - INFO - [Task 2 | ep 2 | step 200] loss=1.0528 c=0.2769 r=0.6388 | si=0.1371 | CI_T0=0.00% | CI_T1=30.21% | CI_T2=94.67%
2026-02-11 17:58:12,003 - INFO - [Task 2 | ep 2 | step 225] loss=1.1220 c=0.2531 r=0.7236 | si=0.1453 | CI_T0=0.00% | CI_T1=24.29% | CI_T2=97.61%
2026-02-11 17:58:24,599 - INFO - [Task 2 | ep 2 | step 250] loss=0.8681 c=0.2234 r=0.4952 | si=0.1495 | CI_T0=0.00% | CI_T1=20.10% | CI_T2=98.74%
2026-02-11 17:58:40,683 - INFO - [Task 2 | ep 3 | step 275] loss=0.8977 c=0.1946 r=0.5542 | si=0.1489 | CI_T0=0.00% | CI_T1=21.91% | CI_T2=98.46%
2026-02-11 17:58:53,148 - INFO - [Task 2 | ep 3 | step 300] loss=1.0312 c=0.1994 r=0.6871 | si=0.1446 | CI_T0=0.07% | CI_T1=30.09% | CI_T2=96.43%
2026-02-11 17:59:05,684 - INFO - [Task 2 | ep 3 | step 325] loss=1.2194 c=0.2372 r=0.8242 | si=0.1580 | CI_T0=0.00% | CI_T1=12.03% | CI_T2=83.91%
2026-02-11 17:59:06,553 - INFO - SI: stored omega for task 2
2026-02-11 17:59:18,731 - INFO - [After Task 2] Task-IL : T0=99.95% | T1=97.45% | T2=98.72% | Avg=98.71%
2026-02-11 17:59:18,731 - INFO - [After Task 2] Class-IL: T0=0.00% | T1=15.23% | T2=97.92% | Avg=37.72%
2026-02-11 17:59:18,731 - INFO - ========== GROUP DIFFERENCES ==========
2026-02-11 17:59:18,731 - INFO - Seen tasks: 0..2 | valid_out_dim=6
2026-02-11 17:59:20,770 - INFO - [Group=Task0] CI_acc=0.00% | corr_slice_max=5.030 | best_other_max=6.787 | gap=-1.758
2026-02-11 17:59:20,770 - INFO - [Group=Task0] winner_task_dist: W0=0.0% | W1=10.7% | W2=89.3%
2026-02-11 17:59:20,770 - INFO - [Group=Task0] slice_strength : S0=5.03 | S1=6.08 | S2=6.76
2026-02-11 17:59:22,812 - INFO - [Group=Task1] CI_acc=15.23% | corr_slice_max=6.572 | best_other_max=7.719 | gap=-1.147
2026-02-11 17:59:22,812 - INFO - [Group=Task1] winner_task_dist: W0=0.0% | W1=15.2% | W2=84.8%
2026-02-11 17:59:22,812 - INFO - [Group=Task1] slice_strength : S0=3.64 | S1=6.57 | S2=7.72
2026-02-11 17:59:24,847 - INFO - [Group=Task2] CI_acc=97.92% | corr_slice_max=8.435 | best_other_max=6.060 | gap=2.375
2026-02-11 17:59:24,847 - INFO - [Group=Task2] winner_task_dist: W0=0.0% | W1=1.0% | W2=99.0%
2026-02-11 17:59:24,847 - INFO - [Group=Task2] slice_strength : S0=3.66 | S1=6.06 | S2=8.44
2026-02-11 17:59:24,847 - INFO - ======================================
2026-02-11 17:59:24,847 - INFO - ========== Training Task 3: classes [6, 7] ==========
2026-02-11 17:59:43,979 - INFO - [Task 3 | ep 0 | step 0] loss=9.4073 c=8.2484 r=0.9951 | si=0.1638 | CI_T0=0.00% | CI_T1=23.50% | CI_T2=97.93% | CI_T3=0.00%
2026-02-11 18:00:00,619 - INFO - [Task 3 | ep 0 | step 25] loss=1.8173 c=0.3933 r=1.1518 | si=0.2721 | CI_T0=0.00% | CI_T1=17.04% | CI_T2=36.69% | CI_T3=96.85%
2026-02-11 18:00:17,342 - INFO - [Task 3 | ep 0 | step 50] loss=1.6834 c=0.3486 r=1.0573 | si=0.2775 | CI_T0=0.07% | CI_T1=11.21% | CI_T2=74.23% | CI_T3=94.28%
2026-02-11 18:00:34,024 - INFO - [Task 3 | ep 0 | step 75] loss=1.2375 c=0.2964 r=0.6763 | si=0.2648 | CI_T0=0.00% | CI_T1=3.73% | CI_T2=73.30% | CI_T3=90.52%
2026-02-11 18:00:54,201 - INFO - [Task 3 | ep 1 | step 100] loss=1.2179 c=0.2725 r=0.6787 | si=0.2668 | CI_T0=0.00% | CI_T1=5.35% | CI_T2=79.37% | CI_T3=95.80%
2026-02-11 18:01:10,903 - INFO - [Task 3 | ep 1 | step 125] loss=1.1713 c=0.3264 r=0.5870 | si=0.2580 | CI_T0=0.00% | CI_T1=12.63% | CI_T2=72.08% | CI_T3=89.13%
2026-02-11 18:01:27,776 - INFO - [Task 3 | ep 1 | step 150] loss=1.2013 c=0.2999 r=0.6442 | si=0.2572 | CI_T0=0.00% | CI_T1=12.23% | CI_T2=72.64% | CI_T3=94.84%
2026-02-11 18:01:44,465 - INFO - [Task 3 | ep 1 | step 175] loss=1.3309 c=0.2575 r=0.8200 | si=0.2534 | CI_T0=0.00% | CI_T1=11.38% | CI_T2=68.10% | CI_T3=94.83%
2026-02-11 18:02:04,752 - INFO - [Task 3 | ep 2 | step 200] loss=1.3146 c=0.2474 r=0.8140 | si=0.2532 | CI_T0=0.00% | CI_T1=6.84% | CI_T2=72.86% | CI_T3=95.33%
2026-02-11 18:02:21,377 - INFO - [Task 3 | ep 2 | step 225] loss=1.0860 c=0.2244 r=0.6054 | si=0.2562 | CI_T0=0.02% | CI_T1=11.11% | CI_T2=56.62% | CI_T3=98.84%
2026-02-11 18:02:38,039 - INFO - [Task 3 | ep 2 | step 250] loss=1.2019 c=0.2515 r=0.6943 | si=0.2561 | CI_T0=0.00% | CI_T1=4.06% | CI_T2=68.08% | CI_T3=98.03%
2026-02-11 18:02:54,578 - INFO - [Task 3 | ep 2 | step 275] loss=1.2809 c=0.1898 r=0.8405 | si=0.2507 | CI_T0=0.00% | CI_T1=3.59% | CI_T2=53.95% | CI_T3=99.40%
2026-02-11 18:03:14,679 - INFO - [Task 3 | ep 3 | step 300] loss=1.3113 c=0.2202 r=0.8497 | si=0.2414 | CI_T0=0.01% | CI_T1=2.64% | CI_T2=55.97% | CI_T3=99.41%
2026-02-11 18:03:31,207 - INFO - [Task 3 | ep 3 | step 325] loss=1.1596 c=0.2340 r=0.6782 | si=0.2473 | CI_T0=0.06% | CI_T1=13.68% | CI_T2=70.13% | CI_T3=95.51%
2026-02-11 18:03:47,920 - INFO - [Task 3 | ep 3 | step 350] loss=1.3753 c=0.2428 r=0.8843 | si=0.2482 | CI_T0=0.00% | CI_T1=2.99% | CI_T2=53.04% | CI_T3=99.54%
2026-02-11 18:04:04,700 - INFO - [Task 3 | ep 3 | step 375] loss=1.1497 c=0.1914 r=0.7104 | si=0.2479 | CI_T0=0.00% | CI_T1=4.74% | CI_T2=59.20% | CI_T3=99.08%
2026-02-11 18:04:05,118 - INFO - SI: stored omega for task 3
2026-02-11 18:04:21,369 - INFO - [After Task 3] Task-IL : T0=99.95% | T1=96.91% | T2=98.83% | T3=99.65% | Avg=98.84%
2026-02-11 18:04:21,369 - INFO - [After Task 3] Class-IL: T0=0.00% | T1=8.52% | T2=72.95% | T3=96.32% | Avg=44.45%
2026-02-11 18:04:21,369 - INFO - ========== GROUP DIFFERENCES ==========
2026-02-11 18:04:21,369 - INFO - Seen tasks: 0..3 | valid_out_dim=8
2026-02-11 18:04:23,394 - INFO - [Group=Task0] CI_acc=0.00% | corr_slice_max=4.847 | best_other_max=7.768 | gap=-2.921
2026-02-11 18:04:23,395 - INFO - [Group=Task0] winner_task_dist: W0=0.0% | W1=2.4% | W2=10.5% | W3=87.0%
2026-02-11 18:04:23,395 - INFO - [Group=Task0] slice_strength : S0=4.85 | S1=6.45 | S2=6.76 | S3=7.71
2026-02-11 18:04:25,425 - INFO - [Group=Task1] CI_acc=8.52% | corr_slice_max=6.722 | best_other_max=8.262 | gap=-1.540
2026-02-11 18:04:25,425 - INFO - [Group=Task1] winner_task_dist: W0=0.0% | W1=8.5% | W2=44.8% | W3=46.7%
2026-02-11 18:04:25,425 - INFO - [Group=Task1] slice_strength : S0=3.34 | S1=6.72 | S2=7.53 | S3=7.59
2026-02-11 18:04:27,441 - INFO - [Group=Task2] CI_acc=72.95% | corr_slice_max=8.257 | best_other_max=7.562 | gap=0.695
2026-02-11 18:04:27,441 - INFO - [Group=Task2] winner_task_dist: W0=0.0% | W1=0.4% | W2=73.1% | W3=26.6%
2026-02-11 18:04:27,441 - INFO - [Group=Task2] slice_strength : S0=3.46 | S1=6.25 | S2=8.26 | S3=7.46
2026-02-11 18:04:29,473 - INFO - [Group=Task3] CI_acc=96.32% | corr_slice_max=9.280 | best_other_max=7.523 | gap=1.758
2026-02-11 18:04:29,473 - INFO - [Group=Task3] winner_task_dist: W0=0.0% | W1=0.4% | W2=3.1% | W3=96.5%
2026-02-11 18:04:29,473 - INFO - [Group=Task3] slice_strength : S0=3.44 | S1=6.28 | S2=7.45 | S3=9.28
2026-02-11 18:04:29,473 - INFO - ======================================
2026-02-11 18:04:29,474 - INFO - ========== Training Task 4: classes [8, 9] ==========
2026-02-11 18:04:52,537 - INFO - [Task 4 | ep 0 | step 0] loss=11.6818 c=8.9074 r=2.5264 | si=0.2480 | CI_T0=0.00% | CI_T1=8.74% | CI_T2=76.45% | CI_T3=90.12% | CI_T4=0.00%
2026-02-11 18:05:13,258 - INFO - [Task 4 | ep 0 | step 25] loss=2.1842 c=0.5643 r=1.1861 | si=0.4338 | CI_T0=0.00% | CI_T1=0.46% | CI_T2=4.09% | CI_T3=18.48% | CI_T4=74.47%
2026-02-11 18:05:34,072 - INFO - [Task 4 | ep 0 | step 50] loss=1.7488 c=0.5188 r=0.8046 | si=0.4254 | CI_T0=0.00% | CI_T1=3.47% | CI_T2=15.00% | CI_T3=42.28% | CI_T4=90.72%
2026-02-11 18:05:54,860 - INFO - [Task 4 | ep 0 | step 75] loss=1.7955 c=0.6112 r=0.7812 | si=0.4032 | CI_T0=0.00% | CI_T1=0.42% | CI_T2=12.82% | CI_T3=45.28% | CI_T4=89.93%
2026-02-11 18:06:19,211 - INFO - [Task 4 | ep 1 | step 100] loss=1.6160 c=0.4572 r=0.7662 | si=0.3925 | CI_T0=0.00% | CI_T1=0.32% | CI_T2=11.55% | CI_T3=38.29% | CI_T4=93.85%
2026-02-11 18:06:40,128 - INFO - [Task 4 | ep 1 | step 125] loss=2.0744 c=0.5218 r=1.1542 | si=0.3985 | CI_T0=0.00% | CI_T1=1.06% | CI_T2=8.53% | CI_T3=33.09% | CI_T4=92.27%
2026-02-11 18:07:00,928 - INFO - [Task 4 | ep 1 | step 150] loss=1.5688 c=0.4267 r=0.7439 | si=0.3982 | CI_T0=0.00% | CI_T1=0.12% | CI_T2=11.13% | CI_T3=36.66% | CI_T4=94.75%
2026-02-11 18:07:21,640 - INFO - [Task 4 | ep 1 | step 175] loss=1.4732 c=0.4401 r=0.6420 | si=0.3911 | CI_T0=0.00% | CI_T1=0.11% | CI_T2=10.68% | CI_T3=30.20% | CI_T4=94.51%
2026-02-11 18:07:45,984 - INFO - [Task 4 | ep 2 | step 200] loss=1.5931 c=0.3820 r=0.8257 | si=0.3854 | CI_T0=0.00% | CI_T1=0.33% | CI_T2=14.19% | CI_T3=38.09% | CI_T4=94.80%
2026-02-11 18:08:06,821 - INFO - [Task 4 | ep 2 | step 225] loss=1.5297 c=0.3937 r=0.7456 | si=0.3904 | CI_T0=0.00% | CI_T1=0.27% | CI_T2=6.87% | CI_T3=28.39% | CI_T4=96.08%
2026-02-11 18:08:27,634 - INFO - [Task 4 | ep 2 | step 250] loss=1.3895 c=0.3528 r=0.6388 | si=0.3979 | CI_T0=0.00% | CI_T1=0.10% | CI_T2=10.87% | CI_T3=41.74% | CI_T4=96.40%
2026-02-11 18:08:48,375 - INFO - [Task 4 | ep 2 | step 275] loss=1.5845 c=0.3664 r=0.8248 | si=0.3933 | CI_T0=0.00% | CI_T1=0.02% | CI_T2=14.76% | CI_T3=43.13% | CI_T4=96.23%
2026-02-11 18:09:12,585 - INFO - [Task 4 | ep 3 | step 300] loss=1.6246 c=0.3737 r=0.8626 | si=0.3882 | CI_T0=0.00% | CI_T1=0.13% | CI_T2=16.31% | CI_T3=39.59% | CI_T4=95.88%
2026-02-11 18:09:33,202 - INFO - [Task 4 | ep 3 | step 325] loss=1.4614 c=0.3916 r=0.6864 | si=0.3834 | CI_T0=0.00% | CI_T1=0.03% | CI_T2=17.26% | CI_T3=36.77% | CI_T4=93.59%
2026-02-11 18:09:53,910 - INFO - [Task 4 | ep 3 | step 350] loss=1.5921 c=0.3441 r=0.8593 | si=0.3887 | CI_T0=0.00% | CI_T1=0.01% | CI_T2=14.74% | CI_T3=21.19% | CI_T4=96.79%
2026-02-11 18:09:54,864 - INFO - SI: stored omega for task 4
2026-02-11 18:10:15,164 - INFO - [After Task 4] Task-IL : T0=99.95% | T1=97.85% | T2=98.67% | T3=99.50% | T4=97.63% | Avg=98.72%
2026-02-11 18:10:15,164 - INFO - [After Task 4] Class-IL: T0=0.05% | T1=0.39% | T2=16.33% | T3=36.35% | T4=95.06% | Avg=29.64%
2026-02-11 18:10:15,164 - INFO - ========== GROUP DIFFERENCES ==========
2026-02-11 18:10:15,164 - INFO - Seen tasks: 0..4 | valid_out_dim=10
2026-02-11 18:10:17,204 - INFO - [Group=Task0] CI_acc=0.05% | corr_slice_max=5.062 | best_other_max=8.253 | gap=-3.191
2026-02-11 18:10:17,205 - INFO - [Group=Task0] winner_task_dist: W0=0.0% | W1=0.0% | W2=0.6% | W3=15.0% | W4=84.3%
2026-02-11 18:10:17,205 - INFO - [Group=Task0] slice_strength : S0=5.06 | S1=6.25 | S2=6.47 | S3=7.18 | S4=8.19
2026-02-11 18:10:19,229 - INFO - [Group=Task1] CI_acc=0.39% | corr_slice_max=6.642 | best_other_max=8.872 | gap=-2.230
2026-02-11 18:10:19,229 - INFO - [Group=Task1] winner_task_dist: W0=0.0% | W1=0.4% | W2=8.6% | W3=17.2% | W4=73.8%
2026-02-11 18:10:19,229 - INFO - [Group=Task1] slice_strength : S0=3.59 | S1=6.64 | S2=7.24 | S3=7.32 | S4=8.67
2026-02-11 18:10:21,260 - INFO - [Group=Task2] CI_acc=16.33% | corr_slice_max=8.064 | best_other_max=9.042 | gap=-0.977
2026-02-11 18:10:21,260 - INFO - [Group=Task2] winner_task_dist: W0=0.0% | W1=0.1% | W2=16.3% | W3=2.8% | W4=80.8%
2026-02-11 18:10:21,260 - INFO - [Group=Task2] slice_strength : S0=3.84 | S1=6.28 | S2=8.06 | S3=7.25 | S4=9.01
2026-02-11 18:10:23,288 - INFO - [Group=Task3] CI_acc=36.35% | corr_slice_max=8.488 | best_other_max=8.849 | gap=-0.361
2026-02-11 18:10:23,288 - INFO - [Group=Task3] winner_task_dist: W0=0.0% | W1=0.0% | W2=4.1% | W3=36.4% | W4=59.5%
2026-02-11 18:10:23,288 - INFO - [Group=Task3] slice_strength : S0=3.86 | S1=6.04 | S2=7.23 | S3=8.49 | S4=8.65
2026-02-11 18:10:25,311 - INFO - [Group=Task4] CI_acc=95.06% | corr_slice_max=9.569 | best_other_max=8.008 | gap=1.561
2026-02-11 18:10:25,311 - INFO - [Group=Task4] winner_task_dist: W0=0.0% | W1=0.1% | W2=0.8% | W3=2.5% | W4=96.6%
2026-02-11 18:10:25,311 - INFO - [Group=Task4] slice_strength : S0=3.71 | S1=6.25 | S2=7.30 | S3=7.71 | S4=9.57
2026-02-11 18:10:25,311 - INFO - ======================================
2026-02-11 18:10:25,311 - INFO - ========== FINAL METRICS (Class-IL) ==========
2026-02-11 18:10:25,311 - INFO - Forgetting per task: T0=99.91%, T1=96.96%, T2=81.59%, T3=59.97%, T4=0.00%
2026-02-11 18:10:25,311 - INFO - BWT: -84.61%
2026-02-11 18:10:25,311 - INFO - Final average Class-IL accuracy: 29.64%
