2026-02-12 08:23:11,552 - INFO - Device: cpu
2026-02-12 08:23:11,552 - INFO - Config: {'device': 'cpu', 'lr': 0.005, 'epochs_per_task': 4, 'batch_size': 128, 'lambda_slice': 2.0, 'lambda_feat': 0.5, 'vae_epochs': 5, 'vae_n_fake_per_task': 32, 'lambda_rev': 0.5}
2026-02-12 08:23:11,554 - INFO - ========== Task 0: classes [0, 1] ==========
2026-02-12 08:23:38,514 - INFO - [Task 0 | ep 0 | step 0] loss=0.8023 c=0.8023 r=0.0000 rev=0.0000 | CI_T0=97.84%
2026-02-12 08:23:42,517 - INFO - [Task 0 | ep 0 | step 25] loss=0.0324 c=0.0324 r=0.0000 rev=0.0000 | CI_T0=99.87%
2026-02-12 08:23:46,540 - INFO - [Task 0 | ep 0 | step 50] loss=0.0017 c=0.0017 r=0.0000 rev=0.0000 | CI_T0=99.84%
2026-02-12 08:23:50,571 - INFO - [Task 0 | ep 0 | step 75] loss=0.0007 c=0.0007 r=0.0000 rev=0.0000 | CI_T0=99.94%
2026-02-12 08:23:58,137 - INFO - [Task 0 | ep 1 | step 100] loss=0.0008 c=0.0008 r=0.0000 rev=0.0000 | CI_T0=99.97%
2026-02-12 08:24:02,141 - INFO - [Task 0 | ep 1 | step 125] loss=0.0002 c=0.0002 r=0.0000 rev=0.0000 | CI_T0=99.96%
2026-02-12 08:24:06,149 - INFO - [Task 0 | ep 1 | step 150] loss=0.0087 c=0.0087 r=0.0000 rev=0.0000 | CI_T0=99.96%
2026-02-12 08:24:10,154 - INFO - [Task 0 | ep 1 | step 175] loss=0.0002 c=0.0002 r=0.0000 rev=0.0000 | CI_T0=99.98%
2026-02-12 08:24:17,669 - INFO - [Task 0 | ep 2 | step 200] loss=0.0002 c=0.0002 r=0.0000 rev=0.0000 | CI_T0=99.82%
2026-02-12 08:24:21,669 - INFO - [Task 0 | ep 2 | step 225] loss=0.0004 c=0.0004 r=0.0000 rev=0.0000 | CI_T0=99.98%
2026-02-12 08:24:25,687 - INFO - [Task 0 | ep 2 | step 250] loss=0.0001 c=0.0001 r=0.0000 rev=0.0000 | CI_T0=99.95%
2026-02-12 08:24:29,682 - INFO - [Task 0 | ep 2 | step 275] loss=0.0002 c=0.0002 r=0.0000 rev=0.0000 | CI_T0=99.94%
2026-02-12 08:24:37,171 - INFO - [Task 0 | ep 3 | step 300] loss=0.0003 c=0.0003 r=0.0000 rev=0.0000 | CI_T0=99.97%
2026-02-12 08:24:41,155 - INFO - [Task 0 | ep 3 | step 325] loss=0.0001 c=0.0001 r=0.0000 rev=0.0000 | CI_T0=99.98%
2026-02-12 08:24:45,140 - INFO - [Task 0 | ep 3 | step 350] loss=0.0001 c=0.0001 r=0.0000 rev=0.0000 | CI_T0=99.90%
2026-02-12 08:24:49,104 - INFO - [Task 0 | ep 3 | step 375] loss=0.0108 c=0.0108 r=0.0000 rev=0.0000 | CI_T0=99.79%
2026-02-12 08:24:53,495 - INFO - [After Task 0] Task-IL : T0=99.91% | Avg=99.91%
2026-02-12 08:24:53,495 - INFO - [After Task 0] Class-IL: T0=99.91% | Avg=99.91%
2026-02-12 08:24:53,495 - INFO - ========== GROUP DIFFERENCES ==========
2026-02-12 08:24:53,495 - INFO - Seen tasks: 0..0 | valid_out_dim=2
2026-02-12 08:24:55,487 - INFO - [Group=Task0] CI_acc=99.91% | corr_slice_max=5.066 | best_other_max=nan | gap=nan
2026-02-12 08:24:55,487 - INFO - [Group=Task0] winner_task_dist: W0=100.0%
2026-02-12 08:24:55,487 - INFO - [Group=Task0] slice_strength : S0=5.07
2026-02-12 08:24:55,487 - INFO - ======================================
2026-02-12 08:24:55,487 - INFO - ========== Task 1: classes [2, 3] ==========
2026-02-12 08:25:26,538 - INFO - [Task 1 | ep 0 | step 0] loss=7.3017 c=4.3643 r=2.9374 rev=0.0000 | CI_T0=99.81% | CI_T1=2.62%
2026-02-12 08:25:34,512 - INFO - [Task 1 | ep 0 | step 25] loss=1.3042 c=0.2666 r=1.0374 rev=0.0001 | CI_T0=17.67% | CI_T1=96.66%
2026-02-12 08:25:42,465 - INFO - [Task 1 | ep 0 | step 50] loss=1.1676 c=0.1211 r=1.0463 rev=0.0002 | CI_T0=0.79% | CI_T1=97.74%
2026-02-12 08:25:50,505 - INFO - [Task 1 | ep 0 | step 75] loss=0.7827 c=0.1015 r=0.6811 rev=0.0001 | CI_T0=0.67% | CI_T1=97.91%
2026-02-12 08:26:02,066 - INFO - [Task 1 | ep 1 | step 100] loss=0.7757 c=0.1049 r=0.6707 rev=0.0001 | CI_T0=3.44% | CI_T1=98.12%
2026-02-12 08:26:10,063 - INFO - [Task 1 | ep 1 | step 125] loss=0.7987 c=0.1010 r=0.6976 rev=0.0001 | CI_T0=2.18% | CI_T1=98.33%
2026-02-12 08:26:18,099 - INFO - [Task 1 | ep 1 | step 150] loss=1.5311 c=0.1046 r=1.4264 rev=0.0001 | CI_T0=0.64% | CI_T1=98.58%
2026-02-12 08:26:26,108 - INFO - [Task 1 | ep 1 | step 175] loss=0.7748 c=0.0874 r=0.6874 rev=0.0001 | CI_T0=2.10% | CI_T1=98.63%
2026-02-12 08:26:37,607 - INFO - [Task 1 | ep 2 | step 200] loss=0.9460 c=0.0889 r=0.8570 rev=0.0001 | CI_T0=0.33% | CI_T1=98.47%
2026-02-12 08:26:45,524 - INFO - [Task 1 | ep 2 | step 225] loss=0.7953 c=0.1054 r=0.6899 rev=0.0001 | CI_T0=0.06% | CI_T1=98.75%
2026-02-12 08:26:53,458 - INFO - [Task 1 | ep 2 | step 250] loss=0.6875 c=0.0617 r=0.6256 rev=0.0001 | CI_T0=3.16% | CI_T1=98.84%
2026-02-12 08:27:01,411 - INFO - [Task 1 | ep 2 | step 275] loss=0.8651 c=0.0884 r=0.7766 rev=0.0001 | CI_T0=0.11% | CI_T1=99.07%
2026-02-12 08:27:12,881 - INFO - [Task 1 | ep 3 | step 300] loss=0.6860 c=0.0981 r=0.5878 rev=0.0001 | CI_T0=1.17% | CI_T1=99.01%
2026-02-12 08:27:20,841 - INFO - [Task 1 | ep 3 | step 325] loss=0.6926 c=0.0861 r=0.6064 rev=0.0001 | CI_T0=3.94% | CI_T1=98.69%
2026-02-12 08:27:28,812 - INFO - [Task 1 | ep 3 | step 350] loss=0.9959 c=0.0960 r=0.8997 rev=0.0001 | CI_T0=0.90% | CI_T1=99.19%
2026-02-12 08:27:36,788 - INFO - [Task 1 | ep 3 | step 375] loss=0.5531 c=0.0650 r=0.4879 rev=0.0001 | CI_T0=6.61% | CI_T1=99.05%
2026-02-12 08:27:45,055 - INFO - [After Task 1] Task-IL : T0=99.91% | T1=98.82% | Avg=99.37%
2026-02-12 08:27:45,055 - INFO - [After Task 1] Class-IL: T0=6.00% | T1=98.82% | Avg=52.41%
2026-02-12 08:27:45,055 - INFO - ========== GROUP DIFFERENCES ==========
2026-02-12 08:27:45,055 - INFO - Seen tasks: 0..1 | valid_out_dim=4
2026-02-12 08:27:47,066 - INFO - [Group=Task0] CI_acc=6.00% | corr_slice_max=4.754 | best_other_max=6.437 | gap=-1.683
2026-02-12 08:27:47,066 - INFO - [Group=Task0] winner_task_dist: W0=6.0% | W1=94.0%
2026-02-12 08:27:47,066 - INFO - [Group=Task0] slice_strength : S0=4.75 | S1=6.44
2026-02-12 08:27:49,083 - INFO - [Group=Task1] CI_acc=98.82% | corr_slice_max=7.566 | best_other_max=2.489 | gap=5.077
2026-02-12 08:27:49,083 - INFO - [Group=Task1] winner_task_dist: W0=0.0% | W1=100.0%
2026-02-12 08:27:49,083 - INFO - [Group=Task1] slice_strength : S0=2.49 | S1=7.57
2026-02-12 08:27:49,083 - INFO - ======================================
2026-02-12 08:27:49,083 - INFO - ========== Task 2: classes [4, 5] ==========
2026-02-12 08:28:23,726 - INFO - [Task 2 | ep 0 | step 0] loss=11.3654 c=6.8802 r=4.4847 rev=0.0006 | CI_T0=14.51% | CI_T1=98.78% | CI_T2=0.00%
2026-02-12 08:28:35,658 - INFO - [Task 2 | ep 0 | step 25] loss=1.6850 c=0.3600 r=1.3098 rev=0.0153 | CI_T0=5.25% | CI_T1=27.25% | CI_T2=92.52%
2026-02-12 08:28:47,654 - INFO - [Task 2 | ep 0 | step 50] loss=1.2315 c=0.2415 r=0.9891 rev=0.0009 | CI_T0=3.56% | CI_T1=22.65% | CI_T2=95.35%
2026-02-12 08:28:59,591 - INFO - [Task 2 | ep 0 | step 75] loss=1.1712 c=0.2574 r=0.9136 rev=0.0003 | CI_T0=10.95% | CI_T1=25.59% | CI_T2=95.94%
2026-02-12 08:29:15,031 - INFO - [Task 2 | ep 1 | step 100] loss=1.0854 c=0.2095 r=0.8757 rev=0.0003 | CI_T0=2.94% | CI_T1=24.04% | CI_T2=97.08%
2026-02-12 08:29:27,011 - INFO - [Task 2 | ep 1 | step 125] loss=0.7625 c=0.1423 r=0.6184 rev=0.0019 | CI_T0=10.03% | CI_T1=26.60% | CI_T2=97.81%
2026-02-12 08:29:38,947 - INFO - [Task 2 | ep 1 | step 150] loss=0.8790 c=0.1327 r=0.7462 rev=0.0001 | CI_T0=9.61% | CI_T1=26.04% | CI_T2=98.12%
2026-02-12 08:29:54,485 - INFO - [Task 2 | ep 2 | step 175] loss=0.7062 c=0.1413 r=0.5636 rev=0.0013 | CI_T0=8.17% | CI_T1=24.78% | CI_T2=98.55%
2026-02-12 08:30:06,436 - INFO - [Task 2 | ep 2 | step 200] loss=0.6474 c=0.1190 r=0.5284 rev=0.0001 | CI_T0=15.35% | CI_T1=24.39% | CI_T2=98.85%
2026-02-12 08:30:18,417 - INFO - [Task 2 | ep 2 | step 225] loss=0.6684 c=0.1084 r=0.5599 rev=0.0001 | CI_T0=7.75% | CI_T1=24.53% | CI_T2=98.52%
2026-02-12 08:30:30,373 - INFO - [Task 2 | ep 2 | step 250] loss=0.7811 c=0.1184 r=0.6627 rev=0.0001 | CI_T0=4.26% | CI_T1=20.02% | CI_T2=98.89%
2026-02-12 08:30:45,835 - INFO - [Task 2 | ep 3 | step 275] loss=0.6184 c=0.0888 r=0.5295 rev=0.0001 | CI_T0=11.73% | CI_T1=23.73% | CI_T2=98.72%
2026-02-12 08:30:57,738 - INFO - [Task 2 | ep 3 | step 300] loss=0.7417 c=0.1149 r=0.6266 rev=0.0002 | CI_T0=3.77% | CI_T1=19.58% | CI_T2=98.93%
2026-02-12 08:31:09,621 - INFO - [Task 2 | ep 3 | step 325] loss=0.9181 c=0.1017 r=0.8162 rev=0.0002 | CI_T0=4.50% | CI_T1=18.48% | CI_T2=99.10%
2026-02-12 08:31:22,188 - INFO - [After Task 2] Task-IL : T0=99.29% | T1=96.67% | T2=99.36% | Avg=98.44%
2026-02-12 08:31:22,188 - INFO - [After Task 2] Class-IL: T0=4.54% | T1=17.97% | T2=99.04% | Avg=40.52%
2026-02-12 08:31:22,188 - INFO - ========== GROUP DIFFERENCES ==========
2026-02-12 08:31:22,188 - INFO - Seen tasks: 0..2 | valid_out_dim=6
2026-02-12 08:31:24,193 - INFO - [Group=Task0] CI_acc=4.54% | corr_slice_max=4.992 | best_other_max=7.005 | gap=-2.014
2026-02-12 08:31:24,193 - INFO - [Group=Task0] winner_task_dist: W0=4.5% | W1=33.4% | W2=62.1%
2026-02-12 08:31:24,193 - INFO - [Group=Task0] slice_strength : S0=4.99 | S1=6.13 | S2=6.75
2026-02-12 08:31:26,211 - INFO - [Group=Task1] CI_acc=17.97% | corr_slice_max=7.038 | best_other_max=8.622 | gap=-1.584
2026-02-12 08:31:26,211 - INFO - [Group=Task1] winner_task_dist: W0=0.0% | W1=18.1% | W2=81.9%
2026-02-12 08:31:26,211 - INFO - [Group=Task1] slice_strength : S0=3.09 | S1=7.04 | S2=8.62
2026-02-12 08:31:28,217 - INFO - [Group=Task2] CI_acc=99.04% | corr_slice_max=9.541 | best_other_max=6.223 | gap=3.318
2026-02-12 08:31:28,217 - INFO - [Group=Task2] winner_task_dist: W0=0.0% | W1=0.4% | W2=99.6%
2026-02-12 08:31:28,217 - INFO - [Group=Task2] slice_strength : S0=4.04 | S1=6.22 | S2=9.54
2026-02-12 08:31:28,217 - INFO - ======================================
2026-02-12 08:31:28,217 - INFO - ========== Task 3: classes [6, 7] ==========
2026-02-12 08:32:07,062 - INFO - [Task 3 | ep 0 | step 0] loss=11.1833 c=8.7028 r=2.4804 rev=0.0001 | CI_T0=3.79% | CI_T1=15.98% | CI_T2=98.78% | CI_T3=0.00%
2026-02-12 08:32:23,081 - INFO - [Task 3 | ep 0 | step 25] loss=2.0400 c=0.2916 r=1.7468 rev=0.0015 | CI_T0=31.74% | CI_T1=22.12% | CI_T2=54.95% | CI_T3=97.79%
2026-02-12 08:32:39,104 - INFO - [Task 3 | ep 0 | step 50] loss=1.5286 c=0.3226 r=1.2056 rev=0.0004 | CI_T0=0.38% | CI_T1=25.01% | CI_T2=67.75% | CI_T3=97.52%
2026-02-12 08:32:55,094 - INFO - [Task 3 | ep 0 | step 75] loss=1.1949 c=0.2326 r=0.9613 rev=0.0009 | CI_T0=1.64% | CI_T1=22.64% | CI_T2=67.24% | CI_T3=98.62%
2026-02-12 08:33:14,806 - INFO - [Task 3 | ep 1 | step 100] loss=1.1882 c=0.2546 r=0.9329 rev=0.0008 | CI_T0=1.72% | CI_T1=23.84% | CI_T2=67.73% | CI_T3=98.94%
2026-02-12 08:33:30,653 - INFO - [Task 3 | ep 1 | step 125] loss=1.1723 c=0.2412 r=0.9309 rev=0.0002 | CI_T0=1.75% | CI_T1=19.24% | CI_T2=69.49% | CI_T3=98.92%
2026-02-12 08:33:46,488 - INFO - [Task 3 | ep 1 | step 150] loss=0.9662 c=0.2597 r=0.7057 rev=0.0008 | CI_T0=2.00% | CI_T1=21.70% | CI_T2=68.31% | CI_T3=99.10%
2026-02-12 08:34:02,394 - INFO - [Task 3 | ep 1 | step 175] loss=0.8050 c=0.1943 r=0.6105 rev=0.0002 | CI_T0=1.51% | CI_T1=18.41% | CI_T2=66.14% | CI_T3=99.32%
2026-02-12 08:34:21,690 - INFO - [Task 3 | ep 2 | step 200] loss=0.8220 c=0.2281 r=0.5933 rev=0.0005 | CI_T0=1.09% | CI_T1=17.50% | CI_T2=66.96% | CI_T3=99.41%
2026-02-12 08:34:37,602 - INFO - [Task 3 | ep 2 | step 225] loss=0.9345 c=0.1823 r=0.7522 rev=0.0001 | CI_T0=1.31% | CI_T1=17.23% | CI_T2=63.75% | CI_T3=99.61%
2026-02-12 08:34:53,308 - INFO - [Task 3 | ep 2 | step 250] loss=0.8106 c=0.2108 r=0.5997 rev=0.0001 | CI_T0=0.71% | CI_T1=18.51% | CI_T2=63.47% | CI_T3=99.58%
2026-02-12 08:35:09,193 - INFO - [Task 3 | ep 2 | step 275] loss=0.8334 c=0.1801 r=0.6531 rev=0.0002 | CI_T0=0.81% | CI_T1=13.80% | CI_T2=60.04% | CI_T3=99.77%
2026-02-12 08:35:28,626 - INFO - [Task 3 | ep 3 | step 300] loss=0.8058 c=0.1489 r=0.6566 rev=0.0003 | CI_T0=0.58% | CI_T1=15.13% | CI_T2=55.03% | CI_T3=99.70%
2026-02-12 08:35:44,456 - INFO - [Task 3 | ep 3 | step 325] loss=0.7344 c=0.1236 r=0.6108 rev=0.0000 | CI_T0=0.47% | CI_T1=10.80% | CI_T2=53.75% | CI_T3=99.79%
2026-02-12 08:36:00,373 - INFO - [Task 3 | ep 3 | step 350] loss=0.8009 c=0.1314 r=0.6695 rev=0.0000 | CI_T0=0.61% | CI_T1=13.74% | CI_T2=57.29% | CI_T3=99.81%
2026-02-12 08:36:16,246 - INFO - [Task 3 | ep 3 | step 375] loss=0.6296 c=0.1280 r=0.5015 rev=0.0001 | CI_T0=0.44% | CI_T1=14.28% | CI_T2=52.38% | CI_T3=99.83%
2026-02-12 08:36:32,662 - INFO - [After Task 3] Task-IL : T0=99.76% | T1=98.53% | T2=97.17% | T3=99.95% | Avg=98.85%
2026-02-12 08:36:32,662 - INFO - [After Task 3] Class-IL: T0=0.33% | T1=15.43% | T2=55.28% | T3=99.55% | Avg=42.65%
2026-02-12 08:36:32,662 - INFO - ========== GROUP DIFFERENCES ==========
2026-02-12 08:36:32,662 - INFO - Seen tasks: 0..3 | valid_out_dim=8
2026-02-12 08:36:34,680 - INFO - [Group=Task0] CI_acc=0.33% | corr_slice_max=5.373 | best_other_max=8.920 | gap=-3.547
2026-02-12 08:36:34,680 - INFO - [Group=Task0] winner_task_dist: W0=0.3% | W1=7.5% | W2=9.4% | W3=82.8%
2026-02-12 08:36:34,680 - INFO - [Group=Task0] slice_strength : S0=5.37 | S1=6.67 | S2=7.16 | S3=8.73
2026-02-12 08:36:36,693 - INFO - [Group=Task1] CI_acc=15.43% | corr_slice_max=7.444 | best_other_max=9.280 | gap=-1.836
2026-02-12 08:36:36,693 - INFO - [Group=Task1] winner_task_dist: W0=0.0% | W1=15.4% | W2=33.1% | W3=51.5%
2026-02-12 08:36:36,693 - INFO - [Group=Task1] slice_strength : S0=2.81 | S1=7.44 | S2=8.18 | S3=8.47
2026-02-12 08:36:38,698 - INFO - [Group=Task2] CI_acc=55.28% | corr_slice_max=9.311 | best_other_max=9.006 | gap=0.305
2026-02-12 08:36:38,698 - INFO - [Group=Task2] winner_task_dist: W0=0.0% | W1=0.4% | W2=55.3% | W3=44.3%
2026-02-12 08:36:38,698 - INFO - [Group=Task2] slice_strength : S0=3.64 | S1=6.23 | S2=9.31 | S3=8.78
2026-02-12 08:36:40,698 - INFO - [Group=Task3] CI_acc=99.55% | corr_slice_max=11.231 | best_other_max=8.702 | gap=2.529
2026-02-12 08:36:40,698 - INFO - [Group=Task3] winner_task_dist: W0=0.0% | W1=0.0% | W2=0.4% | W3=99.6%
2026-02-12 08:36:40,699 - INFO - [Group=Task3] slice_strength : S0=3.59 | S1=6.10 | S2=8.67 | S3=11.23
2026-02-12 08:36:40,699 - INFO - ======================================
2026-02-12 08:36:40,699 - INFO - ========== Task 4: classes [8, 9] ==========
2026-02-12 08:37:23,405 - INFO - [Task 4 | ep 0 | step 0] loss=12.8640 c=10.0275 r=2.8362 rev=0.0003 | CI_T0=1.40% | CI_T1=15.16% | CI_T2=59.93% | CI_T3=99.72% | CI_T4=0.00%
2026-02-12 08:37:43,333 - INFO - [Task 4 | ep 0 | step 25] loss=2.3501 c=0.3743 r=1.9698 rev=0.0059 | CI_T0=0.00% | CI_T1=19.38% | CI_T2=4.18% | CI_T3=15.24% | CI_T4=81.67%
2026-02-12 08:38:03,184 - INFO - [Task 4 | ep 0 | step 50] loss=1.5822 c=0.4988 r=1.0812 rev=0.0023 | CI_T0=0.00% | CI_T1=2.09% | CI_T2=21.85% | CI_T3=40.12% | CI_T4=82.91%
2026-02-12 08:38:23,081 - INFO - [Task 4 | ep 0 | step 75] loss=1.6062 c=0.4468 r=1.1569 rev=0.0025 | CI_T0=0.00% | CI_T1=3.03% | CI_T2=22.16% | CI_T3=44.76% | CI_T4=90.97%
2026-02-12 08:38:46,556 - INFO - [Task 4 | ep 1 | step 100] loss=1.2955 c=0.3864 r=0.9088 rev=0.0003 | CI_T0=0.00% | CI_T1=1.74% | CI_T2=25.73% | CI_T3=46.31% | CI_T4=91.75%
2026-02-12 08:39:06,313 - INFO - [Task 4 | ep 1 | step 125] loss=1.3903 c=0.3474 r=1.0419 rev=0.0010 | CI_T0=0.00% | CI_T1=2.07% | CI_T2=27.07% | CI_T3=42.94% | CI_T4=91.92%
2026-02-12 08:39:26,141 - INFO - [Task 4 | ep 1 | step 150] loss=1.2270 c=0.3575 r=0.8682 rev=0.0014 | CI_T0=0.00% | CI_T1=1.53% | CI_T2=23.37% | CI_T3=43.41% | CI_T4=92.82%
2026-02-12 08:39:45,990 - INFO - [Task 4 | ep 1 | step 175] loss=1.0602 c=0.3432 r=0.7161 rev=0.0009 | CI_T0=0.00% | CI_T1=1.45% | CI_T2=23.92% | CI_T3=43.22% | CI_T4=94.71%
2026-02-12 08:40:09,449 - INFO - [Task 4 | ep 2 | step 200] loss=1.0305 c=0.2565 r=0.7739 rev=0.0001 | CI_T0=0.00% | CI_T1=1.43% | CI_T2=22.67% | CI_T3=43.36% | CI_T4=94.90%
2026-02-12 08:40:29,203 - INFO - [Task 4 | ep 2 | step 225] loss=0.9974 c=0.3308 r=0.6662 rev=0.0004 | CI_T0=0.00% | CI_T1=0.68% | CI_T2=19.41% | CI_T3=41.04% | CI_T4=96.24%
2026-02-12 08:40:48,971 - INFO - [Task 4 | ep 2 | step 250] loss=1.1257 c=0.3029 r=0.8227 rev=0.0001 | CI_T0=0.00% | CI_T1=0.71% | CI_T2=15.70% | CI_T3=41.75% | CI_T4=94.51%
2026-02-12 08:41:08,646 - INFO - [Task 4 | ep 2 | step 275] loss=0.8932 c=0.2269 r=0.6660 rev=0.0002 | CI_T0=0.00% | CI_T1=0.94% | CI_T2=14.29% | CI_T3=40.39% | CI_T4=94.71%
2026-02-12 08:41:31,880 - INFO - [Task 4 | ep 3 | step 300] loss=0.7753 c=0.2160 r=0.5591 rev=0.0002 | CI_T0=0.00% | CI_T1=0.45% | CI_T2=15.51% | CI_T3=37.93% | CI_T4=96.85%
2026-02-12 08:41:51,784 - INFO - [Task 4 | ep 3 | step 325] loss=0.6846 c=0.1801 r=0.5043 rev=0.0001 | CI_T0=0.00% | CI_T1=0.57% | CI_T2=16.22% | CI_T3=35.62% | CI_T4=97.13%
2026-02-12 08:42:11,643 - INFO - [Task 4 | ep 3 | step 350] loss=0.7148 c=0.1932 r=0.5214 rev=0.0002 | CI_T0=0.00% | CI_T1=0.22% | CI_T2=12.47% | CI_T3=35.22% | CI_T4=96.41%
2026-02-12 08:42:32,192 - INFO - [After Task 4] Task-IL : T0=99.95% | T1=95.98% | T2=98.13% | T3=99.60% | T4=97.93% | Avg=98.32%
2026-02-12 08:42:32,192 - INFO - [After Task 4] Class-IL: T0=0.00% | T1=0.29% | T2=15.21% | T3=36.86% | T4=95.76% | Avg=29.62%
2026-02-12 08:42:32,192 - INFO - ========== GROUP DIFFERENCES ==========
2026-02-12 08:42:32,192 - INFO - Seen tasks: 0..4 | valid_out_dim=10
2026-02-12 08:42:34,208 - INFO - [Group=Task0] CI_acc=0.00% | corr_slice_max=5.517 | best_other_max=10.223 | gap=-4.706
2026-02-12 08:42:34,208 - INFO - [Group=Task0] winner_task_dist: W0=0.0% | W1=0.0% | W2=0.7% | W3=20.5% | W4=78.8%
2026-02-12 08:42:34,209 - INFO - [Group=Task0] slice_strength : S0=5.52 | S1=6.78 | S2=7.25 | S3=8.86 | S4=10.13
2026-02-12 08:42:36,210 - INFO - [Group=Task1] CI_acc=0.29% | corr_slice_max=7.447 | best_other_max=10.611 | gap=-3.164
2026-02-12 08:42:36,210 - INFO - [Group=Task1] winner_task_dist: W0=0.0% | W1=0.3% | W2=12.0% | W3=9.2% | W4=78.5%
2026-02-12 08:42:36,210 - INFO - [Group=Task1] slice_strength : S0=2.88 | S1=7.45 | S2=8.47 | S3=8.33 | S4=10.47
2026-02-12 08:42:38,216 - INFO - [Group=Task2] CI_acc=15.21% | corr_slice_max=9.477 | best_other_max=11.642 | gap=-2.166
2026-02-12 08:42:38,216 - INFO - [Group=Task2] winner_task_dist: W0=0.0% | W1=0.0% | W2=15.2% | W3=0.4% | W4=84.4%
2026-02-12 08:42:38,216 - INFO - [Group=Task2] slice_strength : S0=3.32 | S1=6.46 | S2=9.48 | S3=8.91 | S4=11.64
2026-02-12 08:42:40,221 - INFO - [Group=Task3] CI_acc=36.86% | corr_slice_max=10.866 | best_other_max=11.386 | gap=-0.519
2026-02-12 08:42:40,221 - INFO - [Group=Task3] winner_task_dist: W0=0.0% | W1=0.0% | W2=0.1% | W3=36.9% | W4=63.0%
2026-02-12 08:42:40,221 - INFO - [Group=Task3] slice_strength : S0=3.36 | S1=6.17 | S2=8.42 | S3=10.87 | S4=11.38
2026-02-12 08:42:42,234 - INFO - [Group=Task4] CI_acc=95.76% | corr_slice_max=12.357 | best_other_max=10.342 | gap=2.015
2026-02-12 08:42:42,234 - INFO - [Group=Task4] winner_task_dist: W0=0.0% | W1=0.0% | W2=0.2% | W3=3.1% | W4=96.7%
2026-02-12 08:42:42,234 - INFO - [Group=Task4] slice_strength : S0=3.19 | S1=6.71 | S2=8.80 | S3=10.03 | S4=12.36
2026-02-12 08:42:42,234 - INFO - ======================================
2026-02-12 08:42:42,234 - INFO - ========== FINAL METRICS (Class-IL) ==========
2026-02-12 08:42:42,234 - INFO - Forgetting per task: T0=99.91%, T1=98.53%, T2=83.83%, T3=62.69%, T4=0.00%
2026-02-12 08:42:42,234 - INFO - BWT: -86.24%
2026-02-12 08:42:42,234 - INFO - Final average Class-IL accuracy: 29.62%
