2026-02-12 20:05:48,778 - INFO - Device: cuda
2026-02-12 20:05:48,790 - INFO - Config: {'device': 'cuda', 'lr': 0.005, 'epochs_per_task': 4, 'batch_size': 128, 'lambda_slice': 2.0, 'lambda_feat': 0.5, 'vae_epochs': 5, 'vae_n_fake_per_task': 32, 'lambda_rev': 0.5, 'si_lambda': 1.0}
2026-02-12 20:05:48,879 - INFO - ========== Task 0: classes [0, 1] ==========
2026-02-12 20:06:18,550 - INFO - [Task 0 | ep 0 | step 0] loss=0.8324 c=0.8324 r=0.0000 rev=0.0000 | CI_T0=97.29%
2026-02-12 20:06:23,129 - INFO - [Task 0 | ep 0 | step 25] loss=0.0259 c=0.0259 r=0.0000 rev=0.0000 | CI_T0=99.84%
2026-02-12 20:06:27,604 - INFO - [Task 0 | ep 0 | step 50] loss=0.0077 c=0.0077 r=0.0000 rev=0.0000 | CI_T0=99.90%
2026-02-12 20:06:31,974 - INFO - [Task 0 | ep 0 | step 75] loss=0.0024 c=0.0024 r=0.0000 rev=0.0000 | CI_T0=99.82%
2026-02-12 20:06:40,384 - INFO - [Task 0 | ep 1 | step 100] loss=0.0005 c=0.0005 r=0.0000 rev=0.0000 | CI_T0=99.67%
2026-02-12 20:06:44,977 - INFO - [Task 0 | ep 1 | step 125] loss=0.0003 c=0.0003 r=0.0000 rev=0.0000 | CI_T0=99.95%
2026-02-12 20:06:49,488 - INFO - [Task 0 | ep 1 | step 150] loss=0.0003 c=0.0003 r=0.0000 rev=0.0000 | CI_T0=99.97%
2026-02-12 20:06:53,918 - INFO - [Task 0 | ep 1 | step 175] loss=0.0005 c=0.0005 r=0.0000 rev=0.0000 | CI_T0=99.91%
2026-02-12 20:07:02,175 - INFO - [Task 0 | ep 2 | step 200] loss=0.0007 c=0.0007 r=0.0000 rev=0.0000 | CI_T0=99.96%
2026-02-12 20:07:06,636 - INFO - [Task 0 | ep 2 | step 225] loss=0.0002 c=0.0002 r=0.0000 rev=0.0000 | CI_T0=99.97%
2026-02-12 20:07:11,170 - INFO - [Task 0 | ep 2 | step 250] loss=0.0001 c=0.0001 r=0.0000 rev=0.0000 | CI_T0=99.96%
2026-02-12 20:07:15,701 - INFO - [Task 0 | ep 2 | step 275] loss=0.0001 c=0.0001 r=0.0000 rev=0.0000 | CI_T0=99.98%
2026-02-12 20:07:24,169 - INFO - [Task 0 | ep 3 | step 300] loss=0.0003 c=0.0003 r=0.0000 rev=0.0000 | CI_T0=99.95%
2026-02-12 20:07:28,620 - INFO - [Task 0 | ep 3 | step 325] loss=0.0002 c=0.0002 r=0.0000 rev=0.0000 | CI_T0=99.96%
2026-02-12 20:07:33,096 - INFO - [Task 0 | ep 3 | step 350] loss=0.0001 c=0.0001 r=0.0000 rev=0.0000 | CI_T0=99.98%
2026-02-12 20:07:37,579 - INFO - [Task 0 | ep 3 | step 375] loss=0.0001 c=0.0001 r=0.0000 rev=0.0000 | CI_T0=99.98%
2026-02-12 20:07:42,406 - INFO - [After Task 0] Task-IL : T0=99.95% | Avg=99.95%
2026-02-12 20:07:42,407 - INFO - [After Task 0] Class-IL: T0=99.95% | Avg=99.95%
2026-02-12 20:07:42,407 - INFO - ========== GROUP DIFFERENCES ==========
2026-02-12 20:07:42,407 - INFO - Seen tasks: 0..0 | valid_out_dim=2
2026-02-12 20:07:44,602 - INFO - [Group=Task0] CI_acc=99.95% | corr_slice_max=5.002 | best_other_max=nan | gap=nan
2026-02-12 20:07:44,604 - INFO - [Group=Task0] winner_task_dist: W0=100.0%
2026-02-12 20:07:44,604 - INFO - [Group=Task0] slice_strength : S0=5.00
2026-02-12 20:07:44,604 - INFO - ======================================
2026-02-12 20:07:44,604 - INFO - ========== Task 1: classes [2, 3] ==========
2026-02-12 20:08:18,767 - INFO - [Task 1 | ep 0 | step 0] loss=7.3351 c=4.2377 r=3.0974 rev=0.0000 | CI_T0=99.98% | CI_T1=6.42%
2026-02-12 20:08:27,561 - INFO - [Task 1 | ep 0 | step 25] loss=1.2279 c=0.2104 r=1.0159 rev=0.0002 | si=0.0014 | CI_T0=3.11% | CI_T1=96.79%
2026-02-12 20:08:36,458 - INFO - [Task 1 | ep 0 | step 50] loss=0.9168 c=0.1124 r=0.8021 rev=0.0004 | si=0.0019 | CI_T0=0.02% | CI_T1=97.51%
2026-02-12 20:08:45,283 - INFO - [Task 1 | ep 0 | step 75] loss=1.0386 c=0.1197 r=0.9163 rev=0.0002 | si=0.0023 | CI_T0=0.02% | CI_T1=97.11%
2026-02-12 20:08:58,081 - INFO - [Task 1 | ep 1 | step 100] loss=0.9707 c=0.0918 r=0.8761 rev=0.0001 | si=0.0026 | CI_T0=0.00% | CI_T1=97.54%
2026-02-12 20:09:06,834 - INFO - [Task 1 | ep 1 | step 125] loss=0.7810 c=0.0896 r=0.6881 rev=0.0002 | si=0.0030 | CI_T0=0.01% | CI_T1=97.68%
2026-02-12 20:09:15,716 - INFO - [Task 1 | ep 1 | step 150] loss=0.9454 c=0.0812 r=0.8602 rev=0.0006 | si=0.0034 | CI_T0=1.14% | CI_T1=97.86%
2026-02-12 20:09:24,731 - INFO - [Task 1 | ep 1 | step 175] loss=1.1780 c=0.0707 r=1.1034 rev=0.0001 | si=0.0038 | CI_T0=0.07% | CI_T1=96.88%
2026-02-12 20:09:37,656 - INFO - [Task 1 | ep 2 | step 200] loss=0.8535 c=0.0733 r=0.7758 rev=0.0002 | si=0.0042 | CI_T0=0.04% | CI_T1=98.12%
2026-02-12 20:09:46,566 - INFO - [Task 1 | ep 2 | step 225] loss=0.8712 c=0.0835 r=0.7830 rev=0.0002 | si=0.0046 | CI_T0=0.14% | CI_T1=98.24%
2026-02-12 20:09:55,441 - INFO - [Task 1 | ep 2 | step 250] loss=0.6355 c=0.0903 r=0.5402 rev=0.0001 | si=0.0049 | CI_T0=0.02% | CI_T1=98.02%
2026-02-12 20:10:04,293 - INFO - [Task 1 | ep 2 | step 275] loss=1.0880 c=0.0903 r=0.9923 rev=0.0002 | si=0.0053 | CI_T0=0.00% | CI_T1=98.60%
2026-02-12 20:10:17,056 - INFO - [Task 1 | ep 3 | step 300] loss=0.6508 c=0.1075 r=0.5375 rev=0.0002 | si=0.0057 | CI_T0=0.00% | CI_T1=98.43%
2026-02-12 20:10:26,242 - INFO - [Task 1 | ep 3 | step 325] loss=0.8947 c=0.0633 r=0.8251 rev=0.0003 | si=0.0060 | CI_T0=0.00% | CI_T1=98.26%
2026-02-12 20:10:35,127 - INFO - [Task 1 | ep 3 | step 350] loss=0.6208 c=0.0764 r=0.5378 rev=0.0002 | si=0.0064 | CI_T0=0.09% | CI_T1=98.70%
2026-02-12 20:10:43,961 - INFO - [Task 1 | ep 3 | step 375] loss=0.8406 c=0.0733 r=0.7603 rev=0.0001 | si=0.0067 | CI_T0=0.18% | CI_T1=98.67%
2026-02-12 20:10:53,200 - INFO - [After Task 1] Task-IL : T0=99.91% | T1=98.48% | Avg=99.19%
2026-02-12 20:10:53,201 - INFO - [After Task 1] Class-IL: T0=0.14% | T1=98.48% | Avg=49.31%
2026-02-12 20:10:53,201 - INFO - ========== GROUP DIFFERENCES ==========
2026-02-12 20:10:53,201 - INFO - Seen tasks: 0..1 | valid_out_dim=4
2026-02-12 20:10:55,470 - INFO - [Group=Task0] CI_acc=0.14% | corr_slice_max=4.450 | best_other_max=6.340 | gap=-1.890
2026-02-12 20:10:55,472 - INFO - [Group=Task0] winner_task_dist: W0=0.1% | W1=99.9%
2026-02-12 20:10:55,472 - INFO - [Group=Task0] slice_strength : S0=4.45 | S1=6.34
2026-02-12 20:10:57,699 - INFO - [Group=Task1] CI_acc=98.48% | corr_slice_max=7.147 | best_other_max=1.891 | gap=5.256
2026-02-12 20:10:57,701 - INFO - [Group=Task1] winner_task_dist: W0=0.0% | W1=100.0%
2026-02-12 20:10:57,701 - INFO - [Group=Task1] slice_strength : S0=1.89 | S1=7.15
2026-02-12 20:10:57,701 - INFO - ======================================
2026-02-12 20:10:57,701 - INFO - ========== Task 2: classes [4, 5] ==========
2026-02-12 20:11:36,330 - INFO - [Task 2 | ep 0 | step 0] loss=9.8917 c=6.5939 r=3.2903 rev=0.0008 | si=0.0068 | CI_T0=0.78% | CI_T1=98.47% | CI_T2=0.00%
2026-02-12 20:11:49,446 - INFO - [Task 2 | ep 0 | step 25] loss=1.7192 c=0.3853 r=1.2252 rev=0.0002 | si=0.1085 | CI_T0=7.80% | CI_T1=29.42% | CI_T2=90.75%
2026-02-12 20:12:02,553 - INFO - [Task 2 | ep 0 | step 50] loss=1.3240 c=0.3444 r=0.8539 rev=0.0001 | si=0.1255 | CI_T0=5.58% | CI_T1=27.65% | CI_T2=95.73%
2026-02-12 20:12:15,914 - INFO - [Task 2 | ep 0 | step 75] loss=1.2147 c=0.2363 r=0.8494 rev=0.0002 | si=0.1287 | CI_T0=6.40% | CI_T1=29.04% | CI_T2=95.92%
2026-02-12 20:12:32,994 - INFO - [Task 2 | ep 1 | step 100] loss=1.2738 c=0.2001 r=0.9398 rev=0.0004 | si=0.1335 | CI_T0=12.70% | CI_T1=24.14% | CI_T2=95.83%
2026-02-12 20:12:46,069 - INFO - [Task 2 | ep 1 | step 125] loss=1.1905 c=0.1768 r=0.8753 rev=0.0010 | si=0.1373 | CI_T0=10.41% | CI_T1=22.17% | CI_T2=97.21%
2026-02-12 20:12:59,349 - INFO - [Task 2 | ep 1 | step 150] loss=0.9882 c=0.1798 r=0.6703 rev=0.0001 | si=0.1380 | CI_T0=3.12% | CI_T1=25.66% | CI_T2=97.80%
2026-02-12 20:13:16,392 - INFO - [Task 2 | ep 2 | step 175] loss=1.2162 c=0.1724 r=0.9034 rev=0.0002 | si=0.1403 | CI_T0=5.96% | CI_T1=25.56% | CI_T2=96.76%
2026-02-12 20:13:29,568 - INFO - [Task 2 | ep 2 | step 200] loss=0.9263 c=0.1570 r=0.6261 rev=0.0002 | si=0.1430 | CI_T0=2.71% | CI_T1=26.06% | CI_T2=96.82%
2026-02-12 20:13:42,788 - INFO - [Task 2 | ep 2 | step 225] loss=1.0246 c=0.1897 r=0.6875 rev=0.0009 | si=0.1466 | CI_T0=6.54% | CI_T1=22.77% | CI_T2=98.16%
2026-02-12 20:13:56,049 - INFO - [Task 2 | ep 2 | step 250] loss=0.8930 c=0.1289 r=0.6181 rev=0.0009 | si=0.1452 | CI_T0=6.58% | CI_T1=22.81% | CI_T2=97.57%
2026-02-12 20:14:13,206 - INFO - [Task 2 | ep 3 | step 275] loss=0.9327 c=0.1297 r=0.6526 rev=0.0002 | si=0.1503 | CI_T0=1.82% | CI_T1=23.17% | CI_T2=98.14%
2026-02-12 20:14:26,563 - INFO - [Task 2 | ep 3 | step 300] loss=0.8379 c=0.1134 r=0.5729 rev=0.0009 | si=0.1507 | CI_T0=0.71% | CI_T1=23.78% | CI_T2=97.58%
2026-02-12 20:14:40,057 - INFO - [Task 2 | ep 3 | step 325] loss=1.3163 c=0.0993 r=1.0663 rev=0.0006 | si=0.1500 | CI_T0=4.01% | CI_T1=20.64% | CI_T2=98.27%
2026-02-12 20:14:53,992 - INFO - [After Task 2] Task-IL : T0=99.91% | T1=96.82% | T2=99.31% | Avg=98.68%
2026-02-12 20:14:53,994 - INFO - [After Task 2] Class-IL: T0=2.84% | T1=15.82% | T2=98.56% | Avg=39.07%
2026-02-12 20:14:53,994 - INFO - ========== GROUP DIFFERENCES ==========
2026-02-12 20:14:53,994 - INFO - Seen tasks: 0..2 | valid_out_dim=6
2026-02-12 20:14:56,219 - INFO - [Group=Task0] CI_acc=2.84% | corr_slice_max=5.173 | best_other_max=6.684 | gap=-1.511
2026-02-12 20:14:56,219 - INFO - [Group=Task0] winner_task_dist: W0=2.8% | W1=36.1% | W2=61.1%
2026-02-12 20:14:56,219 - INFO - [Group=Task0] slice_strength : S0=5.17 | S1=6.07 | S2=6.48
2026-02-12 20:14:58,394 - INFO - [Group=Task1] CI_acc=15.82% | corr_slice_max=6.737 | best_other_max=8.137 | gap=-1.400
2026-02-12 20:14:58,394 - INFO - [Group=Task1] winner_task_dist: W0=0.0% | W1=15.9% | W2=84.1%
2026-02-12 20:14:58,394 - INFO - [Group=Task1] slice_strength : S0=2.52 | S1=6.74 | S2=8.14
2026-02-12 20:15:00,583 - INFO - [Group=Task2] CI_acc=98.56% | corr_slice_max=9.268 | best_other_max=6.269 | gap=2.998
2026-02-12 20:15:00,585 - INFO - [Group=Task2] winner_task_dist: W0=0.0% | W1=0.9% | W2=99.1%
2026-02-12 20:15:00,585 - INFO - [Group=Task2] slice_strength : S0=2.86 | S1=6.27 | S2=9.27
2026-02-12 20:15:00,585 - INFO - ======================================
2026-02-12 20:15:00,585 - INFO - ========== Task 3: classes [6, 7] ==========
2026-02-12 20:15:43,192 - INFO - [Task 3 | ep 0 | step 0] loss=10.5609 c=8.4691 r=1.9413 rev=0.0002 | si=0.1503 | CI_T0=1.24% | CI_T1=20.62% | CI_T2=98.61% | CI_T3=0.00%
2026-02-12 20:16:00,860 - INFO - [Task 3 | ep 0 | step 25] loss=2.1285 c=0.3769 r=1.4736 rev=0.0057 | si=0.2723 | CI_T0=10.83% | CI_T1=18.60% | CI_T2=54.93% | CI_T3=97.95%
2026-02-12 20:16:18,565 - INFO - [Task 3 | ep 0 | step 50] loss=1.6165 c=0.3165 r=1.0174 rev=0.0007 | si=0.2819 | CI_T0=1.56% | CI_T1=21.10% | CI_T2=69.58% | CI_T3=96.92%
2026-02-12 20:16:36,238 - INFO - [Task 3 | ep 0 | step 75] loss=1.4350 c=0.2906 r=0.8697 rev=0.0006 | si=0.2741 | CI_T0=1.41% | CI_T1=16.66% | CI_T2=74.43% | CI_T3=98.00%
2026-02-12 20:16:57,975 - INFO - [Task 3 | ep 1 | step 100] loss=1.3239 c=0.2412 r=0.8067 rev=0.0007 | si=0.2753 | CI_T0=0.16% | CI_T1=18.03% | CI_T2=75.48% | CI_T3=98.60%
2026-02-12 20:17:15,598 - INFO - [Task 3 | ep 1 | step 125] loss=1.3967 c=0.2830 r=0.8305 rev=0.0009 | si=0.2822 | CI_T0=2.94% | CI_T1=15.90% | CI_T2=69.86% | CI_T3=99.00%
2026-02-12 20:17:33,060 - INFO - [Task 3 | ep 1 | step 150] loss=1.3811 c=0.2680 r=0.8242 rev=0.0003 | si=0.2885 | CI_T0=1.29% | CI_T1=16.03% | CI_T2=75.01% | CI_T3=98.88%
2026-02-12 20:17:50,719 - INFO - [Task 3 | ep 1 | step 175] loss=1.2046 c=0.2584 r=0.6539 rev=0.0005 | si=0.2919 | CI_T0=2.73% | CI_T1=16.12% | CI_T2=69.38% | CI_T3=99.19%
2026-02-12 20:18:12,229 - INFO - [Task 3 | ep 2 | step 200] loss=1.2060 c=0.2387 r=0.6696 rev=0.0009 | si=0.2967 | CI_T0=0.63% | CI_T1=14.59% | CI_T2=68.72% | CI_T3=99.23%
2026-02-12 20:18:29,859 - INFO - [Task 3 | ep 2 | step 225] loss=1.2764 c=0.2714 r=0.7033 rev=0.0012 | si=0.3005 | CI_T0=0.54% | CI_T1=12.92% | CI_T2=71.53% | CI_T3=99.37%
2026-02-12 20:18:47,514 - INFO - [Task 3 | ep 2 | step 250] loss=1.1529 c=0.2062 r=0.6414 rev=0.0003 | si=0.3049 | CI_T0=0.40% | CI_T1=15.11% | CI_T2=68.98% | CI_T3=99.37%
2026-02-12 20:19:05,331 - INFO - [Task 3 | ep 2 | step 275] loss=1.3924 c=0.2217 r=0.8644 rev=0.0002 | si=0.3061 | CI_T0=1.68% | CI_T1=12.54% | CI_T2=63.88% | CI_T3=99.66%
2026-02-12 20:19:26,929 - INFO - [Task 3 | ep 3 | step 300] loss=1.2752 c=0.2024 r=0.7686 rev=0.0001 | si=0.3041 | CI_T0=0.16% | CI_T1=11.82% | CI_T2=68.16% | CI_T3=99.58%
2026-02-12 20:19:44,611 - INFO - [Task 3 | ep 3 | step 325] loss=1.3564 c=0.2154 r=0.8366 rev=0.0004 | si=0.3040 | CI_T0=0.55% | CI_T1=14.69% | CI_T2=66.79% | CI_T3=99.61%
2026-02-12 20:20:02,600 - INFO - [Task 3 | ep 3 | step 350] loss=1.3538 c=0.2283 r=0.8243 rev=0.0002 | si=0.3010 | CI_T0=1.12% | CI_T1=11.06% | CI_T2=70.67% | CI_T3=99.60%
2026-02-12 20:20:20,569 - INFO - [Task 3 | ep 3 | step 375] loss=1.2746 c=0.2197 r=0.7505 rev=0.0002 | si=0.3042 | CI_T0=1.42% | CI_T1=15.47% | CI_T2=65.67% | CI_T3=99.61%
2026-02-12 20:20:38,808 - INFO - [After Task 3] Task-IL : T0=99.91% | T1=98.38% | T2=95.36% | T3=99.90% | Avg=98.39%
2026-02-12 20:20:38,809 - INFO - [After Task 3] Class-IL: T0=0.52% | T1=14.89% | T2=64.03% | T3=99.24% | Avg=44.67%
2026-02-12 20:20:38,809 - INFO - ========== GROUP DIFFERENCES ==========
2026-02-12 20:20:38,809 - INFO - Seen tasks: 0..3 | valid_out_dim=8
2026-02-12 20:20:41,064 - INFO - [Group=Task0] CI_acc=0.52% | corr_slice_max=4.980 | best_other_max=7.960 | gap=-2.980
2026-02-12 20:20:41,065 - INFO - [Group=Task0] winner_task_dist: W0=0.5% | W1=3.0% | W2=10.8% | W3=85.7%
2026-02-12 20:20:41,065 - INFO - [Group=Task0] slice_strength : S0=4.98 | S1=6.36 | S2=6.79 | S3=7.86
2026-02-12 20:20:43,251 - INFO - [Group=Task1] CI_acc=14.89% | corr_slice_max=7.003 | best_other_max=8.466 | gap=-1.463
2026-02-12 20:20:43,252 - INFO - [Group=Task1] winner_task_dist: W0=0.0% | W1=14.9% | W2=38.0% | W3=47.1%
2026-02-12 20:20:43,252 - INFO - [Group=Task1] slice_strength : S0=2.55 | S1=7.00 | S2=7.49 | S3=7.63
2026-02-12 20:20:45,436 - INFO - [Group=Task2] CI_acc=64.03% | corr_slice_max=8.765 | best_other_max=8.213 | gap=0.552
2026-02-12 20:20:45,437 - INFO - [Group=Task2] winner_task_dist: W0=0.0% | W1=1.5% | W2=64.6% | W3=33.9%
2026-02-12 20:20:45,437 - INFO - [Group=Task2] slice_strength : S0=2.81 | S1=6.20 | S2=8.77 | S3=7.97
2026-02-12 20:20:47,638 - INFO - [Group=Task3] CI_acc=99.24% | corr_slice_max=9.983 | best_other_max=7.982 | gap=2.002
2026-02-12 20:20:47,639 - INFO - [Group=Task3] winner_task_dist: W0=0.0% | W1=0.0% | W2=0.8% | W3=99.2%
2026-02-12 20:20:47,639 - INFO - [Group=Task3] slice_strength : S0=2.90 | S1=5.83 | S2=7.94 | S3=9.98
2026-02-12 20:20:47,640 - INFO - ======================================
2026-02-12 20:20:47,640 - INFO - ========== Task 4: classes [8, 9] ==========
2026-02-12 20:21:34,357 - INFO - [Task 4 | ep 0 | step 0] loss=11.6912 c=8.9261 r=2.4609 rev=0.0006 | si=0.3035 | CI_T0=1.78% | CI_T1=17.33% | CI_T2=73.02% | CI_T3=99.04% | CI_T4=0.00%
2026-02-12 20:21:56,418 - INFO - [Task 4 | ep 0 | step 25] loss=2.4911 c=0.5540 r=1.4756 rev=0.0021 | si=0.4595 | CI_T0=2.15% | CI_T1=11.26% | CI_T2=10.58% | CI_T3=28.01% | CI_T4=92.48%
2026-02-12 20:22:18,459 - INFO - [Task 4 | ep 0 | step 50] loss=2.0179 c=0.5068 r=1.0417 rev=0.0007 | si=0.4687 | CI_T0=0.08% | CI_T1=6.17% | CI_T2=20.91% | CI_T3=40.25% | CI_T4=94.00%
2026-02-12 20:22:40,476 - INFO - [Task 4 | ep 0 | step 75] loss=1.9136 c=0.4933 r=0.9640 rev=0.0004 | si=0.4559 | CI_T0=0.44% | CI_T1=7.07% | CI_T2=27.07% | CI_T3=49.04% | CI_T4=94.74%
2026-02-12 20:23:06,438 - INFO - [Task 4 | ep 1 | step 100] loss=1.8390 c=0.4420 r=0.9384 rev=0.0008 | si=0.4578 | CI_T0=1.77% | CI_T1=3.57% | CI_T2=25.70% | CI_T3=41.92% | CI_T4=94.68%
2026-02-12 20:23:28,537 - INFO - [Task 4 | ep 1 | step 125] loss=1.8568 c=0.4176 r=0.9729 rev=0.0007 | si=0.4656 | CI_T0=6.50% | CI_T1=5.24% | CI_T2=22.79% | CI_T3=45.41% | CI_T4=95.21%
2026-02-12 20:23:50,650 - INFO - [Task 4 | ep 1 | step 150] loss=1.8672 c=0.4788 r=0.9249 rev=0.0002 | si=0.4633 | CI_T0=0.07% | CI_T1=2.00% | CI_T2=23.64% | CI_T3=40.11% | CI_T4=94.35%
2026-02-12 20:24:12,547 - INFO - [Task 4 | ep 1 | step 175] loss=1.8719 c=0.4855 r=0.9192 rev=0.0004 | si=0.4668 | CI_T0=0.00% | CI_T1=2.87% | CI_T2=21.61% | CI_T3=36.03% | CI_T4=94.54%
2026-02-12 20:24:38,443 - INFO - [Task 4 | ep 2 | step 200] loss=1.8383 c=0.3683 r=1.0069 rev=0.0002 | si=0.4629 | CI_T0=1.09% | CI_T1=3.80% | CI_T2=20.73% | CI_T3=39.98% | CI_T4=94.76%
2026-02-12 20:25:00,471 - INFO - [Task 4 | ep 2 | step 225] loss=1.7065 c=0.3971 r=0.8452 rev=0.0007 | si=0.4635 | CI_T0=0.03% | CI_T1=2.56% | CI_T2=22.52% | CI_T3=43.27% | CI_T4=96.73%
2026-02-12 20:25:22,549 - INFO - [Task 4 | ep 2 | step 250] loss=1.6600 c=0.4027 r=0.7926 rev=0.0003 | si=0.4644 | CI_T0=3.77% | CI_T1=4.04% | CI_T2=24.49% | CI_T3=38.59% | CI_T4=94.90%
2026-02-12 20:25:44,467 - INFO - [Task 4 | ep 2 | step 275] loss=1.6318 c=0.3862 r=0.7835 rev=0.0003 | si=0.4618 | CI_T0=1.47% | CI_T1=2.85% | CI_T2=23.87% | CI_T3=38.84% | CI_T4=94.64%
2026-02-12 20:26:10,407 - INFO - [Task 4 | ep 3 | step 300] loss=1.9114 c=0.4666 r=0.9814 rev=0.0002 | si=0.4632 | CI_T0=1.34% | CI_T1=0.96% | CI_T2=23.48% | CI_T3=35.81% | CI_T4=93.41%
2026-02-12 20:26:32,721 - INFO - [Task 4 | ep 3 | step 325] loss=1.7431 c=0.3984 r=0.8823 rev=0.0002 | si=0.4621 | CI_T0=0.05% | CI_T1=2.41% | CI_T2=21.38% | CI_T3=35.61% | CI_T4=95.41%
2026-02-12 20:26:55,152 - INFO - [Task 4 | ep 3 | step 350] loss=1.7888 c=0.4459 r=0.8797 rev=0.0007 | si=0.4624 | CI_T0=2.77% | CI_T1=1.71% | CI_T2=28.39% | CI_T3=43.09% | CI_T4=94.55%
2026-02-12 20:27:17,534 - INFO - [After Task 4] Task-IL : T0=99.95% | T1=95.69% | T2=97.81% | T3=93.35% | T4=98.03% | Avg=96.97%
2026-02-12 20:27:17,535 - INFO - [After Task 4] Class-IL: T0=0.66% | T1=1.03% | T2=22.57% | T3=33.13% | T4=93.29% | Avg=30.14%
2026-02-12 20:27:17,535 - INFO - ========== GROUP DIFFERENCES ==========
2026-02-12 20:27:17,535 - INFO - Seen tasks: 0..4 | valid_out_dim=10
2026-02-12 20:27:19,700 - INFO - [Group=Task0] CI_acc=0.66% | corr_slice_max=4.925 | best_other_max=8.266 | gap=-3.341
2026-02-12 20:27:19,701 - INFO - [Group=Task0] winner_task_dist: W0=0.7% | W1=2.2% | W2=8.7% | W3=35.0% | W4=53.5%
2026-02-12 20:27:19,701 - INFO - [Group=Task0] slice_strength : S0=4.92 | S1=6.31 | S2=6.49 | S3=7.64 | S4=7.99
2026-02-12 20:27:21,867 - INFO - [Group=Task1] CI_acc=1.03% | corr_slice_max=6.865 | best_other_max=8.912 | gap=-2.047
2026-02-12 20:27:21,868 - INFO - [Group=Task1] winner_task_dist: W0=0.0% | W1=1.1% | W2=24.7% | W3=16.7% | W4=57.5%
2026-02-12 20:27:21,868 - INFO - [Group=Task1] slice_strength : S0=2.50 | S1=6.87 | S2=7.61 | S3=7.23 | S4=8.53
2026-02-12 20:27:23,994 - INFO - [Group=Task2] CI_acc=22.57% | corr_slice_max=8.876 | best_other_max=9.706 | gap=-0.830
2026-02-12 20:27:23,994 - INFO - [Group=Task2] winner_task_dist: W0=0.0% | W1=1.2% | W2=22.6% | W3=4.3% | W4=72.0%
2026-02-12 20:27:23,995 - INFO - [Group=Task2] slice_strength : S0=2.47 | S1=6.42 | S2=8.88 | S3=8.02 | S4=9.63
2026-02-12 20:27:26,141 - INFO - [Group=Task3] CI_acc=33.13% | corr_slice_max=8.913 | best_other_max=9.226 | gap=-0.313
2026-02-12 20:27:26,142 - INFO - [Group=Task3] winner_task_dist: W0=0.0% | W1=0.0% | W2=8.5% | W3=33.1% | W4=58.4%
2026-02-12 20:27:26,142 - INFO - [Group=Task3] slice_strength : S0=2.82 | S1=5.94 | S2=7.87 | S3=8.91 | S4=9.04
2026-02-12 20:27:28,289 - INFO - [Group=Task4] CI_acc=93.29% | corr_slice_max=10.214 | best_other_max=8.788 | gap=1.426
2026-02-12 20:27:28,289 - INFO - [Group=Task4] winner_task_dist: W0=0.0% | W1=0.2% | W2=0.4% | W3=5.7% | W4=93.7%
2026-02-12 20:27:28,289 - INFO - [Group=Task4] slice_strength : S0=2.35 | S1=6.48 | S2=8.10 | S3=8.56 | S4=10.21
2026-02-12 20:27:28,289 - INFO - ======================================
2026-02-12 20:27:28,289 - INFO - ========== FINAL METRICS (Class-IL) ==========
2026-02-12 20:27:28,289 - INFO - Forgetting per task: T0=99.29%, T1=97.45%, T2=75.99%, T3=66.11%, T4=0.00%
2026-02-12 20:27:28,289 - INFO - BWT: -84.71%
2026-02-12 20:27:28,290 - INFO - Final average Class-IL accuracy: 30.14%
