2026-02-12 15:53:53,128 - INFO - Device: cpu
2026-02-12 15:53:53,128 - INFO - Config: {'device': 'cpu', 'lr': 0.005, 'epochs_per_task': 4, 'batch_size': 128, 'lambda_slice': 2.0, 'lambda_feat': 0.5, 'vae_epochs': 5, 'vae_n_fake_per_task': 32, 'si_lambda': 1.0}
2026-02-12 15:53:53,166 - INFO - ========== Task 0: classes [0, 1] ==========
2026-02-12 15:54:19,889 - INFO - [Task 0 | ep 0 | step 0] loss=0.8023 c=0.8023 r=0.0000 | CI_T0=97.84%
2026-02-12 15:54:23,776 - INFO - [Task 0 | ep 0 | step 25] loss=0.0324 c=0.0324 r=0.0000 | CI_T0=99.87%
2026-02-12 15:54:27,930 - INFO - [Task 0 | ep 0 | step 50] loss=0.0017 c=0.0017 r=0.0000 | CI_T0=99.84%
2026-02-12 15:54:31,874 - INFO - [Task 0 | ep 0 | step 75] loss=0.0007 c=0.0007 r=0.0000 | CI_T0=99.94%
2026-02-12 15:54:39,850 - INFO - [Task 0 | ep 1 | step 100] loss=0.0008 c=0.0008 r=0.0000 | CI_T0=99.97%
2026-02-12 15:54:44,026 - INFO - [Task 0 | ep 1 | step 125] loss=0.0002 c=0.0002 r=0.0000 | CI_T0=99.96%
2026-02-12 15:54:48,338 - INFO - [Task 0 | ep 1 | step 150] loss=0.0087 c=0.0087 r=0.0000 | CI_T0=99.96%
2026-02-12 15:54:52,394 - INFO - [Task 0 | ep 1 | step 175] loss=0.0002 c=0.0002 r=0.0000 | CI_T0=99.98%
2026-02-12 15:54:59,832 - INFO - [Task 0 | ep 2 | step 200] loss=0.0002 c=0.0002 r=0.0000 | CI_T0=99.82%
2026-02-12 15:55:03,791 - INFO - [Task 0 | ep 2 | step 225] loss=0.0004 c=0.0004 r=0.0000 | CI_T0=99.98%
2026-02-12 15:55:07,695 - INFO - [Task 0 | ep 2 | step 250] loss=0.0001 c=0.0001 r=0.0000 | CI_T0=99.95%
2026-02-12 15:55:11,787 - INFO - [Task 0 | ep 2 | step 275] loss=0.0002 c=0.0002 r=0.0000 | CI_T0=99.94%
2026-02-12 15:55:19,479 - INFO - [Task 0 | ep 3 | step 300] loss=0.0003 c=0.0003 r=0.0000 | CI_T0=99.97%
2026-02-12 15:55:23,522 - INFO - [Task 0 | ep 3 | step 325] loss=0.0001 c=0.0001 r=0.0000 | CI_T0=99.98%
2026-02-12 15:55:27,544 - INFO - [Task 0 | ep 3 | step 350] loss=0.0001 c=0.0001 r=0.0000 | CI_T0=99.90%
2026-02-12 15:55:31,507 - INFO - [Task 0 | ep 3 | step 375] loss=0.0108 c=0.0108 r=0.0000 | CI_T0=99.79%
2026-02-12 15:55:35,865 - INFO - [After Task 0] Task-IL : T0=99.91% | Avg=99.91%
2026-02-12 15:55:35,865 - INFO - [After Task 0] Class-IL: T0=99.91% | Avg=99.91%
2026-02-12 15:55:35,865 - INFO - ========== GROUP DIFFERENCES ==========
2026-02-12 15:55:35,865 - INFO - Seen tasks: 0..0 | valid_out_dim=2
2026-02-12 15:55:37,858 - INFO - [Group=Task0] CI_acc=99.91% | corr_slice_max=5.066 | best_other_max=nan | gap=nan
2026-02-12 15:55:37,858 - INFO - [Group=Task0] winner_task_dist: W0=100.0%
2026-02-12 15:55:37,858 - INFO - [Group=Task0] slice_strength : S0=5.07
2026-02-12 15:55:37,858 - INFO - ======================================
2026-02-12 15:55:37,858 - INFO - ========== Task 1: classes [2, 3] ==========
2026-02-12 15:56:07,804 - INFO - [Task 1 | ep 0 | step 0] loss=7.3085 c=4.3643 r=2.9374 | CI_T0=99.71% | CI_T1=3.27%
2026-02-12 15:56:15,595 - INFO - [Task 1 | ep 0 | step 25] loss=1.6185 c=0.4020 r=0.9918 | si=0.0021 | CI_T0=61.41% | CI_T1=89.78%
2026-02-12 15:56:23,417 - INFO - [Task 1 | ep 0 | step 50] loss=1.4407 c=0.2024 r=1.1083 | si=0.0032 | CI_T0=66.17% | CI_T1=91.15%
2026-02-12 15:56:31,219 - INFO - [Task 1 | ep 0 | step 75] loss=1.0005 c=0.1610 r=0.7579 | si=0.0038 | CI_T0=43.76% | CI_T1=95.32%
2026-02-12 15:56:42,510 - INFO - [Task 1 | ep 1 | step 100] loss=0.9845 c=0.1595 r=0.7582 | si=0.0044 | CI_T0=51.40% | CI_T1=95.35%
2026-02-12 15:56:50,432 - INFO - [Task 1 | ep 1 | step 125] loss=0.9903 c=0.1549 r=0.7747 | si=0.0051 | CI_T0=59.29% | CI_T1=93.48%
2026-02-12 15:56:58,270 - INFO - [Task 1 | ep 1 | step 150] loss=1.6684 c=0.1619 r=1.4472 | si=0.0058 | CI_T0=47.50% | CI_T1=97.44%
2026-02-12 15:57:06,113 - INFO - [Task 1 | ep 1 | step 175] loss=0.8770 c=0.1342 r=0.6803 | si=0.0065 | CI_T0=49.57% | CI_T1=97.66%
2026-02-12 15:57:17,441 - INFO - [Task 1 | ep 2 | step 200] loss=1.0862 c=0.1342 r=0.8908 | si=0.0071 | CI_T0=51.07% | CI_T1=97.11%
2026-02-12 15:57:25,210 - INFO - [Task 1 | ep 2 | step 225] loss=1.0866 c=0.1516 r=0.8841 | si=0.0077 | CI_T0=55.19% | CI_T1=97.55%
2026-02-12 15:57:33,043 - INFO - [Task 1 | ep 2 | step 250] loss=0.8851 c=0.0865 r=0.7421 | si=0.0085 | CI_T0=48.45% | CI_T1=98.09%
2026-02-12 15:57:40,861 - INFO - [Task 1 | ep 2 | step 275] loss=0.9857 c=0.1427 r=0.7913 | si=0.0092 | CI_T0=47.78% | CI_T1=97.79%
2026-02-12 15:57:52,109 - INFO - [Task 1 | ep 3 | step 300] loss=0.8433 c=0.1439 r=0.6419 | si=0.0097 | CI_T0=38.62% | CI_T1=98.46%
2026-02-12 15:57:59,973 - INFO - [Task 1 | ep 3 | step 325] loss=0.9345 c=0.1429 r=0.7412 | si=0.0103 | CI_T0=42.69% | CI_T1=98.05%
2026-02-12 15:58:07,898 - INFO - [Task 1 | ep 3 | step 350] loss=1.0967 c=0.1402 r=0.9003 | si=0.0108 | CI_T0=42.53% | CI_T1=98.70%
2026-02-12 15:58:15,782 - INFO - [Task 1 | ep 3 | step 375] loss=0.6731 c=0.0932 r=0.5325 | si=0.0113 | CI_T0=45.70% | CI_T1=97.73%
2026-02-12 15:58:23,897 - INFO - [After Task 1] Task-IL : T0=99.91% | T1=98.33% | Avg=99.12%
2026-02-12 15:58:23,897 - INFO - [After Task 1] Class-IL: T0=46.52% | T1=97.36% | Avg=71.94%
2026-02-12 15:58:23,897 - INFO - ========== GROUP DIFFERENCES ==========
2026-02-12 15:58:23,897 - INFO - Seen tasks: 0..1 | valid_out_dim=4
2026-02-12 15:58:25,879 - INFO - [Group=Task0] CI_acc=46.52% | corr_slice_max=5.281 | best_other_max=5.363 | gap=-0.081
2026-02-12 15:58:25,879 - INFO - [Group=Task0] winner_task_dist: W0=46.5% | W1=53.5%
2026-02-12 15:58:25,879 - INFO - [Group=Task0] slice_strength : S0=5.28 | S1=5.36
2026-02-12 15:58:27,846 - INFO - [Group=Task1] CI_acc=97.36% | corr_slice_max=6.267 | best_other_max=2.614 | gap=3.653
2026-02-12 15:58:27,846 - INFO - [Group=Task1] winner_task_dist: W0=1.5% | W1=98.5%
2026-02-12 15:58:27,846 - INFO - [Group=Task1] slice_strength : S0=2.61 | S1=6.27
2026-02-12 15:58:27,846 - INFO - ======================================
2026-02-12 15:58:27,847 - INFO - ========== Task 2: classes [4, 5] ==========
2026-02-12 15:59:01,457 - INFO - [Task 2 | ep 0 | step 0] loss=10.9993 c=5.9588 r=4.9346 | si=0.0113 | CI_T0=56.44% | CI_T1=93.36% | CI_T2=0.00%
2026-02-12 15:59:13,066 - INFO - [Task 2 | ep 0 | step 25] loss=1.8741 c=0.3482 r=1.2384 | si=0.1709 | CI_T0=69.37% | CI_T1=25.13% | CI_T2=89.96%
2026-02-12 15:59:24,672 - INFO - [Task 2 | ep 0 | step 50] loss=1.4601 c=0.1795 r=1.0294 | si=0.1949 | CI_T0=61.11% | CI_T1=30.95% | CI_T2=94.93%
2026-02-12 15:59:36,378 - INFO - [Task 2 | ep 0 | step 75] loss=1.3875 c=0.1810 r=0.9706 | si=0.1946 | CI_T0=57.48% | CI_T1=28.17% | CI_T2=97.23%
2026-02-12 15:59:51,483 - INFO - [Task 2 | ep 1 | step 100] loss=1.3051 c=0.1699 r=0.8906 | si=0.2005 | CI_T0=53.75% | CI_T1=26.59% | CI_T2=96.79%
2026-02-12 16:00:03,075 - INFO - [Task 2 | ep 1 | step 125] loss=1.0787 c=0.1170 r=0.7278 | si=0.1938 | CI_T0=61.61% | CI_T1=29.39% | CI_T2=94.07%
2026-02-12 16:00:14,683 - INFO - [Task 2 | ep 1 | step 150] loss=1.1687 c=0.0969 r=0.8439 | si=0.1936 | CI_T0=57.13% | CI_T1=27.19% | CI_T2=97.40%
2026-02-12 16:00:29,825 - INFO - [Task 2 | ep 2 | step 175] loss=0.9496 c=0.1016 r=0.6104 | si=0.1971 | CI_T0=39.52% | CI_T1=25.47% | CI_T2=97.75%
2026-02-12 16:00:41,430 - INFO - [Task 2 | ep 2 | step 200] loss=1.0246 c=0.1112 r=0.6858 | si=0.1998 | CI_T0=49.49% | CI_T1=20.58% | CI_T2=98.06%
2026-02-12 16:00:52,988 - INFO - [Task 2 | ep 2 | step 225] loss=0.9968 c=0.0801 r=0.6858 | si=0.2041 | CI_T0=55.59% | CI_T1=32.68% | CI_T2=95.38%
2026-02-12 16:01:04,589 - INFO - [Task 2 | ep 2 | step 250] loss=1.0533 c=0.0906 r=0.7304 | si=0.2058 | CI_T0=45.31% | CI_T1=26.38% | CI_T2=97.68%
2026-02-12 16:01:19,663 - INFO - [Task 2 | ep 3 | step 275] loss=1.0064 c=0.0784 r=0.6936 | si=0.2092 | CI_T0=46.45% | CI_T1=30.16% | CI_T2=99.01%
2026-02-12 16:01:31,274 - INFO - [Task 2 | ep 3 | step 300] loss=1.1508 c=0.1171 r=0.8044 | si=0.2042 | CI_T0=50.11% | CI_T1=28.61% | CI_T2=96.68%
2026-02-12 16:01:42,830 - INFO - [Task 2 | ep 3 | step 325] loss=1.3450 c=0.0909 r=1.0196 | si=0.2100 | CI_T0=46.73% | CI_T1=29.00% | CI_T2=96.08%
2026-02-12 16:01:54,989 - INFO - [After Task 2] Task-IL : T0=98.49% | T1=95.00% | T2=98.72% | Avg=97.40%
2026-02-12 16:01:54,989 - INFO - [After Task 2] Class-IL: T0=30.07% | T1=22.28% | T2=97.71% | Avg=50.02%
2026-02-12 16:01:54,989 - INFO - ========== GROUP DIFFERENCES ==========
2026-02-12 16:01:54,990 - INFO - Seen tasks: 0..2 | valid_out_dim=6
2026-02-12 16:01:56,982 - INFO - [Group=Task0] CI_acc=30.07% | corr_slice_max=5.228 | best_other_max=6.025 | gap=-0.797
2026-02-12 16:01:56,982 - INFO - [Group=Task0] winner_task_dist: W0=30.1% | W1=17.5% | W2=52.4%
2026-02-12 16:01:56,982 - INFO - [Group=Task0] slice_strength : S0=5.23 | S1=4.40 | S2=5.93
2026-02-12 16:01:58,923 - INFO - [Group=Task1] CI_acc=22.28% | corr_slice_max=6.024 | best_other_max=7.508 | gap=-1.483
2026-02-12 16:01:58,923 - INFO - [Group=Task1] winner_task_dist: W0=1.3% | W1=22.7% | W2=76.0%
2026-02-12 16:01:58,923 - INFO - [Group=Task1] slice_strength : S0=3.03 | S1=6.02 | S2=7.50
2026-02-12 16:02:00,883 - INFO - [Group=Task2] CI_acc=97.71% | corr_slice_max=8.759 | best_other_max=5.166 | gap=3.592
2026-02-12 16:02:00,883 - INFO - [Group=Task2] winner_task_dist: W0=0.4% | W1=0.8% | W2=98.8%
2026-02-12 16:02:00,883 - INFO - [Group=Task2] slice_strength : S0=4.17 | S1=4.98 | S2=8.76
2026-02-12 16:02:00,883 - INFO - ======================================
2026-02-12 16:02:00,883 - INFO - ========== Task 3: classes [6, 7] ==========
2026-02-12 16:02:38,346 - INFO - [Task 3 | ep 0 | step 0] loss=11.2690 c=7.7196 r=3.0460 | si=0.2092 | CI_T0=45.52% | CI_T1=33.27% | CI_T2=97.49% | CI_T3=0.00%
2026-02-12 16:02:53,881 - INFO - [Task 3 | ep 0 | step 25] loss=2.1846 c=0.2823 r=1.4848 | si=0.3369 | CI_T0=61.70% | CI_T1=38.68% | CI_T2=64.90% | CI_T3=88.85%
2026-02-12 16:03:09,348 - INFO - [Task 3 | ep 0 | step 50] loss=1.9712 c=0.2655 r=1.3138 | si=0.3435 | CI_T0=44.46% | CI_T1=57.05% | CI_T2=66.28% | CI_T3=98.05%
2026-02-12 16:03:24,917 - INFO - [Task 3 | ep 0 | step 75] loss=1.5544 c=0.1809 r=0.9894 | si=0.3400 | CI_T0=42.67% | CI_T1=50.34% | CI_T2=69.23% | CI_T3=98.59%
2026-02-12 16:03:43,828 - INFO - [Task 3 | ep 1 | step 100] loss=1.4141 c=0.2130 r=0.8379 | si=0.3271 | CI_T0=60.15% | CI_T1=47.76% | CI_T2=73.67% | CI_T3=98.73%
2026-02-12 16:03:59,273 - INFO - [Task 3 | ep 1 | step 125] loss=1.7108 c=0.2007 r=1.1483 | si=0.3276 | CI_T0=38.57% | CI_T1=40.75% | CI_T2=73.65% | CI_T3=97.75%
2026-02-12 16:04:14,774 - INFO - [Task 3 | ep 1 | step 150] loss=1.4414 c=0.2246 r=0.8497 | si=0.3290 | CI_T0=40.23% | CI_T1=41.90% | CI_T2=70.75% | CI_T3=97.25%
2026-02-12 16:04:30,346 - INFO - [Task 3 | ep 1 | step 175] loss=1.2966 c=0.1429 r=0.7843 | si=0.3399 | CI_T0=18.57% | CI_T1=46.43% | CI_T2=69.74% | CI_T3=99.12%
2026-02-12 16:04:49,309 - INFO - [Task 3 | ep 2 | step 200] loss=1.3110 c=0.2079 r=0.7352 | si=0.3378 | CI_T0=40.66% | CI_T1=38.39% | CI_T2=74.31% | CI_T3=98.64%
2026-02-12 16:05:04,775 - INFO - [Task 3 | ep 2 | step 225] loss=1.4129 c=0.1665 r=0.8769 | si=0.3423 | CI_T0=21.48% | CI_T1=46.76% | CI_T2=69.61% | CI_T3=99.29%
2026-02-12 16:05:20,263 - INFO - [Task 3 | ep 2 | step 250] loss=1.3388 c=0.2011 r=0.7684 | si=0.3409 | CI_T0=25.82% | CI_T1=50.49% | CI_T2=71.05% | CI_T3=99.11%
2026-02-12 16:05:35,719 - INFO - [Task 3 | ep 2 | step 275] loss=1.4036 c=0.1806 r=0.8453 | si=0.3472 | CI_T0=22.23% | CI_T1=45.06% | CI_T2=71.08% | CI_T3=99.40%
2026-02-12 16:05:54,594 - INFO - [Task 3 | ep 3 | step 300] loss=1.4656 c=0.1537 r=0.9382 | si=0.3473 | CI_T0=30.88% | CI_T1=43.71% | CI_T2=62.15% | CI_T3=97.61%
2026-02-12 16:06:10,041 - INFO - [Task 3 | ep 3 | step 325] loss=1.2593 c=0.1342 r=0.7500 | si=0.3488 | CI_T0=28.64% | CI_T1=40.77% | CI_T2=71.87% | CI_T3=99.40%
2026-02-12 16:06:25,575 - INFO - [Task 3 | ep 3 | step 350] loss=1.3324 c=0.1364 r=0.8228 | si=0.3487 | CI_T0=26.20% | CI_T1=36.57% | CI_T2=70.04% | CI_T3=99.09%
2026-02-12 16:06:41,273 - INFO - [Task 3 | ep 3 | step 375] loss=1.2480 c=0.1499 r=0.7202 | si=0.3525 | CI_T0=18.00% | CI_T1=52.32% | CI_T2=66.74% | CI_T3=99.11%
2026-02-12 16:06:57,177 - INFO - [After Task 3] Task-IL : T0=99.81% | T1=97.65% | T2=92.53% | T3=99.90% | Avg=97.47%
2026-02-12 16:06:57,177 - INFO - [After Task 3] Class-IL: T0=30.64% | T1=51.81% | T2=71.24% | T3=98.79% | Avg=63.12%
2026-02-12 16:06:57,177 - INFO - ========== GROUP DIFFERENCES ==========
2026-02-12 16:06:57,177 - INFO - Seen tasks: 0..3 | valid_out_dim=8
2026-02-12 16:06:59,157 - INFO - [Group=Task0] CI_acc=30.64% | corr_slice_max=5.980 | best_other_max=6.852 | gap=-0.872
2026-02-12 16:06:59,157 - INFO - [Group=Task0] winner_task_dist: W0=30.6% | W1=7.0% | W2=8.1% | W3=54.2%
2026-02-12 16:06:59,157 - INFO - [Group=Task0] slice_strength : S0=5.98 | S1=4.74 | S2=5.47 | S3=6.65
2026-02-12 16:07:01,096 - INFO - [Group=Task1] CI_acc=51.81% | corr_slice_max=6.672 | best_other_max=6.959 | gap=-0.287
2026-02-12 16:07:01,097 - INFO - [Group=Task1] winner_task_dist: W0=0.2% | W1=51.8% | W2=17.8% | W3=30.1%
2026-02-12 16:07:01,097 - INFO - [Group=Task1] slice_strength : S0=2.73 | S1=6.67 | S2=6.14 | S3=6.41
2026-02-12 16:07:03,043 - INFO - [Group=Task2] CI_acc=71.24% | corr_slice_max=8.130 | best_other_max=7.335 | gap=0.795
2026-02-12 16:07:03,043 - INFO - [Group=Task2] winner_task_dist: W0=0.2% | W1=3.1% | W2=71.7% | W3=25.0%
2026-02-12 16:07:03,044 - INFO - [Group=Task2] slice_strength : S0=3.63 | S1=5.06 | S2=8.13 | S3=7.07
2026-02-12 16:07:04,979 - INFO - [Group=Task3] CI_acc=98.79% | corr_slice_max=9.891 | best_other_max=7.655 | gap=2.236
2026-02-12 16:07:04,979 - INFO - [Group=Task3] winner_task_dist: W0=0.1% | W1=0.1% | W2=1.0% | W3=98.8%
2026-02-12 16:07:04,979 - INFO - [Group=Task3] slice_strength : S0=3.75 | S1=4.82 | S2=7.64 | S3=9.89
2026-02-12 16:07:04,979 - INFO - ======================================
2026-02-12 16:07:04,979 - INFO - ========== Task 4: classes [8, 9] ==========
2026-02-12 16:07:46,148 - INFO - [Task 4 | ep 0 | step 0] loss=12.1770 c=8.6103 r=3.1554 | si=0.3512 | CI_T0=56.09% | CI_T1=33.21% | CI_T2=59.34% | CI_T3=92.32% | CI_T4=0.00%
2026-02-12 16:08:05,453 - INFO - [Task 4 | ep 0 | step 25] loss=2.7701 c=0.4931 r=1.6451 | si=0.5115 | CI_T0=19.12% | CI_T1=32.96% | CI_T2=45.85% | CI_T3=67.66% | CI_T4=50.90%
2026-02-12 16:08:24,897 - INFO - [Task 4 | ep 0 | step 50] loss=2.1792 c=0.4728 r=1.0938 | si=0.5283 | CI_T0=45.07% | CI_T1=23.35% | CI_T2=47.94% | CI_T3=65.55% | CI_T4=91.52%
2026-02-12 16:08:44,322 - INFO - [Task 4 | ep 0 | step 75] loss=2.3005 c=0.4449 r=1.2775 | si=0.5151 | CI_T0=16.73% | CI_T1=22.86% | CI_T2=64.46% | CI_T3=79.12% | CI_T4=82.26%
2026-02-12 16:09:07,025 - INFO - [Task 4 | ep 1 | step 100] loss=2.0017 c=0.3882 r=1.0579 | si=0.5091 | CI_T0=17.39% | CI_T1=26.38% | CI_T2=54.76% | CI_T3=76.92% | CI_T4=86.42%
2026-02-12 16:09:26,466 - INFO - [Task 4 | ep 1 | step 125] loss=2.0635 c=0.3659 r=1.1366 | si=0.5120 | CI_T0=34.14% | CI_T1=23.38% | CI_T2=60.34% | CI_T3=74.06% | CI_T4=93.61%
2026-02-12 16:09:45,855 - INFO - [Task 4 | ep 1 | step 150] loss=1.9175 c=0.3894 r=0.9570 | si=0.5187 | CI_T0=18.74% | CI_T1=21.16% | CI_T2=41.62% | CI_T3=75.38% | CI_T4=90.13%
2026-02-12 16:10:05,197 - INFO - [Task 4 | ep 1 | step 175] loss=1.8564 c=0.4173 r=0.8745 | si=0.5202 | CI_T0=33.34% | CI_T1=26.07% | CI_T2=33.75% | CI_T3=52.66% | CI_T4=91.42%
2026-02-12 16:10:28,120 - INFO - [Task 4 | ep 2 | step 200] loss=1.7606 c=0.3058 r=0.9033 | si=0.5145 | CI_T0=15.41% | CI_T1=22.79% | CI_T2=58.25% | CI_T3=68.36% | CI_T4=95.54%
2026-02-12 16:10:47,510 - INFO - [Task 4 | ep 2 | step 225] loss=1.8973 c=0.4029 r=0.9339 | si=0.5206 | CI_T0=12.87% | CI_T1=25.78% | CI_T2=56.71% | CI_T3=63.52% | CI_T4=96.14%
2026-02-12 16:11:07,047 - INFO - [Task 4 | ep 2 | step 250] loss=2.1123 c=0.3771 r=1.1807 | si=0.5152 | CI_T0=36.65% | CI_T1=27.29% | CI_T2=37.30% | CI_T3=62.45% | CI_T4=96.37%
2026-02-12 16:11:26,441 - INFO - [Task 4 | ep 2 | step 275] loss=1.7014 c=0.2983 r=0.8494 | si=0.5148 | CI_T0=10.04% | CI_T1=15.88% | CI_T2=42.03% | CI_T3=68.11% | CI_T4=95.47%
2026-02-12 16:11:49,128 - INFO - [Task 4 | ep 3 | step 300] loss=1.7042 c=0.2938 r=0.8614 | si=0.5146 | CI_T0=32.92% | CI_T1=26.10% | CI_T2=54.00% | CI_T3=58.10% | CI_T4=95.56%
2026-02-12 16:12:08,291 - INFO - [Task 4 | ep 3 | step 325] loss=1.6058 c=0.2640 r=0.7902 | si=0.5151 | CI_T0=12.54% | CI_T1=21.53% | CI_T2=37.92% | CI_T3=69.00% | CI_T4=96.90%
2026-02-12 16:12:27,616 - INFO - [Task 4 | ep 3 | step 350] loss=1.6465 c=0.3253 r=0.7721 | si=0.5148 | CI_T0=38.45% | CI_T1=27.77% | CI_T2=44.10% | CI_T3=58.35% | CI_T4=95.73%
2026-02-12 16:12:47,715 - INFO - [After Task 4] Task-IL : T0=99.95% | T1=94.76% | T2=97.01% | T3=98.79% | T4=98.44% | Avg=97.79%
2026-02-12 16:12:47,715 - INFO - [After Task 4] Class-IL: T0=19.95% | T1=28.40% | T2=36.29% | T3=50.76% | T4=93.70% | Avg=45.82%
2026-02-12 16:12:47,715 - INFO - ========== GROUP DIFFERENCES ==========
2026-02-12 16:12:47,715 - INFO - Seen tasks: 0..4 | valid_out_dim=10
2026-02-12 16:12:49,673 - INFO - [Group=Task0] CI_acc=19.95% | corr_slice_max=5.908 | best_other_max=7.022 | gap=-1.114
2026-02-12 16:12:49,673 - INFO - [Group=Task0] winner_task_dist: W0=20.0% | W1=6.1% | W2=5.4% | W3=24.2% | W4=44.3%
2026-02-12 16:12:49,673 - INFO - [Group=Task0] slice_strength : S0=5.91 | S1=4.90 | S2=5.30 | S3=6.16 | S4=6.69
2026-02-12 16:12:51,625 - INFO - [Group=Task1] CI_acc=28.40% | corr_slice_max=6.477 | best_other_max=7.524 | gap=-1.047
2026-02-12 16:12:51,625 - INFO - [Group=Task1] winner_task_dist: W0=0.1% | W1=28.4% | W2=25.8% | W3=9.1% | W4=36.7%
2026-02-12 16:12:51,625 - INFO - [Group=Task1] slice_strength : S0=2.82 | S1=6.48 | S2=6.56 | S3=5.74 | S4=7.00
2026-02-12 16:12:53,563 - INFO - [Group=Task2] CI_acc=36.29% | corr_slice_max=8.466 | best_other_max=8.873 | gap=-0.407
2026-02-12 16:12:53,563 - INFO - [Group=Task2] winner_task_dist: W0=0.0% | W1=0.0% | W2=36.3% | W3=2.0% | W4=61.6%
2026-02-12 16:12:53,563 - INFO - [Group=Task2] slice_strength : S0=3.46 | S1=4.99 | S2=8.47 | S3=6.72 | S4=8.85
2026-02-12 16:12:55,518 - INFO - [Group=Task3] CI_acc=50.76% | corr_slice_max=8.920 | best_other_max=8.568 | gap=0.353
2026-02-12 16:12:55,518 - INFO - [Group=Task3] winner_task_dist: W0=0.0% | W1=0.2% | W2=2.5% | W3=50.8% | W4=46.6%
2026-02-12 16:12:55,518 - INFO - [Group=Task3] slice_strength : S0=3.50 | S1=4.69 | S2=6.89 | S3=8.92 | S4=8.50
2026-02-12 16:12:57,482 - INFO - [Group=Task4] CI_acc=93.70% | corr_slice_max=9.861 | best_other_max=8.130 | gap=1.731
2026-02-12 16:12:57,482 - INFO - [Group=Task4] winner_task_dist: W0=0.1% | W1=0.2% | W2=2.4% | W3=3.2% | W4=94.2%
2026-02-12 16:12:57,482 - INFO - [Group=Task4] slice_strength : S0=3.22 | S1=5.31 | S2=7.49 | S3=7.66 | S4=9.86
2026-02-12 16:12:57,482 - INFO - ======================================
2026-02-12 16:12:57,482 - INFO - ========== FINAL METRICS (Class-IL) ==========
2026-02-12 16:12:57,483 - INFO - Forgetting per task: T0=79.95%, T1=68.95%, T2=61.42%, T3=48.04%, T4=0.00%
2026-02-12 16:12:57,483 - INFO - BWT: -64.59%
2026-02-12 16:12:57,483 - INFO - Final average Class-IL accuracy: 45.82%
