2026-02-13 12:21:53,520 - INFO - Device: cuda
2026-02-13 12:21:53,520 - INFO - Config: {'device': 'cuda', 'lr': 0.005, 'epochs_per_task': 4, 'batch_size': 128, 'lambda_slice': 2.0, 'lambda_feat': 0.5, 'vae_epochs': 5, 'vae_n_fake_per_task': 32, 'lambda_adv_feat': 0.1, 'lambda_adv_slice': 0.1, 'slice_margin': 0.3, 'lambda_margin': 0.5, 'lambda_contrast': 0.5, 'contrast_tau': 0.1}
2026-02-13 12:21:53,600 - INFO - ========== Task 0: classes [0, 1] ==========
2026-02-13 12:22:23,841 - INFO - [Task 0 | ep 0 | step 0] loss=0.8626 | CI_T0=96.85%
2026-02-13 12:22:28,253 - INFO - [Task 0 | ep 0 | step 25] loss=0.0311 | CI_T0=99.83%
2026-02-13 12:22:32,729 - INFO - [Task 0 | ep 0 | step 50] loss=0.0042 | CI_T0=99.86%
2026-02-13 12:22:37,171 - INFO - [Task 0 | ep 0 | step 75] loss=0.0349 | CI_T0=99.88%
2026-02-13 12:22:45,512 - INFO - [Task 0 | ep 1 | step 100] loss=0.0008 | CI_T0=99.93%
2026-02-13 12:22:49,970 - INFO - [Task 0 | ep 1 | step 125] loss=0.0199 | CI_T0=99.93%
2026-02-13 12:22:54,491 - INFO - [Task 0 | ep 1 | step 150] loss=0.0004 | CI_T0=99.96%
2026-02-13 12:22:58,977 - INFO - [Task 0 | ep 1 | step 175] loss=0.0004 | CI_T0=99.97%
2026-02-13 12:23:07,390 - INFO - [Task 0 | ep 2 | step 200] loss=0.0001 | CI_T0=99.96%
2026-02-13 12:23:11,881 - INFO - [Task 0 | ep 2 | step 225] loss=0.0001 | CI_T0=99.96%
2026-02-13 12:23:16,348 - INFO - [Task 0 | ep 2 | step 250] loss=0.0001 | CI_T0=99.94%
2026-02-13 12:23:20,853 - INFO - [Task 0 | ep 2 | step 275] loss=0.0002 | CI_T0=99.97%
2026-02-13 12:23:29,190 - INFO - [Task 0 | ep 3 | step 300] loss=0.0003 | CI_T0=100.00%
2026-02-13 12:23:33,626 - INFO - [Task 0 | ep 3 | step 325] loss=0.0001 | CI_T0=99.98%
2026-02-13 12:23:38,115 - INFO - [Task 0 | ep 3 | step 350] loss=0.0001 | CI_T0=99.99%
2026-02-13 12:23:42,580 - INFO - [Task 0 | ep 3 | step 375] loss=0.0001 | CI_T0=99.98%
2026-02-13 12:23:51,718 - INFO - [After Task 0] Task-IL : T0=99.91% | Avg=99.91%
2026-02-13 12:23:51,719 - INFO - [After Task 0] Class-IL: T0=99.91% | Avg=99.91%
2026-02-13 12:23:51,719 - INFO - ========== GROUP DIFFERENCES ==========
2026-02-13 12:23:51,719 - INFO - Seen tasks: 0..0 | valid_out_dim=2
2026-02-13 12:23:53,914 - INFO - [Group=Task0] CI_acc=99.91% | corr_slice_max=5.153 | best_other_max=nan | gap=nan
2026-02-13 12:23:53,914 - INFO - [Group=Task0] winner_task_dist: W0=100.0%
2026-02-13 12:23:53,914 - INFO - [Group=Task0] slice_strength : S0=5.15
2026-02-13 12:23:53,914 - INFO - ======================================
2026-02-13 12:23:53,914 - INFO - ========== Task 1: classes [2, 3] ==========
2026-02-13 12:24:27,882 - INFO - [Task 1 | ep 0 | step 0] loss=6.9833 | CI_T0=99.98% | CI_T1=1.58%
2026-02-13 12:24:36,881 - INFO - [Task 1 | ep 0 | step 25] loss=2.5919 | CI_T0=25.28% | CI_T1=86.32%
2026-02-13 12:24:45,899 - INFO - [Task 1 | ep 0 | step 50] loss=2.3524 | CI_T0=5.01% | CI_T1=54.95%
2026-02-13 12:24:54,945 - INFO - [Task 1 | ep 0 | step 75] loss=2.4732 | CI_T0=7.14% | CI_T1=58.21%
2026-02-13 12:25:07,888 - INFO - [Task 1 | ep 1 | step 100] loss=2.3993 | CI_T0=27.91% | CI_T1=79.57%
2026-02-13 12:25:16,935 - INFO - [Task 1 | ep 1 | step 125] loss=2.5745 | CI_T0=33.60% | CI_T1=83.24%
2026-02-13 12:25:25,896 - INFO - [Task 1 | ep 1 | step 150] loss=2.1292 | CI_T0=32.54% | CI_T1=86.44%
2026-02-13 12:25:34,993 - INFO - [Task 1 | ep 1 | step 175] loss=2.4656 | CI_T0=28.47% | CI_T1=86.41%
2026-02-13 12:25:47,895 - INFO - [Task 1 | ep 2 | step 200] loss=2.3502 | CI_T0=30.35% | CI_T1=85.70%
2026-02-13 12:25:56,932 - INFO - [Task 1 | ep 2 | step 225] loss=2.1703 | CI_T0=31.70% | CI_T1=79.63%
2026-02-13 12:26:06,064 - INFO - [Task 1 | ep 2 | step 250] loss=2.5565 | CI_T0=36.10% | CI_T1=77.23%
2026-02-13 12:26:15,106 - INFO - [Task 1 | ep 2 | step 275] loss=2.3712 | CI_T0=33.90% | CI_T1=79.50%
2026-02-13 12:26:28,040 - INFO - [Task 1 | ep 3 | step 300] loss=2.7984 | CI_T0=30.34% | CI_T1=78.97%
2026-02-13 12:26:37,067 - INFO - [Task 1 | ep 3 | step 325] loss=2.2118 | CI_T0=34.78% | CI_T1=79.16%
2026-02-13 12:26:46,069 - INFO - [Task 1 | ep 3 | step 350] loss=2.4226 | CI_T0=38.54% | CI_T1=85.53%
2026-02-13 12:26:55,045 - INFO - [Task 1 | ep 3 | step 375] loss=2.4904 | CI_T0=33.90% | CI_T1=68.61%
2026-02-13 12:27:08,413 - INFO - [After Task 1] Task-IL : T0=98.44% | T1=94.03% | Avg=96.23%
2026-02-13 12:27:08,413 - INFO - [After Task 1] Class-IL: T0=33.76% | T1=66.60% | Avg=50.18%
2026-02-13 12:27:08,413 - INFO - ========== GROUP DIFFERENCES ==========
2026-02-13 12:27:08,413 - INFO - Seen tasks: 0..1 | valid_out_dim=4
2026-02-13 12:27:10,612 - INFO - [Group=Task0] CI_acc=33.76% | corr_slice_max=3.358 | best_other_max=4.210 | gap=-0.852
2026-02-13 12:27:10,612 - INFO - [Group=Task0] winner_task_dist: W0=34.2% | W1=65.8%
2026-02-13 12:27:10,612 - INFO - [Group=Task0] slice_strength : S0=3.36 | S1=4.21
2026-02-13 12:27:12,831 - INFO - [Group=Task1] CI_acc=66.60% | corr_slice_max=3.069 | best_other_max=2.243 | gap=0.826
2026-02-13 12:27:12,831 - INFO - [Group=Task1] winner_task_dist: W0=31.1% | W1=68.9%
2026-02-13 12:27:12,831 - INFO - [Group=Task1] slice_strength : S0=2.24 | S1=3.07
2026-02-13 12:27:12,831 - INFO - ======================================
2026-02-13 12:27:12,832 - INFO - ========== Task 2: classes [4, 5] ==========
2026-02-13 12:27:50,833 - INFO - [Task 2 | ep 0 | step 0] loss=8.6688 | CI_T0=61.74% | CI_T1=77.58% | CI_T2=0.10%
2026-02-13 12:28:04,212 - INFO - [Task 2 | ep 0 | step 25] loss=2.1733 | CI_T0=68.15% | CI_T1=5.50% | CI_T2=89.55%
2026-02-13 12:28:17,560 - INFO - [Task 2 | ep 0 | step 50] loss=2.2005 | CI_T0=38.31% | CI_T1=15.84% | CI_T2=90.76%
2026-02-13 12:28:30,835 - INFO - [Task 2 | ep 0 | step 75] loss=2.3603 | CI_T0=70.42% | CI_T1=14.64% | CI_T2=92.49%
2026-02-13 12:28:48,258 - INFO - [Task 2 | ep 1 | step 100] loss=2.7561 | CI_T0=62.56% | CI_T1=16.04% | CI_T2=93.56%
2026-02-13 12:29:01,592 - INFO - [Task 2 | ep 1 | step 125] loss=2.8871 | CI_T0=62.40% | CI_T1=17.35% | CI_T2=90.49%
2026-02-13 12:29:14,943 - INFO - [Task 2 | ep 1 | step 150] loss=2.8948 | CI_T0=62.07% | CI_T1=24.11% | CI_T2=85.41%
2026-02-13 12:29:32,196 - INFO - [Task 2 | ep 2 | step 175] loss=3.1734 | CI_T0=57.65% | CI_T1=21.65% | CI_T2=93.71%
2026-02-13 12:29:45,317 - INFO - [Task 2 | ep 2 | step 200] loss=2.9705 | CI_T0=48.71% | CI_T1=20.06% | CI_T2=92.91%
2026-02-13 12:29:58,649 - INFO - [Task 2 | ep 2 | step 225] loss=2.9346 | CI_T0=62.05% | CI_T1=18.82% | CI_T2=94.54%
2026-02-13 12:30:11,847 - INFO - [Task 2 | ep 2 | step 250] loss=2.9527 | CI_T0=43.24% | CI_T1=12.76% | CI_T2=83.01%
2026-02-13 12:30:29,159 - INFO - [Task 2 | ep 3 | step 275] loss=3.0962 | CI_T0=46.36% | CI_T1=15.28% | CI_T2=79.13%
2026-02-13 12:30:42,529 - INFO - [Task 2 | ep 3 | step 300] loss=3.0133 | CI_T0=73.57% | CI_T1=17.74% | CI_T2=93.84%
2026-02-13 12:30:55,909 - INFO - [Task 2 | ep 3 | step 325] loss=3.1221 | CI_T0=77.62% | CI_T1=13.31% | CI_T2=91.08%
2026-02-13 12:31:14,023 - INFO - [After Task 2] Task-IL : T0=99.53% | T1=80.41% | T2=99.09% | Avg=93.01%
2026-02-13 12:31:14,023 - INFO - [After Task 2] Class-IL: T0=65.58% | T1=20.57% | T2=95.30% | Avg=60.48%
2026-02-13 12:31:14,023 - INFO - ========== GROUP DIFFERENCES ==========
2026-02-13 12:31:14,023 - INFO - Seen tasks: 0..2 | valid_out_dim=6
2026-02-13 12:31:16,241 - INFO - [Group=Task0] CI_acc=65.58% | corr_slice_max=4.032 | best_other_max=3.781 | gap=0.250
2026-02-13 12:31:16,241 - INFO - [Group=Task0] winner_task_dist: W0=65.6% | W1=4.7% | W2=29.7%
2026-02-13 12:31:16,243 - INFO - [Group=Task0] slice_strength : S0=4.03 | S1=2.74 | S2=3.54
2026-02-13 12:31:18,457 - INFO - [Group=Task1] CI_acc=20.57% | corr_slice_max=3.701 | best_other_max=4.863 | gap=-1.162
2026-02-13 12:31:18,458 - INFO - [Group=Task1] winner_task_dist: W0=8.1% | W1=22.3% | W2=69.6%
2026-02-13 12:31:18,458 - INFO - [Group=Task1] slice_strength : S0=2.53 | S1=3.70 | S2=4.74
2026-02-13 12:31:20,664 - INFO - [Group=Task2] CI_acc=95.30% | corr_slice_max=5.950 | best_other_max=4.189 | gap=1.761
2026-02-13 12:31:20,664 - INFO - [Group=Task2] winner_task_dist: W0=1.4% | W1=3.3% | W2=95.3%
2026-02-13 12:31:20,664 - INFO - [Group=Task2] slice_strength : S0=3.54 | S1=3.31 | S2=5.95
2026-02-13 12:31:20,664 - INFO - ======================================
2026-02-13 12:31:20,664 - INFO - ========== Task 3: classes [6, 7] ==========
2026-02-13 12:32:03,368 - INFO - [Task 3 | ep 0 | step 0] loss=9.1023 | CI_T0=82.09% | CI_T1=31.59% | CI_T2=93.45% | CI_T3=0.01%
2026-02-13 12:32:21,123 - INFO - [Task 3 | ep 0 | step 25] loss=2.2563 | CI_T0=66.40% | CI_T1=34.56% | CI_T2=51.80% | CI_T3=94.51%
2026-02-13 12:32:38,848 - INFO - [Task 3 | ep 0 | step 50] loss=2.2655 | CI_T0=62.09% | CI_T1=30.13% | CI_T2=56.43% | CI_T3=97.56%
2026-02-13 12:32:56,472 - INFO - [Task 3 | ep 0 | step 75] loss=2.5694 | CI_T0=41.10% | CI_T1=28.47% | CI_T2=64.96% | CI_T3=97.82%
2026-02-13 12:33:17,916 - INFO - [Task 3 | ep 1 | step 100] loss=2.5232 | CI_T0=63.23% | CI_T1=23.06% | CI_T2=56.51% | CI_T3=95.84%
2026-02-13 12:33:35,548 - INFO - [Task 3 | ep 1 | step 125] loss=2.6001 | CI_T0=44.71% | CI_T1=21.20% | CI_T2=53.65% | CI_T3=98.46%
2026-02-13 12:33:53,208 - INFO - [Task 3 | ep 1 | step 150] loss=2.8311 | CI_T0=47.82% | CI_T1=19.37% | CI_T2=50.23% | CI_T3=98.70%
2026-02-13 12:34:10,753 - INFO - [Task 3 | ep 1 | step 175] loss=2.9208 | CI_T0=29.26% | CI_T1=18.38% | CI_T2=47.45% | CI_T3=97.36%
2026-02-13 12:34:32,295 - INFO - [Task 3 | ep 2 | step 200] loss=3.1931 | CI_T0=52.56% | CI_T1=31.95% | CI_T2=46.03% | CI_T3=96.94%
2026-02-13 12:34:49,987 - INFO - [Task 3 | ep 2 | step 225] loss=3.1755 | CI_T0=30.06% | CI_T1=15.09% | CI_T2=58.66% | CI_T3=96.79%
2026-02-13 12:35:07,552 - INFO - [Task 3 | ep 2 | step 250] loss=3.1752 | CI_T0=68.01% | CI_T1=17.29% | CI_T2=52.31% | CI_T3=98.29%
2026-02-13 12:35:25,263 - INFO - [Task 3 | ep 2 | step 275] loss=2.9225 | CI_T0=72.61% | CI_T1=17.71% | CI_T2=45.66% | CI_T3=98.11%
2026-02-13 12:35:46,734 - INFO - [Task 3 | ep 3 | step 300] loss=3.1193 | CI_T0=72.49% | CI_T1=26.24% | CI_T2=41.32% | CI_T3=98.24%
2026-02-13 12:36:04,279 - INFO - [Task 3 | ep 3 | step 325] loss=3.2394 | CI_T0=42.40% | CI_T1=32.36% | CI_T2=39.31% | CI_T3=92.10%
2026-02-13 12:36:21,914 - INFO - [Task 3 | ep 3 | step 350] loss=3.0796 | CI_T0=64.38% | CI_T1=23.37% | CI_T2=49.21% | CI_T3=96.92%
2026-02-13 12:36:39,609 - INFO - [Task 3 | ep 3 | step 375] loss=2.9666 | CI_T0=54.33% | CI_T1=34.33% | CI_T2=40.37% | CI_T3=95.60%
2026-02-13 12:37:01,861 - INFO - [After Task 3] Task-IL : T0=99.62% | T1=93.44% | T2=95.78% | T3=99.24% | Avg=97.02%
2026-02-13 12:37:01,863 - INFO - [After Task 3] Class-IL: T0=54.14% | T1=36.53% | T2=39.11% | T3=94.91% | Avg=56.17%
2026-02-13 12:37:01,863 - INFO - ========== GROUP DIFFERENCES ==========
2026-02-13 12:37:01,863 - INFO - Seen tasks: 0..3 | valid_out_dim=8
2026-02-13 12:37:04,096 - INFO - [Group=Task0] CI_acc=54.14% | corr_slice_max=4.983 | best_other_max=4.967 | gap=0.017
2026-02-13 12:37:04,096 - INFO - [Group=Task0] winner_task_dist: W0=54.2% | W1=0.9% | W2=1.7% | W3=43.1%
2026-02-13 12:37:04,096 - INFO - [Group=Task0] slice_strength : S0=4.98 | S1=2.29 | S2=3.10 | S3=4.86
2026-02-13 12:37:06,288 - INFO - [Group=Task1] CI_acc=36.53% | corr_slice_max=3.926 | best_other_max=4.978 | gap=-1.052
2026-02-13 12:37:06,288 - INFO - [Group=Task1] winner_task_dist: W0=3.4% | W1=36.5% | W2=18.1% | W3=42.0%
2026-02-13 12:37:06,288 - INFO - [Group=Task1] slice_strength : S0=2.64 | S1=3.93 | S2=3.80 | S3=4.55
2026-02-13 12:37:08,511 - INFO - [Group=Task2] CI_acc=39.11% | corr_slice_max=5.649 | best_other_max=5.749 | gap=-0.100
2026-02-13 12:37:08,511 - INFO - [Group=Task2] winner_task_dist: W0=3.1% | W1=2.0% | W2=39.3% | W3=55.5%
2026-02-13 12:37:08,511 - INFO - [Group=Task2] slice_strength : S0=3.26 | S1=2.70 | S2=5.65 | S3=5.62
2026-02-13 12:37:10,716 - INFO - [Group=Task3] CI_acc=94.91% | corr_slice_max=7.094 | best_other_max=5.438 | gap=1.655
2026-02-13 12:37:10,716 - INFO - [Group=Task3] winner_task_dist: W0=0.5% | W1=0.1% | W2=4.5% | W3=95.0%
2026-02-13 12:37:10,716 - INFO - [Group=Task3] slice_strength : S0=3.77 | S1=2.69 | S2=5.19 | S3=7.09
2026-02-13 12:37:10,717 - INFO - ======================================
2026-02-13 12:37:10,717 - INFO - ========== Task 4: classes [8, 9] ==========
2026-02-13 12:37:57,660 - INFO - [Task 4 | ep 0 | step 0] loss=11.1946 | CI_T0=84.32% | CI_T1=33.87% | CI_T2=51.02% | CI_T3=98.18% | CI_T4=0.00%
2026-02-13 12:38:19,649 - INFO - [Task 4 | ep 0 | step 25] loss=3.6190 | CI_T0=29.60% | CI_T1=2.39% | CI_T2=6.61% | CI_T3=35.72% | CI_T4=86.36%
2026-02-13 12:38:41,700 - INFO - [Task 4 | ep 0 | step 50] loss=3.1089 | CI_T0=26.72% | CI_T1=3.46% | CI_T2=16.39% | CI_T3=49.04% | CI_T4=89.80%
2026-02-13 12:39:03,782 - INFO - [Task 4 | ep 0 | step 75] loss=3.0356 | CI_T0=37.28% | CI_T1=8.55% | CI_T2=19.95% | CI_T3=50.33% | CI_T4=93.86%
2026-02-13 12:39:29,483 - INFO - [Task 4 | ep 1 | step 100] loss=3.0250 | CI_T0=28.79% | CI_T1=9.26% | CI_T2=23.13% | CI_T3=49.04% | CI_T4=94.99%
2026-02-13 12:39:51,468 - INFO - [Task 4 | ep 1 | step 125] loss=3.2022 | CI_T0=34.13% | CI_T1=9.87% | CI_T2=24.12% | CI_T3=39.72% | CI_T4=95.33%
2026-02-13 12:40:13,620 - INFO - [Task 4 | ep 1 | step 150] loss=3.0065 | CI_T0=53.62% | CI_T1=9.05% | CI_T2=29.27% | CI_T3=31.00% | CI_T4=94.10%
2026-02-13 12:40:35,580 - INFO - [Task 4 | ep 1 | step 175] loss=3.2883 | CI_T0=33.41% | CI_T1=8.20% | CI_T2=31.59% | CI_T3=33.96% | CI_T4=92.79%
2026-02-13 12:41:01,627 - INFO - [Task 4 | ep 2 | step 200] loss=3.4107 | CI_T0=29.01% | CI_T1=9.57% | CI_T2=26.25% | CI_T3=45.06% | CI_T4=95.47%
2026-02-13 12:41:23,640 - INFO - [Task 4 | ep 2 | step 225] loss=3.5163 | CI_T0=23.16% | CI_T1=10.76% | CI_T2=24.23% | CI_T3=41.10% | CI_T4=96.14%
2026-02-13 12:41:45,637 - INFO - [Task 4 | ep 2 | step 250] loss=3.2926 | CI_T0=33.32% | CI_T1=8.59% | CI_T2=34.06% | CI_T3=42.11% | CI_T4=95.71%
2026-02-13 12:42:07,460 - INFO - [Task 4 | ep 2 | step 275] loss=3.5478 | CI_T0=44.47% | CI_T1=9.05% | CI_T2=31.70% | CI_T3=45.74% | CI_T4=96.26%
2026-02-13 12:42:33,311 - INFO - [Task 4 | ep 3 | step 300] loss=3.4482 | CI_T0=30.41% | CI_T1=9.21% | CI_T2=34.66% | CI_T3=47.72% | CI_T4=96.29%
2026-02-13 12:42:55,382 - INFO - [Task 4 | ep 3 | step 325] loss=3.5098 | CI_T0=39.26% | CI_T1=12.32% | CI_T2=32.55% | CI_T3=35.16% | CI_T4=96.47%
2026-02-13 12:43:17,598 - INFO - [Task 4 | ep 3 | step 350] loss=3.5865 | CI_T0=31.96% | CI_T1=10.84% | CI_T2=36.21% | CI_T3=39.16% | CI_T4=96.01%
2026-02-13 12:43:44,537 - INFO - [After Task 4] Task-IL : T0=99.76% | T1=81.64% | T2=98.19% | T3=86.35% | T4=98.39% | Avg=92.87%
2026-02-13 12:43:44,538 - INFO - [After Task 4] Class-IL: T0=57.40% | T1=9.84% | T2=31.43% | T3=47.43% | T4=92.69% | Avg=47.76%
2026-02-13 12:43:44,538 - INFO - ========== GROUP DIFFERENCES ==========
2026-02-13 12:43:44,538 - INFO - Seen tasks: 0..4 | valid_out_dim=10
2026-02-13 12:43:46,766 - INFO - [Group=Task0] CI_acc=57.40% | corr_slice_max=5.406 | best_other_max=5.477 | gap=-0.071
2026-02-13 12:43:46,766 - INFO - [Group=Task0] winner_task_dist: W0=57.4% | W1=0.0% | W2=0.9% | W3=13.6% | W4=28.1%
2026-02-13 12:43:46,767 - INFO - [Group=Task0] slice_strength : S0=5.41 | S1=2.05 | S2=3.42 | S3=4.43 | S4=5.28
2026-02-13 12:43:48,944 - INFO - [Group=Task1] CI_acc=9.84% | corr_slice_max=2.981 | best_other_max=6.069 | gap=-3.088
2026-02-13 12:43:48,944 - INFO - [Group=Task1] winner_task_dist: W0=3.1% | W1=9.9% | W2=15.8% | W3=15.1% | W4=56.1%
2026-02-13 12:43:48,944 - INFO - [Group=Task1] slice_strength : S0=2.58 | S1=2.98 | S2=4.26 | S3=4.52 | S4=5.68
2026-02-13 12:43:51,134 - INFO - [Group=Task2] CI_acc=31.43% | corr_slice_max=6.176 | best_other_max=7.095 | gap=-0.919
2026-02-13 12:43:51,134 - INFO - [Group=Task2] winner_task_dist: W0=0.4% | W1=0.1% | W2=31.4% | W3=4.7% | W4=63.4%
2026-02-13 12:43:51,134 - INFO - [Group=Task2] slice_strength : S0=2.53 | S1=2.41 | S2=6.18 | S3=5.44 | S4=7.04
2026-02-13 12:43:53,338 - INFO - [Group=Task3] CI_acc=47.43% | corr_slice_max=6.735 | best_other_max=7.038 | gap=-0.303
2026-02-13 12:43:53,338 - INFO - [Group=Task3] winner_task_dist: W0=0.8% | W1=0.4% | W2=10.2% | W3=47.7% | W4=40.9%
2026-02-13 12:43:53,338 - INFO - [Group=Task3] slice_strength : S0=2.32 | S1=2.37 | S2=4.52 | S3=6.73 | S4=6.90
2026-02-13 12:43:55,547 - INFO - [Group=Task4] CI_acc=92.69% | corr_slice_max=8.447 | best_other_max=6.813 | gap=1.634
2026-02-13 12:43:55,547 - INFO - [Group=Task4] winner_task_dist: W0=0.5% | W1=0.1% | W2=1.0% | W3=5.5% | W4=92.9%
2026-02-13 12:43:55,547 - INFO - [Group=Task4] slice_strength : S0=2.67 | S1=2.64 | S2=4.77 | S3=6.54 | S4=8.45
2026-02-13 12:43:55,547 - INFO - ======================================
2026-02-13 12:43:55,547 - INFO - ========== FINAL METRICS (Class-IL) ==========
2026-02-13 12:43:55,547 - INFO - Forgetting per task: T0=42.51%, T1=56.76%, T2=63.87%, T3=47.48%, T4=0.00%
2026-02-13 12:43:55,547 - INFO - BWT: -52.66%
2026-02-13 12:43:55,547 - INFO - Final average Class-IL accuracy: 47.76%
