2026-02-11 18:48:59,726 - INFO - Device: cpu
2026-02-11 18:48:59,726 - INFO - Config: {'device': 'cpu', 'lr': 0.005, 'epochs_per_task': 4, 'batch_size': 128, 'lambda_slice': 2.0, 'lambda_feat': 0.5, 'use_cosine_head': True, 'seed': 42, 'freeze_backbone_after_task': -1, 'ewc_lambda': 0.0, 'si_lambda': 0.0, 'use_attention_backbone': False, 'use_adapters': False, 'lambda_slice_balance': 0.5, 'lambda_slice_margin': 0.0, 'slice_margin': 0.5, 'use_task_inference': False, 'lambda_task_inference': 1.0}
2026-02-11 18:48:59,729 - INFO - ========== Training Task 0: classes [0, 1] ==========
2026-02-11 18:49:06,817 - INFO - [Task 0 | ep 0 | step 0] loss=0.8633 c=0.8633 r=0.0000 | CI_T0=95.74%
2026-02-11 18:49:10,766 - INFO - [Task 0 | ep 0 | step 25] loss=0.0014 c=0.0014 r=0.0000 | CI_T0=99.93%
2026-02-11 18:49:14,741 - INFO - [Task 0 | ep 0 | step 50] loss=0.0007 c=0.0007 r=0.0000 | CI_T0=99.85%
2026-02-11 18:49:18,716 - INFO - [Task 0 | ep 0 | step 75] loss=0.0003 c=0.0003 r=0.0000 | CI_T0=99.97%
2026-02-11 18:49:26,202 - INFO - [Task 0 | ep 1 | step 100] loss=0.0003 c=0.0003 r=0.0000 | CI_T0=99.94%
2026-02-11 18:49:30,169 - INFO - [Task 0 | ep 1 | step 125] loss=0.0005 c=0.0005 r=0.0000 | CI_T0=99.94%
2026-02-11 18:49:34,148 - INFO - [Task 0 | ep 1 | step 150] loss=0.0003 c=0.0003 r=0.0000 | CI_T0=99.92%
2026-02-11 18:49:38,121 - INFO - [Task 0 | ep 1 | step 175] loss=0.0002 c=0.0002 r=0.0000 | CI_T0=99.94%
2026-02-11 18:49:45,622 - INFO - [Task 0 | ep 2 | step 200] loss=0.0001 c=0.0001 r=0.0000 | CI_T0=99.97%
2026-02-11 18:49:49,598 - INFO - [Task 0 | ep 2 | step 225] loss=0.0001 c=0.0001 r=0.0000 | CI_T0=99.94%
2026-02-11 18:49:53,586 - INFO - [Task 0 | ep 2 | step 250] loss=0.0003 c=0.0003 r=0.0000 | CI_T0=99.96%
2026-02-11 18:49:57,552 - INFO - [Task 0 | ep 2 | step 275] loss=0.0003 c=0.0003 r=0.0000 | CI_T0=99.97%
2026-02-11 18:50:05,075 - INFO - [Task 0 | ep 3 | step 300] loss=0.0001 c=0.0001 r=0.0000 | CI_T0=99.96%
2026-02-11 18:50:09,062 - INFO - [Task 0 | ep 3 | step 325] loss=0.0001 c=0.0001 r=0.0000 | CI_T0=99.96%
2026-02-11 18:50:13,042 - INFO - [Task 0 | ep 3 | step 350] loss=0.0005 c=0.0005 r=0.0000 | CI_T0=99.98%
2026-02-11 18:50:17,025 - INFO - [Task 0 | ep 3 | step 375] loss=0.0008 c=0.0008 r=0.0000 | CI_T0=99.98%
2026-02-11 18:50:21,356 - INFO - [After Task 0] Task-IL : T0=99.91% | Avg=99.91%
2026-02-11 18:50:21,356 - INFO - [After Task 0] Class-IL: T0=99.91% | Avg=99.91%
2026-02-11 18:50:21,356 - INFO - ========== GROUP DIFFERENCES ==========
2026-02-11 18:50:21,356 - INFO - Seen tasks: 0..0 | valid_out_dim=2
2026-02-11 18:50:23,351 - INFO - [Group=Task0] CI_acc=99.91% | corr_slice_max=5.001 | best_other_max=nan | gap=nan
2026-02-11 18:50:23,351 - INFO - [Group=Task0] winner_task_dist: W0=100.0%
2026-02-11 18:50:23,351 - INFO - [Group=Task0] slice_strength : S0=5.00
2026-02-11 18:50:23,351 - INFO - ======================================
2026-02-11 18:50:23,351 - INFO - ========== Training Task 1: classes [2, 3] ==========
2026-02-11 18:50:34,342 - INFO - [Task 1 | ep 0 | step 0] loss=10.3383 c=4.1526 r=2.5354 | bal=3.6503 | CI_T0=99.95% | CI_T1=8.13%
2026-02-11 18:50:42,157 - INFO - [Task 1 | ep 0 | step 25] loss=2.0591 c=0.5449 r=1.2860 | bal=0.2281 | CI_T0=98.16% | CI_T1=62.85%
2026-02-11 18:50:49,981 - INFO - [Task 1 | ep 0 | step 50] loss=1.6644 c=0.5853 r=0.9995 | bal=0.0796 | CI_T0=97.92% | CI_T1=77.58%
2026-02-11 18:50:57,774 - INFO - [Task 1 | ep 0 | step 75] loss=1.5776 c=0.5415 r=0.9172 | bal=0.1189 | CI_T0=78.12% | CI_T1=89.10%
2026-02-11 18:51:09,095 - INFO - [Task 1 | ep 1 | step 100] loss=1.4474 c=0.5083 r=0.7921 | bal=0.1471 | CI_T0=75.95% | CI_T1=84.28%
2026-02-11 18:51:16,910 - INFO - [Task 1 | ep 1 | step 125] loss=1.2522 c=0.5693 r=0.5989 | bal=0.0840 | CI_T0=84.18% | CI_T1=90.58%
2026-02-11 18:51:24,744 - INFO - [Task 1 | ep 1 | step 150] loss=1.5430 c=0.4970 r=0.9081 | bal=0.1379 | CI_T0=76.91% | CI_T1=91.18%
2026-02-11 18:51:32,747 - INFO - [Task 1 | ep 1 | step 175] loss=1.5574 c=0.5077 r=0.9432 | bal=0.1065 | CI_T0=90.06% | CI_T1=91.05%
2026-02-11 18:51:44,032 - INFO - [Task 1 | ep 2 | step 200] loss=1.7684 c=0.4921 r=1.1293 | bal=0.1470 | CI_T0=86.62% | CI_T1=92.72%
2026-02-11 18:51:51,834 - INFO - [Task 1 | ep 2 | step 225] loss=1.5195 c=0.4834 r=0.9258 | bal=0.1104 | CI_T0=70.99% | CI_T1=93.12%
2026-02-11 18:51:59,690 - INFO - [Task 1 | ep 2 | step 250] loss=1.2421 c=0.4730 r=0.6456 | bal=0.1235 | CI_T0=84.89% | CI_T1=94.46%
2026-02-11 18:52:07,581 - INFO - [Task 1 | ep 2 | step 275] loss=1.1720 c=0.4832 r=0.5683 | bal=0.1205 | CI_T0=82.73% | CI_T1=93.63%
2026-02-11 18:52:18,942 - INFO - [Task 1 | ep 3 | step 300] loss=1.2487 c=0.4802 r=0.6451 | bal=0.1233 | CI_T0=77.18% | CI_T1=89.68%
2026-02-11 18:52:26,800 - INFO - [Task 1 | ep 3 | step 325] loss=1.2297 c=0.4956 r=0.6325 | bal=0.1016 | CI_T0=83.68% | CI_T1=93.87%
2026-02-11 18:52:34,632 - INFO - [Task 1 | ep 3 | step 350] loss=1.1726 c=0.5399 r=0.5509 | bal=0.0817 | CI_T0=87.32% | CI_T1=93.18%
2026-02-11 18:52:42,433 - INFO - [Task 1 | ep 3 | step 375] loss=1.8189 c=0.4256 r=1.2134 | bal=0.1799 | CI_T0=78.25% | CI_T1=93.94%
2026-02-11 18:52:50,699 - INFO - [After Task 1] Task-IL : T0=99.91% | T1=98.78% | Avg=99.34%
2026-02-11 18:52:50,699 - INFO - [After Task 1] Class-IL: T0=76.93% | T1=94.27% | Avg=85.60%
2026-02-11 18:52:50,699 - INFO - ========== GROUP DIFFERENCES ==========
2026-02-11 18:52:50,699 - INFO - Seen tasks: 0..1 | valid_out_dim=4
2026-02-11 18:52:52,695 - INFO - [Group=Task0] CI_acc=76.93% | corr_slice_max=4.958 | best_other_max=4.662 | gap=0.297
2026-02-11 18:52:52,695 - INFO - [Group=Task0] winner_task_dist: W0=77.0% | W1=23.0%
2026-02-11 18:52:52,695 - INFO - [Group=Task0] slice_strength : S0=4.96 | S1=4.66
2026-02-11 18:52:54,674 - INFO - [Group=Task1] CI_acc=94.27% | corr_slice_max=3.448 | best_other_max=2.782 | gap=0.666
2026-02-11 18:52:54,674 - INFO - [Group=Task1] winner_task_dist: W0=5.3% | W1=94.7%
2026-02-11 18:52:54,674 - INFO - [Group=Task1] slice_strength : S0=2.78 | S1=3.45
2026-02-11 18:52:54,674 - INFO - ======================================
2026-02-11 18:52:54,674 - INFO - ========== Training Task 2: classes [4, 5] ==========
2026-02-11 18:53:09,402 - INFO - [Task 2 | ep 0 | step 0] loss=6.5824 c=3.4710 r=2.3217 | bal=0.7898 | CI_T0=76.43% | CI_T1=84.86% | CI_T2=7.75%
2026-02-11 18:53:21,209 - INFO - [Task 2 | ep 0 | step 25] loss=1.7783 c=0.7113 r=0.8437 | bal=0.2233 | CI_T0=64.14% | CI_T1=12.04% | CI_T2=89.51%
2026-02-11 18:53:32,968 - INFO - [Task 2 | ep 0 | step 50] loss=1.9738 c=0.6373 r=1.0824 | bal=0.2541 | CI_T0=30.67% | CI_T1=21.92% | CI_T2=92.47%
2026-02-11 18:53:44,770 - INFO - [Task 2 | ep 0 | step 75] loss=1.6043 c=0.5480 r=0.7565 | bal=0.2998 | CI_T0=16.29% | CI_T1=23.82% | CI_T2=95.86%
2026-02-11 18:54:00,278 - INFO - [Task 2 | ep 1 | step 100] loss=1.6854 c=0.6120 r=0.8474 | bal=0.2260 | CI_T0=34.14% | CI_T1=38.88% | CI_T2=92.60%
2026-02-11 18:54:12,146 - INFO - [Task 2 | ep 1 | step 125] loss=1.6677 c=0.5426 r=0.8395 | bal=0.2855 | CI_T0=16.48% | CI_T1=24.47% | CI_T2=97.34%
2026-02-11 18:54:23,940 - INFO - [Task 2 | ep 1 | step 150] loss=1.5396 c=0.5175 r=0.7128 | bal=0.3092 | CI_T0=38.74% | CI_T1=27.51% | CI_T2=98.21%
2026-02-11 18:54:39,238 - INFO - [Task 2 | ep 2 | step 175] loss=1.4999 c=0.5869 r=0.6819 | bal=0.2311 | CI_T0=39.41% | CI_T1=27.80% | CI_T2=97.54%
2026-02-11 18:54:50,955 - INFO - [Task 2 | ep 2 | step 200] loss=1.3041 c=0.5938 r=0.4830 | bal=0.2274 | CI_T0=40.89% | CI_T1=39.80% | CI_T2=97.84%
2026-02-11 18:55:02,675 - INFO - [Task 2 | ep 2 | step 225] loss=1.3006 c=0.5940 r=0.4715 | bal=0.2351 | CI_T0=42.26% | CI_T1=27.49% | CI_T2=98.28%
2026-02-11 18:55:14,431 - INFO - [Task 2 | ep 2 | step 250] loss=1.5953 c=0.5852 r=0.7729 | bal=0.2372 | CI_T0=40.32% | CI_T1=23.39% | CI_T2=98.47%
2026-02-11 18:55:29,875 - INFO - [Task 2 | ep 3 | step 275] loss=1.4121 c=0.5724 r=0.6020 | bal=0.2376 | CI_T0=30.44% | CI_T1=32.28% | CI_T2=98.75%
2026-02-11 18:55:41,843 - INFO - [Task 2 | ep 3 | step 300] loss=1.8731 c=0.5822 r=1.0621 | bal=0.2287 | CI_T0=18.45% | CI_T1=29.34% | CI_T2=97.89%
2026-02-11 18:55:53,612 - INFO - [Task 2 | ep 3 | step 325] loss=1.5779 c=0.5594 r=0.7736 | bal=0.2448 | CI_T0=64.51% | CI_T1=31.49% | CI_T2=98.37%
2026-02-11 18:56:05,983 - INFO - [After Task 2] Task-IL : T0=99.91% | T1=97.75% | T2=99.84% | Avg=99.16%
2026-02-11 18:56:05,984 - INFO - [After Task 2] Class-IL: T0=32.62% | T1=28.60% | T2=99.09% | Avg=53.44%
2026-02-11 18:56:05,984 - INFO - ========== GROUP DIFFERENCES ==========
2026-02-11 18:56:05,984 - INFO - Seen tasks: 0..2 | valid_out_dim=6
2026-02-11 18:56:07,972 - INFO - [Group=Task0] CI_acc=32.62% | corr_slice_max=4.984 | best_other_max=5.127 | gap=-0.143
2026-02-11 18:56:07,972 - INFO - [Group=Task0] winner_task_dist: W0=32.6% | W1=10.2% | W2=57.2%
2026-02-11 18:56:07,972 - INFO - [Group=Task0] slice_strength : S0=4.98 | S1=4.60 | S2=5.11
2026-02-11 18:56:09,941 - INFO - [Group=Task1] CI_acc=28.60% | corr_slice_max=3.278 | best_other_max=3.629 | gap=-0.351
2026-02-11 18:56:09,941 - INFO - [Group=Task1] winner_task_dist: W0=1.9% | W1=28.7% | W2=69.4%
2026-02-11 18:56:09,941 - INFO - [Group=Task1] slice_strength : S0=2.68 | S1=3.28 | S2=3.62
2026-02-11 18:56:11,926 - INFO - [Group=Task2] CI_acc=99.09% | corr_slice_max=4.059 | best_other_max=3.042 | gap=1.017
2026-02-11 18:56:11,926 - INFO - [Group=Task2] winner_task_dist: W0=0.2% | W1=0.7% | W2=99.1%
2026-02-11 18:56:11,926 - INFO - [Group=Task2] slice_strength : S0=2.65 | S1=2.92 | S2=4.06
2026-02-11 18:56:11,926 - INFO - ======================================
2026-02-11 18:56:11,926 - INFO - ========== Training Task 3: classes [6, 7] ==========
2026-02-11 18:56:30,626 - INFO - [Task 3 | ep 0 | step 0] loss=6.3395 c=4.4636 r=0.8635 | bal=1.0123 | CI_T0=30.23% | CI_T1=34.82% | CI_T2=98.42% | CI_T3=4.70%
2026-02-11 18:56:46,206 - INFO - [Task 3 | ep 0 | step 25] loss=1.8140 c=0.7134 r=0.7823 | bal=0.3183 | CI_T0=26.10% | CI_T1=2.74% | CI_T2=22.83% | CI_T3=96.37%
2026-02-11 18:57:01,726 - INFO - [Task 3 | ep 0 | step 50] loss=1.5230 c=0.5811 r=0.5417 | bal=0.4001 | CI_T0=12.48% | CI_T1=4.96% | CI_T2=33.41% | CI_T3=98.43%
2026-02-11 18:57:17,287 - INFO - [Task 3 | ep 0 | step 75] loss=1.6426 c=0.5632 r=0.6768 | bal=0.4025 | CI_T0=6.69% | CI_T1=8.11% | CI_T2=39.43% | CI_T3=98.82%
2026-02-11 18:57:36,455 - INFO - [Task 3 | ep 1 | step 100] loss=1.5963 c=0.5801 r=0.6507 | bal=0.3655 | CI_T0=3.72% | CI_T1=18.45% | CI_T2=43.56% | CI_T3=99.14%
2026-02-11 18:57:52,463 - INFO - [Task 3 | ep 1 | step 125] loss=1.8641 c=0.6252 r=0.8859 | bal=0.3531 | CI_T0=15.69% | CI_T1=21.28% | CI_T2=59.19% | CI_T3=98.69%
2026-02-11 18:58:08,216 - INFO - [Task 3 | ep 1 | step 150] loss=1.8750 c=0.5831 r=0.9276 | bal=0.3643 | CI_T0=7.73% | CI_T1=20.68% | CI_T2=56.03% | CI_T3=99.05%
2026-02-11 18:58:23,892 - INFO - [Task 3 | ep 1 | step 175] loss=1.5385 c=0.5788 r=0.5997 | bal=0.3600 | CI_T0=3.71% | CI_T1=25.75% | CI_T2=47.24% | CI_T3=99.21%
2026-02-11 18:58:43,007 - INFO - [Task 3 | ep 2 | step 200] loss=1.4881 c=0.5547 r=0.5428 | bal=0.3906 | CI_T0=6.62% | CI_T1=20.03% | CI_T2=52.81% | CI_T3=99.32%
2026-02-11 18:58:58,564 - INFO - [Task 3 | ep 2 | step 225] loss=1.6626 c=0.6021 r=0.7113 | bal=0.3492 | CI_T0=17.01% | CI_T1=21.11% | CI_T2=57.32% | CI_T3=99.33%
2026-02-11 18:59:14,161 - INFO - [Task 3 | ep 2 | step 250] loss=1.4893 c=0.5321 r=0.5623 | bal=0.3950 | CI_T0=4.39% | CI_T1=19.21% | CI_T2=49.70% | CI_T3=99.71%
2026-02-11 18:59:29,803 - INFO - [Task 3 | ep 2 | step 275] loss=1.4478 c=0.5428 r=0.5134 | bal=0.3917 | CI_T0=13.12% | CI_T1=20.36% | CI_T2=48.41% | CI_T3=99.47%
2026-02-11 18:59:48,981 - INFO - [Task 3 | ep 3 | step 300] loss=1.5984 c=0.5347 r=0.6761 | bal=0.3876 | CI_T0=5.77% | CI_T1=16.78% | CI_T2=48.65% | CI_T3=99.61%
2026-02-11 19:00:04,681 - INFO - [Task 3 | ep 3 | step 325] loss=1.4554 c=0.5667 r=0.5298 | bal=0.3589 | CI_T0=10.71% | CI_T1=20.55% | CI_T2=53.47% | CI_T3=99.28%
2026-02-11 19:00:20,375 - INFO - [Task 3 | ep 3 | step 350] loss=1.7055 c=0.5726 r=0.7751 | bal=0.3578 | CI_T0=3.87% | CI_T1=21.54% | CI_T2=53.52% | CI_T3=99.67%
2026-02-11 19:00:36,050 - INFO - [Task 3 | ep 3 | step 375] loss=1.4370 c=0.5412 r=0.5197 | bal=0.3761 | CI_T0=8.43% | CI_T1=21.65% | CI_T2=55.03% | CI_T3=99.50%
2026-02-11 19:00:52,454 - INFO - [After Task 3] Task-IL : T0=99.91% | T1=97.70% | T2=99.89% | T3=99.95% | Avg=99.36%
2026-02-11 19:00:52,454 - INFO - [After Task 3] Class-IL: T0=10.54% | T1=19.98% | T2=51.33% | T3=99.24% | Avg=45.28%
2026-02-11 19:00:52,454 - INFO - ========== GROUP DIFFERENCES ==========
2026-02-11 19:00:52,454 - INFO - Seen tasks: 0..3 | valid_out_dim=8
2026-02-11 19:00:54,462 - INFO - [Group=Task0] CI_acc=10.54% | corr_slice_max=4.969 | best_other_max=5.641 | gap=-0.673
2026-02-11 19:00:54,462 - INFO - [Group=Task0] winner_task_dist: W0=10.5% | W1=0.4% | W2=5.2% | W3=83.9%
2026-02-11 19:00:54,462 - INFO - [Group=Task0] slice_strength : S0=4.97 | S1=4.73 | S2=4.99 | S3=5.62
2026-02-11 19:00:56,495 - INFO - [Group=Task1] CI_acc=19.98% | corr_slice_max=3.479 | best_other_max=4.021 | gap=-0.542
2026-02-11 19:00:56,495 - INFO - [Group=Task1] winner_task_dist: W0=0.4% | W1=20.0% | W2=23.5% | W3=56.2%
2026-02-11 19:00:56,495 - INFO - [Group=Task1] slice_strength : S0=2.67 | S1=3.48 | S2=3.44 | S3=3.88
2026-02-11 19:00:58,498 - INFO - [Group=Task2] CI_acc=51.33% | corr_slice_max=3.817 | best_other_max=3.826 | gap=-0.010
2026-02-11 19:00:58,498 - INFO - [Group=Task2] winner_task_dist: W0=0.3% | W1=4.2% | W2=51.3% | W3=44.2%
2026-02-11 19:00:58,498 - INFO - [Group=Task2] slice_strength : S0=2.67 | S1=3.07 | S2=3.82 | S3=3.76
2026-02-11 19:01:00,505 - INFO - [Group=Task3] CI_acc=99.24% | corr_slice_max=4.701 | best_other_max=3.565 | gap=1.136
2026-02-11 19:01:00,505 - INFO - [Group=Task3] winner_task_dist: W0=0.1% | W1=0.1% | W2=0.6% | W3=99.2%
2026-02-11 19:01:00,505 - INFO - [Group=Task3] slice_strength : S0=2.87 | S1=3.01 | S2=3.41 | S3=4.70
2026-02-11 19:01:00,505 - INFO - ======================================
2026-02-11 19:01:00,506 - INFO - ========== Training Task 4: classes [8, 9] ==========
2026-02-11 19:01:23,138 - INFO - [Task 4 | ep 0 | step 0] loss=8.2926 c=4.9803 r=2.3433 | bal=0.9690 | CI_T0=13.79% | CI_T1=28.52% | CI_T2=61.88% | CI_T3=99.34% | CI_T4=0.50%
2026-02-11 19:01:42,653 - INFO - [Task 4 | ep 0 | step 25] loss=2.2059 c=0.6859 r=1.0758 | bal=0.4442 | CI_T0=32.65% | CI_T1=0.02% | CI_T2=3.33% | CI_T3=2.87% | CI_T4=93.10%
2026-02-11 19:02:02,283 - INFO - [Task 4 | ep 0 | step 50] loss=1.9201 c=0.7514 r=0.7878 | bal=0.3810 | CI_T0=0.16% | CI_T1=0.35% | CI_T2=1.63% | CI_T3=3.16% | CI_T4=97.27%
2026-02-11 19:02:21,775 - INFO - [Task 4 | ep 0 | step 75] loss=1.8842 c=0.6539 r=0.7991 | bal=0.4312 | CI_T0=0.00% | CI_T1=0.04% | CI_T2=5.56% | CI_T3=4.10% | CI_T4=97.72%
2026-02-11 19:02:44,722 - INFO - [Task 4 | ep 1 | step 100] loss=1.7740 c=0.6148 r=0.7322 | bal=0.4270 | CI_T0=0.01% | CI_T1=0.16% | CI_T2=3.12% | CI_T3=6.41% | CI_T4=97.83%
2026-02-11 19:03:04,074 - INFO - [Task 4 | ep 1 | step 125] loss=1.9756 c=0.6045 r=0.9461 | bal=0.4250 | CI_T0=0.03% | CI_T1=0.72% | CI_T2=4.39% | CI_T3=7.04% | CI_T4=98.17%
2026-02-11 19:03:23,538 - INFO - [Task 4 | ep 1 | step 150] loss=1.8312 c=0.6334 r=0.7737 | bal=0.4242 | CI_T0=0.05% | CI_T1=0.58% | CI_T2=6.65% | CI_T3=8.28% | CI_T4=98.33%
2026-02-11 19:03:43,019 - INFO - [Task 4 | ep 1 | step 175] loss=1.5789 c=0.5847 r=0.5446 | bal=0.4495 | CI_T0=1.71% | CI_T1=0.32% | CI_T2=6.65% | CI_T3=10.44% | CI_T4=98.62%
2026-02-11 19:04:05,970 - INFO - [Task 4 | ep 2 | step 200] loss=1.7063 c=0.6077 r=0.6788 | bal=0.4197 | CI_T0=0.22% | CI_T1=0.32% | CI_T2=4.90% | CI_T3=10.10% | CI_T4=98.67%
2026-02-11 19:04:25,458 - INFO - [Task 4 | ep 2 | step 225] loss=1.6897 c=0.6498 r=0.6293 | bal=0.4106 | CI_T0=0.25% | CI_T1=0.57% | CI_T2=8.58% | CI_T3=14.86% | CI_T4=98.68%
2026-02-11 19:04:44,903 - INFO - [Task 4 | ep 2 | step 250] loss=1.5284 c=0.6297 r=0.4902 | bal=0.4085 | CI_T0=0.73% | CI_T1=0.85% | CI_T2=8.79% | CI_T3=15.67% | CI_T4=98.69%
2026-02-11 19:05:04,240 - INFO - [Task 4 | ep 2 | step 275] loss=2.2793 c=0.6390 r=1.2376 | bal=0.4027 | CI_T0=0.08% | CI_T1=1.07% | CI_T2=10.28% | CI_T3=12.75% | CI_T4=98.93%
2026-02-11 19:05:27,156 - INFO - [Task 4 | ep 3 | step 300] loss=1.6143 c=0.6779 r=0.5173 | bal=0.4191 | CI_T0=0.49% | CI_T1=1.16% | CI_T2=11.91% | CI_T3=17.06% | CI_T4=98.70%
2026-02-11 19:05:46,650 - INFO - [Task 4 | ep 3 | step 325] loss=1.5295 c=0.5883 r=0.5067 | bal=0.4345 | CI_T0=0.22% | CI_T1=0.78% | CI_T2=7.16% | CI_T3=10.08% | CI_T4=99.13%
2026-02-11 19:06:06,211 - INFO - [Task 4 | ep 3 | step 350] loss=1.5873 c=0.5526 r=0.5440 | bal=0.4907 | CI_T0=0.06% | CI_T1=1.50% | CI_T2=7.88% | CI_T3=9.48% | CI_T4=99.01%
2026-02-11 19:06:26,688 - INFO - [After Task 4] Task-IL : T0=99.91% | T1=97.31% | T2=99.68% | T3=99.80% | T4=98.89% | Avg=99.12%
2026-02-11 19:06:26,689 - INFO - [After Task 4] Class-IL: T0=0.61% | T1=1.67% | T2=8.54% | T3=19.44% | T4=98.34% | Avg=25.72%
2026-02-11 19:06:26,689 - INFO - ========== GROUP DIFFERENCES ==========
2026-02-11 19:06:26,689 - INFO - Seen tasks: 0..4 | valid_out_dim=10
2026-02-11 19:06:28,697 - INFO - [Group=Task0] CI_acc=0.61% | corr_slice_max=5.043 | best_other_max=6.122 | gap=-1.079
2026-02-11 19:06:28,697 - INFO - [Group=Task0] winner_task_dist: W0=0.6% | W1=0.0% | W2=1.0% | W3=5.2% | W4=93.2%
2026-02-11 19:06:28,697 - INFO - [Group=Task0] slice_strength : S0=5.04 | S1=4.78 | S2=5.15 | S3=5.42 | S4=6.11
2026-02-11 19:06:30,692 - INFO - [Group=Task1] CI_acc=1.67% | corr_slice_max=3.371 | best_other_max=4.553 | gap=-1.181
2026-02-11 19:06:30,693 - INFO - [Group=Task1] winner_task_dist: W0=0.0% | W1=1.7% | W2=8.0% | W3=3.4% | W4=86.9%
2026-02-11 19:06:30,693 - INFO - [Group=Task1] slice_strength : S0=2.80 | S1=3.37 | S2=3.48 | S3=3.51 | S4=4.52
2026-02-11 19:06:32,685 - INFO - [Group=Task2] CI_acc=8.54% | corr_slice_max=3.986 | best_other_max=4.812 | gap=-0.826
2026-02-11 19:06:32,685 - INFO - [Group=Task2] winner_task_dist: W0=0.0% | W1=0.3% | W2=8.5% | W3=0.5% | W4=90.7%
2026-02-11 19:06:32,685 - INFO - [Group=Task2] slice_strength : S0=2.83 | S1=3.13 | S2=3.99 | S3=3.51 | S4=4.81
2026-02-11 19:06:34,725 - INFO - [Group=Task3] CI_acc=19.44% | corr_slice_max=4.161 | best_other_max=4.627 | gap=-0.465
2026-02-11 19:06:34,725 - INFO - [Group=Task3] winner_task_dist: W0=0.1% | W1=0.2% | W2=2.1% | W3=19.4% | W4=78.2%
2026-02-11 19:06:34,725 - INFO - [Group=Task3] slice_strength : S0=3.02 | S1=3.04 | S2=3.45 | S3=4.16 | S4=4.62
2026-02-11 19:06:36,719 - INFO - [Group=Task4] CI_acc=98.34% | corr_slice_max=5.407 | best_other_max=4.199 | gap=1.207
2026-02-11 19:06:36,719 - INFO - [Group=Task4] winner_task_dist: W0=0.0% | W1=0.0% | W2=0.2% | W3=0.7% | W4=99.2%
2026-02-11 19:06:36,719 - INFO - [Group=Task4] slice_strength : S0=3.12 | S1=3.38 | S2=3.65 | S3=4.09 | S4=5.41
2026-02-11 19:06:36,719 - INFO - ======================================
2026-02-11 19:06:36,721 - INFO - ========== FINAL METRICS (Class-IL) ==========
2026-02-11 19:06:36,721 - INFO - Forgetting per task: T0=99.29%, T1=92.61%, T2=90.55%, T3=79.81%, T4=0.00%
2026-02-11 19:06:36,721 - INFO - BWT: -90.56%
2026-02-11 19:06:36,721 - INFO - Final average Class-IL accuracy: 25.72%
