2026-02-12 01:20:56,003 - INFO - Device: cpu
2026-02-12 01:20:56,003 - INFO - Config: {'device': 'cpu', 'lr': 0.005, 'epochs_per_task': 4, 'batch_size': 128, 'lambda_slice': 2.0, 'lambda_feat': 0.5, 'proto_aug_n_per_class': 8, 'lambda_ac': 0.1, 'si_lambda': 1.0}
2026-02-12 01:20:56,005 - INFO - ========== Task 0: classes [0, 1] ==========
2026-02-12 01:21:02,960 - INFO - [Task 0 | ep 0 | step 0] loss=0.8810 c=0.8633 r=0.0000 ac=0.0177 | CI_T0=95.71%
2026-02-12 01:21:06,870 - INFO - [Task 0 | ep 0 | step 25] loss=0.0195 c=0.0016 r=0.0000 ac=0.0179 | CI_T0=99.94%
2026-02-12 01:21:10,765 - INFO - [Task 0 | ep 0 | step 50] loss=0.0146 c=0.0010 r=0.0000 ac=0.0136 | CI_T0=99.90%
2026-02-12 01:21:14,699 - INFO - [Task 0 | ep 0 | step 75] loss=0.0102 c=0.0009 r=0.0000 ac=0.0093 | CI_T0=99.90%
2026-02-12 01:21:22,027 - INFO - [Task 0 | ep 1 | step 100] loss=0.0080 c=0.0007 r=0.0000 ac=0.0073 | CI_T0=99.94%
2026-02-12 01:21:25,950 - INFO - [Task 0 | ep 1 | step 125] loss=0.0056 c=0.0008 r=0.0000 ac=0.0048 | CI_T0=99.93%
2026-02-12 01:21:29,868 - INFO - [Task 0 | ep 1 | step 150] loss=0.0046 c=0.0006 r=0.0000 ac=0.0040 | CI_T0=99.88%
2026-02-12 01:21:33,771 - INFO - [Task 0 | ep 1 | step 175] loss=0.0028 c=0.0004 r=0.0000 ac=0.0024 | CI_T0=99.94%
2026-02-12 01:21:41,098 - INFO - [Task 0 | ep 2 | step 200] loss=0.0024 c=0.0003 r=0.0000 ac=0.0020 | CI_T0=99.96%
2026-02-12 01:21:44,980 - INFO - [Task 0 | ep 2 | step 225] loss=0.0014 c=0.0003 r=0.0000 ac=0.0011 | CI_T0=99.96%
2026-02-12 01:21:48,874 - INFO - [Task 0 | ep 2 | step 250] loss=0.0013 c=0.0004 r=0.0000 ac=0.0009 | CI_T0=99.97%
2026-02-12 01:21:52,761 - INFO - [Task 0 | ep 2 | step 275] loss=0.0011 c=0.0004 r=0.0000 ac=0.0007 | CI_T0=99.88%
2026-02-12 01:22:00,088 - INFO - [Task 0 | ep 3 | step 300] loss=0.0010 c=0.0003 r=0.0000 ac=0.0007 | CI_T0=99.93%
2026-02-12 01:22:03,991 - INFO - [Task 0 | ep 3 | step 325] loss=0.0009 c=0.0003 r=0.0000 ac=0.0006 | CI_T0=99.96%
2026-02-12 01:22:07,885 - INFO - [Task 0 | ep 3 | step 350] loss=0.0012 c=0.0008 r=0.0000 ac=0.0004 | CI_T0=99.95%
2026-02-12 01:22:11,777 - INFO - [Task 0 | ep 3 | step 375] loss=0.0050 c=0.0045 r=0.0000 ac=0.0005 | CI_T0=99.98%
2026-02-12 01:22:19,857 - INFO - [After Task 0] Task-IL : T0=99.91% | Avg=99.91%
2026-02-12 01:22:19,857 - INFO - [After Task 0] Class-IL: T0=99.91% | Avg=99.91%
2026-02-12 01:22:19,857 - INFO - ========== GROUP DIFFERENCES ==========
2026-02-12 01:22:19,857 - INFO - Seen tasks: 0..0 | valid_out_dim=2
2026-02-12 01:22:21,811 - INFO - [Group=Task0] CI_acc=99.91% | corr_slice_max=4.714 | best_other_max=nan | gap=nan
2026-02-12 01:22:21,811 - INFO - [Group=Task0] winner_task_dist: W0=100.0%
2026-02-12 01:22:21,811 - INFO - [Group=Task0] slice_strength : S0=4.71
2026-02-12 01:22:21,811 - INFO - ======================================
2026-02-12 01:22:21,811 - INFO - ========== Task 1: classes [2, 3] ==========
2026-02-12 01:22:32,483 - INFO - [Task 1 | ep 0 | step 0] loss=6.0508 c=3.9855 r=2.0628 ac=0.0025 | CI_T0=99.96% | CI_T1=5.25%
2026-02-12 01:22:40,183 - INFO - [Task 1 | ep 0 | step 25] loss=5.6407 c=0.2046 r=1.4190 ac=0.0037 | si=0.0015 | CI_T0=30.84% | CI_T1=95.54%
2026-02-12 01:22:47,878 - INFO - [Task 1 | ep 0 | step 50] loss=8.1935 c=0.1965 r=1.5911 ac=0.0049 | si=0.0021 | CI_T0=16.84% | CI_T1=97.36%
2026-02-12 01:22:55,608 - INFO - [Task 1 | ep 0 | step 75] loss=7.1597 c=0.1568 r=1.2939 ac=0.0062 | si=0.0026 | CI_T0=30.29% | CI_T1=97.92%
2026-02-12 01:23:06,731 - INFO - [Task 1 | ep 1 | step 100] loss=6.1467 c=0.1607 r=1.0417 ac=0.0069 | si=0.0032 | CI_T0=26.40% | CI_T1=98.11%
2026-02-12 01:23:14,567 - INFO - [Task 1 | ep 1 | step 125] loss=6.0263 c=0.1663 r=0.7565 ac=0.0078 | si=0.0037 | CI_T0=40.08% | CI_T1=98.42%
2026-02-12 01:23:22,288 - INFO - [Task 1 | ep 1 | step 150] loss=4.9659 c=0.1611 r=1.0861 ac=0.0091 | si=0.0043 | CI_T0=28.29% | CI_T1=97.89%
2026-02-12 01:23:30,055 - INFO - [Task 1 | ep 1 | step 175] loss=3.9688 c=0.1635 r=0.7947 ac=0.0102 | si=0.0048 | CI_T0=19.92% | CI_T1=98.46%
2026-02-12 01:23:41,239 - INFO - [Task 1 | ep 2 | step 200] loss=4.1714 c=0.1290 r=1.4399 ac=0.0110 | si=0.0053 | CI_T0=26.81% | CI_T1=98.45%
2026-02-12 01:23:48,978 - INFO - [Task 1 | ep 2 | step 225] loss=3.3755 c=0.1590 r=0.7628 ac=0.0123 | si=0.0058 | CI_T0=28.03% | CI_T1=98.79%
2026-02-12 01:23:56,750 - INFO - [Task 1 | ep 2 | step 250] loss=2.6919 c=0.1858 r=0.8196 ac=0.0134 | si=0.0064 | CI_T0=32.25% | CI_T1=98.70%
2026-02-12 01:24:04,520 - INFO - [Task 1 | ep 2 | step 275] loss=2.9816 c=0.1214 r=0.7521 ac=0.0135 | si=0.0069 | CI_T0=24.39% | CI_T1=98.72%
2026-02-12 01:24:15,735 - INFO - [Task 1 | ep 3 | step 300] loss=1.9751 c=0.2026 r=0.7962 ac=0.0141 | si=0.0075 | CI_T0=38.30% | CI_T1=98.38%
2026-02-12 01:24:23,542 - INFO - [Task 1 | ep 3 | step 325] loss=2.1920 c=0.1657 r=1.0528 ac=0.0146 | si=0.0081 | CI_T0=27.29% | CI_T1=98.84%
2026-02-12 01:24:31,320 - INFO - [Task 1 | ep 3 | step 350] loss=1.9925 c=0.1347 r=0.8318 ac=0.0160 | si=0.0086 | CI_T0=36.08% | CI_T1=98.50%
2026-02-12 01:24:39,106 - INFO - [Task 1 | ep 3 | step 375] loss=2.0433 c=0.1244 r=1.5001 ac=0.0161 | si=0.0091 | CI_T0=29.14% | CI_T1=98.88%
2026-02-12 01:24:51,053 - INFO - [After Task 1] Task-IL : T0=99.91% | T1=99.07% | Avg=99.49%
2026-02-12 01:24:51,053 - INFO - [After Task 1] Class-IL: T0=28.84% | T1=98.82% | Avg=63.83%
2026-02-12 01:24:51,053 - INFO - ========== GROUP DIFFERENCES ==========
2026-02-12 01:24:51,053 - INFO - Seen tasks: 0..1 | valid_out_dim=4
2026-02-12 01:24:53,008 - INFO - [Group=Task0] CI_acc=28.84% | corr_slice_max=4.805 | best_other_max=5.307 | gap=-0.502
2026-02-12 01:24:53,008 - INFO - [Group=Task0] winner_task_dist: W0=28.8% | W1=71.2%
2026-02-12 01:24:53,008 - INFO - [Group=Task0] slice_strength : S0=4.81 | S1=5.31
2026-02-12 01:24:54,972 - INFO - [Group=Task1] CI_acc=98.82% | corr_slice_max=6.647 | best_other_max=3.145 | gap=3.502
2026-02-12 01:24:54,972 - INFO - [Group=Task1] winner_task_dist: W0=0.3% | W1=99.7%
2026-02-12 01:24:54,972 - INFO - [Group=Task1] slice_strength : S0=3.14 | S1=6.65
2026-02-12 01:24:54,972 - INFO - ======================================
2026-02-12 01:24:54,972 - INFO - ========== Task 2: classes [4, 5] ==========
2026-02-12 01:25:09,460 - INFO - [Task 2 | ep 0 | step 0] loss=8.5801 c=6.0797 r=2.2440 ac=0.0155 | si=0.0091 | CI_T0=31.28% | CI_T1=98.71% | CI_T2=0.00%
2026-02-12 01:25:21,018 - INFO - [Task 2 | ep 0 | step 25] loss=2.5601 c=0.4741 r=1.1471 ac=0.0168 | si=0.1038 | CI_T0=3.98% | CI_T1=43.43% | CI_T2=88.46%
2026-02-12 01:25:32,606 - INFO - [Task 2 | ep 0 | step 50] loss=1.9973 c=0.3336 r=0.7308 ac=0.0181 | si=0.1198 | CI_T0=9.29% | CI_T1=42.17% | CI_T2=94.38%
2026-02-12 01:25:44,235 - INFO - [Task 2 | ep 0 | step 75] loss=2.2032 c=0.2843 r=0.8437 ac=0.0189 | si=0.1286 | CI_T0=9.72% | CI_T1=42.94% | CI_T2=95.60%
2026-02-12 01:25:59,358 - INFO - [Task 2 | ep 1 | step 100] loss=1.7974 c=0.2510 r=0.7272 ac=0.0197 | si=0.1303 | CI_T0=3.93% | CI_T1=38.76% | CI_T2=97.82%
2026-02-12 01:26:10,962 - INFO - [Task 2 | ep 1 | step 125] loss=1.8948 c=0.2696 r=0.7987 ac=0.0201 | si=0.1334 | CI_T0=15.52% | CI_T1=34.02% | CI_T2=96.98%
2026-02-12 01:26:22,657 - INFO - [Task 2 | ep 1 | step 150] loss=1.5518 c=0.2824 r=0.6093 ac=0.0204 | si=0.1389 | CI_T0=10.65% | CI_T1=36.94% | CI_T2=97.93%
2026-02-12 01:26:37,763 - INFO - [Task 2 | ep 2 | step 175] loss=1.6944 c=0.2536 r=0.6403 ac=0.0213 | si=0.1446 | CI_T0=4.15% | CI_T1=33.95% | CI_T2=98.51%
2026-02-12 01:26:49,377 - INFO - [Task 2 | ep 2 | step 200] loss=1.6101 c=0.2253 r=0.8468 ac=0.0215 | si=0.1407 | CI_T0=4.13% | CI_T1=37.08% | CI_T2=98.45%
2026-02-12 01:27:00,947 - INFO - [Task 2 | ep 2 | step 225] loss=1.6657 c=0.2492 r=0.8080 ac=0.0218 | si=0.1411 | CI_T0=14.18% | CI_T1=35.48% | CI_T2=98.18%
2026-02-12 01:27:12,486 - INFO - [Task 2 | ep 2 | step 250] loss=1.5174 c=0.2458 r=0.6057 ac=0.0210 | si=0.1459 | CI_T0=14.99% | CI_T1=32.73% | CI_T2=98.60%
2026-02-12 01:27:27,431 - INFO - [Task 2 | ep 3 | step 275] loss=1.4716 c=0.2236 r=0.6018 ac=0.0223 | si=0.1489 | CI_T0=8.88% | CI_T1=29.55% | CI_T2=98.44%
2026-02-12 01:27:39,027 - INFO - [Task 2 | ep 3 | step 300] loss=1.4281 c=0.2196 r=0.5771 ac=0.0222 | si=0.1468 | CI_T0=12.46% | CI_T1=37.69% | CI_T2=97.78%
2026-02-12 01:27:50,683 - INFO - [Task 2 | ep 3 | step 325] loss=1.4236 c=0.2420 r=0.6559 ac=0.0228 | si=0.1473 | CI_T0=23.13% | CI_T1=35.69% | CI_T2=98.71%
2026-02-12 01:28:06,818 - INFO - [After Task 2] Task-IL : T0=99.91% | T1=98.87% | T2=99.63% | Avg=99.47%
2026-02-12 01:28:06,818 - INFO - [After Task 2] Class-IL: T0=7.66% | T1=35.06% | T2=98.88% | Avg=47.20%
2026-02-12 01:28:06,818 - INFO - ========== GROUP DIFFERENCES ==========
2026-02-12 01:28:06,818 - INFO - Seen tasks: 0..2 | valid_out_dim=6
2026-02-12 01:28:08,780 - INFO - [Group=Task0] CI_acc=7.66% | corr_slice_max=4.690 | best_other_max=5.955 | gap=-1.265
2026-02-12 01:28:08,781 - INFO - [Group=Task0] winner_task_dist: W0=7.7% | W1=10.9% | W2=81.4%
2026-02-12 01:28:08,781 - INFO - [Group=Task0] slice_strength : S0=4.69 | S1=5.18 | S2=5.92
2026-02-12 01:28:10,731 - INFO - [Group=Task1] CI_acc=35.06% | corr_slice_max=6.392 | best_other_max=6.814 | gap=-0.422
2026-02-12 01:28:10,731 - INFO - [Group=Task1] winner_task_dist: W0=0.3% | W1=35.1% | W2=64.6%
2026-02-12 01:28:10,731 - INFO - [Group=Task1] slice_strength : S0=3.05 | S1=6.39 | S2=6.81
2026-02-12 01:28:12,665 - INFO - [Group=Task2] CI_acc=98.88% | corr_slice_max=7.767 | best_other_max=5.684 | gap=2.083
2026-02-12 01:28:12,665 - INFO - [Group=Task2] winner_task_dist: W0=0.0% | W1=0.9% | W2=99.1%
2026-02-12 01:28:12,665 - INFO - [Group=Task2] slice_strength : S0=3.05 | S1=5.68 | S2=7.77
2026-02-12 01:28:12,665 - INFO - ======================================
2026-02-12 01:28:12,665 - INFO - ========== Task 3: classes [6, 7] ==========
2026-02-12 01:28:30,942 - INFO - [Task 3 | ep 0 | step 0] loss=9.3293 c=7.4497 r=1.5135 ac=0.0200 | si=0.1524 | CI_T0=2.75% | CI_T1=35.52% | CI_T2=99.42% | CI_T3=0.00%
2026-02-12 01:28:46,361 - INFO - [Task 3 | ep 0 | step 25] loss=2.4309 c=0.4773 r=1.1633 ac=0.0200 | si=0.2547 | CI_T0=5.25% | CI_T1=29.66% | CI_T2=62.91% | CI_T3=96.41%
2026-02-12 01:29:01,736 - INFO - [Task 3 | ep 0 | step 50] loss=1.6061 c=0.3719 r=0.7964 ac=0.0209 | si=0.2558 | CI_T0=0.68% | CI_T1=21.19% | CI_T2=73.00% | CI_T3=96.51%
2026-02-12 01:29:17,140 - INFO - [Task 3 | ep 0 | step 75] loss=1.7330 c=0.3909 r=0.7490 ac=0.0209 | si=0.2477 | CI_T0=0.75% | CI_T1=20.59% | CI_T2=80.32% | CI_T3=97.41%
2026-02-12 01:29:35,943 - INFO - [Task 3 | ep 1 | step 100] loss=1.6690 c=0.4206 r=0.6610 ac=0.0214 | si=0.2444 | CI_T0=0.60% | CI_T1=22.13% | CI_T2=79.21% | CI_T3=96.47%
2026-02-12 01:29:51,312 - INFO - [Task 3 | ep 1 | step 125] loss=1.7174 c=0.3553 r=0.7846 ac=0.0219 | si=0.2450 | CI_T0=0.93% | CI_T1=22.31% | CI_T2=77.90% | CI_T3=98.78%
2026-02-12 01:30:06,735 - INFO - [Task 3 | ep 1 | step 150] loss=1.6661 c=0.3449 r=0.7848 ac=0.0219 | si=0.2418 | CI_T0=0.39% | CI_T1=24.19% | CI_T2=77.02% | CI_T3=97.40%
2026-02-12 01:30:22,301 - INFO - [Task 3 | ep 1 | step 175] loss=1.7671 c=0.3301 r=0.9308 ac=0.0226 | si=0.2376 | CI_T0=0.41% | CI_T1=21.74% | CI_T2=79.14% | CI_T3=98.54%
2026-02-12 01:30:41,262 - INFO - [Task 3 | ep 2 | step 200] loss=1.7002 c=0.3518 r=0.8903 ac=0.0222 | si=0.2355 | CI_T0=0.70% | CI_T1=17.97% | CI_T2=75.26% | CI_T3=98.55%
2026-02-12 01:30:56,690 - INFO - [Task 3 | ep 2 | step 225] loss=1.6058 c=0.3711 r=0.7546 ac=0.0228 | si=0.2347 | CI_T0=0.26% | CI_T1=23.69% | CI_T2=76.45% | CI_T3=98.51%
2026-02-12 01:31:12,126 - INFO - [Task 3 | ep 2 | step 250] loss=1.5069 c=0.3326 r=0.6615 ac=0.0227 | si=0.2347 | CI_T0=2.02% | CI_T1=16.76% | CI_T2=75.33% | CI_T3=98.48%
2026-02-12 01:31:27,589 - INFO - [Task 3 | ep 2 | step 275] loss=1.6095 c=0.3764 r=0.6938 ac=0.0227 | si=0.2355 | CI_T0=0.45% | CI_T1=19.68% | CI_T2=77.86% | CI_T3=98.42%
2026-02-12 01:31:46,501 - INFO - [Task 3 | ep 3 | step 300] loss=1.6850 c=0.3066 r=0.6844 ac=0.0229 | si=0.2350 | CI_T0=0.21% | CI_T1=22.27% | CI_T2=74.41% | CI_T3=98.12%
2026-02-12 01:32:01,951 - INFO - [Task 3 | ep 3 | step 325] loss=1.4204 c=0.3083 r=0.6931 ac=0.0227 | si=0.2330 | CI_T0=1.32% | CI_T1=23.41% | CI_T2=76.53% | CI_T3=98.78%
2026-02-12 01:32:17,363 - INFO - [Task 3 | ep 3 | step 350] loss=1.4323 c=0.3387 r=0.6618 ac=0.0225 | si=0.2330 | CI_T0=1.15% | CI_T1=22.71% | CI_T2=75.92% | CI_T3=98.41%
2026-02-12 01:32:32,766 - INFO - [Task 3 | ep 3 | step 375] loss=1.6892 c=0.3196 r=0.8253 ac=0.0223 | si=0.2315 | CI_T0=0.23% | CI_T1=22.11% | CI_T2=76.19% | CI_T3=98.76%
2026-02-12 01:32:52,458 - INFO - [After Task 3] Task-IL : T0=99.91% | T1=98.73% | T2=99.73% | T3=99.80% | Avg=99.54%
2026-02-12 01:32:52,458 - INFO - [After Task 3] Class-IL: T0=0.95% | T1=23.60% | T2=77.37% | T3=98.59% | Avg=50.13%
2026-02-12 01:32:52,459 - INFO - ========== GROUP DIFFERENCES ==========
2026-02-12 01:32:52,459 - INFO - Seen tasks: 0..3 | valid_out_dim=8
2026-02-12 01:32:54,413 - INFO - [Group=Task0] CI_acc=0.95% | corr_slice_max=5.045 | best_other_max=6.498 | gap=-1.453
2026-02-12 01:32:54,413 - INFO - [Group=Task0] winner_task_dist: W0=0.9% | W1=3.5% | W2=15.0% | W3=80.5%
2026-02-12 01:32:54,413 - INFO - [Group=Task0] slice_strength : S0=5.05 | S1=5.24 | S2=5.79 | S3=6.39
2026-02-12 01:32:56,376 - INFO - [Group=Task1] CI_acc=23.60% | corr_slice_max=6.353 | best_other_max=7.075 | gap=-0.723
2026-02-12 01:32:56,376 - INFO - [Group=Task1] winner_task_dist: W0=0.0% | W1=23.6% | W2=42.3% | W3=34.1%
2026-02-12 01:32:56,376 - INFO - [Group=Task1] slice_strength : S0=3.20 | S1=6.35 | S2=6.48 | S3=6.34
2026-02-12 01:32:58,310 - INFO - [Group=Task2] CI_acc=77.37% | corr_slice_max=7.381 | best_other_max=6.764 | gap=0.618
2026-02-12 01:32:58,310 - INFO - [Group=Task2] winner_task_dist: W0=0.0% | W1=0.7% | W2=77.4% | W3=21.9%
2026-02-12 01:32:58,310 - INFO - [Group=Task2] slice_strength : S0=3.16 | S1=5.75 | S2=7.38 | S3=6.54
2026-02-12 01:33:00,254 - INFO - [Group=Task3] CI_acc=98.59% | corr_slice_max=8.175 | best_other_max=6.581 | gap=1.594
2026-02-12 01:33:00,254 - INFO - [Group=Task3] winner_task_dist: W0=0.0% | W1=0.1% | W2=1.3% | W3=98.6%
2026-02-12 01:33:00,254 - INFO - [Group=Task3] slice_strength : S0=3.14 | S1=5.63 | S2=6.52 | S3=8.18
2026-02-12 01:33:00,254 - INFO - ======================================
2026-02-12 01:33:00,254 - INFO - ========== Task 4: classes [8, 9] ==========
2026-02-12 01:33:22,265 - INFO - [Task 4 | ep 0 | step 0] loss=10.0085 c=7.7301 r=1.9002 ac=0.0220 | si=0.2316 | CI_T0=8.57% | CI_T1=32.44% | CI_T2=77.36% | CI_T3=98.22% | CI_T4=0.00%
2026-02-12 01:33:41,557 - INFO - [Task 4 | ep 0 | step 25] loss=2.4780 c=0.7057 r=1.2844 ac=0.0190 | si=0.3678 | CI_T0=0.19% | CI_T1=7.50% | CI_T2=18.96% | CI_T3=34.09% | CI_T4=93.19%
2026-02-12 01:34:00,771 - INFO - [Task 4 | ep 0 | step 50] loss=2.0201 c=0.6686 r=0.8632 ac=0.0217 | si=0.3783 | CI_T0=1.43% | CI_T1=6.28% | CI_T2=26.36% | CI_T3=42.10% | CI_T4=93.66%
2026-02-12 01:34:19,964 - INFO - [Task 4 | ep 0 | step 75] loss=1.8614 c=0.6098 r=0.7718 ac=0.0229 | si=0.3754 | CI_T0=0.40% | CI_T1=7.21% | CI_T2=22.87% | CI_T3=43.02% | CI_T4=95.39%
2026-02-12 01:34:42,566 - INFO - [Task 4 | ep 1 | step 100] loss=1.8597 c=0.5681 r=0.8175 ac=0.0237 | si=0.3747 | CI_T0=1.33% | CI_T1=3.51% | CI_T2=26.45% | CI_T3=47.15% | CI_T4=96.30%
2026-02-12 01:35:01,735 - INFO - [Task 4 | ep 1 | step 125] loss=1.9243 c=0.6108 r=0.8361 ac=0.0227 | si=0.3699 | CI_T0=1.31% | CI_T1=4.44% | CI_T2=23.78% | CI_T3=42.18% | CI_T4=96.87%
2026-02-12 01:35:20,859 - INFO - [Task 4 | ep 1 | step 150] loss=1.7469 c=0.5682 r=0.7419 ac=0.0245 | si=0.3613 | CI_T0=2.36% | CI_T1=3.50% | CI_T2=23.71% | CI_T3=50.29% | CI_T4=95.61%
2026-02-12 01:35:40,002 - INFO - [Task 4 | ep 1 | step 175] loss=1.8224 c=0.5933 r=0.7910 ac=0.0247 | si=0.3576 | CI_T0=6.83% | CI_T1=2.18% | CI_T2=27.70% | CI_T3=49.39% | CI_T4=95.74%
2026-02-12 01:36:02,594 - INFO - [Task 4 | ep 2 | step 200] loss=1.8784 c=0.5872 r=0.8661 ac=0.0249 | si=0.3579 | CI_T0=0.16% | CI_T1=5.98% | CI_T2=23.20% | CI_T3=36.99% | CI_T4=97.43%
2026-02-12 01:36:21,825 - INFO - [Task 4 | ep 2 | step 225] loss=1.8339 c=0.5333 r=0.8672 ac=0.0245 | si=0.3568 | CI_T0=2.71% | CI_T1=2.41% | CI_T2=26.02% | CI_T3=45.77% | CI_T4=96.86%
2026-02-12 01:36:41,072 - INFO - [Task 4 | ep 2 | step 250] loss=1.7779 c=0.5398 r=0.7908 ac=0.0245 | si=0.3511 | CI_T0=0.02% | CI_T1=6.35% | CI_T2=24.96% | CI_T3=37.51% | CI_T4=96.95%
2026-02-12 01:37:00,386 - INFO - [Task 4 | ep 2 | step 275] loss=1.8613 c=0.5393 r=0.9150 ac=0.0249 | si=0.3547 | CI_T0=2.14% | CI_T1=3.36% | CI_T2=30.71% | CI_T3=42.29% | CI_T4=97.66%
2026-02-12 01:37:23,173 - INFO - [Task 4 | ep 3 | step 300] loss=1.8049 c=0.5508 r=0.8308 ac=0.0247 | si=0.3497 | CI_T0=4.79% | CI_T1=4.39% | CI_T2=28.05% | CI_T3=45.16% | CI_T4=96.99%
2026-02-12 01:37:42,572 - INFO - [Task 4 | ep 3 | step 325] loss=1.8183 c=0.6058 r=0.7780 ac=0.0252 | si=0.3550 | CI_T0=0.10% | CI_T1=4.18% | CI_T2=35.78% | CI_T3=39.03% | CI_T4=97.31%
2026-02-12 01:38:01,949 - INFO - [Task 4 | ep 3 | step 350] loss=1.6626 c=0.5376 r=0.7344 ac=0.0254 | si=0.3513 | CI_T0=1.51% | CI_T1=2.40% | CI_T2=26.63% | CI_T3=43.41% | CI_T4=97.36%
2026-02-12 01:38:26,121 - INFO - [After Task 4] Task-IL : T0=99.91% | T1=98.73% | T2=99.47% | T3=99.50% | T4=98.49% | Avg=99.22%
2026-02-12 01:38:26,121 - INFO - [After Task 4] Class-IL: T0=0.43% | T1=3.23% | T2=31.86% | T3=45.02% | T4=96.12% | Avg=35.33%
2026-02-12 01:38:26,121 - INFO - ========== GROUP DIFFERENCES ==========
2026-02-12 01:38:26,121 - INFO - Seen tasks: 0..4 | valid_out_dim=10
2026-02-12 01:38:28,097 - INFO - [Group=Task0] CI_acc=0.43% | corr_slice_max=4.793 | best_other_max=6.824 | gap=-2.031
2026-02-12 01:38:28,098 - INFO - [Group=Task0] winner_task_dist: W0=0.4% | W1=0.0% | W2=15.2% | W3=29.0% | W4=55.4%
2026-02-12 01:38:28,098 - INFO - [Group=Task0] slice_strength : S0=4.79 | S1=5.30 | S2=5.89 | S3=6.00 | S4=6.60
2026-02-12 01:38:30,070 - INFO - [Group=Task1] CI_acc=3.23% | corr_slice_max=6.251 | best_other_max=7.538 | gap=-1.288
2026-02-12 01:38:30,070 - INFO - [Group=Task1] winner_task_dist: W0=0.0% | W1=3.2% | W2=23.8% | W3=17.9% | W4=55.1%
2026-02-12 01:38:30,070 - INFO - [Group=Task1] slice_strength : S0=3.06 | S1=6.25 | S2=6.44 | S3=6.06 | S4=7.19
2026-02-12 01:38:32,046 - INFO - [Group=Task2] CI_acc=31.86% | corr_slice_max=7.309 | best_other_max=7.598 | gap=-0.288
2026-02-12 01:38:32,046 - INFO - [Group=Task2] winner_task_dist: W0=0.0% | W1=0.1% | W2=31.9% | W3=4.4% | W4=63.7%
2026-02-12 01:38:32,046 - INFO - [Group=Task2] slice_strength : S0=3.03 | S1=5.59 | S2=7.31 | S3=6.28 | S4=7.54
2026-02-12 01:38:34,009 - INFO - [Group=Task3] CI_acc=45.02% | corr_slice_max=7.557 | best_other_max=7.516 | gap=0.040
2026-02-12 01:38:34,009 - INFO - [Group=Task3] winner_task_dist: W0=0.0% | W1=0.2% | W2=2.3% | W3=45.1% | W4=52.5%
2026-02-12 01:38:34,009 - INFO - [Group=Task3] slice_strength : S0=3.06 | S1=5.50 | S2=6.37 | S3=7.56 | S4=7.40
2026-02-12 01:38:35,966 - INFO - [Group=Task4] CI_acc=96.12% | corr_slice_max=8.352 | best_other_max=7.155 | gap=1.197
2026-02-12 01:38:35,967 - INFO - [Group=Task4] winner_task_dist: W0=0.0% | W1=0.1% | W2=1.2% | W3=2.2% | W4=96.6%
2026-02-12 01:38:35,967 - INFO - [Group=Task4] slice_strength : S0=2.97 | S1=5.68 | S2=6.81 | S3=6.84 | S4=8.35
2026-02-12 01:38:35,967 - INFO - ======================================
2026-02-12 01:38:35,967 - INFO - ========== FINAL METRICS (Class-IL) ==========
2026-02-12 01:38:35,967 - INFO - Forgetting per task: T0=99.48%, T1=95.59%, T2=67.02%, T3=53.58%, T4=0.00%
2026-02-12 01:38:35,967 - INFO - BWT: -78.92%
2026-02-12 01:38:35,967 - INFO - Final average Class-IL accuracy: 35.33%
