2026-02-12 20:27:56,802 - INFO - Device: cuda
2026-02-12 20:27:56,802 - INFO - Config: {'device': 'cuda', 'lr': 0.005, 'epochs_per_task': 4, 'batch_size': 128, 'lambda_slice': 2.0, 'lambda_feat': 0.5, 'proto_aug_n_per_class': 8, 'proto_aug_r': 0.4, 'lambda_ac': 0.1, 'si_lambda': 1.0, 'proto_extra_weight': 0.3}
2026-02-12 20:27:56,880 - INFO - ========== Task 0: classes [0, 1] ==========
2026-02-12 20:28:04,881 - INFO - [Task 0 | ep 0 | step 0] loss=0.8810 c=0.8633 r=0.0000 ac=0.0177 | CI_T0=96.68%
2026-02-12 20:28:09,408 - INFO - [Task 0 | ep 0 | step 25] loss=0.0195 c=0.0016 r=0.0000 ac=0.0179 | CI_T0=99.94%
2026-02-12 20:28:13,992 - INFO - [Task 0 | ep 0 | step 50] loss=0.0147 c=0.0010 r=0.0000 ac=0.0137 | CI_T0=99.90%
2026-02-12 20:28:18,458 - INFO - [Task 0 | ep 0 | step 75] loss=0.0102 c=0.0009 r=0.0000 ac=0.0093 | CI_T0=99.90%
2026-02-12 20:28:26,870 - INFO - [Task 0 | ep 1 | step 100] loss=0.0080 c=0.0007 r=0.0000 ac=0.0073 | CI_T0=99.94%
2026-02-12 20:28:31,371 - INFO - [Task 0 | ep 1 | step 125] loss=0.0056 c=0.0008 r=0.0000 ac=0.0048 | CI_T0=99.93%
2026-02-12 20:28:35,901 - INFO - [Task 0 | ep 1 | step 150] loss=0.0046 c=0.0006 r=0.0000 ac=0.0040 | CI_T0=99.87%
2026-02-12 20:28:40,383 - INFO - [Task 0 | ep 1 | step 175] loss=0.0028 c=0.0004 r=0.0000 ac=0.0024 | CI_T0=99.94%
2026-02-12 20:28:48,770 - INFO - [Task 0 | ep 2 | step 200] loss=0.0025 c=0.0003 r=0.0000 ac=0.0021 | CI_T0=99.96%
2026-02-12 20:28:53,247 - INFO - [Task 0 | ep 2 | step 225] loss=0.0015 c=0.0003 r=0.0000 ac=0.0012 | CI_T0=99.96%
2026-02-12 20:28:57,787 - INFO - [Task 0 | ep 2 | step 250] loss=0.0013 c=0.0004 r=0.0000 ac=0.0009 | CI_T0=99.97%
2026-02-12 20:29:02,398 - INFO - [Task 0 | ep 2 | step 275] loss=0.0013 c=0.0004 r=0.0000 ac=0.0008 | CI_T0=99.92%
2026-02-12 20:29:10,739 - INFO - [Task 0 | ep 3 | step 300] loss=0.0011 c=0.0003 r=0.0000 ac=0.0008 | CI_T0=99.94%
2026-02-12 20:29:15,260 - INFO - [Task 0 | ep 3 | step 325] loss=0.0009 c=0.0003 r=0.0000 ac=0.0006 | CI_T0=99.96%
2026-02-12 20:29:19,778 - INFO - [Task 0 | ep 3 | step 350] loss=0.0013 c=0.0009 r=0.0000 ac=0.0004 | CI_T0=99.94%
2026-02-12 20:29:24,217 - INFO - [Task 0 | ep 3 | step 375] loss=0.0018 c=0.0014 r=0.0000 ac=0.0005 | CI_T0=99.96%
2026-02-12 20:29:33,489 - INFO - [After Task 0] Task-IL : T0=99.95% | Avg=99.95%
2026-02-12 20:29:33,489 - INFO - [After Task 0] Class-IL: T0=99.95% | Avg=99.95%
2026-02-12 20:29:33,489 - INFO - ========== GROUP DIFFERENCES ==========
2026-02-12 20:29:33,489 - INFO - Seen tasks: 0..0 | valid_out_dim=2
2026-02-12 20:29:35,688 - INFO - [Group=Task0] CI_acc=99.95% | corr_slice_max=4.735 | best_other_max=nan | gap=nan
2026-02-12 20:29:35,689 - INFO - [Group=Task0] winner_task_dist: W0=100.0%
2026-02-12 20:29:35,689 - INFO - [Group=Task0] slice_strength : S0=4.73
2026-02-12 20:29:35,689 - INFO - ======================================
2026-02-12 20:29:35,690 - INFO - ========== Task 1: classes [2, 3] ==========
2026-02-12 20:29:47,806 - INFO - [Task 1 | ep 0 | step 0] loss=6.2540 c=3.9795 r=2.2718 ac=0.0027 | CI_T0=99.74% | CI_T1=3.17%
2026-02-12 20:29:56,790 - INFO - [Task 1 | ep 0 | step 25] loss=7.5230 c=0.2244 r=1.3294 ac=0.0046 | si=0.0019 | CI_T0=54.82% | CI_T1=90.88%
2026-02-12 20:30:05,744 - INFO - [Task 1 | ep 0 | step 50] loss=12.9726 c=0.1808 r=1.3090 ac=0.0056 | si=0.0026 | CI_T0=27.88% | CI_T1=96.18%
2026-02-12 20:30:14,651 - INFO - [Task 1 | ep 0 | step 75] loss=11.4139 c=0.1600 r=1.0294 ac=0.0066 | si=0.0032 | CI_T0=18.94% | CI_T1=97.58%
2026-02-12 20:30:27,561 - INFO - [Task 1 | ep 1 | step 100] loss=10.4025 c=0.1639 r=0.9450 ac=0.0073 | si=0.0037 | CI_T0=19.13% | CI_T1=98.13%
2026-02-12 20:30:36,436 - INFO - [Task 1 | ep 1 | step 125] loss=10.3226 c=0.1433 r=0.7688 ac=0.0082 | si=0.0043 | CI_T0=11.18% | CI_T1=98.37%
2026-02-12 20:30:45,323 - INFO - [Task 1 | ep 1 | step 150] loss=10.4936 c=0.1707 r=0.9669 ac=0.0096 | si=0.0048 | CI_T0=15.60% | CI_T1=98.56%
2026-02-12 20:30:54,186 - INFO - [Task 1 | ep 1 | step 175] loss=7.8552 c=0.1404 r=0.9526 ac=0.0104 | si=0.0054 | CI_T0=31.08% | CI_T1=98.19%
2026-02-12 20:31:07,030 - INFO - [Task 1 | ep 2 | step 200] loss=7.1156 c=0.1554 r=0.9716 ac=0.0119 | si=0.0060 | CI_T0=28.86% | CI_T1=98.09%
2026-02-12 20:31:15,931 - INFO - [Task 1 | ep 2 | step 225] loss=5.9024 c=0.1661 r=0.7614 ac=0.0124 | si=0.0066 | CI_T0=24.99% | CI_T1=98.63%
2026-02-12 20:31:24,817 - INFO - [Task 1 | ep 2 | step 250] loss=6.3637 c=0.1548 r=0.8274 ac=0.0132 | si=0.0072 | CI_T0=22.94% | CI_T1=98.48%
2026-02-12 20:31:33,783 - INFO - [Task 1 | ep 2 | step 275] loss=4.4861 c=0.1232 r=0.6933 ac=0.0138 | si=0.0078 | CI_T0=36.86% | CI_T1=98.31%
2026-02-12 20:31:46,576 - INFO - [Task 1 | ep 3 | step 300] loss=4.1547 c=0.1329 r=1.1755 ac=0.0148 | si=0.0083 | CI_T0=33.35% | CI_T1=98.43%
2026-02-12 20:31:55,678 - INFO - [Task 1 | ep 3 | step 325] loss=3.7811 c=0.1665 r=0.6973 ac=0.0155 | si=0.0089 | CI_T0=33.47% | CI_T1=98.55%
2026-02-12 20:32:04,846 - INFO - [Task 1 | ep 3 | step 350] loss=3.2893 c=0.1565 r=0.7328 ac=0.0154 | si=0.0094 | CI_T0=37.40% | CI_T1=98.71%
2026-02-12 20:32:13,747 - INFO - [Task 1 | ep 3 | step 375] loss=2.5543 c=0.1215 r=0.7765 ac=0.0160 | si=0.0100 | CI_T0=34.49% | CI_T1=97.76%
2026-02-12 20:32:27,436 - INFO - [After Task 1] Task-IL : T0=99.95% | T1=98.97% | Avg=99.46%
2026-02-12 20:32:27,437 - INFO - [After Task 1] Class-IL: T0=35.18% | T1=98.29% | Avg=66.73%
2026-02-12 20:32:27,437 - INFO - ========== GROUP DIFFERENCES ==========
2026-02-12 20:32:27,437 - INFO - Seen tasks: 0..1 | valid_out_dim=4
2026-02-12 20:32:29,701 - INFO - [Group=Task0] CI_acc=35.18% | corr_slice_max=4.873 | best_other_max=5.202 | gap=-0.329
2026-02-12 20:32:29,702 - INFO - [Group=Task0] winner_task_dist: W0=35.2% | W1=64.8%
2026-02-12 20:32:29,702 - INFO - [Group=Task0] slice_strength : S0=4.87 | S1=5.20
2026-02-12 20:32:31,999 - INFO - [Group=Task1] CI_acc=98.29% | corr_slice_max=6.537 | best_other_max=3.190 | gap=3.347
2026-02-12 20:32:32,000 - INFO - [Group=Task1] winner_task_dist: W0=0.8% | W1=99.2%
2026-02-12 20:32:32,000 - INFO - [Group=Task1] slice_strength : S0=3.19 | S1=6.54
2026-02-12 20:32:32,000 - INFO - ======================================
2026-02-12 20:32:32,000 - INFO - ========== Task 2: classes [4, 5] ==========
2026-02-12 20:32:48,491 - INFO - [Task 2 | ep 0 | step 0] loss=8.5262 c=6.0472 r=2.0225 ac=0.0159 | si=0.0100 | CI_T0=12.62% | CI_T1=98.50% | CI_T2=0.00%
2026-02-12 20:33:01,782 - INFO - [Task 2 | ep 0 | step 25] loss=2.9306 c=0.5358 r=1.0212 ac=0.0164 | si=0.0865 | CI_T0=24.65% | CI_T1=44.91% | CI_T2=91.53%
2026-02-12 20:33:15,094 - INFO - [Task 2 | ep 0 | step 50] loss=2.5298 c=0.3948 r=0.8169 ac=0.0181 | si=0.1093 | CI_T0=39.41% | CI_T1=38.03% | CI_T2=94.42%
2026-02-12 20:33:28,602 - INFO - [Task 2 | ep 0 | step 75] loss=1.8284 c=0.3225 r=0.6553 ac=0.0186 | si=0.1134 | CI_T0=24.08% | CI_T1=33.46% | CI_T2=96.98%
2026-02-12 20:33:45,858 - INFO - [Task 2 | ep 1 | step 100] loss=1.4332 c=0.3471 r=0.6012 ac=0.0194 | si=0.1176 | CI_T0=41.36% | CI_T1=36.41% | CI_T2=96.41%
2026-02-12 20:33:59,271 - INFO - [Task 2 | ep 1 | step 125] loss=1.4711 c=0.2968 r=0.7609 ac=0.0202 | si=0.1190 | CI_T0=37.55% | CI_T1=31.63% | CI_T2=97.60%
2026-02-12 20:34:13,064 - INFO - [Task 2 | ep 1 | step 150] loss=1.3056 c=0.2874 r=0.6465 ac=0.0201 | si=0.1222 | CI_T0=39.24% | CI_T1=33.29% | CI_T2=97.32%
2026-02-12 20:34:30,258 - INFO - [Task 2 | ep 2 | step 175] loss=1.2668 c=0.2514 r=0.6698 ac=0.0205 | si=0.1221 | CI_T0=30.32% | CI_T1=29.02% | CI_T2=98.46%
2026-02-12 20:34:43,629 - INFO - [Task 2 | ep 2 | step 200] loss=1.3918 c=0.2794 r=0.7267 ac=0.0204 | si=0.1232 | CI_T0=48.71% | CI_T1=32.81% | CI_T2=97.52%
2026-02-12 20:34:56,953 - INFO - [Task 2 | ep 2 | step 225] loss=1.4236 c=0.2623 r=0.6664 ac=0.0203 | si=0.1294 | CI_T0=27.19% | CI_T1=28.00% | CI_T2=97.60%
2026-02-12 20:35:10,619 - INFO - [Task 2 | ep 2 | step 250] loss=1.5665 c=0.2511 r=0.6466 ac=0.0211 | si=0.1280 | CI_T0=34.34% | CI_T1=29.57% | CI_T2=97.24%
2026-02-12 20:35:27,925 - INFO - [Task 2 | ep 3 | step 275] loss=1.5410 c=0.2492 r=0.8037 ac=0.0209 | si=0.1283 | CI_T0=28.84% | CI_T1=30.70% | CI_T2=97.58%
2026-02-12 20:35:41,471 - INFO - [Task 2 | ep 3 | step 300] loss=1.5585 c=0.2677 r=0.7555 ac=0.0210 | si=0.1312 | CI_T0=30.28% | CI_T1=31.82% | CI_T2=98.73%
2026-02-12 20:35:54,884 - INFO - [Task 2 | ep 3 | step 325] loss=1.7944 c=0.2609 r=0.6396 ac=0.0203 | si=0.1310 | CI_T0=38.69% | CI_T1=30.73% | CI_T2=97.50%
2026-02-12 20:36:13,211 - INFO - [After Task 2] Task-IL : T0=99.95% | T1=98.82% | T2=99.57% | Avg=99.45%
2026-02-12 20:36:13,211 - INFO - [After Task 2] Class-IL: T0=24.92% | T1=34.23% | T2=97.92% | Avg=52.36%
2026-02-12 20:36:13,211 - INFO - ========== GROUP DIFFERENCES ==========
2026-02-12 20:36:13,212 - INFO - Seen tasks: 0..2 | valid_out_dim=6
2026-02-12 20:36:15,488 - INFO - [Group=Task0] CI_acc=24.92% | corr_slice_max=4.765 | best_other_max=5.589 | gap=-0.824
2026-02-12 20:36:15,488 - INFO - [Group=Task0] winner_task_dist: W0=24.9% | W1=20.9% | W2=54.2%
2026-02-12 20:36:15,488 - INFO - [Group=Task0] slice_strength : S0=4.77 | S1=5.04 | S2=5.49
2026-02-12 20:36:17,735 - INFO - [Group=Task1] CI_acc=34.23% | corr_slice_max=6.286 | best_other_max=6.629 | gap=-0.343
2026-02-12 20:36:17,736 - INFO - [Group=Task1] winner_task_dist: W0=0.7% | W1=34.2% | W2=65.1%
2026-02-12 20:36:17,736 - INFO - [Group=Task1] slice_strength : S0=3.12 | S1=6.29 | S2=6.60
2026-02-12 20:36:19,978 - INFO - [Group=Task2] CI_acc=97.92% | corr_slice_max=7.584 | best_other_max=5.829 | gap=1.755
2026-02-12 20:36:19,979 - INFO - [Group=Task2] winner_task_dist: W0=0.2% | W1=1.8% | W2=98.0%
2026-02-12 20:36:19,980 - INFO - [Group=Task2] slice_strength : S0=3.24 | S1=5.83 | S2=7.58
2026-02-12 20:36:19,980 - INFO - ======================================
2026-02-12 20:36:19,980 - INFO - ========== Task 3: classes [6, 7] ==========
2026-02-12 20:36:40,877 - INFO - [Task 3 | ep 0 | step 0] loss=9.1823 c=7.2565 r=1.4665 ac=0.0191 | si=0.1325 | CI_T0=3.62% | CI_T1=32.61% | CI_T2=97.98% | CI_T3=0.00%
2026-02-12 20:36:58,742 - INFO - [Task 3 | ep 0 | step 25] loss=2.8213 c=0.5422 r=1.1596 ac=0.0189 | si=0.2328 | CI_T0=36.62% | CI_T1=23.52% | CI_T2=63.78% | CI_T3=95.40%
2026-02-12 20:37:16,443 - INFO - [Task 3 | ep 0 | step 50] loss=2.2228 c=0.4252 r=0.8533 ac=0.0197 | si=0.2333 | CI_T0=0.62% | CI_T1=23.08% | CI_T2=71.89% | CI_T3=95.36%
2026-02-12 20:37:34,017 - INFO - [Task 3 | ep 0 | step 75] loss=1.9817 c=0.4214 r=0.7681 ac=0.0206 | si=0.2211 | CI_T0=3.45% | CI_T1=22.96% | CI_T2=74.16% | CI_T3=96.50%
2026-02-12 20:37:55,563 - INFO - [Task 3 | ep 1 | step 100] loss=2.1191 c=0.3828 r=0.8184 ac=0.0205 | si=0.2149 | CI_T0=0.20% | CI_T1=22.17% | CI_T2=74.40% | CI_T3=96.39%
2026-02-12 20:38:13,299 - INFO - [Task 3 | ep 1 | step 125] loss=2.0061 c=0.4111 r=0.7887 ac=0.0208 | si=0.2074 | CI_T0=7.53% | CI_T1=21.38% | CI_T2=77.76% | CI_T3=96.81%
2026-02-12 20:38:30,974 - INFO - [Task 3 | ep 1 | step 150] loss=1.9279 c=0.4381 r=0.7211 ac=0.0205 | si=0.2037 | CI_T0=0.57% | CI_T1=24.43% | CI_T2=75.38% | CI_T3=96.03%
2026-02-12 20:38:48,568 - INFO - [Task 3 | ep 1 | step 175] loss=1.8417 c=0.3914 r=0.7147 ac=0.0219 | si=0.2034 | CI_T0=2.36% | CI_T1=23.00% | CI_T2=76.04% | CI_T3=98.06%
2026-02-12 20:39:10,106 - INFO - [Task 3 | ep 2 | step 200] loss=2.0594 c=0.4036 r=0.6637 ac=0.0212 | si=0.2023 | CI_T0=16.22% | CI_T1=26.35% | CI_T2=74.89% | CI_T3=97.75%
2026-02-12 20:39:27,908 - INFO - [Task 3 | ep 2 | step 225] loss=2.0373 c=0.3953 r=0.7176 ac=0.0222 | si=0.2009 | CI_T0=19.55% | CI_T1=24.73% | CI_T2=74.62% | CI_T3=97.55%
2026-02-12 20:39:45,854 - INFO - [Task 3 | ep 2 | step 250] loss=1.9189 c=0.3927 r=0.8812 ac=0.0217 | si=0.2052 | CI_T0=0.49% | CI_T1=23.66% | CI_T2=75.87% | CI_T3=98.40%
2026-02-12 20:40:03,715 - INFO - [Task 3 | ep 2 | step 275] loss=1.9033 c=0.3993 r=0.7210 ac=0.0222 | si=0.2032 | CI_T0=2.23% | CI_T1=25.50% | CI_T2=76.54% | CI_T3=97.70%
2026-02-12 20:40:25,301 - INFO - [Task 3 | ep 3 | step 300] loss=1.7692 c=0.3605 r=0.7160 ac=0.0223 | si=0.2054 | CI_T0=0.53% | CI_T1=18.49% | CI_T2=77.21% | CI_T3=98.36%
2026-02-12 20:40:43,176 - INFO - [Task 3 | ep 3 | step 325] loss=2.2070 c=0.4322 r=0.9495 ac=0.0216 | si=0.2035 | CI_T0=41.70% | CI_T1=25.71% | CI_T2=74.80% | CI_T3=97.56%
2026-02-12 20:41:01,009 - INFO - [Task 3 | ep 3 | step 350] loss=1.8785 c=0.3568 r=0.6601 ac=0.0208 | si=0.2024 | CI_T0=12.73% | CI_T1=23.20% | CI_T2=72.94% | CI_T3=98.51%
2026-02-12 20:41:18,956 - INFO - [Task 3 | ep 3 | step 375] loss=1.9432 c=0.3548 r=0.8036 ac=0.0216 | si=0.2026 | CI_T0=19.00% | CI_T1=26.48% | CI_T2=73.49% | CI_T3=98.29%
2026-02-12 20:41:41,548 - INFO - [After Task 3] Task-IL : T0=99.95% | T1=98.38% | T2=98.77% | T3=99.75% | Avg=99.21%
2026-02-12 20:41:41,549 - INFO - [After Task 3] Class-IL: T0=6.10% | T1=23.80% | T2=75.45% | T3=96.73% | Avg=50.52%
2026-02-12 20:41:41,549 - INFO - ========== GROUP DIFFERENCES ==========
2026-02-12 20:41:41,549 - INFO - Seen tasks: 0..3 | valid_out_dim=8
2026-02-12 20:41:43,743 - INFO - [Group=Task0] CI_acc=6.10% | corr_slice_max=4.884 | best_other_max=6.145 | gap=-1.260
2026-02-12 20:41:43,745 - INFO - [Group=Task0] winner_task_dist: W0=6.1% | W1=2.8% | W2=18.8% | W3=72.3%
2026-02-12 20:41:43,745 - INFO - [Group=Task0] slice_strength : S0=4.88 | S1=5.08 | S2=5.31 | S3=5.95
2026-02-12 20:41:46,018 - INFO - [Group=Task1] CI_acc=23.80% | corr_slice_max=6.145 | best_other_max=6.808 | gap=-0.662
2026-02-12 20:41:46,020 - INFO - [Group=Task1] winner_task_dist: W0=0.8% | W1=23.8% | W2=44.7% | W3=30.7%
2026-02-12 20:41:46,020 - INFO - [Group=Task1] slice_strength : S0=3.22 | S1=6.15 | S2=6.23 | S3=5.97
2026-02-12 20:41:48,173 - INFO - [Group=Task2] CI_acc=75.45% | corr_slice_max=7.259 | best_other_max=6.666 | gap=0.592
2026-02-12 20:41:48,174 - INFO - [Group=Task2] winner_task_dist: W0=0.0% | W1=1.5% | W2=75.6% | W3=22.9%
2026-02-12 20:41:48,174 - INFO - [Group=Task2] slice_strength : S0=3.38 | S1=5.76 | S2=7.26 | S3=6.37
2026-02-12 20:41:50,412 - INFO - [Group=Task3] CI_acc=96.73% | corr_slice_max=8.020 | best_other_max=6.568 | gap=1.452
2026-02-12 20:41:50,413 - INFO - [Group=Task3] winner_task_dist: W0=0.1% | W1=0.8% | W2=2.4% | W3=96.8%
2026-02-12 20:41:50,413 - INFO - [Group=Task3] slice_strength : S0=3.33 | S1=5.50 | S2=6.48 | S3=8.02
2026-02-12 20:41:50,413 - INFO - ======================================
2026-02-12 20:41:50,414 - INFO - ========== Task 4: classes [8, 9] ==========
2026-02-12 20:42:15,543 - INFO - [Task 4 | ep 0 | step 0] loss=9.8171 c=7.4715 r=1.8074 ac=0.0198 | si=0.2036 | CI_T0=45.31% | CI_T1=28.73% | CI_T2=73.45% | CI_T3=95.51% | CI_T4=0.00%
2026-02-12 20:42:37,799 - INFO - [Task 4 | ep 0 | step 25] loss=2.5224 c=0.7884 r=1.3138 ac=0.0182 | si=0.3389 | CI_T0=7.59% | CI_T1=9.92% | CI_T2=21.57% | CI_T3=38.68% | CI_T4=90.68%
2026-02-12 20:42:59,804 - INFO - [Task 4 | ep 0 | step 50] loss=2.1662 c=0.7301 r=0.9319 ac=0.0202 | si=0.3462 | CI_T0=0.13% | CI_T1=3.86% | CI_T2=27.77% | CI_T3=49.49% | CI_T4=92.33%
2026-02-12 20:43:21,950 - INFO - [Task 4 | ep 0 | step 75] loss=2.0023 c=0.6868 r=0.8745 ac=0.0200 | si=0.3312 | CI_T0=1.39% | CI_T1=8.48% | CI_T2=21.46% | CI_T3=41.41% | CI_T4=95.79%
2026-02-12 20:43:48,006 - INFO - [Task 4 | ep 1 | step 100] loss=2.0619 c=0.6528 r=0.8945 ac=0.0218 | si=0.3199 | CI_T0=0.02% | CI_T1=4.71% | CI_T2=25.92% | CI_T3=44.72% | CI_T4=95.31%
2026-02-12 20:44:10,083 - INFO - [Task 4 | ep 1 | step 125] loss=1.9923 c=0.6376 r=0.9026 ac=0.0219 | si=0.3104 | CI_T0=0.78% | CI_T1=5.61% | CI_T2=29.96% | CI_T3=49.31% | CI_T4=94.92%
2026-02-12 20:44:32,130 - INFO - [Task 4 | ep 1 | step 150] loss=1.9196 c=0.6234 r=0.8511 ac=0.0228 | si=0.3034 | CI_T0=1.66% | CI_T1=5.44% | CI_T2=29.52% | CI_T3=47.77% | CI_T4=94.80%
2026-02-12 20:44:54,198 - INFO - [Task 4 | ep 1 | step 175] loss=1.8539 c=0.6492 r=0.7902 ac=0.0225 | si=0.3015 | CI_T0=0.26% | CI_T1=2.80% | CI_T2=27.86% | CI_T3=47.66% | CI_T4=95.60%
2026-02-12 20:45:20,131 - INFO - [Task 4 | ep 2 | step 200] loss=1.8915 c=0.5648 r=0.8681 ac=0.0230 | si=0.3010 | CI_T0=0.58% | CI_T1=5.25% | CI_T2=31.80% | CI_T3=46.82% | CI_T4=96.56%
2026-02-12 20:45:42,328 - INFO - [Task 4 | ep 2 | step 225] loss=1.7035 c=0.5435 r=0.7473 ac=0.0233 | si=0.2974 | CI_T0=0.65% | CI_T1=2.72% | CI_T2=33.72% | CI_T3=45.23% | CI_T4=96.09%
2026-02-12 20:46:04,628 - INFO - [Task 4 | ep 2 | step 250] loss=1.8749 c=0.6327 r=0.8260 ac=0.0230 | si=0.2965 | CI_T0=0.45% | CI_T1=5.09% | CI_T2=24.88% | CI_T3=45.30% | CI_T4=95.40%
2026-02-12 20:46:26,660 - INFO - [Task 4 | ep 2 | step 275] loss=1.9785 c=0.5477 r=1.0049 ac=0.0227 | si=0.2968 | CI_T0=4.42% | CI_T1=6.02% | CI_T2=26.25% | CI_T3=44.43% | CI_T4=97.21%
2026-02-12 20:46:52,631 - INFO - [Task 4 | ep 3 | step 300] loss=1.7496 c=0.5852 r=0.7325 ac=0.0242 | si=0.2974 | CI_T0=1.58% | CI_T1=8.59% | CI_T2=31.21% | CI_T3=44.68% | CI_T4=96.70%
2026-02-12 20:47:14,868 - INFO - [Task 4 | ep 3 | step 325] loss=1.9833 c=0.5839 r=0.9773 ac=0.0234 | si=0.2940 | CI_T0=0.04% | CI_T1=4.51% | CI_T2=26.91% | CI_T3=45.44% | CI_T4=96.31%
2026-02-12 20:47:37,391 - INFO - [Task 4 | ep 3 | step 350] loss=1.8775 c=0.6444 r=0.8012 ac=0.0234 | si=0.2957 | CI_T0=1.33% | CI_T1=7.05% | CI_T2=27.74% | CI_T3=41.06% | CI_T4=96.35%
2026-02-12 20:48:04,431 - INFO - [After Task 4] Task-IL : T0=99.95% | T1=98.87% | T2=99.09% | T3=99.24% | T4=98.54% | Avg=99.14%
2026-02-12 20:48:04,432 - INFO - [After Task 4] Class-IL: T0=0.24% | T1=4.95% | T2=22.95% | T3=42.55% | T4=95.92% | Avg=33.32%
2026-02-12 20:48:04,432 - INFO - ========== GROUP DIFFERENCES ==========
2026-02-12 20:48:04,432 - INFO - Seen tasks: 0..4 | valid_out_dim=10
2026-02-12 20:48:06,617 - INFO - [Group=Task0] CI_acc=0.24% | corr_slice_max=4.878 | best_other_max=6.249 | gap=-1.371
2026-02-12 20:48:06,619 - INFO - [Group=Task0] winner_task_dist: W0=0.2% | W1=4.1% | W2=6.7% | W3=34.2% | W4=54.8%
2026-02-12 20:48:06,619 - INFO - [Group=Task0] slice_strength : S0=4.88 | S1=5.35 | S2=5.33 | S3=5.72 | S4=6.04
2026-02-12 20:48:08,812 - INFO - [Group=Task1] CI_acc=4.95% | corr_slice_max=6.062 | best_other_max=7.143 | gap=-1.081
2026-02-12 20:48:08,814 - INFO - [Group=Task1] winner_task_dist: W0=0.0% | W1=4.9% | W2=26.6% | W3=13.9% | W4=54.5%
2026-02-12 20:48:08,814 - INFO - [Group=Task1] slice_strength : S0=3.13 | S1=6.06 | S2=6.09 | S3=5.65 | S4=6.79
2026-02-12 20:48:10,987 - INFO - [Group=Task2] CI_acc=22.95% | corr_slice_max=7.031 | best_other_max=7.526 | gap=-0.495
2026-02-12 20:48:10,988 - INFO - [Group=Task2] winner_task_dist: W0=0.0% | W1=0.6% | W2=23.0% | W3=3.4% | W4=72.9%
2026-02-12 20:48:10,988 - INFO - [Group=Task2] slice_strength : S0=3.15 | S1=5.53 | S2=7.03 | S3=6.03 | S4=7.47
2026-02-12 20:48:13,153 - INFO - [Group=Task3] CI_acc=42.55% | corr_slice_max=7.172 | best_other_max=7.295 | gap=-0.124
2026-02-12 20:48:13,154 - INFO - [Group=Task3] winner_task_dist: W0=0.1% | W1=1.2% | W2=2.8% | W3=42.5% | W4=53.4%
2026-02-12 20:48:13,154 - INFO - [Group=Task3] slice_strength : S0=3.21 | S1=5.42 | S2=6.32 | S3=7.17 | S4=7.22
2026-02-12 20:48:15,373 - INFO - [Group=Task4] CI_acc=95.92% | corr_slice_max=7.891 | best_other_max=6.696 | gap=1.195
2026-02-12 20:48:15,374 - INFO - [Group=Task4] winner_task_dist: W0=0.0% | W1=0.2% | W2=0.9% | W3=2.5% | W4=96.4%
2026-02-12 20:48:15,374 - INFO - [Group=Task4] slice_strength : S0=2.96 | S1=5.47 | S2=6.31 | S3=6.42 | S4=7.89
2026-02-12 20:48:15,374 - INFO - ======================================
2026-02-12 20:48:15,374 - INFO - ========== FINAL METRICS (Class-IL) ==========
2026-02-12 20:48:15,374 - INFO - Forgetting per task: T0=99.72%, T1=93.34%, T2=74.97%, T3=54.18%, T4=0.00%
2026-02-12 20:48:15,374 - INFO - BWT: -80.55%
2026-02-12 20:48:15,374 - INFO - Final average Class-IL accuracy: 33.32%
