2026-02-13 12:44:24,282 - INFO - Device: cuda
2026-02-13 12:44:24,282 - INFO - Config: {'device': 'cuda', 'lr': 0.005, 'epochs_per_task': 4, 'batch_size': 128, 'lambda_slice': 2.0, 'lambda_feat': 0.5, 'vae_epochs': 5, 'vae_n_fake_per_task': 32, 'lambda_adv_feat': 0.1, 'lambda_adv_slice': 0.1, 'slice_margin': 0.3, 'lambda_margin': 0.5, 'importance_decay': 0.9}
2026-02-13 12:44:24,356 - INFO - ========== Task 0: classes [0, 1] ==========
2026-02-13 12:44:54,279 - INFO - [Task 0 | ep 0 | step 0] loss=0.8626 | CI_T0=96.85%
2026-02-13 12:44:58,779 - INFO - [Task 0 | ep 0 | step 25] loss=0.0311 | CI_T0=99.83%
2026-02-13 12:45:03,367 - INFO - [Task 0 | ep 0 | step 50] loss=0.0042 | CI_T0=99.86%
2026-02-13 12:45:07,848 - INFO - [Task 0 | ep 0 | step 75] loss=0.0349 | CI_T0=99.88%
2026-02-13 12:45:16,183 - INFO - [Task 0 | ep 1 | step 100] loss=0.0008 | CI_T0=99.93%
2026-02-13 12:45:20,693 - INFO - [Task 0 | ep 1 | step 125] loss=0.0199 | CI_T0=99.93%
2026-02-13 12:45:25,175 - INFO - [Task 0 | ep 1 | step 150] loss=0.0004 | CI_T0=99.96%
2026-02-13 12:45:29,661 - INFO - [Task 0 | ep 1 | step 175] loss=0.0004 | CI_T0=99.97%
2026-02-13 12:45:38,053 - INFO - [Task 0 | ep 2 | step 200] loss=0.0001 | CI_T0=99.96%
2026-02-13 12:45:42,531 - INFO - [Task 0 | ep 2 | step 225] loss=0.0001 | CI_T0=99.96%
2026-02-13 12:45:47,089 - INFO - [Task 0 | ep 2 | step 250] loss=0.0001 | CI_T0=99.94%
2026-02-13 12:45:51,580 - INFO - [Task 0 | ep 2 | step 275] loss=0.0002 | CI_T0=99.97%
2026-02-13 12:45:59,947 - INFO - [Task 0 | ep 3 | step 300] loss=0.0003 | CI_T0=100.00%
2026-02-13 12:46:04,496 - INFO - [Task 0 | ep 3 | step 325] loss=0.0001 | CI_T0=99.98%
2026-02-13 12:46:09,023 - INFO - [Task 0 | ep 3 | step 350] loss=0.0001 | CI_T0=99.99%
2026-02-13 12:46:13,650 - INFO - [Task 0 | ep 3 | step 375] loss=0.0001 | CI_T0=99.98%
2026-02-13 12:46:18,532 - INFO - [After Task 0] Task-IL : T0=99.91% | Avg=99.91%
2026-02-13 12:46:18,532 - INFO - [After Task 0] Class-IL: T0=99.91% | Avg=99.91%
2026-02-13 12:46:18,532 - INFO - ========== GROUP DIFFERENCES ==========
2026-02-13 12:46:18,532 - INFO - Seen tasks: 0..0 | valid_out_dim=2
2026-02-13 12:46:20,723 - INFO - [Group=Task0] CI_acc=99.91% | corr_slice_max=5.153 | best_other_max=nan | gap=nan
2026-02-13 12:46:20,723 - INFO - [Group=Task0] winner_task_dist: W0=100.0%
2026-02-13 12:46:20,723 - INFO - [Group=Task0] slice_strength : S0=5.15
2026-02-13 12:46:20,723 - INFO - ======================================
2026-02-13 12:46:20,723 - INFO - ========== Task 1: classes [2, 3] ==========
2026-02-13 12:46:54,853 - INFO - [Task 1 | ep 0 | step 0] loss=6.9046 | CI_T0=99.98% | CI_T1=2.08%
2026-02-13 12:47:03,905 - INFO - [Task 1 | ep 0 | step 25] loss=2.0049 | CI_T0=38.30% | CI_T1=94.05%
2026-02-13 12:47:12,932 - INFO - [Task 1 | ep 0 | step 50] loss=2.4346 | CI_T0=19.83% | CI_T1=58.03%
2026-02-13 12:47:23,166 - INFO - [Task 1 | ep 0 | step 75] loss=2.5406 | CI_T0=38.57% | CI_T1=80.62%
2026-02-13 12:47:35,838 - INFO - [Task 1 | ep 1 | step 100] loss=2.2130 | CI_T0=40.82% | CI_T1=77.56%
2026-02-13 12:47:44,763 - INFO - [Task 1 | ep 1 | step 125] loss=3.0280 | CI_T0=54.41% | CI_T1=86.80%
2026-02-13 12:47:53,585 - INFO - [Task 1 | ep 1 | step 150] loss=2.9618 | CI_T0=52.62% | CI_T1=89.06%
2026-02-13 12:48:02,394 - INFO - [Task 1 | ep 1 | step 175] loss=3.2403 | CI_T0=47.53% | CI_T1=89.84%
2026-02-13 12:48:15,011 - INFO - [Task 1 | ep 2 | step 200] loss=3.1815 | CI_T0=44.19% | CI_T1=89.52%
2026-02-13 12:48:23,951 - INFO - [Task 1 | ep 2 | step 225] loss=2.3775 | CI_T0=35.42% | CI_T1=86.45%
2026-02-13 12:48:32,740 - INFO - [Task 1 | ep 2 | step 250] loss=2.6539 | CI_T0=36.13% | CI_T1=74.83%
2026-02-13 12:48:41,531 - INFO - [Task 1 | ep 2 | step 275] loss=2.7324 | CI_T0=32.39% | CI_T1=71.45%
2026-02-13 12:48:54,293 - INFO - [Task 1 | ep 3 | step 300] loss=3.5103 | CI_T0=24.12% | CI_T1=79.05%
2026-02-13 12:49:03,281 - INFO - [Task 1 | ep 3 | step 325] loss=2.4640 | CI_T0=31.18% | CI_T1=87.08%
2026-02-13 12:49:12,147 - INFO - [Task 1 | ep 3 | step 350] loss=2.4532 | CI_T0=21.80% | CI_T1=90.59%
2026-02-13 12:49:20,980 - INFO - [Task 1 | ep 3 | step 375] loss=2.4284 | CI_T0=27.02% | CI_T1=85.97%
2026-02-13 12:49:30,094 - INFO - [After Task 1] Task-IL : T0=98.25% | T1=93.78% | Avg=96.02%
2026-02-13 12:49:30,094 - INFO - [After Task 1] Class-IL: T0=27.52% | T1=85.50% | Avg=56.51%
2026-02-13 12:49:30,094 - INFO - ========== GROUP DIFFERENCES ==========
2026-02-13 12:49:30,094 - INFO - Seen tasks: 0..1 | valid_out_dim=4
2026-02-13 12:49:32,285 - INFO - [Group=Task0] CI_acc=27.52% | corr_slice_max=3.500 | best_other_max=4.342 | gap=-0.843
2026-02-13 12:49:32,285 - INFO - [Group=Task0] winner_task_dist: W0=27.9% | W1=72.1%
2026-02-13 12:49:32,285 - INFO - [Group=Task0] slice_strength : S0=3.50 | S1=4.34
2026-02-13 12:49:34,491 - INFO - [Group=Task1] CI_acc=85.50% | corr_slice_max=3.805 | best_other_max=2.280 | gap=1.526
2026-02-13 12:49:34,491 - INFO - [Group=Task1] winner_task_dist: W0=11.6% | W1=88.4%
2026-02-13 12:49:34,491 - INFO - [Group=Task1] slice_strength : S0=2.28 | S1=3.81
2026-02-13 12:49:34,491 - INFO - ======================================
2026-02-13 12:49:34,491 - INFO - ========== Task 2: classes [4, 5] ==========
2026-02-13 12:50:12,350 - INFO - [Task 2 | ep 0 | step 0] loss=8.7422 | CI_T0=64.11% | CI_T1=89.83% | CI_T2=0.08%
2026-02-13 12:50:25,459 - INFO - [Task 2 | ep 0 | step 25] loss=2.2593 | CI_T0=44.41% | CI_T1=26.75% | CI_T2=85.03%
2026-02-13 12:50:38,587 - INFO - [Task 2 | ep 0 | step 50] loss=2.0152 | CI_T0=57.17% | CI_T1=25.29% | CI_T2=91.16%
2026-02-13 12:50:51,649 - INFO - [Task 2 | ep 0 | step 75] loss=2.4322 | CI_T0=30.69% | CI_T1=30.13% | CI_T2=90.54%
2026-02-13 12:51:08,779 - INFO - [Task 2 | ep 1 | step 100] loss=2.9418 | CI_T0=29.34% | CI_T1=40.17% | CI_T2=89.32%
2026-02-13 12:51:21,922 - INFO - [Task 2 | ep 1 | step 125] loss=3.0150 | CI_T0=37.91% | CI_T1=37.92% | CI_T2=89.47%
2026-02-13 12:51:35,105 - INFO - [Task 2 | ep 1 | step 150] loss=2.5535 | CI_T0=34.87% | CI_T1=30.47% | CI_T2=81.37%
2026-02-13 12:51:52,177 - INFO - [Task 2 | ep 2 | step 175] loss=2.5065 | CI_T0=31.73% | CI_T1=19.67% | CI_T2=77.54%
2026-02-13 12:52:05,371 - INFO - [Task 2 | ep 2 | step 200] loss=2.5780 | CI_T0=39.00% | CI_T1=15.82% | CI_T2=63.57%
2026-02-13 12:52:18,366 - INFO - [Task 2 | ep 2 | step 225] loss=2.8145 | CI_T0=31.05% | CI_T1=27.27% | CI_T2=75.09%
2026-02-13 12:52:31,590 - INFO - [Task 2 | ep 2 | step 250] loss=2.7491 | CI_T0=46.05% | CI_T1=18.97% | CI_T2=72.80%
2026-02-13 12:52:48,589 - INFO - [Task 2 | ep 3 | step 275] loss=2.8562 | CI_T0=55.30% | CI_T1=38.58% | CI_T2=76.40%
2026-02-13 12:53:01,715 - INFO - [Task 2 | ep 3 | step 300] loss=2.9562 | CI_T0=53.99% | CI_T1=19.72% | CI_T2=75.02%
2026-02-13 12:53:14,840 - INFO - [Task 2 | ep 3 | step 325] loss=2.8623 | CI_T0=51.83% | CI_T1=21.47% | CI_T2=76.24%
2026-02-13 12:53:28,771 - INFO - [After Task 2] Task-IL : T0=98.63% | T1=85.90% | T2=95.68% | Avg=93.40%
2026-02-13 12:53:28,771 - INFO - [After Task 2] Class-IL: T0=39.53% | T1=14.64% | T2=85.43% | Avg=46.53%
2026-02-13 12:53:28,771 - INFO - ========== GROUP DIFFERENCES ==========
2026-02-13 12:53:28,771 - INFO - Seen tasks: 0..2 | valid_out_dim=6
2026-02-13 12:53:30,974 - INFO - [Group=Task0] CI_acc=39.53% | corr_slice_max=3.995 | best_other_max=4.327 | gap=-0.332
2026-02-13 12:53:30,974 - INFO - [Group=Task0] winner_task_dist: W0=39.5% | W1=3.6% | W2=56.8%
2026-02-13 12:53:30,974 - INFO - [Group=Task0] slice_strength : S0=4.00 | S1=2.88 | S2=4.23
2026-02-13 12:53:33,187 - INFO - [Group=Task1] CI_acc=14.64% | corr_slice_max=3.539 | best_other_max=5.059 | gap=-1.520
2026-02-13 12:53:33,187 - INFO - [Group=Task1] winner_task_dist: W0=24.6% | W1=14.8% | W2=60.5%
2026-02-13 12:53:33,187 - INFO - [Group=Task1] slice_strength : S0=3.54 | S1=3.54 | S2=4.69
2026-02-13 12:53:35,405 - INFO - [Group=Task2] CI_acc=85.43% | corr_slice_max=5.694 | best_other_max=4.102 | gap=1.592
2026-02-13 12:53:35,406 - INFO - [Group=Task2] winner_task_dist: W0=11.8% | W1=1.1% | W2=87.1%
2026-02-13 12:53:35,406 - INFO - [Group=Task2] slice_strength : S0=3.91 | S1=2.73 | S2=5.69
2026-02-13 12:53:35,406 - INFO - ======================================
2026-02-13 12:53:35,406 - INFO - ========== Task 3: classes [6, 7] ==========
2026-02-13 12:54:17,458 - INFO - [Task 3 | ep 0 | step 0] loss=9.4645 | CI_T0=55.67% | CI_T1=24.15% | CI_T2=89.94% | CI_T3=0.00%
2026-02-13 12:54:34,786 - INFO - [Task 3 | ep 0 | step 25] loss=2.5467 | CI_T0=38.19% | CI_T1=16.90% | CI_T2=39.70% | CI_T3=94.61%
2026-02-13 12:54:52,341 - INFO - [Task 3 | ep 0 | step 50] loss=2.0954 | CI_T0=62.99% | CI_T1=19.35% | CI_T2=47.91% | CI_T3=98.16%
2026-02-13 12:55:09,898 - INFO - [Task 3 | ep 0 | step 75] loss=2.0512 | CI_T0=65.48% | CI_T1=26.22% | CI_T2=54.29% | CI_T3=98.60%
2026-02-13 12:55:31,155 - INFO - [Task 3 | ep 1 | step 100] loss=2.0360 | CI_T0=46.24% | CI_T1=24.31% | CI_T2=57.18% | CI_T3=99.17%
2026-02-13 12:55:48,579 - INFO - [Task 3 | ep 1 | step 125] loss=2.0868 | CI_T0=51.86% | CI_T1=30.25% | CI_T2=43.79% | CI_T3=99.14%
2026-02-13 12:56:06,127 - INFO - [Task 3 | ep 1 | step 150] loss=2.2654 | CI_T0=59.44% | CI_T1=29.06% | CI_T2=46.77% | CI_T3=98.89%
2026-02-13 12:56:23,534 - INFO - [Task 3 | ep 1 | step 175] loss=2.4091 | CI_T0=39.17% | CI_T1=29.06% | CI_T2=46.33% | CI_T3=98.31%
2026-02-13 12:56:44,858 - INFO - [Task 3 | ep 2 | step 200] loss=2.3097 | CI_T0=39.52% | CI_T1=34.03% | CI_T2=49.79% | CI_T3=97.92%
2026-02-13 12:57:02,268 - INFO - [Task 3 | ep 2 | step 225] loss=2.5789 | CI_T0=59.03% | CI_T1=30.12% | CI_T2=40.86% | CI_T3=98.58%
2026-02-13 12:57:19,551 - INFO - [Task 3 | ep 2 | step 250] loss=2.5773 | CI_T0=69.28% | CI_T1=28.51% | CI_T2=34.11% | CI_T3=98.41%
2026-02-13 12:57:37,067 - INFO - [Task 3 | ep 2 | step 275] loss=2.6027 | CI_T0=76.29% | CI_T1=28.66% | CI_T2=34.93% | CI_T3=99.05%
2026-02-13 12:58:01,953 - INFO - [Task 3 | ep 3 | step 300] loss=2.5177 | CI_T0=78.09% | CI_T1=28.01% | CI_T2=38.59% | CI_T3=99.24%
2026-02-13 12:58:19,145 - INFO - [Task 3 | ep 3 | step 325] loss=2.4896 | CI_T0=68.50% | CI_T1=26.41% | CI_T2=30.33% | CI_T3=98.89%
2026-02-13 12:58:36,599 - INFO - [Task 3 | ep 3 | step 350] loss=2.5532 | CI_T0=59.96% | CI_T1=30.98% | CI_T2=40.69% | CI_T3=98.36%
2026-02-13 12:58:54,036 - INFO - [Task 3 | ep 3 | step 375] loss=2.7008 | CI_T0=65.98% | CI_T1=26.89% | CI_T2=42.81% | CI_T3=98.19%
2026-02-13 12:59:11,955 - INFO - [After Task 3] Task-IL : T0=99.57% | T1=91.87% | T2=88.05% | T3=99.85% | Avg=94.84%
2026-02-13 12:59:11,955 - INFO - [After Task 3] Class-IL: T0=54.70% | T1=29.33% | T2=48.13% | T3=97.68% | Avg=57.46%
2026-02-13 12:59:11,956 - INFO - ========== GROUP DIFFERENCES ==========
2026-02-13 12:59:11,956 - INFO - Seen tasks: 0..3 | valid_out_dim=8
2026-02-13 12:59:14,190 - INFO - [Group=Task0] CI_acc=54.70% | corr_slice_max=4.815 | best_other_max=4.686 | gap=0.129
2026-02-13 12:59:14,190 - INFO - [Group=Task0] winner_task_dist: W0=54.8% | W1=6.6% | W2=2.7% | W3=35.9%
2026-02-13 12:59:14,190 - INFO - [Group=Task0] slice_strength : S0=4.82 | S1=2.65 | S2=3.29 | S3=4.37
2026-02-13 12:59:16,430 - INFO - [Group=Task1] CI_acc=29.33% | corr_slice_max=3.717 | best_other_max=4.818 | gap=-1.100
2026-02-13 12:59:16,431 - INFO - [Group=Task1] winner_task_dist: W0=8.1% | W1=29.4% | W2=16.3% | W3=46.2%
2026-02-13 12:59:16,431 - INFO - [Group=Task1] slice_strength : S0=2.50 | S1=3.72 | S2=3.67 | S3=4.24
2026-02-13 12:59:18,635 - INFO - [Group=Task2] CI_acc=48.13% | corr_slice_max=5.580 | best_other_max=5.522 | gap=0.058
2026-02-13 12:59:18,635 - INFO - [Group=Task2] winner_task_dist: W0=4.8% | W1=2.5% | W2=48.9% | W3=43.8%
2026-02-13 12:59:18,636 - INFO - [Group=Task2] slice_strength : S0=3.31 | S1=2.62 | S2=5.58 | S3=5.28
2026-02-13 12:59:20,823 - INFO - [Group=Task3] CI_acc=97.68% | corr_slice_max=7.312 | best_other_max=5.773 | gap=1.538
2026-02-13 12:59:20,824 - INFO - [Group=Task3] winner_task_dist: W0=0.1% | W1=0.1% | W2=2.1% | W3=97.7%
2026-02-13 12:59:20,824 - INFO - [Group=Task3] slice_strength : S0=3.82 | S1=2.52 | S2=5.67 | S3=7.31
2026-02-13 12:59:20,824 - INFO - ======================================
2026-02-13 12:59:20,824 - INFO - ========== Task 4: classes [8, 9] ==========
2026-02-13 13:00:07,196 - INFO - [Task 4 | ep 0 | step 0] loss=9.4707 | CI_T0=72.80% | CI_T1=28.99% | CI_T2=49.71% | CI_T3=98.85% | CI_T4=0.00%
2026-02-13 13:00:28,849 - INFO - [Task 4 | ep 0 | step 25] loss=2.9956 | CI_T0=40.96% | CI_T1=1.21% | CI_T2=9.90% | CI_T3=41.57% | CI_T4=87.29%
2026-02-13 13:00:50,664 - INFO - [Task 4 | ep 0 | step 50] loss=2.5352 | CI_T0=40.07% | CI_T1=7.06% | CI_T2=5.86% | CI_T3=45.01% | CI_T4=90.23%
2026-02-13 13:01:12,263 - INFO - [Task 4 | ep 0 | step 75] loss=2.4901 | CI_T0=39.58% | CI_T1=11.04% | CI_T2=9.51% | CI_T3=47.23% | CI_T4=94.74%
2026-02-13 13:01:37,824 - INFO - [Task 4 | ep 1 | step 100] loss=2.6887 | CI_T0=39.42% | CI_T1=11.36% | CI_T2=9.90% | CI_T3=49.88% | CI_T4=95.58%
2026-02-13 13:01:59,564 - INFO - [Task 4 | ep 1 | step 125] loss=2.6265 | CI_T0=28.77% | CI_T1=7.50% | CI_T2=8.92% | CI_T3=48.31% | CI_T4=95.09%
2026-02-13 13:02:21,122 - INFO - [Task 4 | ep 1 | step 150] loss=2.7214 | CI_T0=40.34% | CI_T1=7.94% | CI_T2=9.47% | CI_T3=41.41% | CI_T4=92.13%
2026-02-13 13:02:42,674 - INFO - [Task 4 | ep 1 | step 175] loss=2.8444 | CI_T0=49.47% | CI_T1=9.60% | CI_T2=20.60% | CI_T3=36.72% | CI_T4=94.68%
2026-02-13 13:03:08,235 - INFO - [Task 4 | ep 2 | step 200] loss=2.8699 | CI_T0=30.72% | CI_T1=5.63% | CI_T2=15.96% | CI_T3=21.33% | CI_T4=93.55%
2026-02-13 13:03:30,033 - INFO - [Task 4 | ep 2 | step 225] loss=3.0342 | CI_T0=49.52% | CI_T1=11.75% | CI_T2=23.15% | CI_T3=30.22% | CI_T4=94.99%
2026-02-13 13:03:51,657 - INFO - [Task 4 | ep 2 | step 250] loss=2.8866 | CI_T0=54.87% | CI_T1=12.90% | CI_T2=24.31% | CI_T3=29.38% | CI_T4=94.68%
2026-02-13 13:04:13,319 - INFO - [Task 4 | ep 2 | step 275] loss=2.6785 | CI_T0=29.70% | CI_T1=21.43% | CI_T2=20.77% | CI_T3=37.62% | CI_T4=90.29%
2026-02-13 13:04:38,891 - INFO - [Task 4 | ep 3 | step 300] loss=2.9562 | CI_T0=33.50% | CI_T1=18.06% | CI_T2=23.75% | CI_T3=29.56% | CI_T4=89.40%
2026-02-13 13:05:00,564 - INFO - [Task 4 | ep 3 | step 325] loss=3.0596 | CI_T0=40.49% | CI_T1=27.58% | CI_T2=22.64% | CI_T3=47.62% | CI_T4=90.85%
2026-02-13 13:05:22,338 - INFO - [Task 4 | ep 3 | step 350] loss=2.8596 | CI_T0=24.04% | CI_T1=19.80% | CI_T2=14.43% | CI_T3=30.21% | CI_T4=93.83%
2026-02-13 13:05:44,744 - INFO - [After Task 4] Task-IL : T0=99.76% | T1=81.64% | T2=94.56% | T3=95.47% | T4=97.73% | Avg=93.83%
2026-02-13 13:05:44,744 - INFO - [After Task 4] Class-IL: T0=39.39% | T1=18.07% | T2=30.04% | T3=30.82% | T4=94.25% | Avg=42.51%
2026-02-13 13:05:44,744 - INFO - ========== GROUP DIFFERENCES ==========
2026-02-13 13:05:44,744 - INFO - Seen tasks: 0..4 | valid_out_dim=10
2026-02-13 13:05:46,978 - INFO - [Group=Task0] CI_acc=39.39% | corr_slice_max=5.046 | best_other_max=5.600 | gap=-0.554
2026-02-13 13:05:46,978 - INFO - [Group=Task0] winner_task_dist: W0=39.4% | W1=0.5% | W2=4.9% | W3=2.7% | W4=52.6%
2026-02-13 13:05:46,978 - INFO - [Group=Task0] slice_strength : S0=5.05 | S1=2.87 | S2=3.53 | S3=3.59 | S4=5.54
2026-02-13 13:05:49,194 - INFO - [Group=Task1] CI_acc=18.07% | corr_slice_max=4.021 | best_other_max=6.167 | gap=-2.146
2026-02-13 13:05:49,194 - INFO - [Group=Task1] winner_task_dist: W0=2.0% | W1=18.3% | W2=9.7% | W3=13.4% | W4=56.7%
2026-02-13 13:05:49,194 - INFO - [Group=Task1] slice_strength : S0=2.78 | S1=4.02 | S2=4.18 | S3=4.33 | S4=5.95
2026-02-13 13:05:51,404 - INFO - [Group=Task2] CI_acc=30.04% | corr_slice_max=6.188 | best_other_max=7.128 | gap=-0.940
2026-02-13 13:05:51,404 - INFO - [Group=Task2] winner_task_dist: W0=0.5% | W1=0.2% | W2=30.3% | W3=4.3% | W4=64.8%
2026-02-13 13:05:51,405 - INFO - [Group=Task2] slice_strength : S0=2.92 | S1=2.79 | S2=6.19 | S3=5.15 | S4=7.07
2026-02-13 13:05:53,605 - INFO - [Group=Task3] CI_acc=30.82% | corr_slice_max=6.657 | best_other_max=7.186 | gap=-0.529
2026-02-13 13:05:53,605 - INFO - [Group=Task3] winner_task_dist: W0=0.1% | W1=0.5% | W2=3.4% | W3=30.8% | W4=65.2%
2026-02-13 13:05:53,605 - INFO - [Group=Task3] slice_strength : S0=2.28 | S1=2.71 | S2=4.36 | S3=6.66 | S4=7.13
2026-02-13 13:05:55,800 - INFO - [Group=Task4] CI_acc=94.25% | corr_slice_max=8.459 | best_other_max=6.398 | gap=2.060
2026-02-13 13:05:55,800 - INFO - [Group=Task4] winner_task_dist: W0=0.2% | W1=0.2% | W2=0.8% | W3=4.1% | W4=94.8%
2026-02-13 13:05:55,800 - INFO - [Group=Task4] slice_strength : S0=2.90 | S1=3.38 | S2=4.94 | S3=6.09 | S4=8.46
2026-02-13 13:05:55,800 - INFO - ======================================
2026-02-13 13:05:55,800 - INFO - ========== FINAL METRICS (Class-IL) ==========
2026-02-13 13:05:55,801 - INFO - Forgetting per task: T0=60.52%, T1=67.43%, T2=55.39%, T3=66.87%, T4=0.00%
2026-02-13 13:05:55,801 - INFO - BWT: -62.55%
2026-02-13 13:05:55,801 - INFO - Final average Class-IL accuracy: 42.51%
