2026-02-11 20:33:22,105 - INFO - Device: cpu
2026-02-11 20:33:22,106 - INFO - Config: {'device': 'cpu', 'lr': 0.005, 'epochs_per_task': 4, 'batch_size': 128, 'lambda_slice': 2.0, 'lambda_feat': 0.5, 'lambda_pes': 0.5, 'lambda_inter': 0.5}
2026-02-11 20:33:22,108 - INFO - ========== Task 0: classes [0, 1] ==========
2026-02-11 20:33:29,326 - INFO - [Task 0 | ep 0 | step 0] loss=1.2077 c=0.8633 r=0.0000 | pes=0.6889 | CI_T0=96.32%
2026-02-11 20:33:33,317 - INFO - [Task 0 | ep 0 | step 25] loss=0.0074 c=0.0010 r=0.0000 | pes=0.0127 | CI_T0=99.86%
2026-02-11 20:33:37,335 - INFO - [Task 0 | ep 0 | step 50] loss=0.0046 c=0.0011 r=0.0000 | pes=0.0070 | CI_T0=99.91%
2026-02-11 20:33:41,355 - INFO - [Task 0 | ep 0 | step 75] loss=0.0039 c=0.0008 r=0.0000 | pes=0.0063 | CI_T0=99.92%
2026-02-11 20:33:48,903 - INFO - [Task 0 | ep 1 | step 100] loss=0.0030 c=0.0006 r=0.0000 | pes=0.0048 | CI_T0=99.90%
2026-02-11 20:33:52,894 - INFO - [Task 0 | ep 1 | step 125] loss=0.0025 c=0.0005 r=0.0000 | pes=0.0040 | CI_T0=99.94%
2026-02-11 20:33:56,927 - INFO - [Task 0 | ep 1 | step 150] loss=0.0027 c=0.0004 r=0.0000 | pes=0.0046 | CI_T0=99.75%
2026-02-11 20:34:00,977 - INFO - [Task 0 | ep 1 | step 175] loss=0.0017 c=0.0005 r=0.0000 | pes=0.0025 | CI_T0=99.92%
2026-02-11 20:34:08,559 - INFO - [Task 0 | ep 2 | step 200] loss=0.0007 c=0.0002 r=0.0000 | pes=0.0011 | CI_T0=99.95%
2026-02-11 20:34:12,580 - INFO - [Task 0 | ep 2 | step 225] loss=0.0005 c=0.0002 r=0.0000 | pes=0.0007 | CI_T0=99.95%
2026-02-11 20:34:16,588 - INFO - [Task 0 | ep 2 | step 250] loss=0.0006 c=0.0002 r=0.0000 | pes=0.0009 | CI_T0=99.97%
2026-02-11 20:34:20,613 - INFO - [Task 0 | ep 2 | step 275] loss=0.0019 c=0.0004 r=0.0000 | pes=0.0029 | CI_T0=99.90%
2026-02-11 20:34:28,169 - INFO - [Task 0 | ep 3 | step 300] loss=0.0014 c=0.0004 r=0.0000 | pes=0.0019 | CI_T0=99.96%
2026-02-11 20:34:32,187 - INFO - [Task 0 | ep 3 | step 325] loss=0.0009 c=0.0003 r=0.0000 | pes=0.0013 | CI_T0=99.95%
2026-02-11 20:34:36,220 - INFO - [Task 0 | ep 3 | step 350] loss=0.0012 c=0.0005 r=0.0000 | pes=0.0014 | CI_T0=99.98%
2026-02-11 20:34:40,229 - INFO - [Task 0 | ep 3 | step 375] loss=0.0020 c=0.0004 r=0.0000 | pes=0.0032 | CI_T0=99.98%
2026-02-11 20:34:44,626 - INFO - [After Task 0] Task-IL : T0=99.95% | Avg=99.95%
2026-02-11 20:34:44,626 - INFO - [After Task 0] Class-IL: T0=99.95% | Avg=99.95%
2026-02-11 20:34:44,626 - INFO - ========== GROUP DIFFERENCES ==========
2026-02-11 20:34:44,626 - INFO - Seen tasks: 0..0 | valid_out_dim=2
2026-02-11 20:34:46,637 - INFO - [Group=Task0] CI_acc=99.95% | corr_slice_max=4.412 | best_other_max=nan | gap=nan
2026-02-11 20:34:46,637 - INFO - [Group=Task0] winner_task_dist: W0=100.0%
2026-02-11 20:34:46,637 - INFO - [Group=Task0] slice_strength : S0=4.41
2026-02-11 20:34:46,637 - INFO - ======================================
2026-02-11 20:34:46,637 - INFO - ========== Task 1: classes [2, 3] ==========
2026-02-11 20:34:57,622 - INFO - [Task 1 | ep 0 | step 0] loss=5.6457 c=4.0457 r=1.6000 | CI_T0=99.72% | CI_T1=2.84%
2026-02-11 20:35:05,513 - INFO - [Task 1 | ep 0 | step 25] loss=1.1210 c=0.1717 r=0.9493 | CI_T0=0.00% | CI_T1=96.84%
2026-02-11 20:35:13,428 - INFO - [Task 1 | ep 0 | step 50] loss=1.0435 c=0.1475 r=0.8960 | CI_T0=0.00% | CI_T1=97.86%
2026-02-11 20:35:21,312 - INFO - [Task 1 | ep 0 | step 75] loss=1.2025 c=0.1482 r=1.0543 | CI_T0=0.00% | CI_T1=97.87%
2026-02-11 20:35:32,695 - INFO - [Task 1 | ep 1 | step 100] loss=1.0396 c=0.1283 r=0.9113 | CI_T0=0.00% | CI_T1=98.24%
2026-02-11 20:35:40,623 - INFO - [Task 1 | ep 1 | step 125] loss=0.7855 c=0.1271 r=0.6584 | CI_T0=0.00% | CI_T1=98.52%
2026-02-11 20:35:48,562 - INFO - [Task 1 | ep 1 | step 150] loss=0.8550 c=0.1071 r=0.7479 | CI_T0=0.00% | CI_T1=98.45%
2026-02-11 20:35:56,531 - INFO - [Task 1 | ep 1 | step 175] loss=0.8868 c=0.0838 r=0.8029 | CI_T0=0.00% | CI_T1=98.60%
2026-02-11 20:36:08,077 - INFO - [Task 1 | ep 2 | step 200] loss=1.0870 c=0.1392 r=0.9478 | CI_T0=0.00% | CI_T1=98.90%
2026-02-11 20:36:15,991 - INFO - [Task 1 | ep 2 | step 225] loss=1.0559 c=0.0855 r=0.9704 | CI_T0=0.00% | CI_T1=98.98%
2026-02-11 20:36:23,903 - INFO - [Task 1 | ep 2 | step 250] loss=0.9115 c=0.0950 r=0.8165 | CI_T0=0.00% | CI_T1=98.89%
2026-02-11 20:36:31,850 - INFO - [Task 1 | ep 2 | step 275] loss=0.6341 c=0.0927 r=0.5414 | CI_T0=0.00% | CI_T1=99.11%
2026-02-11 20:36:43,284 - INFO - [Task 1 | ep 3 | step 300] loss=0.7161 c=0.0857 r=0.6304 | CI_T0=0.00% | CI_T1=99.07%
2026-02-11 20:36:51,199 - INFO - [Task 1 | ep 3 | step 325] loss=0.6077 c=0.0852 r=0.5225 | CI_T0=0.00% | CI_T1=99.15%
2026-02-11 20:36:59,090 - INFO - [Task 1 | ep 3 | step 350] loss=0.6785 c=0.0910 r=0.5875 | CI_T0=0.00% | CI_T1=99.18%
2026-02-11 20:37:06,957 - INFO - [Task 1 | ep 3 | step 375] loss=1.5801 c=0.0613 r=1.5188 | CI_T0=0.00% | CI_T1=99.19%
2026-02-11 20:37:15,250 - INFO - [After Task 1] Task-IL : T0=99.95% | T1=99.12% | Avg=99.54%
2026-02-11 20:37:15,251 - INFO - [After Task 1] Class-IL: T0=0.00% | T1=99.12% | Avg=49.56%
2026-02-11 20:37:15,251 - INFO - ========== GROUP DIFFERENCES ==========
2026-02-11 20:37:15,251 - INFO - Seen tasks: 0..1 | valid_out_dim=4
2026-02-11 20:37:17,252 - INFO - [Group=Task0] CI_acc=0.00% | corr_slice_max=4.438 | best_other_max=6.236 | gap=-1.798
2026-02-11 20:37:17,253 - INFO - [Group=Task0] winner_task_dist: W0=0.0% | W1=100.0%
2026-02-11 20:37:17,253 - INFO - [Group=Task0] slice_strength : S0=4.44 | S1=6.24
2026-02-11 20:37:19,254 - INFO - [Group=Task1] CI_acc=99.12% | corr_slice_max=7.435 | best_other_max=3.236 | gap=4.200
2026-02-11 20:37:19,255 - INFO - [Group=Task1] winner_task_dist: W0=0.0% | W1=100.0%
2026-02-11 20:37:19,255 - INFO - [Group=Task1] slice_strength : S0=3.24 | S1=7.44
2026-02-11 20:37:19,255 - INFO - ======================================
2026-02-11 20:37:19,255 - INFO - ========== Task 2: classes [4, 5] ==========
2026-02-11 20:37:34,139 - INFO - [Task 2 | ep 0 | step 0] loss=9.0791 c=6.9496 r=2.1295 | CI_T0=0.00% | CI_T1=99.04% | CI_T2=0.00%
2026-02-11 20:37:45,912 - INFO - [Task 2 | ep 0 | step 25] loss=1.5028 c=0.4772 r=1.0256 | CI_T0=0.00% | CI_T1=30.49% | CI_T2=93.07%
2026-02-11 20:37:57,703 - INFO - [Task 2 | ep 0 | step 50] loss=1.5777 c=0.3876 r=1.1901 | CI_T0=0.00% | CI_T1=34.26% | CI_T2=94.04%
2026-02-11 20:38:09,485 - INFO - [Task 2 | ep 0 | step 75] loss=1.0331 c=0.3175 r=0.7157 | CI_T0=0.00% | CI_T1=36.34% | CI_T2=96.76%
2026-02-11 20:38:24,893 - INFO - [Task 2 | ep 1 | step 100] loss=1.1063 c=0.2763 r=0.8300 | CI_T0=0.00% | CI_T1=30.39% | CI_T2=97.32%
2026-02-11 20:38:36,716 - INFO - [Task 2 | ep 1 | step 125] loss=0.9749 c=0.2233 r=0.7516 | CI_T0=0.00% | CI_T1=27.38% | CI_T2=98.71%
2026-02-11 20:38:48,417 - INFO - [Task 2 | ep 1 | step 150] loss=0.7723 c=0.1798 r=0.5925 | CI_T0=0.00% | CI_T1=27.91% | CI_T2=99.14%
2026-02-11 20:39:03,654 - INFO - [Task 2 | ep 2 | step 175] loss=0.9437 c=0.1711 r=0.7725 | CI_T0=0.00% | CI_T1=23.72% | CI_T2=99.51%
2026-02-11 20:39:15,423 - INFO - [Task 2 | ep 2 | step 200] loss=0.6621 c=0.1661 r=0.4959 | CI_T0=0.00% | CI_T1=26.50% | CI_T2=99.42%
2026-02-11 20:39:27,179 - INFO - [Task 2 | ep 2 | step 225] loss=0.6782 c=0.1603 r=0.5179 | CI_T0=0.00% | CI_T1=19.18% | CI_T2=99.64%
2026-02-11 20:39:38,934 - INFO - [Task 2 | ep 2 | step 250] loss=0.7654 c=0.1645 r=0.6009 | CI_T0=0.00% | CI_T1=18.37% | CI_T2=99.58%
2026-02-11 20:39:54,218 - INFO - [Task 2 | ep 3 | step 275] loss=0.6483 c=0.1388 r=0.5095 | CI_T0=0.00% | CI_T1=15.49% | CI_T2=99.86%
2026-02-11 20:40:06,004 - INFO - [Task 2 | ep 3 | step 300] loss=1.0253 c=0.1435 r=0.8818 | CI_T0=0.00% | CI_T1=18.99% | CI_T2=99.82%
2026-02-11 20:40:17,774 - INFO - [Task 2 | ep 3 | step 325] loss=0.6307 c=0.1074 r=0.5233 | CI_T0=0.00% | CI_T1=19.37% | CI_T2=99.81%
2026-02-11 20:40:30,248 - INFO - [After Task 2] Task-IL : T0=99.95% | T1=98.04% | T2=99.95% | Avg=99.31%
2026-02-11 20:40:30,248 - INFO - [After Task 2] Class-IL: T0=0.00% | T1=13.17% | T2=99.89% | Avg=37.69%
2026-02-11 20:40:30,248 - INFO - ========== GROUP DIFFERENCES ==========
2026-02-11 20:40:30,248 - INFO - Seen tasks: 0..2 | valid_out_dim=6
2026-02-11 20:40:32,254 - INFO - [Group=Task0] CI_acc=0.00% | corr_slice_max=4.445 | best_other_max=7.660 | gap=-3.215
2026-02-11 20:40:32,254 - INFO - [Group=Task0] winner_task_dist: W0=0.0% | W1=3.2% | W2=96.8%
2026-02-11 20:40:32,254 - INFO - [Group=Task0] slice_strength : S0=4.45 | S1=6.21 | S2=7.65
2026-02-11 20:40:34,248 - INFO - [Group=Task1] CI_acc=13.17% | corr_slice_max=7.305 | best_other_max=8.632 | gap=-1.326
2026-02-11 20:40:34,249 - INFO - [Group=Task1] winner_task_dist: W0=0.0% | W1=13.2% | W2=86.8%
2026-02-11 20:40:34,249 - INFO - [Group=Task1] slice_strength : S0=3.22 | S1=7.31 | S2=8.63
2026-02-11 20:40:36,241 - INFO - [Group=Task2] CI_acc=99.89% | corr_slice_max=9.343 | best_other_max=6.718 | gap=2.626
2026-02-11 20:40:36,241 - INFO - [Group=Task2] winner_task_dist: W0=0.0% | W1=0.1% | W2=99.9%
2026-02-11 20:40:36,241 - INFO - [Group=Task2] slice_strength : S0=3.16 | S1=6.72 | S2=9.34
2026-02-11 20:40:36,241 - INFO - ======================================
2026-02-11 20:40:36,241 - INFO - ========== Task 3: classes [6, 7] ==========
2026-02-11 20:40:54,846 - INFO - [Task 3 | ep 0 | step 0] loss=10.2301 c=8.9518 r=1.2783 | CI_T0=0.00% | CI_T1=13.46% | CI_T2=99.55% | CI_T3=0.00%
2026-02-11 20:41:10,450 - INFO - [Task 3 | ep 0 | step 25] loss=1.7745 c=0.4525 r=1.3219 | CI_T0=0.00% | CI_T1=15.49% | CI_T2=61.59% | CI_T3=94.88%
2026-02-11 20:41:26,071 - INFO - [Task 3 | ep 0 | step 50] loss=1.3264 c=0.4061 r=0.9203 | CI_T0=0.00% | CI_T1=5.49% | CI_T2=76.80% | CI_T3=95.94%
2026-02-11 20:41:41,729 - INFO - [Task 3 | ep 0 | step 75] loss=1.2081 c=0.3755 r=0.8326 | CI_T0=0.00% | CI_T1=9.14% | CI_T2=77.60% | CI_T3=96.46%
2026-02-11 20:42:01,099 - INFO - [Task 3 | ep 1 | step 100] loss=1.0370 c=0.2903 r=0.7467 | CI_T0=0.00% | CI_T1=5.52% | CI_T2=74.81% | CI_T3=97.74%
2026-02-11 20:42:16,841 - INFO - [Task 3 | ep 1 | step 125] loss=1.1223 c=0.2786 r=0.8437 | CI_T0=0.00% | CI_T1=4.31% | CI_T2=74.52% | CI_T3=98.30%
2026-02-11 20:42:32,616 - INFO - [Task 3 | ep 1 | step 150] loss=1.5287 c=0.2535 r=1.2752 | CI_T0=0.00% | CI_T1=6.47% | CI_T2=74.54% | CI_T3=98.98%
2026-02-11 20:42:48,375 - INFO - [Task 3 | ep 1 | step 175] loss=0.9352 c=0.2165 r=0.7187 | CI_T0=0.00% | CI_T1=4.25% | CI_T2=73.35% | CI_T3=99.14%
2026-02-11 20:43:07,590 - INFO - [Task 3 | ep 2 | step 200] loss=0.7943 c=0.1852 r=0.6090 | CI_T0=0.00% | CI_T1=3.24% | CI_T2=71.54% | CI_T3=98.91%
2026-02-11 20:43:23,344 - INFO - [Task 3 | ep 2 | step 225] loss=0.9756 c=0.1946 r=0.7810 | CI_T0=0.00% | CI_T1=3.36% | CI_T2=70.67% | CI_T3=99.52%
2026-02-11 20:43:39,075 - INFO - [Task 3 | ep 2 | step 250] loss=0.7219 c=0.1696 r=0.5523 | CI_T0=0.00% | CI_T1=2.13% | CI_T2=65.63% | CI_T3=99.73%
2026-02-11 20:43:54,834 - INFO - [Task 3 | ep 2 | step 275] loss=0.8467 c=0.1721 r=0.6746 | CI_T0=0.00% | CI_T1=3.32% | CI_T2=64.71% | CI_T3=99.71%
2026-02-11 20:44:14,097 - INFO - [Task 3 | ep 3 | step 300] loss=0.7926 c=0.1807 r=0.6119 | CI_T0=0.00% | CI_T1=2.64% | CI_T2=63.43% | CI_T3=99.77%
2026-02-11 20:44:29,878 - INFO - [Task 3 | ep 3 | step 325] loss=0.6389 c=0.1415 r=0.4974 | CI_T0=0.00% | CI_T1=2.69% | CI_T2=63.74% | CI_T3=99.75%
2026-02-11 20:44:45,525 - INFO - [Task 3 | ep 3 | step 350] loss=0.8529 c=0.1200 r=0.7330 | CI_T0=0.00% | CI_T1=2.04% | CI_T2=60.34% | CI_T3=99.90%
2026-02-11 20:45:01,133 - INFO - [Task 3 | ep 3 | step 375] loss=0.7016 c=0.1190 r=0.5825 | CI_T0=0.00% | CI_T1=2.07% | CI_T2=60.60% | CI_T3=99.92%
2026-02-11 20:45:17,375 - INFO - [After Task 3] Task-IL : T0=99.95% | T1=98.82% | T2=99.84% | T3=100.00% | Avg=99.65%
2026-02-11 20:45:17,375 - INFO - [After Task 3] Class-IL: T0=0.00% | T1=2.94% | T2=58.06% | T3=99.70% | Avg=40.17%
2026-02-11 20:45:17,375 - INFO - ========== GROUP DIFFERENCES ==========
2026-02-11 20:45:17,375 - INFO - Seen tasks: 0..3 | valid_out_dim=8
2026-02-11 20:45:19,395 - INFO - [Group=Task0] CI_acc=0.00% | corr_slice_max=4.616 | best_other_max=9.309 | gap=-4.692
2026-02-11 20:45:19,395 - INFO - [Group=Task0] winner_task_dist: W0=0.0% | W1=0.0% | W2=6.0% | W3=93.9%
2026-02-11 20:45:19,395 - INFO - [Group=Task0] slice_strength : S0=4.62 | S1=6.39 | S2=7.80 | S3=9.26
2026-02-11 20:45:21,394 - INFO - [Group=Task1] CI_acc=2.94% | corr_slice_max=7.412 | best_other_max=9.728 | gap=-2.315
2026-02-11 20:45:21,394 - INFO - [Group=Task1] winner_task_dist: W0=0.0% | W1=2.9% | W2=40.3% | W3=56.8%
2026-02-11 20:45:21,394 - INFO - [Group=Task1] slice_strength : S0=3.41 | S1=7.41 | S2=8.67 | S3=9.06
2026-02-11 20:45:23,390 - INFO - [Group=Task2] CI_acc=58.06% | corr_slice_max=9.433 | best_other_max=9.091 | gap=0.342
2026-02-11 20:45:23,390 - INFO - [Group=Task2] winner_task_dist: W0=0.0% | W1=0.0% | W2=58.1% | W3=41.9%
2026-02-11 20:45:23,390 - INFO - [Group=Task2] slice_strength : S0=3.34 | S1=6.63 | S2=9.43 | S3=9.05
2026-02-11 20:45:25,385 - INFO - [Group=Task3] CI_acc=99.70% | corr_slice_max=10.905 | best_other_max=8.376 | gap=2.529
2026-02-11 20:45:25,385 - INFO - [Group=Task3] winner_task_dist: W0=0.0% | W1=0.0% | W2=0.3% | W3=99.7%
2026-02-11 20:45:25,385 - INFO - [Group=Task3] slice_strength : S0=3.37 | S1=6.62 | S2=8.36 | S3=10.91
2026-02-11 20:45:25,385 - INFO - ======================================
2026-02-11 20:45:25,385 - INFO - ========== Task 4: classes [8, 9] ==========
2026-02-11 20:45:47,996 - INFO - [Task 4 | ep 0 | step 0] loss=12.0800 c=10.0795 r=2.0006 | CI_T0=0.00% | CI_T1=2.74% | CI_T2=60.43% | CI_T3=99.89% | CI_T4=0.00%
2026-02-11 20:46:07,512 - INFO - [Task 4 | ep 0 | step 25] loss=2.1922 c=0.4827 r=1.7096 | CI_T0=0.00% | CI_T1=1.40% | CI_T2=3.71% | CI_T3=19.36% | CI_T4=92.42%
2026-02-11 20:46:27,114 - INFO - [Task 4 | ep 0 | step 50] loss=1.6470 c=0.6318 r=1.0151 | CI_T0=0.00% | CI_T1=0.07% | CI_T2=6.54% | CI_T3=39.79% | CI_T4=94.51%
2026-02-11 20:46:46,669 - INFO - [Task 4 | ep 0 | step 75] loss=1.4200 c=0.4762 r=0.9438 | CI_T0=0.00% | CI_T1=0.03% | CI_T2=8.59% | CI_T3=46.05% | CI_T4=95.25%
2026-02-11 20:47:09,684 - INFO - [Task 4 | ep 1 | step 100] loss=1.1000 c=0.3704 r=0.7296 | CI_T0=0.00% | CI_T1=0.03% | CI_T2=7.17% | CI_T3=45.44% | CI_T4=95.48%
2026-02-11 20:47:29,306 - INFO - [Task 4 | ep 1 | step 125] loss=1.1783 c=0.2973 r=0.8810 | CI_T0=0.00% | CI_T1=0.01% | CI_T2=8.63% | CI_T3=48.48% | CI_T4=96.32%
2026-02-11 20:47:49,004 - INFO - [Task 4 | ep 1 | step 150] loss=1.0330 c=0.3088 r=0.7242 | CI_T0=0.00% | CI_T1=0.00% | CI_T2=6.95% | CI_T3=42.42% | CI_T4=96.49%
2026-02-11 20:48:08,690 - INFO - [Task 4 | ep 1 | step 175] loss=0.9191 c=0.2610 r=0.6581 | CI_T0=0.00% | CI_T1=0.02% | CI_T2=8.86% | CI_T3=42.64% | CI_T4=97.93%
2026-02-11 20:48:32,008 - INFO - [Task 4 | ep 2 | step 200] loss=0.8182 c=0.2801 r=0.5381 | CI_T0=0.00% | CI_T1=0.00% | CI_T2=7.25% | CI_T3=40.49% | CI_T4=98.21%
2026-02-11 20:48:51,648 - INFO - [Task 4 | ep 2 | step 225] loss=0.9582 c=0.2689 r=0.6893 | CI_T0=0.00% | CI_T1=0.02% | CI_T2=5.07% | CI_T3=43.19% | CI_T4=98.62%
2026-02-11 20:49:11,299 - INFO - [Task 4 | ep 2 | step 250] loss=0.7281 c=0.2130 r=0.5151 | CI_T0=0.00% | CI_T1=0.00% | CI_T2=4.60% | CI_T3=42.70% | CI_T4=98.59%
2026-02-11 20:49:31,051 - INFO - [Task 4 | ep 2 | step 275] loss=1.1157 c=0.2554 r=0.8603 | CI_T0=0.00% | CI_T1=0.00% | CI_T2=5.19% | CI_T3=38.03% | CI_T4=98.66%
2026-02-11 20:49:54,288 - INFO - [Task 4 | ep 3 | step 300] loss=0.8867 c=0.2444 r=0.6423 | CI_T0=0.00% | CI_T1=0.01% | CI_T2=6.83% | CI_T3=37.86% | CI_T4=99.01%
2026-02-11 20:50:13,999 - INFO - [Task 4 | ep 3 | step 325] loss=0.6990 c=0.1749 r=0.5241 | CI_T0=0.00% | CI_T1=0.00% | CI_T2=7.07% | CI_T3=31.58% | CI_T4=99.24%
2026-02-11 20:50:33,677 - INFO - [Task 4 | ep 3 | step 350] loss=0.8044 c=0.1492 r=0.6552 | CI_T0=0.00% | CI_T1=0.02% | CI_T2=7.35% | CI_T3=31.20% | CI_T4=99.33%
2026-02-11 20:50:54,002 - INFO - [After Task 4] Task-IL : T0=99.95% | T1=98.63% | T2=99.84% | T3=99.90% | T4=98.99% | Avg=99.46%
2026-02-11 20:50:54,002 - INFO - [After Task 4] Class-IL: T0=0.00% | T1=0.00% | T2=7.20% | T3=39.48% | T4=98.34% | Avg=29.00%
2026-02-11 20:50:54,002 - INFO - ========== GROUP DIFFERENCES ==========
2026-02-11 20:50:54,002 - INFO - Seen tasks: 0..4 | valid_out_dim=10
2026-02-11 20:50:55,994 - INFO - [Group=Task0] CI_acc=0.00% | corr_slice_max=4.504 | best_other_max=10.788 | gap=-6.284
2026-02-11 20:50:55,995 - INFO - [Group=Task0] winner_task_dist: W0=0.0% | W1=0.0% | W2=0.1% | W3=15.9% | W4=84.0%
2026-02-11 20:50:55,995 - INFO - [Group=Task0] slice_strength : S0=4.50 | S1=6.28 | S2=7.58 | S3=8.93 | S4=10.70
2026-02-11 20:50:57,982 - INFO - [Group=Task1] CI_acc=0.00% | corr_slice_max=7.478 | best_other_max=10.962 | gap=-3.484
2026-02-11 20:50:57,982 - INFO - [Group=Task1] winner_task_dist: W0=0.0% | W1=0.0% | W2=9.4% | W3=11.7% | W4=79.0%
2026-02-11 20:50:57,982 - INFO - [Group=Task1] slice_strength : S0=3.20 | S1=7.48 | S2=8.63 | S3=8.98 | S4=10.80
2026-02-11 20:50:59,969 - INFO - [Group=Task2] CI_acc=7.20% | corr_slice_max=9.327 | best_other_max=11.467 | gap=-2.140
2026-02-11 20:50:59,969 - INFO - [Group=Task2] winner_task_dist: W0=0.0% | W1=0.0% | W2=7.2% | W3=1.5% | W4=91.3%
2026-02-11 20:50:59,969 - INFO - [Group=Task2] slice_strength : S0=3.12 | S1=6.61 | S2=9.33 | S3=9.11 | S4=11.46
2026-02-11 20:51:01,949 - INFO - [Group=Task3] CI_acc=39.48% | corr_slice_max=10.612 | best_other_max=10.952 | gap=-0.340
2026-02-11 20:51:01,949 - INFO - [Group=Task3] winner_task_dist: W0=0.0% | W1=0.0% | W2=0.1% | W3=39.5% | W4=60.5%
2026-02-11 20:51:01,949 - INFO - [Group=Task3] slice_strength : S0=3.28 | S1=6.61 | S2=8.19 | S3=10.61 | S4=10.90
2026-02-11 20:51:03,927 - INFO - [Group=Task4] CI_acc=98.34% | corr_slice_max=12.280 | best_other_max=9.955 | gap=2.324
2026-02-11 20:51:03,927 - INFO - [Group=Task4] winner_task_dist: W0=0.0% | W1=0.0% | W2=0.1% | W3=0.7% | W4=99.3%
2026-02-11 20:51:03,927 - INFO - [Group=Task4] slice_strength : S0=3.31 | S1=6.67 | S2=8.48 | S3=9.80 | S4=12.28
2026-02-11 20:51:03,927 - INFO - ======================================
2026-02-11 20:51:03,927 - INFO - ========== FINAL METRICS (Class-IL) ==========
2026-02-11 20:51:03,927 - INFO - Forgetting per task: T0=99.95%, T1=99.12%, T2=92.69%, T3=60.22%, T4=0.00%
2026-02-11 20:51:03,927 - INFO - BWT: -88.00%
2026-02-11 20:51:03,927 - INFO - Final average Class-IL accuracy: 29.00%
