2026-02-11 14:54:30,257 - INFO - Device: cuda
2026-02-11 14:54:30,257 - INFO - Config: {'device': 'cuda', 'lr': 0.005, 'epochs_per_task': 4, 'batch_size': 128, 'lambda_slice': 2.0, 'lambda_feat': 0.5, 'use_cosine_head': True, 'seed': 42, 'freeze_backbone_after_task': -1, 'ewc_lambda': 5000.0}
2026-02-11 14:54:30,341 - INFO - ========== Training Task 0: classes [0, 1] ==========
2026-02-11 14:54:38,349 - INFO - [Task 0 | ep 0 | step 0] loss=0.8633 c=0.8633 r=0.0000 | CI_T0=96.97%
2026-02-11 14:54:42,798 - INFO - [Task 0 | ep 0 | step 25] loss=0.0014 c=0.0014 r=0.0000 | CI_T0=99.93%
2026-02-11 14:54:47,331 - INFO - [Task 0 | ep 0 | step 50] loss=0.0007 c=0.0007 r=0.0000 | CI_T0=99.85%
2026-02-11 14:54:51,720 - INFO - [Task 0 | ep 0 | step 75] loss=0.0003 c=0.0003 r=0.0000 | CI_T0=99.97%
2026-02-11 14:55:00,189 - INFO - [Task 0 | ep 1 | step 100] loss=0.0003 c=0.0003 r=0.0000 | CI_T0=99.94%
2026-02-11 14:55:04,695 - INFO - [Task 0 | ep 1 | step 125] loss=0.0005 c=0.0005 r=0.0000 | CI_T0=99.94%
2026-02-11 14:55:09,233 - INFO - [Task 0 | ep 1 | step 150] loss=0.0003 c=0.0003 r=0.0000 | CI_T0=99.92%
2026-02-11 14:55:13,704 - INFO - [Task 0 | ep 1 | step 175] loss=0.0002 c=0.0002 r=0.0000 | CI_T0=99.94%
2026-02-11 14:55:22,228 - INFO - [Task 0 | ep 2 | step 200] loss=0.0001 c=0.0001 r=0.0000 | CI_T0=99.98%
2026-02-11 14:55:26,593 - INFO - [Task 0 | ep 2 | step 225] loss=0.0001 c=0.0001 r=0.0000 | CI_T0=99.97%
2026-02-11 14:55:30,964 - INFO - [Task 0 | ep 2 | step 250] loss=0.0003 c=0.0003 r=0.0000 | CI_T0=99.97%
2026-02-11 14:55:35,434 - INFO - [Task 0 | ep 2 | step 275] loss=0.0003 c=0.0003 r=0.0000 | CI_T0=99.98%
2026-02-11 14:55:43,589 - INFO - [Task 0 | ep 3 | step 300] loss=0.0001 c=0.0001 r=0.0000 | CI_T0=99.95%
2026-02-11 14:55:48,090 - INFO - [Task 0 | ep 3 | step 325] loss=0.0001 c=0.0001 r=0.0000 | CI_T0=99.98%
2026-02-11 14:55:52,508 - INFO - [Task 0 | ep 3 | step 350] loss=0.0004 c=0.0004 r=0.0000 | CI_T0=99.97%
2026-02-11 14:55:56,887 - INFO - [Task 0 | ep 3 | step 375] loss=0.0007 c=0.0007 r=0.0000 | CI_T0=99.98%
2026-02-11 14:56:01,227 - INFO - EWC: stored Fisher for task 0
2026-02-11 14:56:05,731 - INFO - [After Task 0] Task-IL : T0=99.95% | Avg=99.95%
2026-02-11 14:56:05,731 - INFO - [After Task 0] Class-IL: T0=99.95% | Avg=99.95%
2026-02-11 14:56:05,731 - INFO - ========== GROUP DIFFERENCES ==========
2026-02-11 14:56:05,731 - INFO - Seen tasks: 0..0 | valid_out_dim=2
2026-02-11 14:56:07,910 - INFO - [Group=Task0] CI_acc=99.95% | corr_slice_max=5.008 | best_other_max=nan | gap=nan
2026-02-11 14:56:07,910 - INFO - [Group=Task0] winner_task_dist: W0=100.0%
2026-02-11 14:56:07,910 - INFO - [Group=Task0] slice_strength : S0=5.01
2026-02-11 14:56:07,910 - INFO - ======================================
2026-02-11 14:56:07,910 - INFO - ========== Training Task 1: classes [2, 3] ==========
2026-02-11 14:56:19,929 - INFO - [Task 1 | ep 0 | step 0] loss=7.3840 c=4.1912 r=3.1928 | CI_T0=99.19% | CI_T1=3.67%
2026-02-11 14:56:28,598 - INFO - [Task 1 | ep 0 | step 25] loss=1.4693 c=0.2184 r=1.2509 | ewc=0.0000 | CI_T0=35.16% | CI_T1=94.45%
2026-02-11 14:56:37,293 - INFO - [Task 1 | ep 0 | step 50] loss=1.1550 c=0.1495 r=1.0055 | ewc=0.0000 | CI_T0=4.51% | CI_T1=97.46%
2026-02-11 14:56:45,861 - INFO - [Task 1 | ep 0 | step 75] loss=1.2268 c=0.1186 r=1.1082 | ewc=0.0000 | CI_T0=17.27% | CI_T1=98.32%
2026-02-11 14:56:58,378 - INFO - [Task 1 | ep 1 | step 100] loss=0.9112 c=0.1157 r=0.7955 | ewc=0.0000 | CI_T0=15.55% | CI_T1=98.03%
2026-02-11 14:57:07,000 - INFO - [Task 1 | ep 1 | step 125] loss=0.6739 c=0.0951 r=0.5788 | ewc=0.0000 | CI_T0=21.38% | CI_T1=98.40%
2026-02-11 14:57:15,543 - INFO - [Task 1 | ep 1 | step 150] loss=0.9636 c=0.1291 r=0.8346 | ewc=0.0000 | CI_T0=9.10% | CI_T1=98.65%
2026-02-11 14:57:24,182 - INFO - [Task 1 | ep 1 | step 175] loss=1.1003 c=0.0882 r=1.0121 | ewc=0.0000 | CI_T0=26.14% | CI_T1=98.53%
2026-02-11 14:57:36,974 - INFO - [Task 1 | ep 2 | step 200] loss=1.0472 c=0.0890 r=0.9582 | ewc=0.0000 | CI_T0=20.42% | CI_T1=98.84%
2026-02-11 14:57:45,800 - INFO - [Task 1 | ep 2 | step 225] loss=0.7590 c=0.0967 r=0.6623 | ewc=0.0000 | CI_T0=20.43% | CI_T1=98.81%
2026-02-11 14:57:54,623 - INFO - [Task 1 | ep 2 | step 250] loss=0.6253 c=0.0811 r=0.5442 | ewc=0.0000 | CI_T0=6.41% | CI_T1=99.09%
2026-02-11 14:58:03,242 - INFO - [Task 1 | ep 2 | step 275] loss=0.7710 c=0.0661 r=0.7049 | ewc=0.0000 | CI_T0=13.07% | CI_T1=99.07%
2026-02-11 14:58:15,708 - INFO - [Task 1 | ep 3 | step 300] loss=0.7364 c=0.0624 r=0.6740 | ewc=0.0000 | CI_T0=8.07% | CI_T1=99.20%
2026-02-11 14:58:24,299 - INFO - [Task 1 | ep 3 | step 325] loss=0.7219 c=0.0842 r=0.6377 | ewc=0.0000 | CI_T0=17.50% | CI_T1=99.14%
2026-02-11 14:58:32,936 - INFO - [Task 1 | ep 3 | step 350] loss=0.7234 c=0.0733 r=0.6501 | ewc=0.0000 | CI_T0=17.54% | CI_T1=99.27%
2026-02-11 14:58:41,637 - INFO - [Task 1 | ep 3 | step 375] loss=0.7661 c=0.0736 r=0.6925 | ewc=0.0000 | CI_T0=3.31% | CI_T1=99.32%
2026-02-11 14:58:45,849 - INFO - EWC: stored Fisher for task 1
2026-02-11 14:58:54,722 - INFO - [After Task 1] Task-IL : T0=99.95% | T1=99.22% | Avg=99.58%
2026-02-11 14:58:54,722 - INFO - [After Task 1] Class-IL: T0=2.41% | T1=99.22% | Avg=50.81%
2026-02-11 14:58:54,722 - INFO - ========== GROUP DIFFERENCES ==========
2026-02-11 14:58:54,722 - INFO - Seen tasks: 0..1 | valid_out_dim=4
2026-02-11 14:58:56,985 - INFO - [Group=Task0] CI_acc=2.41% | corr_slice_max=5.177 | best_other_max=6.232 | gap=-1.055
2026-02-11 14:58:56,985 - INFO - [Group=Task0] winner_task_dist: W0=2.4% | W1=97.6%
2026-02-11 14:58:56,985 - INFO - [Group=Task0] slice_strength : S0=5.18 | S1=6.23
2026-02-11 14:58:59,160 - INFO - [Group=Task1] CI_acc=99.22% | corr_slice_max=7.215 | best_other_max=2.942 | gap=4.273
2026-02-11 14:58:59,160 - INFO - [Group=Task1] winner_task_dist: W0=0.0% | W1=100.0%
2026-02-11 14:58:59,160 - INFO - [Group=Task1] slice_strength : S0=2.94 | S1=7.22
2026-02-11 14:58:59,160 - INFO - ======================================
2026-02-11 14:58:59,161 - INFO - ========== Training Task 2: classes [4, 5] ==========
2026-02-11 14:59:15,442 - INFO - [Task 2 | ep 0 | step 0] loss=9.0689 c=6.7282 r=2.3406 | ewc=0.0000 | CI_T0=2.45% | CI_T1=98.91% | CI_T2=0.00%
2026-02-11 14:59:28,478 - INFO - [Task 2 | ep 0 | step 25] loss=1.7997 c=0.5083 r=1.2909 | ewc=0.0005 | CI_T0=6.97% | CI_T1=37.87% | CI_T2=92.05%
2026-02-11 14:59:41,417 - INFO - [Task 2 | ep 0 | step 50] loss=1.4189 c=0.3299 r=1.0882 | ewc=0.0008 | CI_T0=0.77% | CI_T1=39.22% | CI_T2=95.34%
2026-02-11 14:59:55,078 - INFO - [Task 2 | ep 0 | step 75] loss=1.0563 c=0.2761 r=0.7791 | ewc=0.0011 | CI_T0=0.36% | CI_T1=32.43% | CI_T2=96.20%
2026-02-11 15:00:12,395 - INFO - [Task 2 | ep 1 | step 100] loss=0.8771 c=0.2421 r=0.6335 | ewc=0.0015 | CI_T0=1.07% | CI_T1=27.24% | CI_T2=98.29%
2026-02-11 15:00:25,453 - INFO - [Task 2 | ep 1 | step 125] loss=0.8419 c=0.2002 r=0.6397 | ewc=0.0020 | CI_T0=1.07% | CI_T1=26.60% | CI_T2=98.69%
2026-02-11 15:00:38,821 - INFO - [Task 2 | ep 1 | step 150] loss=0.8148 c=0.1696 r=0.6428 | ewc=0.0025 | CI_T0=0.69% | CI_T1=25.47% | CI_T2=99.08%
2026-02-11 15:00:56,029 - INFO - [Task 2 | ep 2 | step 175] loss=0.9189 c=0.1390 r=0.7769 | ewc=0.0030 | CI_T0=1.63% | CI_T1=19.63% | CI_T2=99.44%
2026-02-11 15:01:09,289 - INFO - [Task 2 | ep 2 | step 200] loss=0.8033 c=0.1345 r=0.6653 | ewc=0.0036 | CI_T0=1.19% | CI_T1=24.91% | CI_T2=99.20%
2026-02-11 15:01:22,546 - INFO - [Task 2 | ep 2 | step 225] loss=0.8825 c=0.1361 r=0.7422 | ewc=0.0042 | CI_T0=1.54% | CI_T1=18.41% | CI_T2=99.53%
2026-02-11 15:01:35,798 - INFO - [Task 2 | ep 2 | step 250] loss=0.7031 c=0.1155 r=0.5829 | ewc=0.0048 | CI_T0=0.85% | CI_T1=18.18% | CI_T2=99.65%
2026-02-11 15:01:53,343 - INFO - [Task 2 | ep 3 | step 275] loss=0.8638 c=0.1097 r=0.7487 | ewc=0.0055 | CI_T0=1.51% | CI_T1=16.59% | CI_T2=99.78%
2026-02-11 15:02:06,815 - INFO - [Task 2 | ep 3 | step 300] loss=0.7777 c=0.1096 r=0.6620 | ewc=0.0061 | CI_T0=0.81% | CI_T1=18.58% | CI_T2=99.70%
2026-02-11 15:02:20,140 - INFO - [Task 2 | ep 3 | step 325] loss=0.6570 c=0.1073 r=0.5430 | ewc=0.0067 | CI_T0=0.67% | CI_T1=16.09% | CI_T2=99.86%
2026-02-11 15:02:24,745 - INFO - EWC: stored Fisher for task 2
2026-02-11 15:02:39,203 - INFO - [After Task 2] Task-IL : T0=99.95% | T1=98.33% | T2=99.89% | Avg=99.39%
2026-02-11 15:02:39,203 - INFO - [After Task 2] Class-IL: T0=0.47% | T1=17.38% | T2=99.73% | Avg=39.20%
2026-02-11 15:02:39,203 - INFO - ========== GROUP DIFFERENCES ==========
2026-02-11 15:02:39,203 - INFO - Seen tasks: 0..2 | valid_out_dim=6
2026-02-11 15:02:41,561 - INFO - [Group=Task0] CI_acc=0.47% | corr_slice_max=5.183 | best_other_max=7.327 | gap=-2.144
2026-02-11 15:02:41,561 - INFO - [Group=Task0] winner_task_dist: W0=0.5% | W1=9.6% | W2=90.0%
2026-02-11 15:02:41,561 - INFO - [Group=Task0] slice_strength : S0=5.18 | S1=6.34 | S2=7.28
2026-02-11 15:02:43,830 - INFO - [Group=Task1] CI_acc=17.38% | corr_slice_max=7.074 | best_other_max=8.367 | gap=-1.293
2026-02-11 15:02:43,830 - INFO - [Group=Task1] winner_task_dist: W0=0.0% | W1=17.4% | W2=82.6%
2026-02-11 15:02:43,830 - INFO - [Group=Task1] slice_strength : S0=2.82 | S1=7.07 | S2=8.37
2026-02-11 15:02:46,196 - INFO - [Group=Task2] CI_acc=99.73% | corr_slice_max=9.129 | best_other_max=6.245 | gap=2.884
2026-02-11 15:02:46,196 - INFO - [Group=Task2] winner_task_dist: W0=0.0% | W1=0.3% | W2=99.7%
2026-02-11 15:02:46,196 - INFO - [Group=Task2] slice_strength : S0=2.84 | S1=6.24 | S2=9.13
2026-02-11 15:02:46,196 - INFO - ======================================
2026-02-11 15:02:46,197 - INFO - ========== Training Task 3: classes [6, 7] ==========
2026-02-11 15:03:07,336 - INFO - [Task 3 | ep 0 | step 0] loss=10.0604 c=8.4283 r=1.6249 | ewc=0.0073 | CI_T0=0.92% | CI_T1=18.21% | CI_T2=99.77% | CI_T3=0.00%
2026-02-11 15:03:24,672 - INFO - [Task 3 | ep 0 | step 25] loss=1.7774 c=0.4046 r=1.3637 | ewc=0.0091 | CI_T0=5.74% | CI_T1=12.38% | CI_T2=66.35% | CI_T3=96.31%
2026-02-11 15:03:45,965 - INFO - [Task 3 | ep 0 | step 50] loss=1.2544 c=0.3301 r=0.9131 | ewc=0.0112 | CI_T0=0.02% | CI_T1=6.85% | CI_T2=78.69% | CI_T3=95.64%
2026-02-11 15:04:05,047 - INFO - [Task 3 | ep 0 | step 75] loss=1.0857 c=0.2928 r=0.7793 | ewc=0.0135 | CI_T0=0.55% | CI_T1=3.10% | CI_T2=77.98% | CI_T3=97.09%
2026-02-11 15:04:27,710 - INFO - [Task 3 | ep 1 | step 100] loss=0.9395 c=0.2210 r=0.7022 | ewc=0.0162 | CI_T0=1.53% | CI_T1=4.87% | CI_T2=76.17% | CI_T3=97.58%
2026-02-11 15:04:44,549 - INFO - [Task 3 | ep 1 | step 125] loss=0.9657 c=0.2123 r=0.7342 | ewc=0.0191 | CI_T0=0.22% | CI_T1=5.91% | CI_T2=77.51% | CI_T3=98.49%
2026-02-11 15:05:01,304 - INFO - [Task 3 | ep 1 | step 150] loss=0.9045 c=0.2246 r=0.6579 | ewc=0.0221 | CI_T0=0.33% | CI_T1=5.19% | CI_T2=75.85% | CI_T3=98.36%
2026-02-11 15:05:18,060 - INFO - [Task 3 | ep 1 | step 175] loss=0.9556 c=0.2164 r=0.7142 | ewc=0.0250 | CI_T0=0.37% | CI_T1=4.66% | CI_T2=75.56% | CI_T3=99.14%
2026-02-11 15:05:38,752 - INFO - [Task 3 | ep 2 | step 200] loss=0.8743 c=0.1834 r=0.6629 | ewc=0.0280 | CI_T0=0.02% | CI_T1=3.94% | CI_T2=71.43% | CI_T3=98.29%
2026-02-11 15:05:55,543 - INFO - [Task 3 | ep 2 | step 225] loss=0.8338 c=0.1572 r=0.6457 | ewc=0.0309 | CI_T0=0.01% | CI_T1=3.66% | CI_T2=72.20% | CI_T3=98.61%
2026-02-11 15:06:12,386 - INFO - [Task 3 | ep 2 | step 250] loss=0.9073 c=0.1525 r=0.7211 | ewc=0.0337 | CI_T0=2.38% | CI_T1=3.01% | CI_T2=68.50% | CI_T3=99.61%
2026-02-11 15:06:29,228 - INFO - [Task 3 | ep 2 | step 275] loss=0.7310 c=0.1448 r=0.5495 | ewc=0.0366 | CI_T0=0.29% | CI_T1=5.57% | CI_T2=70.90% | CI_T3=99.58%
2026-02-11 15:06:49,786 - INFO - [Task 3 | ep 3 | step 300] loss=0.7621 c=0.1362 r=0.5865 | ewc=0.0394 | CI_T0=2.51% | CI_T1=3.11% | CI_T2=69.41% | CI_T3=99.65%
2026-02-11 15:07:06,524 - INFO - [Task 3 | ep 3 | step 325] loss=1.2064 c=0.1730 r=0.9912 | ewc=0.0422 | CI_T0=0.00% | CI_T1=5.63% | CI_T2=66.78% | CI_T3=99.61%
2026-02-11 15:07:23,338 - INFO - [Task 3 | ep 3 | step 350] loss=0.7269 c=0.1353 r=0.5467 | ewc=0.0448 | CI_T0=0.01% | CI_T1=2.78% | CI_T2=69.06% | CI_T3=99.65%
2026-02-11 15:07:40,143 - INFO - [Task 3 | ep 3 | step 375] loss=0.8238 c=0.1214 r=0.6551 | ewc=0.0473 | CI_T0=0.02% | CI_T1=3.31% | CI_T2=66.46% | CI_T3=99.78%
2026-02-11 15:07:44,248 - INFO - EWC: stored Fisher for task 3
2026-02-11 15:08:01,324 - INFO - [After Task 3] Task-IL : T0=99.95% | T1=98.58% | T2=99.84% | T3=99.95% | Avg=99.58%
2026-02-11 15:08:01,324 - INFO - [After Task 3] Class-IL: T0=0.14% | T1=2.35% | T2=66.06% | T3=99.40% | Avg=41.99%
2026-02-11 15:08:01,325 - INFO - ========== GROUP DIFFERENCES ==========
2026-02-11 15:08:01,325 - INFO - Seen tasks: 0..3 | valid_out_dim=8
2026-02-11 15:08:03,462 - INFO - [Group=Task0] CI_acc=0.14% | corr_slice_max=5.314 | best_other_max=8.836 | gap=-3.522
2026-02-11 15:08:03,462 - INFO - [Group=Task0] winner_task_dist: W0=0.1% | W1=0.0% | W2=9.0% | W3=90.8%
2026-02-11 15:08:03,462 - INFO - [Group=Task0] slice_strength : S0=5.31 | S1=6.39 | S2=7.54 | S3=8.77
2026-02-11 15:08:05,605 - INFO - [Group=Task1] CI_acc=2.35% | corr_slice_max=7.046 | best_other_max=9.333 | gap=-2.287
2026-02-11 15:08:05,605 - INFO - [Group=Task1] winner_task_dist: W0=0.0% | W1=2.4% | W2=49.0% | W3=48.7%
2026-02-11 15:08:05,605 - INFO - [Group=Task1] slice_strength : S0=2.90 | S1=7.05 | S2=8.34 | S3=8.36
2026-02-11 15:08:07,728 - INFO - [Group=Task2] CI_acc=66.06% | corr_slice_max=9.219 | best_other_max=8.564 | gap=0.655
2026-02-11 15:08:07,728 - INFO - [Group=Task2] winner_task_dist: W0=0.0% | W1=0.1% | W2=66.1% | W3=33.9%
2026-02-11 15:08:07,728 - INFO - [Group=Task2] slice_strength : S0=2.86 | S1=6.18 | S2=9.22 | S3=8.48
2026-02-11 15:08:09,867 - INFO - [Group=Task3] CI_acc=99.40% | corr_slice_max=10.561 | best_other_max=8.070 | gap=2.490
2026-02-11 15:08:09,867 - INFO - [Group=Task3] winner_task_dist: W0=0.0% | W1=0.0% | W2=0.6% | W3=99.4%
2026-02-11 15:08:09,867 - INFO - [Group=Task3] slice_strength : S0=2.85 | S1=5.89 | S2=8.05 | S3=10.56
2026-02-11 15:08:09,867 - INFO - ======================================
2026-02-11 15:08:09,867 - INFO - ========== Training Task 4: classes [8, 9] ==========
2026-02-11 15:08:33,910 - INFO - [Task 4 | ep 0 | step 0] loss=11.6030 c=9.2591 r=2.2961 | ewc=0.0478 | CI_T0=0.00% | CI_T1=3.15% | CI_T2=67.72% | CI_T3=99.69% | CI_T4=0.00%
2026-02-11 15:08:54,847 - INFO - [Task 4 | ep 0 | step 25] loss=2.1200 c=0.5136 r=1.5558 | ewc=0.0507 | CI_T0=0.02% | CI_T1=4.42% | CI_T2=10.29% | CI_T3=29.65% | CI_T4=92.17%
2026-02-11 15:09:15,794 - INFO - [Task 4 | ep 0 | step 50] loss=1.5619 c=0.5754 r=0.9285 | ewc=0.0579 | CI_T0=0.00% | CI_T1=0.02% | CI_T2=12.45% | CI_T3=42.68% | CI_T4=94.62%
2026-02-11 15:09:36,543 - INFO - [Task 4 | ep 0 | step 75] loss=1.3918 c=0.5117 r=0.8142 | ewc=0.0660 | CI_T0=0.00% | CI_T1=0.02% | CI_T2=10.40% | CI_T3=39.81% | CI_T4=95.52%
2026-02-11 15:10:01,307 - INFO - [Task 4 | ep 1 | step 100] loss=1.3213 c=0.4179 r=0.8290 | ewc=0.0743 | CI_T0=0.00% | CI_T1=0.00% | CI_T2=9.70% | CI_T3=35.53% | CI_T4=95.65%
2026-02-11 15:10:22,214 - INFO - [Task 4 | ep 1 | step 125] loss=1.2441 c=0.3582 r=0.8033 | ewc=0.0826 | CI_T0=0.01% | CI_T1=0.01% | CI_T2=12.07% | CI_T3=44.51% | CI_T4=96.84%
2026-02-11 15:10:43,094 - INFO - [Task 4 | ep 1 | step 150] loss=1.1897 c=0.3364 r=0.7624 | ewc=0.0909 | CI_T0=0.00% | CI_T1=0.00% | CI_T2=10.30% | CI_T3=36.00% | CI_T4=97.53%
2026-02-11 15:11:03,821 - INFO - [Task 4 | ep 1 | step 175] loss=1.0568 c=0.3057 r=0.6524 | ewc=0.0987 | CI_T0=0.00% | CI_T1=0.00% | CI_T2=9.52% | CI_T3=40.30% | CI_T4=97.66%
2026-02-11 15:11:28,440 - INFO - [Task 4 | ep 2 | step 200] loss=0.9843 c=0.2602 r=0.6177 | ewc=0.1064 | CI_T0=0.00% | CI_T1=0.00% | CI_T2=10.24% | CI_T3=40.76% | CI_T4=98.19%
2026-02-11 15:11:49,296 - INFO - [Task 4 | ep 2 | step 225] loss=0.9891 c=0.2262 r=0.6490 | ewc=0.1138 | CI_T0=0.02% | CI_T1=0.00% | CI_T2=10.30% | CI_T3=41.24% | CI_T4=97.99%
2026-02-11 15:12:10,158 - INFO - [Task 4 | ep 2 | step 250] loss=0.9991 c=0.2961 r=0.5821 | ewc=0.1209 | CI_T0=0.03% | CI_T1=0.00% | CI_T2=10.09% | CI_T3=39.11% | CI_T4=98.59%
2026-02-11 15:12:31,128 - INFO - [Task 4 | ep 2 | step 275] loss=1.2319 c=0.2183 r=0.8862 | ewc=0.1274 | CI_T0=0.00% | CI_T1=0.00% | CI_T2=6.56% | CI_T3=37.52% | CI_T4=98.74%
2026-02-11 15:12:55,879 - INFO - [Task 4 | ep 3 | step 300] loss=0.9033 c=0.2210 r=0.5490 | ewc=0.1332 | CI_T0=0.00% | CI_T1=0.00% | CI_T2=9.16% | CI_T3=35.93% | CI_T4=98.90%
2026-02-11 15:13:16,835 - INFO - [Task 4 | ep 3 | step 325] loss=1.1878 c=0.2428 r=0.8065 | ewc=0.1385 | CI_T0=0.00% | CI_T1=0.00% | CI_T2=9.16% | CI_T3=37.56% | CI_T4=98.98%
2026-02-11 15:13:37,814 - INFO - [Task 4 | ep 3 | step 350] loss=1.0551 c=0.2728 r=0.6393 | ewc=0.1430 | CI_T0=0.00% | CI_T1=0.00% | CI_T2=8.82% | CI_T3=39.12% | CI_T4=98.90%
2026-02-11 15:13:42,199 - INFO - EWC: stored Fisher for task 4
2026-02-11 15:14:03,528 - INFO - [After Task 4] Task-IL : T0=99.91% | T1=98.63% | T2=99.79% | T3=99.80% | T4=98.94% | Avg=99.41%
2026-02-11 15:14:03,528 - INFO - [After Task 4] Class-IL: T0=0.00% | T1=0.00% | T2=9.82% | T3=36.81% | T4=98.49% | Avg=29.02%
2026-02-11 15:14:03,528 - INFO - ========== GROUP DIFFERENCES ==========
2026-02-11 15:14:03,528 - INFO - Seen tasks: 0..4 | valid_out_dim=10
2026-02-11 15:14:05,680 - INFO - [Group=Task0] CI_acc=0.00% | corr_slice_max=5.270 | best_other_max=9.790 | gap=-4.519
2026-02-11 15:14:05,680 - INFO - [Group=Task0] winner_task_dist: W0=0.0% | W1=0.0% | W2=1.1% | W3=14.6% | W4=84.3%
2026-02-11 15:14:05,680 - INFO - [Group=Task0] slice_strength : S0=5.27 | S1=6.38 | S2=7.35 | S3=8.41 | S4=9.71
2026-02-11 15:14:07,820 - INFO - [Group=Task1] CI_acc=0.00% | corr_slice_max=7.004 | best_other_max=10.173 | gap=-3.169
2026-02-11 15:14:07,820 - INFO - [Group=Task1] winner_task_dist: W0=0.0% | W1=0.0% | W2=14.4% | W3=13.6% | W4=72.0%
2026-02-11 15:14:07,820 - INFO - [Group=Task1] slice_strength : S0=2.83 | S1=7.00 | S2=8.14 | S3=8.15 | S4=9.96
2026-02-11 15:14:09,957 - INFO - [Group=Task2] CI_acc=9.82% | corr_slice_max=9.125 | best_other_max=10.672 | gap=-1.547
2026-02-11 15:14:09,957 - INFO - [Group=Task2] winner_task_dist: W0=0.0% | W1=0.0% | W2=9.8% | W3=1.2% | W4=89.0%
2026-02-11 15:14:09,957 - INFO - [Group=Task2] slice_strength : S0=2.80 | S1=6.08 | S2=9.12 | S3=8.37 | S4=10.66
2026-02-11 15:14:12,102 - INFO - [Group=Task3] CI_acc=36.81% | corr_slice_max=9.923 | best_other_max=10.325 | gap=-0.402
2026-02-11 15:14:12,102 - INFO - [Group=Task3] winner_task_dist: W0=0.0% | W1=0.0% | W2=1.0% | W3=36.8% | W4=62.2%
2026-02-11 15:14:12,102 - INFO - [Group=Task3] slice_strength : S0=2.90 | S1=6.02 | S2=7.85 | S3=9.92 | S4=10.26
2026-02-11 15:14:14,241 - INFO - [Group=Task4] CI_acc=98.49% | corr_slice_max=11.576 | best_other_max=9.428 | gap=2.148
2026-02-11 15:14:14,241 - INFO - [Group=Task4] winner_task_dist: W0=0.0% | W1=0.0% | W2=0.2% | W3=0.5% | W4=99.4%
2026-02-11 15:14:14,241 - INFO - [Group=Task4] slice_strength : S0=3.12 | S1=6.37 | S2=8.42 | S3=9.21 | S4=11.58
2026-02-11 15:14:14,241 - INFO - ======================================
2026-02-11 15:14:14,241 - INFO - ========== FINAL METRICS (Class-IL) ==========
2026-02-11 15:14:14,241 - INFO - Forgetting per task: T0=99.95%, T1=99.22%, T2=89.91%, T3=62.59%, T4=0.00%
2026-02-11 15:14:14,241 - INFO - BWT: -87.92%
2026-02-11 15:14:14,242 - INFO - Final average Class-IL accuracy: 29.02%
