2026-02-11 20:14:56,457 - INFO - Device: cpu
2026-02-11 20:14:56,457 - INFO - Config: {'device': 'cpu', 'lr': 0.005, 'epochs_per_task': 4, 'batch_size': 128, 'lambda_slice': 2.0, 'lambda_feat': 0.5, 'proto_aug_r': 0.4, 'proto_aug_n_per_class': 8}
2026-02-11 20:14:56,459 - INFO - ========== Task 0: classes [0, 1] ==========
2026-02-11 20:15:03,614 - INFO - [Task 0 | ep 0 | step 0] loss=0.8633 c=0.8633 r=0.0000 | CI_T0=95.74%
2026-02-11 20:15:07,583 - INFO - [Task 0 | ep 0 | step 25] loss=0.0014 c=0.0014 r=0.0000 | CI_T0=99.93%
2026-02-11 20:15:11,569 - INFO - [Task 0 | ep 0 | step 50] loss=0.0007 c=0.0007 r=0.0000 | CI_T0=99.85%
2026-02-11 20:15:15,556 - INFO - [Task 0 | ep 0 | step 75] loss=0.0003 c=0.0003 r=0.0000 | CI_T0=99.97%
2026-02-11 20:15:23,061 - INFO - [Task 0 | ep 1 | step 100] loss=0.0003 c=0.0003 r=0.0000 | CI_T0=99.94%
2026-02-11 20:15:27,138 - INFO - [Task 0 | ep 1 | step 125] loss=0.0005 c=0.0005 r=0.0000 | CI_T0=99.94%
2026-02-11 20:15:31,113 - INFO - [Task 0 | ep 1 | step 150] loss=0.0003 c=0.0003 r=0.0000 | CI_T0=99.92%
2026-02-11 20:15:35,099 - INFO - [Task 0 | ep 1 | step 175] loss=0.0002 c=0.0002 r=0.0000 | CI_T0=99.94%
2026-02-11 20:15:42,587 - INFO - [Task 0 | ep 2 | step 200] loss=0.0001 c=0.0001 r=0.0000 | CI_T0=99.97%
2026-02-11 20:15:46,600 - INFO - [Task 0 | ep 2 | step 225] loss=0.0001 c=0.0001 r=0.0000 | CI_T0=99.94%
2026-02-11 20:15:50,589 - INFO - [Task 0 | ep 2 | step 250] loss=0.0003 c=0.0003 r=0.0000 | CI_T0=99.96%
2026-02-11 20:15:54,690 - INFO - [Task 0 | ep 2 | step 275] loss=0.0003 c=0.0003 r=0.0000 | CI_T0=99.97%
2026-02-11 20:16:02,178 - INFO - [Task 0 | ep 3 | step 300] loss=0.0001 c=0.0001 r=0.0000 | CI_T0=99.96%
2026-02-11 20:16:06,175 - INFO - [Task 0 | ep 3 | step 325] loss=0.0001 c=0.0001 r=0.0000 | CI_T0=99.96%
2026-02-11 20:16:10,168 - INFO - [Task 0 | ep 3 | step 350] loss=0.0005 c=0.0005 r=0.0000 | CI_T0=99.98%
2026-02-11 20:16:14,160 - INFO - [Task 0 | ep 3 | step 375] loss=0.0008 c=0.0008 r=0.0000 | CI_T0=99.98%
2026-02-11 20:16:22,445 - INFO - [After Task 0] Task-IL : T0=99.91% | Avg=99.91%
2026-02-11 20:16:22,445 - INFO - [After Task 0] Class-IL: T0=99.91% | Avg=99.91%
2026-02-11 20:16:22,445 - INFO - ========== GROUP DIFFERENCES ==========
2026-02-11 20:16:22,445 - INFO - Seen tasks: 0..0 | valid_out_dim=2
2026-02-11 20:16:24,538 - INFO - [Group=Task0] CI_acc=99.91% | corr_slice_max=5.001 | best_other_max=nan | gap=nan
2026-02-11 20:16:24,538 - INFO - [Group=Task0] winner_task_dist: W0=100.0%
2026-02-11 20:16:24,538 - INFO - [Group=Task0] slice_strength : S0=5.00
2026-02-11 20:16:24,538 - INFO - ======================================
2026-02-11 20:16:24,538 - INFO - ========== Task 1: classes [2, 3] ==========
2026-02-11 20:16:35,611 - INFO - [Task 1 | ep 0 | step 0] loss=7.4382 c=4.1971 r=3.2411 | CI_T0=99.55% | CI_T1=4.61%
2026-02-11 20:16:43,496 - INFO - [Task 1 | ep 0 | step 25] loss=8.0900 c=0.2090 r=1.2149 | CI_T0=36.23% | CI_T1=93.96%
2026-02-11 20:16:51,382 - INFO - [Task 1 | ep 0 | step 50] loss=11.0795 c=0.1552 r=1.0467 | CI_T0=6.30% | CI_T1=97.48%
2026-02-11 20:16:59,341 - INFO - [Task 1 | ep 0 | step 75] loss=11.1490 c=0.1073 r=1.0118 | CI_T0=16.78% | CI_T1=98.10%
2026-02-11 20:17:10,752 - INFO - [Task 1 | ep 1 | step 100] loss=10.2272 c=0.1166 r=0.8628 | CI_T0=14.98% | CI_T1=98.24%
2026-02-11 20:17:18,660 - INFO - [Task 1 | ep 1 | step 125] loss=9.4162 c=0.1415 r=0.6724 | CI_T0=35.64% | CI_T1=98.43%
2026-02-11 20:17:26,660 - INFO - [Task 1 | ep 1 | step 150] loss=9.4073 c=0.1397 r=1.0423 | CI_T0=24.78% | CI_T1=98.43%
2026-02-11 20:17:34,586 - INFO - [Task 1 | ep 1 | step 175] loss=8.3768 c=0.1276 r=0.7572 | CI_T0=21.74% | CI_T1=98.41%
2026-02-11 20:17:46,083 - INFO - [Task 1 | ep 2 | step 200] loss=8.3740 c=0.1092 r=1.3476 | CI_T0=25.08% | CI_T1=98.77%
2026-02-11 20:17:54,092 - INFO - [Task 1 | ep 2 | step 225] loss=7.1741 c=0.1236 r=0.6160 | CI_T0=30.05% | CI_T1=98.48%
2026-02-11 20:18:01,993 - INFO - [Task 1 | ep 2 | step 250] loss=5.7161 c=0.1783 r=0.6219 | CI_T0=37.21% | CI_T1=98.63%
2026-02-11 20:18:09,946 - INFO - [Task 1 | ep 2 | step 275] loss=6.0749 c=0.1032 r=0.5954 | CI_T0=35.87% | CI_T1=98.88%
2026-02-11 20:18:21,408 - INFO - [Task 1 | ep 3 | step 300] loss=5.3502 c=0.1737 r=0.6537 | CI_T0=36.96% | CI_T1=98.44%
2026-02-11 20:18:29,451 - INFO - [Task 1 | ep 3 | step 325] loss=4.9415 c=0.1340 r=0.8179 | CI_T0=50.25% | CI_T1=98.74%
2026-02-11 20:18:37,406 - INFO - [Task 1 | ep 3 | step 350] loss=4.1085 c=0.1331 r=0.4835 | CI_T0=36.88% | CI_T1=98.03%
2026-02-11 20:18:45,325 - INFO - [Task 1 | ep 3 | step 375] loss=3.6350 c=0.1288 r=1.3533 | CI_T0=43.05% | CI_T1=98.94%
2026-02-11 20:18:57,590 - INFO - [After Task 1] Task-IL : T0=99.91% | T1=98.97% | Avg=99.44%
2026-02-11 20:18:57,590 - INFO - [After Task 1] Class-IL: T0=44.82% | T1=98.87% | Avg=71.85%
2026-02-11 20:18:57,590 - INFO - ========== GROUP DIFFERENCES ==========
2026-02-11 20:18:57,590 - INFO - Seen tasks: 0..1 | valid_out_dim=4
2026-02-11 20:18:59,593 - INFO - [Group=Task0] CI_acc=44.82% | corr_slice_max=5.004 | best_other_max=5.102 | gap=-0.098
2026-02-11 20:18:59,593 - INFO - [Group=Task0] winner_task_dist: W0=44.8% | W1=55.2%
2026-02-11 20:18:59,593 - INFO - [Group=Task0] slice_strength : S0=5.00 | S1=5.10
2026-02-11 20:19:01,598 - INFO - [Group=Task1] CI_acc=98.87% | corr_slice_max=6.245 | best_other_max=2.786 | gap=3.459
2026-02-11 20:19:01,598 - INFO - [Group=Task1] winner_task_dist: W0=0.1% | W1=99.9%
2026-02-11 20:19:01,598 - INFO - [Group=Task1] slice_strength : S0=2.79 | S1=6.24
2026-02-11 20:19:01,598 - INFO - ======================================
2026-02-11 20:19:01,598 - INFO - ========== Task 2: classes [4, 5] ==========
2026-02-11 20:19:16,561 - INFO - [Task 2 | ep 0 | step 0] loss=8.6809 c=5.8373 r=2.0320 | CI_T0=37.77% | CI_T1=98.50% | CI_T2=0.00%
2026-02-11 20:19:28,530 - INFO - [Task 2 | ep 0 | step 25] loss=2.9010 c=0.5394 r=1.0197 | CI_T0=17.02% | CI_T1=40.69% | CI_T2=90.40%
2026-02-11 20:19:40,387 - INFO - [Task 2 | ep 0 | step 50] loss=2.5865 c=0.4173 r=0.7961 | CI_T0=34.83% | CI_T1=44.21% | CI_T2=92.16%
2026-02-11 20:19:52,129 - INFO - [Task 2 | ep 0 | step 75] loss=2.0164 c=0.3447 r=0.6898 | CI_T0=22.04% | CI_T1=46.67% | CI_T2=93.49%
2026-02-11 20:20:07,571 - INFO - [Task 2 | ep 1 | step 100] loss=1.6478 c=0.2929 r=0.6353 | CI_T0=28.83% | CI_T1=39.76% | CI_T2=96.77%
2026-02-11 20:20:19,450 - INFO - [Task 2 | ep 1 | step 125] loss=1.4279 c=0.2694 r=0.5677 | CI_T0=23.97% | CI_T1=35.40% | CI_T2=97.98%
2026-02-11 20:20:31,389 - INFO - [Task 2 | ep 1 | step 150] loss=1.5366 c=0.2899 r=0.5684 | CI_T0=24.10% | CI_T1=34.72% | CI_T2=98.64%
2026-02-11 20:20:46,736 - INFO - [Task 2 | ep 2 | step 175] loss=1.2981 c=0.2281 r=0.6331 | CI_T0=18.85% | CI_T1=33.28% | CI_T2=98.79%
2026-02-11 20:20:58,617 - INFO - [Task 2 | ep 2 | step 200] loss=1.3307 c=0.1970 r=0.7681 | CI_T0=19.42% | CI_T1=33.39% | CI_T2=99.25%
2026-02-11 20:21:10,342 - INFO - [Task 2 | ep 2 | step 225] loss=1.1112 c=0.2039 r=0.6509 | CI_T0=15.86% | CI_T1=27.09% | CI_T2=99.28%
2026-02-11 20:21:22,069 - INFO - [Task 2 | ep 2 | step 250] loss=1.2158 c=0.1775 r=0.7502 | CI_T0=10.88% | CI_T1=25.36% | CI_T2=99.61%
2026-02-11 20:21:37,486 - INFO - [Task 2 | ep 3 | step 275] loss=1.0526 c=0.1723 r=0.6160 | CI_T0=7.45% | CI_T1=21.91% | CI_T2=99.66%
2026-02-11 20:21:49,328 - INFO - [Task 2 | ep 3 | step 300] loss=0.9414 c=0.1408 r=0.6590 | CI_T0=9.45% | CI_T1=25.63% | CI_T2=99.75%
2026-02-11 20:22:01,193 - INFO - [Task 2 | ep 3 | step 325] loss=0.8999 c=0.1534 r=0.5670 | CI_T0=9.67% | CI_T1=23.31% | CI_T2=99.78%
2026-02-11 20:22:17,543 - INFO - [After Task 2] Task-IL : T0=99.91% | T1=98.48% | T2=99.84% | Avg=99.41%
2026-02-11 20:22:17,543 - INFO - [After Task 2] Class-IL: T0=12.96% | T1=21.50% | T2=99.68% | Avg=44.71%
2026-02-11 20:22:17,543 - INFO - ========== GROUP DIFFERENCES ==========
2026-02-11 20:22:17,543 - INFO - Seen tasks: 0..2 | valid_out_dim=6
2026-02-11 20:22:19,554 - INFO - [Group=Task0] CI_acc=12.96% | corr_slice_max=5.140 | best_other_max=6.402 | gap=-1.262
2026-02-11 20:22:19,554 - INFO - [Group=Task0] winner_task_dist: W0=13.0% | W1=3.1% | W2=84.0%
2026-02-11 20:22:19,554 - INFO - [Group=Task0] slice_strength : S0=5.14 | S1=5.25 | S2=6.39
2026-02-11 20:22:21,568 - INFO - [Group=Task1] CI_acc=21.50% | corr_slice_max=6.187 | best_other_max=7.246 | gap=-1.058
2026-02-11 20:22:21,568 - INFO - [Group=Task1] winner_task_dist: W0=0.2% | W1=21.5% | W2=78.3%
2026-02-11 20:22:21,568 - INFO - [Group=Task1] slice_strength : S0=2.65 | S1=6.19 | S2=7.24
2026-02-11 20:22:23,578 - INFO - [Group=Task2] CI_acc=99.68% | corr_slice_max=7.969 | best_other_max=5.372 | gap=2.597
2026-02-11 20:22:23,578 - INFO - [Group=Task2] winner_task_dist: W0=0.0% | W1=0.2% | W2=99.8%
2026-02-11 20:22:23,578 - INFO - [Group=Task2] slice_strength : S0=2.58 | S1=5.36 | S2=7.97
2026-02-11 20:22:23,578 - INFO - ======================================
2026-02-11 20:22:23,579 - INFO - ========== Task 3: classes [6, 7] ==========
2026-02-11 20:22:42,300 - INFO - [Task 3 | ep 0 | step 0] loss=8.9953 c=7.3843 r=1.5662 | CI_T0=9.65% | CI_T1=20.93% | CI_T2=99.83% | CI_T3=0.00%
2026-02-11 20:22:58,014 - INFO - [Task 3 | ep 0 | step 25] loss=2.4965 c=0.4345 r=1.2783 | CI_T0=13.07% | CI_T1=16.82% | CI_T2=60.50% | CI_T3=95.48%
2026-02-11 20:23:13,669 - INFO - [Task 3 | ep 0 | step 50] loss=1.7631 c=0.4002 r=0.8027 | CI_T0=7.11% | CI_T1=12.43% | CI_T2=77.61% | CI_T3=94.88%
2026-02-11 20:23:29,484 - INFO - [Task 3 | ep 0 | step 75] loss=1.6999 c=0.3794 r=0.8526 | CI_T0=3.87% | CI_T1=12.80% | CI_T2=79.72% | CI_T3=96.75%
2026-02-11 20:23:48,780 - INFO - [Task 3 | ep 1 | step 100] loss=1.3126 c=0.3734 r=0.6872 | CI_T0=3.72% | CI_T1=13.21% | CI_T2=77.37% | CI_T3=96.89%
2026-02-11 20:24:04,623 - INFO - [Task 3 | ep 1 | step 125] loss=1.3812 c=0.2974 r=0.7953 | CI_T0=7.02% | CI_T1=11.74% | CI_T2=77.51% | CI_T3=98.40%
2026-02-11 20:24:20,306 - INFO - [Task 3 | ep 1 | step 150] loss=1.1169 c=0.2953 r=0.6862 | CI_T0=6.87% | CI_T1=11.15% | CI_T2=75.92% | CI_T3=98.43%
2026-02-11 20:24:36,078 - INFO - [Task 3 | ep 1 | step 175] loss=1.3671 c=0.2370 r=0.9602 | CI_T0=2.70% | CI_T1=11.35% | CI_T2=72.18% | CI_T3=99.34%
2026-02-11 20:24:55,857 - INFO - [Task 3 | ep 2 | step 200] loss=1.2004 c=0.2620 r=0.8732 | CI_T0=0.97% | CI_T1=9.98% | CI_T2=68.35% | CI_T3=99.00%
2026-02-11 20:25:11,637 - INFO - [Task 3 | ep 2 | step 225] loss=0.9345 c=0.2300 r=0.5986 | CI_T0=2.26% | CI_T1=8.23% | CI_T2=64.45% | CI_T3=99.24%
2026-02-11 20:25:27,749 - INFO - [Task 3 | ep 2 | step 250] loss=0.8730 c=0.1979 r=0.5790 | CI_T0=2.70% | CI_T1=7.50% | CI_T2=64.29% | CI_T3=99.39%
2026-02-11 20:25:43,679 - INFO - [Task 3 | ep 2 | step 275] loss=0.8882 c=0.2305 r=0.6095 | CI_T0=1.96% | CI_T1=6.79% | CI_T2=65.99% | CI_T3=99.61%
2026-02-11 20:26:03,056 - INFO - [Task 3 | ep 3 | step 300] loss=0.8099 c=0.1629 r=0.5783 | CI_T0=0.22% | CI_T1=6.87% | CI_T2=61.58% | CI_T3=99.75%
2026-02-11 20:26:18,906 - INFO - [Task 3 | ep 3 | step 325] loss=0.7147 c=0.1542 r=0.5305 | CI_T0=0.60% | CI_T1=5.19% | CI_T2=60.23% | CI_T3=99.76%
2026-02-11 20:26:34,696 - INFO - [Task 3 | ep 3 | step 350] loss=0.7018 c=0.1483 r=0.5092 | CI_T0=0.41% | CI_T1=4.43% | CI_T2=57.23% | CI_T3=99.80%
2026-02-11 20:26:50,395 - INFO - [Task 3 | ep 3 | step 375] loss=0.8430 c=0.1349 r=0.6265 | CI_T0=0.59% | CI_T1=4.01% | CI_T2=59.78% | CI_T3=99.83%
2026-02-11 20:27:10,571 - INFO - [After Task 3] Task-IL : T0=99.91% | T1=97.99% | T2=99.73% | T3=100.00% | Avg=99.41%
2026-02-11 20:27:10,571 - INFO - [After Task 3] Class-IL: T0=1.23% | T1=3.23% | T2=57.04% | T3=99.65% | Avg=40.29%
2026-02-11 20:27:10,571 - INFO - ========== GROUP DIFFERENCES ==========
2026-02-11 20:27:10,571 - INFO - Seen tasks: 0..3 | valid_out_dim=8
2026-02-11 20:27:12,600 - INFO - [Group=Task0] CI_acc=1.23% | corr_slice_max=5.275 | best_other_max=7.986 | gap=-2.711
2026-02-11 20:27:12,600 - INFO - [Group=Task0] winner_task_dist: W0=1.2% | W1=0.0% | W2=9.7% | W3=89.0%
2026-02-11 20:27:12,600 - INFO - [Group=Task0] slice_strength : S0=5.28 | S1=5.35 | S2=6.77 | S3=7.90
2026-02-11 20:27:14,606 - INFO - [Group=Task1] CI_acc=3.23% | corr_slice_max=6.319 | best_other_max=8.310 | gap=-1.991
2026-02-11 20:27:14,606 - INFO - [Group=Task1] winner_task_dist: W0=0.0% | W1=3.2% | W2=42.5% | W3=54.3%
2026-02-11 20:27:14,606 - INFO - [Group=Task1] slice_strength : S0=2.67 | S1=6.32 | S2=7.26 | S3=7.53
2026-02-11 20:27:16,597 - INFO - [Group=Task2] CI_acc=57.04% | corr_slice_max=8.112 | best_other_max=7.812 | gap=0.300
2026-02-11 20:27:16,597 - INFO - [Group=Task2] winner_task_dist: W0=0.0% | W1=0.0% | W2=57.0% | W3=43.0%
2026-02-11 20:27:16,597 - INFO - [Group=Task2] slice_strength : S0=2.54 | S1=5.51 | S2=8.11 | S3=7.68
2026-02-11 20:27:18,614 - INFO - [Group=Task3] CI_acc=99.65% | corr_slice_max=9.476 | best_other_max=7.150 | gap=2.325
2026-02-11 20:27:18,614 - INFO - [Group=Task3] winner_task_dist: W0=0.0% | W1=0.0% | W2=0.4% | W3=99.6%
2026-02-11 20:27:18,614 - INFO - [Group=Task3] slice_strength : S0=2.68 | S1=5.10 | S2=7.12 | S3=9.48
2026-02-11 20:27:18,614 - INFO - ======================================
2026-02-11 20:27:18,614 - INFO - ========== Task 4: classes [8, 9] ==========
2026-02-11 20:27:41,304 - INFO - [Task 4 | ep 0 | step 0] loss=11.7273 c=8.6026 r=2.6636 | CI_T0=0.37% | CI_T1=5.21% | CI_T2=58.07% | CI_T3=99.82% | CI_T4=0.00%
2026-02-11 20:28:00,954 - INFO - [Task 4 | ep 0 | step 25] loss=2.5287 c=0.4698 r=1.5494 | CI_T0=1.91% | CI_T1=3.27% | CI_T2=4.62% | CI_T3=30.69% | CI_T4=93.11%
2026-02-11 20:28:20,580 - INFO - [Task 4 | ep 0 | step 50] loss=1.5933 c=0.5024 r=0.7986 | CI_T0=0.18% | CI_T1=0.10% | CI_T2=6.49% | CI_T3=36.48% | CI_T4=94.32%
2026-02-11 20:28:40,165 - INFO - [Task 4 | ep 0 | step 75] loss=1.3657 c=0.4266 r=0.7698 | CI_T0=0.07% | CI_T1=0.02% | CI_T2=6.27% | CI_T3=32.79% | CI_T4=95.34%
2026-02-11 20:29:03,136 - INFO - [Task 4 | ep 1 | step 100] loss=1.3650 c=0.3911 r=0.7615 | CI_T0=0.49% | CI_T1=0.01% | CI_T2=5.97% | CI_T3=38.29% | CI_T4=96.62%
2026-02-11 20:29:22,752 - INFO - [Task 4 | ep 1 | step 125] loss=1.2021 c=0.4484 r=0.6166 | CI_T0=0.43% | CI_T1=0.00% | CI_T2=7.59% | CI_T3=32.64% | CI_T4=96.55%
2026-02-11 20:29:42,447 - INFO - [Task 4 | ep 1 | step 150] loss=1.0649 c=0.3436 r=0.5981 | CI_T0=0.47% | CI_T1=0.00% | CI_T2=8.37% | CI_T3=38.39% | CI_T4=97.55%
2026-02-11 20:30:02,200 - INFO - [Task 4 | ep 1 | step 175] loss=0.9312 c=0.3430 r=0.5581 | CI_T0=1.32% | CI_T1=0.00% | CI_T2=10.57% | CI_T3=40.26% | CI_T4=98.12%
2026-02-11 20:30:25,423 - INFO - [Task 4 | ep 2 | step 200] loss=1.0197 c=0.3157 r=0.6507 | CI_T0=0.19% | CI_T1=0.00% | CI_T2=9.23% | CI_T3=29.48% | CI_T4=98.36%
2026-02-11 20:30:45,083 - INFO - [Task 4 | ep 2 | step 225] loss=1.1201 c=0.2719 r=0.7772 | CI_T0=0.02% | CI_T1=0.01% | CI_T2=7.08% | CI_T3=34.28% | CI_T4=98.28%
2026-02-11 20:31:04,683 - INFO - [Task 4 | ep 2 | step 250] loss=0.9045 c=0.2356 r=0.6534 | CI_T0=0.73% | CI_T1=0.00% | CI_T2=9.45% | CI_T3=32.91% | CI_T4=98.64%
2026-02-11 20:31:24,371 - INFO - [Task 4 | ep 2 | step 275] loss=1.0264 c=0.2430 r=0.7770 | CI_T0=0.36% | CI_T1=0.00% | CI_T2=8.74% | CI_T3=33.00% | CI_T4=98.92%
2026-02-11 20:31:47,613 - INFO - [Task 4 | ep 3 | step 300] loss=1.0399 c=0.2393 r=0.7920 | CI_T0=0.26% | CI_T1=0.00% | CI_T2=8.39% | CI_T3=32.22% | CI_T4=98.94%
2026-02-11 20:32:07,300 - INFO - [Task 4 | ep 3 | step 325] loss=0.7772 c=0.2641 r=0.4944 | CI_T0=0.01% | CI_T1=0.00% | CI_T2=5.50% | CI_T3=31.30% | CI_T4=99.18%
2026-02-11 20:32:26,992 - INFO - [Task 4 | ep 3 | step 350] loss=0.7327 c=0.1987 r=0.5246 | CI_T0=0.06% | CI_T1=0.00% | CI_T2=7.41% | CI_T3=32.14% | CI_T4=99.29%
2026-02-11 20:32:51,224 - INFO - [After Task 4] Task-IL : T0=99.91% | T1=98.38% | T2=99.79% | T3=99.80% | T4=98.99% | Avg=99.37%
2026-02-11 20:32:51,224 - INFO - [After Task 4] Class-IL: T0=0.00% | T1=0.00% | T2=6.35% | T3=33.69% | T4=98.44% | Avg=27.69%
2026-02-11 20:32:51,224 - INFO - ========== GROUP DIFFERENCES ==========
2026-02-11 20:32:51,224 - INFO - Seen tasks: 0..4 | valid_out_dim=10
2026-02-11 20:32:53,214 - INFO - [Group=Task0] CI_acc=0.00% | corr_slice_max=5.263 | best_other_max=9.214 | gap=-3.950
2026-02-11 20:32:53,214 - INFO - [Group=Task0] winner_task_dist: W0=0.0% | W1=0.0% | W2=0.5% | W3=8.1% | W4=91.4%
2026-02-11 20:32:53,214 - INFO - [Group=Task0] slice_strength : S0=5.26 | S1=5.22 | S2=6.44 | S3=7.85 | S4=9.18
2026-02-11 20:32:55,194 - INFO - [Group=Task1] CI_acc=0.00% | corr_slice_max=6.146 | best_other_max=9.580 | gap=-3.434
2026-02-11 20:32:55,195 - INFO - [Group=Task1] winner_task_dist: W0=0.0% | W1=0.0% | W2=5.5% | W3=10.8% | W4=83.7%
2026-02-11 20:32:55,195 - INFO - [Group=Task1] slice_strength : S0=2.58 | S1=6.15 | S2=7.11 | S3=7.55 | S4=9.47
2026-02-11 20:32:57,188 - INFO - [Group=Task2] CI_acc=6.35% | corr_slice_max=7.969 | best_other_max=10.003 | gap=-2.033
2026-02-11 20:32:57,188 - INFO - [Group=Task2] winner_task_dist: W0=0.0% | W1=0.0% | W2=6.4% | W3=1.1% | W4=92.6%
2026-02-11 20:32:57,188 - INFO - [Group=Task2] slice_strength : S0=2.61 | S1=5.33 | S2=7.97 | S3=7.74 | S4=10.00
2026-02-11 20:32:59,177 - INFO - [Group=Task3] CI_acc=33.69% | corr_slice_max=9.301 | best_other_max=9.777 | gap=-0.476
2026-02-11 20:32:59,178 - INFO - [Group=Task3] winner_task_dist: W0=0.0% | W1=0.0% | W2=0.0% | W3=33.7% | W4=66.3%
2026-02-11 20:32:59,178 - INFO - [Group=Task3] slice_strength : S0=2.70 | S1=5.09 | S2=6.92 | S3=9.30 | S4=9.77
2026-02-11 20:33:01,165 - INFO - [Group=Task4] CI_acc=98.44% | corr_slice_max=10.803 | best_other_max=8.665 | gap=2.137
2026-02-11 20:33:01,166 - INFO - [Group=Task4] winner_task_dist: W0=0.0% | W1=0.0% | W2=0.1% | W3=0.6% | W4=99.3%
2026-02-11 20:33:01,166 - INFO - [Group=Task4] slice_strength : S0=2.91 | S1=5.53 | S2=7.34 | S3=8.53 | S4=10.80
2026-02-11 20:33:01,166 - INFO - ======================================
2026-02-11 20:33:01,166 - INFO - ========== FINAL METRICS (Class-IL) ==========
2026-02-11 20:33:01,166 - INFO - Forgetting per task: T0=99.91%, T1=98.87%, T2=93.33%, T3=65.96%, T4=0.00%
2026-02-11 20:33:01,166 - INFO - BWT: -89.52%
2026-02-11 20:33:01,166 - INFO - Final average Class-IL accuracy: 27.69%
