2026-02-12 00:43:00,870 - INFO - Device: cpu
2026-02-12 00:43:00,870 - INFO - Config: {'device': 'cpu', 'lr': 0.005, 'epochs_per_task': 4, 'batch_size': 128, 'lambda_slice': 2.0, 'lambda_feat': 0.5, 'proto_aug_n_per_class': 8, 'lambda_ac': 0.1}
2026-02-12 00:43:00,872 - INFO - ========== Task 0: classes [0, 1] ==========
2026-02-12 00:43:07,895 - INFO - [Task 0 | ep 0 | step 0] loss=0.8810 c=0.8633 r=0.0000 ac=0.0177 | CI_T0=95.71%
2026-02-12 00:43:11,782 - INFO - [Task 0 | ep 0 | step 25] loss=0.0195 c=0.0016 r=0.0000 ac=0.0179 | CI_T0=99.94%
2026-02-12 00:43:15,686 - INFO - [Task 0 | ep 0 | step 50] loss=0.0146 c=0.0010 r=0.0000 ac=0.0136 | CI_T0=99.90%
2026-02-12 00:43:19,579 - INFO - [Task 0 | ep 0 | step 75] loss=0.0102 c=0.0009 r=0.0000 ac=0.0093 | CI_T0=99.90%
2026-02-12 00:43:26,948 - INFO - [Task 0 | ep 1 | step 100] loss=0.0080 c=0.0007 r=0.0000 ac=0.0073 | CI_T0=99.94%
2026-02-12 00:43:30,826 - INFO - [Task 0 | ep 1 | step 125] loss=0.0056 c=0.0008 r=0.0000 ac=0.0048 | CI_T0=99.93%
2026-02-12 00:43:34,744 - INFO - [Task 0 | ep 1 | step 150] loss=0.0046 c=0.0006 r=0.0000 ac=0.0040 | CI_T0=99.88%
2026-02-12 00:43:38,659 - INFO - [Task 0 | ep 1 | step 175] loss=0.0028 c=0.0004 r=0.0000 ac=0.0024 | CI_T0=99.94%
2026-02-12 00:43:46,021 - INFO - [Task 0 | ep 2 | step 200] loss=0.0024 c=0.0003 r=0.0000 ac=0.0020 | CI_T0=99.96%
2026-02-12 00:43:49,932 - INFO - [Task 0 | ep 2 | step 225] loss=0.0014 c=0.0003 r=0.0000 ac=0.0011 | CI_T0=99.96%
2026-02-12 00:43:53,815 - INFO - [Task 0 | ep 2 | step 250] loss=0.0013 c=0.0004 r=0.0000 ac=0.0009 | CI_T0=99.97%
2026-02-12 00:43:57,722 - INFO - [Task 0 | ep 2 | step 275] loss=0.0011 c=0.0004 r=0.0000 ac=0.0007 | CI_T0=99.88%
2026-02-12 00:44:05,044 - INFO - [Task 0 | ep 3 | step 300] loss=0.0010 c=0.0003 r=0.0000 ac=0.0007 | CI_T0=99.93%
2026-02-12 00:44:08,941 - INFO - [Task 0 | ep 3 | step 325] loss=0.0009 c=0.0003 r=0.0000 ac=0.0006 | CI_T0=99.96%
2026-02-12 00:44:12,918 - INFO - [Task 0 | ep 3 | step 350] loss=0.0012 c=0.0008 r=0.0000 ac=0.0004 | CI_T0=99.95%
2026-02-12 00:44:16,806 - INFO - [Task 0 | ep 3 | step 375] loss=0.0050 c=0.0045 r=0.0000 ac=0.0005 | CI_T0=99.98%
2026-02-12 00:44:24,909 - INFO - [After Task 0] Task-IL : T0=99.91% | Avg=99.91%
2026-02-12 00:44:24,909 - INFO - [After Task 0] Class-IL: T0=99.91% | Avg=99.91%
2026-02-12 00:44:24,909 - INFO - ========== GROUP DIFFERENCES ==========
2026-02-12 00:44:24,909 - INFO - Seen tasks: 0..0 | valid_out_dim=2
2026-02-12 00:44:26,870 - INFO - [Group=Task0] CI_acc=99.91% | corr_slice_max=4.714 | best_other_max=nan | gap=nan
2026-02-12 00:44:26,870 - INFO - [Group=Task0] winner_task_dist: W0=100.0%
2026-02-12 00:44:26,870 - INFO - [Group=Task0] slice_strength : S0=4.71
2026-02-12 00:44:26,870 - INFO - ======================================
2026-02-12 00:44:26,870 - INFO - ========== Task 1: classes [2, 3] ==========
2026-02-12 00:44:37,699 - INFO - [Task 1 | ep 0 | step 0] loss=6.0508 c=3.9855 r=2.0628 ac=0.0025 | CI_T0=99.96% | CI_T1=5.25%
2026-02-12 00:44:45,386 - INFO - [Task 1 | ep 0 | step 25] loss=5.5800 c=0.2013 r=1.3793 ac=0.0037 | CI_T0=31.44% | CI_T1=95.64%
2026-02-12 00:44:53,060 - INFO - [Task 1 | ep 0 | step 50] loss=8.0528 c=0.1975 r=1.5179 ac=0.0049 | CI_T0=18.10% | CI_T1=97.55%
2026-02-12 00:45:00,721 - INFO - [Task 1 | ep 0 | step 75] loss=7.1640 c=0.1601 r=1.2677 ac=0.0061 | CI_T0=30.49% | CI_T1=97.83%
2026-02-12 00:45:11,820 - INFO - [Task 1 | ep 1 | step 100] loss=6.0402 c=0.1678 r=0.9788 ac=0.0070 | CI_T0=26.67% | CI_T1=98.12%
2026-02-12 00:45:19,519 - INFO - [Task 1 | ep 1 | step 125] loss=5.9148 c=0.1771 r=0.8344 ac=0.0078 | CI_T0=41.40% | CI_T1=98.26%
2026-02-12 00:45:27,219 - INFO - [Task 1 | ep 1 | step 150] loss=4.8336 c=0.1634 r=1.1123 ac=0.0091 | CI_T0=28.31% | CI_T1=98.05%
2026-02-12 00:45:34,944 - INFO - [Task 1 | ep 1 | step 175] loss=3.9799 c=0.1605 r=0.8154 ac=0.0102 | CI_T0=21.97% | CI_T1=98.16%
2026-02-12 00:45:46,105 - INFO - [Task 1 | ep 2 | step 200] loss=3.9243 c=0.1247 r=1.3515 ac=0.0109 | CI_T0=30.45% | CI_T1=98.56%
2026-02-12 00:45:53,812 - INFO - [Task 1 | ep 2 | step 225] loss=3.3574 c=0.1623 r=0.8870 ac=0.0122 | CI_T0=34.74% | CI_T1=98.70%
2026-02-12 00:46:01,528 - INFO - [Task 1 | ep 2 | step 250] loss=2.5979 c=0.1890 r=0.7916 ac=0.0134 | CI_T0=30.73% | CI_T1=98.71%
2026-02-12 00:46:09,241 - INFO - [Task 1 | ep 2 | step 275] loss=2.9737 c=0.1226 r=0.7544 ac=0.0135 | CI_T0=19.98% | CI_T1=98.70%
2026-02-12 00:46:20,312 - INFO - [Task 1 | ep 3 | step 300] loss=2.0019 c=0.1919 r=0.7615 ac=0.0141 | CI_T0=36.53% | CI_T1=98.69%
2026-02-12 00:46:27,975 - INFO - [Task 1 | ep 3 | step 325] loss=2.2023 c=0.1703 r=1.0362 ac=0.0147 | CI_T0=29.08% | CI_T1=98.82%
2026-02-12 00:46:35,693 - INFO - [Task 1 | ep 3 | step 350] loss=2.0241 c=0.1374 r=0.8014 ac=0.0161 | CI_T0=36.51% | CI_T1=98.47%
2026-02-12 00:46:43,346 - INFO - [Task 1 | ep 3 | step 375] loss=1.9812 c=0.1315 r=1.4800 ac=0.0161 | CI_T0=31.16% | CI_T1=98.84%
2026-02-12 00:46:55,192 - INFO - [After Task 1] Task-IL : T0=99.91% | T1=99.27% | Avg=99.59%
2026-02-12 00:46:55,192 - INFO - [After Task 1] Class-IL: T0=30.59% | T1=98.97% | Avg=64.78%
2026-02-12 00:46:55,192 - INFO - ========== GROUP DIFFERENCES ==========
2026-02-12 00:46:55,192 - INFO - Seen tasks: 0..1 | valid_out_dim=4
2026-02-12 00:46:57,139 - INFO - [Group=Task0] CI_acc=30.59% | corr_slice_max=4.813 | best_other_max=5.269 | gap=-0.455
2026-02-12 00:46:57,139 - INFO - [Group=Task0] winner_task_dist: W0=30.6% | W1=69.4%
2026-02-12 00:46:57,139 - INFO - [Group=Task0] slice_strength : S0=4.81 | S1=5.27
2026-02-12 00:46:59,090 - INFO - [Group=Task1] CI_acc=98.97% | corr_slice_max=6.611 | best_other_max=3.171 | gap=3.439
2026-02-12 00:46:59,090 - INFO - [Group=Task1] winner_task_dist: W0=0.3% | W1=99.7%
2026-02-12 00:46:59,090 - INFO - [Group=Task1] slice_strength : S0=3.17 | S1=6.61
2026-02-12 00:46:59,090 - INFO - ======================================
2026-02-12 00:46:59,090 - INFO - ========== Task 2: classes [4, 5] ==========
2026-02-12 00:47:13,489 - INFO - [Task 2 | ep 0 | step 0] loss=8.6073 c=6.0649 r=2.2929 ac=0.0156 | CI_T0=31.69% | CI_T1=98.68% | CI_T2=0.00%
2026-02-12 00:47:24,992 - INFO - [Task 2 | ep 0 | step 25] loss=2.4527 c=0.4401 r=1.1690 ac=0.0165 | CI_T0=1.51% | CI_T1=35.10% | CI_T2=92.50%
2026-02-12 00:47:36,554 - INFO - [Task 2 | ep 0 | step 50] loss=1.9550 c=0.3129 r=0.7711 ac=0.0180 | CI_T0=17.76% | CI_T1=38.91% | CI_T2=94.62%
2026-02-12 00:47:48,114 - INFO - [Task 2 | ep 0 | step 75] loss=2.0296 c=0.2662 r=0.8166 ac=0.0190 | CI_T0=9.45% | CI_T1=37.55% | CI_T2=96.59%
2026-02-12 00:48:03,105 - INFO - [Task 2 | ep 1 | step 100] loss=1.6472 c=0.2259 r=0.7397 ac=0.0200 | CI_T0=6.51% | CI_T1=34.81% | CI_T2=98.13%
2026-02-12 00:48:14,704 - INFO - [Task 2 | ep 1 | step 125] loss=1.6821 c=0.2415 r=0.7575 ac=0.0207 | CI_T0=17.15% | CI_T1=27.24% | CI_T2=98.17%
2026-02-12 00:48:26,252 - INFO - [Task 2 | ep 1 | step 150] loss=1.3598 c=0.2447 r=0.6158 ac=0.0215 | CI_T0=2.28% | CI_T1=30.68% | CI_T2=98.99%
2026-02-12 00:48:41,232 - INFO - [Task 2 | ep 2 | step 175] loss=1.4028 c=0.2106 r=0.6460 ac=0.0222 | CI_T0=4.73% | CI_T1=28.94% | CI_T2=99.12%
2026-02-12 00:48:52,743 - INFO - [Task 2 | ep 2 | step 200] loss=1.2448 c=0.1741 r=0.7761 ac=0.0225 | CI_T0=2.31% | CI_T1=26.40% | CI_T2=99.43%
2026-02-12 00:49:04,225 - INFO - [Task 2 | ep 2 | step 225] loss=1.3217 c=0.1841 r=0.8135 ac=0.0230 | CI_T0=4.41% | CI_T1=26.04% | CI_T2=99.53%
2026-02-12 00:49:15,854 - INFO - [Task 2 | ep 2 | step 250] loss=1.2204 c=0.1746 r=0.5843 ac=0.0227 | CI_T0=9.75% | CI_T1=22.93% | CI_T2=99.50%
2026-02-12 00:49:30,794 - INFO - [Task 2 | ep 3 | step 275] loss=1.1629 c=0.1533 r=0.5208 ac=0.0239 | CI_T0=1.10% | CI_T1=19.99% | CI_T2=99.60%
2026-02-12 00:49:42,309 - INFO - [Task 2 | ep 3 | step 300] loss=1.0260 c=0.1360 r=0.5843 ac=0.0238 | CI_T0=3.28% | CI_T1=22.16% | CI_T2=99.71%
2026-02-12 00:49:53,816 - INFO - [Task 2 | ep 3 | step 325] loss=1.0422 c=0.1520 r=0.5952 ac=0.0244 | CI_T0=12.21% | CI_T1=22.87% | CI_T2=99.75%
2026-02-12 00:50:09,766 - INFO - [After Task 2] Task-IL : T0=99.91% | T1=98.63% | T2=99.68% | Avg=99.40%
2026-02-12 00:50:09,767 - INFO - [After Task 2] Class-IL: T0=3.40% | T1=19.69% | T2=99.63% | Avg=40.91%
2026-02-12 00:50:09,767 - INFO - ========== GROUP DIFFERENCES ==========
2026-02-12 00:50:09,767 - INFO - Seen tasks: 0..2 | valid_out_dim=6
2026-02-12 00:50:11,747 - INFO - [Group=Task0] CI_acc=3.40% | corr_slice_max=4.707 | best_other_max=6.461 | gap=-1.754
2026-02-12 00:50:11,747 - INFO - [Group=Task0] winner_task_dist: W0=3.4% | W1=3.5% | W2=93.1%
2026-02-12 00:50:11,747 - INFO - [Group=Task0] slice_strength : S0=4.71 | S1=5.19 | S2=6.45
2026-02-12 00:50:13,720 - INFO - [Group=Task1] CI_acc=19.69% | corr_slice_max=6.396 | best_other_max=7.454 | gap=-1.058
2026-02-12 00:50:13,720 - INFO - [Group=Task1] winner_task_dist: W0=0.1% | W1=19.7% | W2=80.2%
2026-02-12 00:50:13,720 - INFO - [Group=Task1] slice_strength : S0=2.98 | S1=6.40 | S2=7.45
2026-02-12 00:50:15,695 - INFO - [Group=Task2] CI_acc=99.63% | corr_slice_max=8.290 | best_other_max=5.658 | gap=2.632
2026-02-12 00:50:15,695 - INFO - [Group=Task2] winner_task_dist: W0=0.0% | W1=0.2% | W2=99.8%
2026-02-12 00:50:15,695 - INFO - [Group=Task2] slice_strength : S0=3.03 | S1=5.66 | S2=8.29
2026-02-12 00:50:15,695 - INFO - ======================================
2026-02-12 00:50:15,695 - INFO - ========== Task 3: classes [6, 7] ==========
2026-02-12 00:50:34,068 - INFO - [Task 3 | ep 0 | step 0] loss=9.6247 c=7.7960 r=1.6739 ac=0.0221 | CI_T0=1.99% | CI_T1=21.58% | CI_T2=99.85% | CI_T3=0.00%
2026-02-12 00:50:49,581 - INFO - [Task 3 | ep 0 | step 25] loss=2.1114 c=0.4393 r=1.2653 ac=0.0216 | CI_T0=4.63% | CI_T1=27.24% | CI_T2=59.35% | CI_T3=96.19%
2026-02-12 00:51:05,286 - INFO - [Task 3 | ep 0 | step 50] loss=1.2150 c=0.3324 r=0.7857 ac=0.0229 | CI_T0=0.30% | CI_T1=10.65% | CI_T2=74.04% | CI_T3=96.29%
2026-02-12 00:51:20,540 - INFO - [Task 3 | ep 0 | step 75] loss=1.2753 c=0.3458 r=0.7771 ac=0.0231 | CI_T0=0.47% | CI_T1=10.66% | CI_T2=78.70% | CI_T3=97.61%
2026-02-12 00:51:39,214 - INFO - [Task 3 | ep 1 | step 100] loss=1.1832 c=0.3319 r=0.6374 ac=0.0240 | CI_T0=0.39% | CI_T1=9.07% | CI_T2=77.04% | CI_T3=97.66%
2026-02-12 00:51:54,461 - INFO - [Task 3 | ep 1 | step 125] loss=1.1697 c=0.2689 r=0.7517 ac=0.0248 | CI_T0=0.16% | CI_T1=8.12% | CI_T2=74.54% | CI_T3=98.82%
2026-02-12 00:52:09,760 - INFO - [Task 3 | ep 1 | step 150] loss=1.0999 c=0.2644 r=0.7332 ac=0.0250 | CI_T0=0.13% | CI_T1=7.06% | CI_T2=75.04% | CI_T3=98.96%
2026-02-12 00:52:25,063 - INFO - [Task 3 | ep 1 | step 175] loss=1.1886 c=0.2110 r=0.8909 ac=0.0260 | CI_T0=0.09% | CI_T1=6.11% | CI_T2=72.31% | CI_T3=99.33%
2026-02-12 00:52:43,907 - INFO - [Task 3 | ep 2 | step 200] loss=1.2638 c=0.2414 r=0.9200 ac=0.0258 | CI_T0=0.14% | CI_T1=6.58% | CI_T2=66.92% | CI_T3=99.26%
2026-02-12 00:52:59,167 - INFO - [Task 3 | ep 2 | step 225] loss=1.0036 c=0.2173 r=0.7290 ac=0.0259 | CI_T0=0.03% | CI_T1=4.85% | CI_T2=64.42% | CI_T3=99.25%
2026-02-12 00:53:14,460 - INFO - [Task 3 | ep 2 | step 250] loss=0.8532 c=0.1768 r=0.5746 ac=0.0264 | CI_T0=0.33% | CI_T1=4.69% | CI_T2=65.37% | CI_T3=99.58%
2026-02-12 00:53:29,664 - INFO - [Task 3 | ep 2 | step 275] loss=0.8605 c=0.2194 r=0.5504 ac=0.0263 | CI_T0=0.06% | CI_T1=4.03% | CI_T2=64.97% | CI_T3=99.61%
2026-02-12 00:53:48,326 - INFO - [Task 3 | ep 3 | step 300] loss=0.7830 c=0.1455 r=0.5171 ac=0.0266 | CI_T0=0.04% | CI_T1=4.06% | CI_T2=60.17% | CI_T3=99.61%
2026-02-12 00:54:03,687 - INFO - [Task 3 | ep 3 | step 325] loss=0.7369 c=0.1496 r=0.5252 ac=0.0266 | CI_T0=0.05% | CI_T1=3.87% | CI_T2=58.63% | CI_T3=99.81%
2026-02-12 00:54:19,049 - INFO - [Task 3 | ep 3 | step 350] loss=0.7877 c=0.1361 r=0.5899 ac=0.0267 | CI_T0=0.02% | CI_T1=3.96% | CI_T2=55.07% | CI_T3=99.76%
2026-02-12 00:54:34,384 - INFO - [Task 3 | ep 3 | step 375] loss=0.9208 c=0.1293 r=0.6600 ac=0.0266 | CI_T0=0.00% | CI_T1=3.08% | CI_T2=53.45% | CI_T3=99.77%
2026-02-12 00:54:54,127 - INFO - [After Task 3] Task-IL : T0=99.91% | T1=98.33% | T2=99.68% | T3=99.90% | Avg=99.45%
2026-02-12 00:54:54,127 - INFO - [After Task 3] Class-IL: T0=0.05% | T1=3.04% | T2=56.83% | T3=99.60% | Avg=39.88%
2026-02-12 00:54:54,127 - INFO - ========== GROUP DIFFERENCES ==========
2026-02-12 00:54:54,127 - INFO - Seen tasks: 0..3 | valid_out_dim=8
2026-02-12 00:54:56,117 - INFO - [Group=Task0] CI_acc=0.05% | corr_slice_max=5.050 | best_other_max=8.043 | gap=-2.993
2026-02-12 00:54:56,117 - INFO - [Group=Task0] winner_task_dist: W0=0.0% | W1=0.0% | W2=10.8% | W3=89.1%
2026-02-12 00:54:56,117 - INFO - [Group=Task0] slice_strength : S0=5.05 | S1=5.31 | S2=6.71 | S3=7.94
2026-02-12 00:54:58,071 - INFO - [Group=Task1] CI_acc=3.04% | corr_slice_max=6.468 | best_other_max=8.643 | gap=-2.175
2026-02-12 00:54:58,071 - INFO - [Group=Task1] winner_task_dist: W0=0.0% | W1=3.0% | W2=35.3% | W3=61.7%
2026-02-12 00:54:58,071 - INFO - [Group=Task1] slice_strength : S0=3.03 | S1=6.47 | S2=7.48 | S3=8.16
2026-02-12 00:55:00,036 - INFO - [Group=Task2] CI_acc=56.83% | corr_slice_max=8.414 | best_other_max=8.190 | gap=0.223
2026-02-12 00:55:00,036 - INFO - [Group=Task2] winner_task_dist: W0=0.0% | W1=0.0% | W2=56.8% | W3=43.2%
2026-02-12 00:55:00,036 - INFO - [Group=Task2] slice_strength : S0=3.15 | S1=5.80 | S2=8.41 | S3=8.14
2026-02-12 00:55:02,027 - INFO - [Group=Task3] CI_acc=99.60% | corr_slice_max=9.856 | best_other_max=7.443 | gap=2.412
2026-02-12 00:55:02,027 - INFO - [Group=Task3] winner_task_dist: W0=0.0% | W1=0.0% | W2=0.3% | W3=99.7%
2026-02-12 00:55:02,027 - INFO - [Group=Task3] slice_strength : S0=3.06 | S1=5.60 | S2=7.43 | S3=9.86
2026-02-12 00:55:02,027 - INFO - ======================================
2026-02-12 00:55:02,027 - INFO - ========== Task 4: classes [8, 9] ==========
2026-02-12 00:55:24,146 - INFO - [Task 4 | ep 0 | step 0] loss=11.3712 c=8.9249 r=2.1432 ac=0.0263 | CI_T0=0.02% | CI_T1=4.45% | CI_T2=57.50% | CI_T3=99.77% | CI_T4=0.00%
2026-02-12 00:55:43,306 - INFO - [Task 4 | ep 0 | step 25] loss=2.3558 c=0.5250 r=1.4555 ac=0.0243 | CI_T0=0.00% | CI_T1=0.67% | CI_T2=4.50% | CI_T3=41.46% | CI_T4=91.86%
2026-02-12 00:56:02,460 - INFO - [Task 4 | ep 0 | step 50] loss=1.5811 c=0.5120 r=0.8556 ac=0.0265 | CI_T0=0.00% | CI_T1=0.04% | CI_T2=4.97% | CI_T3=45.23% | CI_T4=93.41%
2026-02-12 00:56:21,619 - INFO - [Task 4 | ep 0 | step 75] loss=1.3502 c=0.4502 r=0.7399 ac=0.0273 | CI_T0=0.00% | CI_T1=0.01% | CI_T2=5.77% | CI_T3=38.61% | CI_T4=94.90%
2026-02-12 00:56:44,190 - INFO - [Task 4 | ep 1 | step 100] loss=1.2512 c=0.3831 r=0.7686 ac=0.0290 | CI_T0=0.00% | CI_T1=0.01% | CI_T2=4.06% | CI_T3=41.18% | CI_T4=96.50%
2026-02-12 00:57:03,212 - INFO - [Task 4 | ep 1 | step 125] loss=1.2469 c=0.4239 r=0.7411 ac=0.0296 | CI_T0=0.00% | CI_T1=0.01% | CI_T2=3.08% | CI_T3=35.79% | CI_T4=96.79%
2026-02-12 00:57:22,288 - INFO - [Task 4 | ep 1 | step 150] loss=1.0893 c=0.3327 r=0.6813 ac=0.0308 | CI_T0=0.00% | CI_T1=0.01% | CI_T2=5.13% | CI_T3=40.47% | CI_T4=97.89%
2026-02-12 00:57:41,424 - INFO - [Task 4 | ep 1 | step 175] loss=1.0478 c=0.3678 r=0.6202 ac=0.0316 | CI_T0=0.00% | CI_T1=0.00% | CI_T2=4.66% | CI_T3=44.45% | CI_T4=97.97%
2026-02-12 00:58:03,951 - INFO - [Task 4 | ep 2 | step 200] loss=1.0679 c=0.3322 r=0.6925 ac=0.0317 | CI_T0=0.00% | CI_T1=0.00% | CI_T2=4.17% | CI_T3=31.07% | CI_T4=98.45%
2026-02-12 00:58:22,951 - INFO - [Task 4 | ep 2 | step 225] loss=1.1144 c=0.2717 r=0.7869 ac=0.0329 | CI_T0=0.00% | CI_T1=0.00% | CI_T2=3.93% | CI_T3=38.96% | CI_T4=98.35%
2026-02-12 00:58:41,924 - INFO - [Task 4 | ep 2 | step 250] loss=0.9494 c=0.2365 r=0.6711 ac=0.0324 | CI_T0=0.00% | CI_T1=0.00% | CI_T2=4.69% | CI_T3=34.44% | CI_T4=98.86%
2026-02-12 00:59:00,948 - INFO - [Task 4 | ep 2 | step 275] loss=1.0443 c=0.2455 r=0.7646 ac=0.0329 | CI_T0=0.00% | CI_T1=0.00% | CI_T2=4.99% | CI_T3=32.38% | CI_T4=99.13%
2026-02-12 00:59:23,435 - INFO - [Task 4 | ep 3 | step 300] loss=0.9331 c=0.2359 r=0.6609 ac=0.0335 | CI_T0=0.00% | CI_T1=0.00% | CI_T2=3.89% | CI_T3=33.31% | CI_T4=99.01%
2026-02-12 00:59:42,601 - INFO - [Task 4 | ep 3 | step 325] loss=0.8680 c=0.2536 r=0.5776 ac=0.0336 | CI_T0=0.00% | CI_T1=0.00% | CI_T2=3.12% | CI_T3=28.82% | CI_T4=99.28%
2026-02-12 01:00:01,593 - INFO - [Task 4 | ep 3 | step 350] loss=0.8005 c=0.2049 r=0.5612 ac=0.0337 | CI_T0=0.00% | CI_T1=0.00% | CI_T2=4.46% | CI_T3=33.08% | CI_T4=99.28%
2026-02-12 01:00:25,375 - INFO - [After Task 4] Task-IL : T0=99.91% | T1=98.48% | T2=99.73% | T3=99.80% | T4=99.04% | Avg=99.39%
2026-02-12 01:00:25,375 - INFO - [After Task 4] Class-IL: T0=0.00% | T1=0.00% | T2=3.90% | T3=31.52% | T4=98.94% | Avg=26.87%
2026-02-12 01:00:25,375 - INFO - ========== GROUP DIFFERENCES ==========
2026-02-12 01:00:25,375 - INFO - Seen tasks: 0..4 | valid_out_dim=10
2026-02-12 01:00:27,319 - INFO - [Group=Task0] CI_acc=0.00% | corr_slice_max=5.020 | best_other_max=9.303 | gap=-4.282
2026-02-12 01:00:27,319 - INFO - [Group=Task0] winner_task_dist: W0=0.0% | W1=0.0% | W2=0.7% | W3=7.0% | W4=92.3%
2026-02-12 01:00:27,319 - INFO - [Group=Task0] slice_strength : S0=5.02 | S1=5.30 | S2=6.52 | S3=7.91 | S4=9.28
2026-02-12 01:00:29,264 - INFO - [Group=Task1] CI_acc=0.00% | corr_slice_max=6.400 | best_other_max=10.051 | gap=-3.650
2026-02-12 01:00:29,264 - INFO - [Group=Task1] winner_task_dist: W0=0.0% | W1=0.0% | W2=3.5% | W3=8.2% | W4=88.3%
2026-02-12 01:00:29,264 - INFO - [Group=Task1] slice_strength : S0=3.01 | S1=6.40 | S2=7.35 | S3=8.12 | S4=9.99
2026-02-12 01:00:31,270 - INFO - [Group=Task2] CI_acc=3.90% | corr_slice_max=8.302 | best_other_max=10.469 | gap=-2.167
2026-02-12 01:00:31,270 - INFO - [Group=Task2] winner_task_dist: W0=0.0% | W1=0.0% | W2=3.9% | W3=0.7% | W4=95.4%
2026-02-12 01:00:31,270 - INFO - [Group=Task2] slice_strength : S0=3.00 | S1=5.64 | S2=8.30 | S3=8.17 | S4=10.47
2026-02-12 01:00:33,226 - INFO - [Group=Task3] CI_acc=31.52% | corr_slice_max=9.702 | best_other_max=10.215 | gap=-0.513
2026-02-12 01:00:33,226 - INFO - [Group=Task3] winner_task_dist: W0=0.0% | W1=0.0% | W2=0.0% | W3=31.5% | W4=68.5%
2026-02-12 01:00:33,226 - INFO - [Group=Task3] slice_strength : S0=3.09 | S1=5.57 | S2=7.23 | S3=9.70 | S4=10.21
2026-02-12 01:00:35,179 - INFO - [Group=Task4] CI_acc=98.94% | corr_slice_max=11.194 | best_other_max=8.997 | gap=2.196
2026-02-12 01:00:35,179 - INFO - [Group=Task4] winner_task_dist: W0=0.0% | W1=0.0% | W2=0.0% | W3=0.3% | W4=99.7%
2026-02-12 01:00:35,179 - INFO - [Group=Task4] slice_strength : S0=3.09 | S1=5.78 | S2=7.60 | S3=8.91 | S4=11.19
2026-02-12 01:00:35,179 - INFO - ======================================
2026-02-12 01:00:35,180 - INFO - ========== FINAL METRICS (Class-IL) ==========
2026-02-12 01:00:35,180 - INFO - Forgetting per task: T0=99.91%, T1=98.97%, T2=95.73%, T3=68.08%, T4=0.00%
2026-02-12 01:00:35,180 - INFO - BWT: -90.67%
2026-02-12 01:00:35,180 - INFO - Final average Class-IL accuracy: 26.87%
