2026-02-11 21:45:37,999 - INFO - Device: cpu
2026-02-11 21:45:37,999 - INFO - Config: {'device': 'cpu', 'lr': 0.005, 'epochs_per_task': 4, 'batch_size': 128, 'lambda_slice': 2.0, 'lambda_feat': 0.5, 'proto_aug_r': 0.4, 'proto_aug_n_per_class': 8, 'si_lambda': 1.0}
2026-02-11 21:45:38,001 - INFO - ========== Task 0: classes [0, 1] ==========
2026-02-11 21:45:45,186 - INFO - [Task 0 | ep 0 | step 0] loss=0.8633 c=0.8633 r=0.0000 | CI_T0=95.74%
2026-02-11 21:45:49,180 - INFO - [Task 0 | ep 0 | step 25] loss=0.0014 c=0.0014 r=0.0000 | CI_T0=99.93%
2026-02-11 21:45:53,203 - INFO - [Task 0 | ep 0 | step 50] loss=0.0007 c=0.0007 r=0.0000 | CI_T0=99.85%
2026-02-11 21:45:57,213 - INFO - [Task 0 | ep 0 | step 75] loss=0.0003 c=0.0003 r=0.0000 | CI_T0=99.97%
2026-02-11 21:46:04,729 - INFO - [Task 0 | ep 1 | step 100] loss=0.0003 c=0.0003 r=0.0000 | CI_T0=99.94%
2026-02-11 21:46:08,715 - INFO - [Task 0 | ep 1 | step 125] loss=0.0005 c=0.0005 r=0.0000 | CI_T0=99.94%
2026-02-11 21:46:12,734 - INFO - [Task 0 | ep 1 | step 150] loss=0.0003 c=0.0003 r=0.0000 | CI_T0=99.92%
2026-02-11 21:46:16,736 - INFO - [Task 0 | ep 1 | step 175] loss=0.0002 c=0.0002 r=0.0000 | CI_T0=99.94%
2026-02-11 21:46:24,242 - INFO - [Task 0 | ep 2 | step 200] loss=0.0001 c=0.0001 r=0.0000 | CI_T0=99.97%
2026-02-11 21:46:28,245 - INFO - [Task 0 | ep 2 | step 225] loss=0.0001 c=0.0001 r=0.0000 | CI_T0=99.94%
2026-02-11 21:46:32,300 - INFO - [Task 0 | ep 2 | step 250] loss=0.0003 c=0.0003 r=0.0000 | CI_T0=99.96%
2026-02-11 21:46:36,307 - INFO - [Task 0 | ep 2 | step 275] loss=0.0003 c=0.0003 r=0.0000 | CI_T0=99.97%
2026-02-11 21:46:43,848 - INFO - [Task 0 | ep 3 | step 300] loss=0.0001 c=0.0001 r=0.0000 | CI_T0=99.96%
2026-02-11 21:46:47,822 - INFO - [Task 0 | ep 3 | step 325] loss=0.0001 c=0.0001 r=0.0000 | CI_T0=99.96%
2026-02-11 21:46:51,824 - INFO - [Task 0 | ep 3 | step 350] loss=0.0005 c=0.0005 r=0.0000 | CI_T0=99.98%
2026-02-11 21:46:55,809 - INFO - [Task 0 | ep 3 | step 375] loss=0.0008 c=0.0008 r=0.0000 | CI_T0=99.98%
2026-02-11 21:47:04,117 - INFO - [After Task 0] Task-IL : T0=99.91% | Avg=99.91%
2026-02-11 21:47:04,117 - INFO - [After Task 0] Class-IL: T0=99.91% | Avg=99.91%
2026-02-11 21:47:04,117 - INFO - ========== GROUP DIFFERENCES ==========
2026-02-11 21:47:04,117 - INFO - Seen tasks: 0..0 | valid_out_dim=2
2026-02-11 21:47:06,127 - INFO - [Group=Task0] CI_acc=99.91% | corr_slice_max=5.001 | best_other_max=nan | gap=nan
2026-02-11 21:47:06,127 - INFO - [Group=Task0] winner_task_dist: W0=100.0%
2026-02-11 21:47:06,127 - INFO - [Group=Task0] slice_strength : S0=5.00
2026-02-11 21:47:06,127 - INFO - ======================================
2026-02-11 21:47:06,127 - INFO - ========== Task 1: classes [2, 3] ==========
2026-02-11 21:47:17,219 - INFO - [Task 1 | ep 0 | step 0] loss=7.4382 c=4.1971 r=3.2411 | CI_T0=99.55% | CI_T1=4.61%
2026-02-11 21:47:25,219 - INFO - [Task 1 | ep 0 | step 25] loss=8.1069 c=0.2097 r=1.2443 | si=0.0017 | CI_T0=36.84% | CI_T1=93.97%
2026-02-11 21:47:33,180 - INFO - [Task 1 | ep 0 | step 50] loss=11.0748 c=0.1535 r=1.1012 | si=0.0024 | CI_T0=5.92% | CI_T1=97.52%
2026-02-11 21:47:41,252 - INFO - [Task 1 | ep 0 | step 75] loss=11.0765 c=0.1085 r=0.9831 | si=0.0028 | CI_T0=20.89% | CI_T1=98.06%
2026-02-11 21:47:52,928 - INFO - [Task 1 | ep 1 | step 100] loss=10.2237 c=0.1187 r=0.8248 | si=0.0032 | CI_T0=16.29% | CI_T1=98.17%
2026-02-11 21:48:00,994 - INFO - [Task 1 | ep 1 | step 125] loss=9.2474 c=0.1429 r=0.7252 | si=0.0036 | CI_T0=42.42% | CI_T1=98.35%
2026-02-11 21:48:09,093 - INFO - [Task 1 | ep 1 | step 150] loss=9.5650 c=0.1357 r=0.9984 | si=0.0040 | CI_T0=21.95% | CI_T1=98.40%
2026-02-11 21:48:17,180 - INFO - [Task 1 | ep 1 | step 175] loss=8.6183 c=0.1294 r=0.8199 | si=0.0045 | CI_T0=21.68% | CI_T1=98.33%
2026-02-11 21:48:28,707 - INFO - [Task 1 | ep 2 | step 200] loss=8.6367 c=0.1051 r=1.3424 | si=0.0049 | CI_T0=21.30% | CI_T1=98.89%
2026-02-11 21:48:36,727 - INFO - [Task 1 | ep 2 | step 225] loss=7.2509 c=0.1274 r=0.6945 | si=0.0054 | CI_T0=31.50% | CI_T1=98.27%
2026-02-11 21:48:44,703 - INFO - [Task 1 | ep 2 | step 250] loss=5.7254 c=0.1844 r=0.6396 | si=0.0058 | CI_T0=34.22% | CI_T1=98.60%
2026-02-11 21:48:52,706 - INFO - [Task 1 | ep 2 | step 275] loss=6.1647 c=0.1044 r=0.6616 | si=0.0062 | CI_T0=31.23% | CI_T1=98.81%
2026-02-11 21:49:04,267 - INFO - [Task 1 | ep 3 | step 300] loss=5.4408 c=0.1685 r=0.6121 | si=0.0066 | CI_T0=39.45% | CI_T1=98.06%
2026-02-11 21:49:12,266 - INFO - [Task 1 | ep 3 | step 325] loss=4.8653 c=0.1474 r=0.8019 | si=0.0072 | CI_T0=50.16% | CI_T1=98.75%
2026-02-11 21:49:20,275 - INFO - [Task 1 | ep 3 | step 350] loss=4.1140 c=0.1411 r=0.5208 | si=0.0076 | CI_T0=35.14% | CI_T1=98.19%
2026-02-11 21:49:28,259 - INFO - [Task 1 | ep 3 | step 375] loss=3.7643 c=0.1263 r=1.3369 | si=0.0081 | CI_T0=42.77% | CI_T1=98.84%
2026-02-11 21:49:40,506 - INFO - [After Task 1] Task-IL : T0=99.91% | T1=98.87% | Avg=99.39%
2026-02-11 21:49:40,506 - INFO - [After Task 1] Class-IL: T0=44.07% | T1=98.63% | Avg=71.35%
2026-02-11 21:49:40,506 - INFO - ========== GROUP DIFFERENCES ==========
2026-02-11 21:49:40,506 - INFO - Seen tasks: 0..1 | valid_out_dim=4
2026-02-11 21:49:42,520 - INFO - [Group=Task0] CI_acc=44.07% | corr_slice_max=5.001 | best_other_max=5.088 | gap=-0.088
2026-02-11 21:49:42,520 - INFO - [Group=Task0] winner_task_dist: W0=44.1% | W1=55.9%
2026-02-11 21:49:42,520 - INFO - [Group=Task0] slice_strength : S0=5.00 | S1=5.09
2026-02-11 21:49:44,544 - INFO - [Group=Task1] CI_acc=98.63% | corr_slice_max=6.198 | best_other_max=2.811 | gap=3.387
2026-02-11 21:49:44,544 - INFO - [Group=Task1] winner_task_dist: W0=0.3% | W1=99.7%
2026-02-11 21:49:44,544 - INFO - [Group=Task1] slice_strength : S0=2.81 | S1=6.20
2026-02-11 21:49:44,544 - INFO - ======================================
2026-02-11 21:49:44,544 - INFO - ========== Task 2: classes [4, 5] ==========
2026-02-11 21:49:59,592 - INFO - [Task 2 | ep 0 | step 0] loss=8.7508 c=5.8267 r=2.0687 | si=0.0081 | CI_T0=38.33% | CI_T1=98.32% | CI_T2=0.00%
2026-02-11 21:50:11,580 - INFO - [Task 2 | ep 0 | step 25] loss=3.1301 c=0.5490 r=1.0100 | si=0.0847 | CI_T0=19.97% | CI_T1=42.99% | CI_T2=88.64%
2026-02-11 21:50:23,603 - INFO - [Task 2 | ep 0 | step 50] loss=2.9380 c=0.4298 r=0.7928 | si=0.1043 | CI_T0=36.02% | CI_T1=46.82% | CI_T2=90.46%
2026-02-11 21:50:35,541 - INFO - [Task 2 | ep 0 | step 75] loss=2.5026 c=0.3687 r=0.7024 | si=0.1105 | CI_T0=25.25% | CI_T1=52.14% | CI_T2=90.93%
2026-02-11 21:50:50,989 - INFO - [Task 2 | ep 1 | step 100] loss=2.2822 c=0.3257 r=0.6772 | si=0.1121 | CI_T0=31.39% | CI_T1=44.87% | CI_T2=95.66%
2026-02-11 21:51:02,874 - INFO - [Task 2 | ep 1 | step 125] loss=2.0940 c=0.3186 r=0.6252 | si=0.1194 | CI_T0=30.80% | CI_T1=42.40% | CI_T2=96.75%
2026-02-11 21:51:14,732 - INFO - [Task 2 | ep 1 | step 150] loss=2.2278 c=0.3461 r=0.5903 | si=0.1237 | CI_T0=33.25% | CI_T1=40.45% | CI_T2=97.47%
2026-02-11 21:51:30,124 - INFO - [Task 2 | ep 2 | step 175] loss=1.9694 c=0.3033 r=0.6196 | si=0.1256 | CI_T0=25.51% | CI_T1=42.64% | CI_T2=97.75%
2026-02-11 21:51:41,997 - INFO - [Task 2 | ep 2 | step 200] loss=2.1693 c=0.2939 r=0.8751 | si=0.1260 | CI_T0=21.71% | CI_T1=41.27% | CI_T2=96.73%
2026-02-11 21:51:53,888 - INFO - [Task 2 | ep 2 | step 225] loss=1.9550 c=0.3088 r=0.6442 | si=0.1277 | CI_T0=28.37% | CI_T1=36.85% | CI_T2=95.92%
2026-02-11 21:52:05,808 - INFO - [Task 2 | ep 2 | step 250] loss=2.0121 c=0.2893 r=0.6927 | si=0.1318 | CI_T0=25.74% | CI_T1=37.72% | CI_T2=98.37%
2026-02-11 21:52:21,255 - INFO - [Task 2 | ep 3 | step 275] loss=1.9974 c=0.2900 r=0.6835 | si=0.1344 | CI_T0=43.61% | CI_T1=34.45% | CI_T2=97.69%
2026-02-11 21:52:33,179 - INFO - [Task 2 | ep 3 | step 300] loss=2.1010 c=0.2697 r=0.6540 | si=0.1323 | CI_T0=35.14% | CI_T1=41.92% | CI_T2=97.80%
2026-02-11 21:52:45,075 - INFO - [Task 2 | ep 3 | step 325] loss=2.1158 c=0.2962 r=0.6275 | si=0.1316 | CI_T0=35.75% | CI_T1=36.04% | CI_T2=98.60%
2026-02-11 21:53:01,486 - INFO - [After Task 2] Task-IL : T0=99.91% | T1=98.43% | T2=99.79% | Avg=99.37%
2026-02-11 21:53:01,486 - INFO - [After Task 2] Class-IL: T0=25.25% | T1=36.34% | T2=99.15% | Avg=53.58%
2026-02-11 21:53:01,487 - INFO - ========== GROUP DIFFERENCES ==========
2026-02-11 21:53:01,487 - INFO - Seen tasks: 0..2 | valid_out_dim=6
2026-02-11 21:53:03,487 - INFO - [Group=Task0] CI_acc=25.25% | corr_slice_max=4.905 | best_other_max=5.556 | gap=-0.651
2026-02-11 21:53:03,487 - INFO - [Group=Task0] winner_task_dist: W0=25.2% | W1=28.3% | W2=46.5%
2026-02-11 21:53:03,487 - INFO - [Group=Task0] slice_strength : S0=4.90 | S1=5.11 | S2=5.42
2026-02-11 21:53:05,489 - INFO - [Group=Task1] CI_acc=36.34% | corr_slice_max=5.966 | best_other_max=6.376 | gap=-0.410
2026-02-11 21:53:05,489 - INFO - [Group=Task1] winner_task_dist: W0=0.5% | W1=36.3% | W2=63.2%
2026-02-11 21:53:05,489 - INFO - [Group=Task1] slice_strength : S0=2.51 | S1=5.97 | S2=6.37
2026-02-11 21:53:07,494 - INFO - [Group=Task2] CI_acc=99.15% | corr_slice_max=7.084 | best_other_max=5.243 | gap=1.840
2026-02-11 21:53:07,494 - INFO - [Group=Task2] winner_task_dist: W0=0.2% | W1=0.6% | W2=99.2%
2026-02-11 21:53:07,494 - INFO - [Group=Task2] slice_strength : S0=2.46 | S1=5.23 | S2=7.08
2026-02-11 21:53:07,494 - INFO - ======================================
2026-02-11 21:53:07,494 - INFO - ========== Task 3: classes [6, 7] ==========
2026-02-11 21:53:26,257 - INFO - [Task 3 | ep 0 | step 0] loss=9.0046 c=6.8461 r=1.4883 | si=0.1337 | CI_T0=19.34% | CI_T1=36.15% | CI_T2=99.33% | CI_T3=0.00%
2026-02-11 21:53:42,101 - INFO - [Task 3 | ep 0 | step 25] loss=3.2484 c=0.5088 r=1.1595 | si=0.2454 | CI_T0=38.21% | CI_T1=27.87% | CI_T2=63.22% | CI_T3=95.35%
2026-02-11 21:53:57,968 - INFO - [Task 3 | ep 0 | step 50] loss=2.4992 c=0.4599 r=0.8009 | si=0.2459 | CI_T0=14.95% | CI_T1=26.99% | CI_T2=71.08% | CI_T3=95.30%
2026-02-11 21:54:13,861 - INFO - [Task 3 | ep 0 | step 75] loss=2.1936 c=0.4645 r=0.7396 | si=0.2372 | CI_T0=18.34% | CI_T1=28.20% | CI_T2=76.83% | CI_T3=96.30%
2026-02-11 21:54:33,252 - INFO - [Task 3 | ep 1 | step 100] loss=2.1092 c=0.4833 r=0.7412 | si=0.2299 | CI_T0=18.42% | CI_T1=29.54% | CI_T2=73.71% | CI_T3=95.68%
2026-02-11 21:54:49,110 - INFO - [Task 3 | ep 1 | step 125] loss=2.0815 c=0.4282 r=0.7995 | si=0.2313 | CI_T0=13.86% | CI_T1=31.63% | CI_T2=76.35% | CI_T3=97.63%
2026-02-11 21:55:04,968 - INFO - [Task 3 | ep 1 | step 150] loss=1.8661 c=0.4059 r=0.7402 | si=0.2267 | CI_T0=17.41% | CI_T1=28.01% | CI_T2=76.27% | CI_T3=98.41%
2026-02-11 21:55:20,965 - INFO - [Task 3 | ep 1 | step 175] loss=2.2811 c=0.4091 r=1.0208 | si=0.2244 | CI_T0=8.66% | CI_T1=29.50% | CI_T2=76.45% | CI_T3=98.54%
2026-02-11 21:55:40,390 - INFO - [Task 3 | ep 2 | step 200] loss=2.2270 c=0.4195 r=0.9358 | si=0.2216 | CI_T0=11.76% | CI_T1=29.66% | CI_T2=69.95% | CI_T3=97.74%
2026-02-11 21:55:56,349 - INFO - [Task 3 | ep 2 | step 225] loss=1.8952 c=0.4471 r=0.6661 | si=0.2232 | CI_T0=9.44% | CI_T1=36.04% | CI_T2=72.21% | CI_T3=97.36%
2026-02-11 21:56:12,260 - INFO - [Task 3 | ep 2 | step 250] loss=1.8274 c=0.3889 r=0.6782 | si=0.2226 | CI_T0=17.28% | CI_T1=29.83% | CI_T2=72.52% | CI_T3=98.83%
2026-02-11 21:56:28,265 - INFO - [Task 3 | ep 2 | step 275] loss=1.7746 c=0.4465 r=0.6520 | si=0.2208 | CI_T0=15.87% | CI_T1=29.90% | CI_T2=75.09% | CI_T3=98.45%
2026-02-11 21:56:47,642 - INFO - [Task 3 | ep 3 | step 300] loss=1.8117 c=0.3627 r=0.6530 | si=0.2199 | CI_T0=9.20% | CI_T1=31.52% | CI_T2=71.65% | CI_T3=98.72%
2026-02-11 21:57:03,446 - INFO - [Task 3 | ep 3 | step 325] loss=1.7899 c=0.3779 r=0.7134 | si=0.2209 | CI_T0=15.52% | CI_T1=29.90% | CI_T2=71.35% | CI_T3=98.99%
2026-02-11 21:57:19,293 - INFO - [Task 3 | ep 3 | step 350] loss=1.6824 c=0.4172 r=0.6368 | si=0.2239 | CI_T0=12.52% | CI_T1=32.87% | CI_T2=73.00% | CI_T3=98.17%
2026-02-11 21:57:35,107 - INFO - [Task 3 | ep 3 | step 375] loss=1.8898 c=0.3747 r=0.8178 | si=0.2211 | CI_T0=7.87% | CI_T1=31.16% | CI_T2=70.13% | CI_T3=98.47%
2026-02-11 21:57:55,467 - INFO - [After Task 3] Task-IL : T0=99.91% | T1=98.19% | T2=99.73% | T3=99.95% | Avg=99.44%
2026-02-11 21:57:55,467 - INFO - [After Task 3] Class-IL: T0=14.75% | T1=27.72% | T2=71.18% | T3=98.24% | Avg=52.97%
2026-02-11 21:57:55,467 - INFO - ========== GROUP DIFFERENCES ==========
2026-02-11 21:57:55,467 - INFO - Seen tasks: 0..3 | valid_out_dim=8
2026-02-11 21:57:57,471 - INFO - [Group=Task0] CI_acc=14.75% | corr_slice_max=4.882 | best_other_max=6.091 | gap=-1.208
2026-02-11 21:57:57,472 - INFO - [Group=Task0] winner_task_dist: W0=14.8% | W1=6.1% | W2=8.6% | W3=70.6%
2026-02-11 21:57:57,472 - INFO - [Group=Task0] slice_strength : S0=4.88 | S1=5.15 | S2=5.35 | S3=5.99
2026-02-11 21:57:59,515 - INFO - [Group=Task1] CI_acc=27.72% | corr_slice_max=5.921 | best_other_max=6.524 | gap=-0.603
2026-02-11 21:57:59,515 - INFO - [Group=Task1] winner_task_dist: W0=0.1% | W1=27.7% | W2=39.6% | W3=32.6%
2026-02-11 21:57:59,515 - INFO - [Group=Task1] slice_strength : S0=2.60 | S1=5.92 | S2=5.96 | S3=5.67
2026-02-11 21:58:01,573 - INFO - [Group=Task2] CI_acc=71.18% | corr_slice_max=6.674 | best_other_max=6.226 | gap=0.447
2026-02-11 21:58:01,573 - INFO - [Group=Task2] winner_task_dist: W0=0.3% | W1=2.1% | W2=71.2% | W3=26.4%
2026-02-11 21:58:01,573 - INFO - [Group=Task2] slice_strength : S0=2.54 | S1=5.34 | S2=6.67 | S3=5.87
2026-02-11 21:58:03,584 - INFO - [Group=Task3] CI_acc=98.24% | corr_slice_max=7.409 | best_other_max=6.039 | gap=1.371
2026-02-11 21:58:03,585 - INFO - [Group=Task3] winner_task_dist: W0=0.1% | W1=0.1% | W2=1.6% | W3=98.2%
2026-02-11 21:58:03,585 - INFO - [Group=Task3] slice_strength : S0=2.62 | S1=5.01 | S2=5.97 | S3=7.41
2026-02-11 21:58:03,585 - INFO - ======================================
2026-02-11 21:58:03,585 - INFO - ========== Task 4: classes [8, 9] ==========
2026-02-11 21:58:26,254 - INFO - [Task 4 | ep 0 | step 0] loss=10.0528 c=7.1799 r=2.3263 | si=0.2218 | CI_T0=9.08% | CI_T1=34.99% | CI_T2=72.14% | CI_T3=98.21% | CI_T4=0.00%
2026-02-11 21:58:45,964 - INFO - [Task 4 | ep 0 | step 25] loss=2.9730 c=0.7798 r=1.2655 | si=0.3631 | CI_T0=0.29% | CI_T1=20.07% | CI_T2=16.16% | CI_T3=28.40% | CI_T4=92.16%
2026-02-11 21:59:05,662 - INFO - [Task 4 | ep 0 | step 50] loss=2.2449 c=0.7474 r=0.7993 | si=0.3679 | CI_T0=10.34% | CI_T1=8.78% | CI_T2=24.81% | CI_T3=38.62% | CI_T4=92.25%
2026-02-11 21:59:25,396 - INFO - [Task 4 | ep 0 | step 75] loss=2.0856 c=0.6932 r=0.7930 | si=0.3570 | CI_T0=4.06% | CI_T1=11.64% | CI_T2=22.84% | CI_T3=30.53% | CI_T4=94.03%
2026-02-11 21:59:48,661 - INFO - [Task 4 | ep 1 | step 100] loss=2.0284 c=0.7115 r=0.7402 | si=0.3453 | CI_T0=6.47% | CI_T1=7.37% | CI_T2=30.89% | CI_T3=38.91% | CI_T4=95.05%
2026-02-11 22:00:08,428 - INFO - [Task 4 | ep 1 | step 125] loss=2.0261 c=0.7233 r=0.7491 | si=0.3312 | CI_T0=8.13% | CI_T1=9.61% | CI_T2=35.27% | CI_T3=33.17% | CI_T4=95.39%
2026-02-11 22:00:28,141 - INFO - [Task 4 | ep 1 | step 150] loss=1.9195 c=0.6838 r=0.7496 | si=0.3264 | CI_T0=17.06% | CI_T1=9.78% | CI_T2=34.57% | CI_T3=40.19% | CI_T4=95.48%
2026-02-11 22:00:47,885 - INFO - [Task 4 | ep 1 | step 175] loss=1.9024 c=0.6634 r=0.6965 | si=0.3191 | CI_T0=20.28% | CI_T1=6.30% | CI_T2=32.28% | CI_T3=42.63% | CI_T4=95.26%
2026-02-11 22:01:11,135 - INFO - [Task 4 | ep 2 | step 200] loss=2.0265 c=0.6650 r=0.7926 | si=0.3195 | CI_T0=12.20% | CI_T1=9.43% | CI_T2=31.94% | CI_T3=33.20% | CI_T4=96.83%
2026-02-11 22:01:30,941 - INFO - [Task 4 | ep 2 | step 225] loss=2.0480 c=0.6451 r=0.8295 | si=0.3236 | CI_T0=14.39% | CI_T1=7.36% | CI_T2=29.12% | CI_T3=35.17% | CI_T4=96.14%
2026-02-11 22:01:50,746 - INFO - [Task 4 | ep 2 | step 250] loss=1.8850 c=0.6259 r=0.7838 | si=0.3138 | CI_T0=2.26% | CI_T1=7.31% | CI_T2=34.13% | CI_T3=35.56% | CI_T4=96.96%
2026-02-11 22:02:10,542 - INFO - [Task 4 | ep 2 | step 275] loss=2.0106 c=0.6314 r=0.9382 | si=0.3188 | CI_T0=18.68% | CI_T1=8.00% | CI_T2=35.71% | CI_T3=35.97% | CI_T4=96.97%
2026-02-11 22:02:33,891 - INFO - [Task 4 | ep 3 | step 300] loss=2.0864 c=0.6493 r=0.9571 | si=0.3147 | CI_T0=12.31% | CI_T1=7.97% | CI_T2=30.58% | CI_T3=39.84% | CI_T4=96.43%
2026-02-11 22:02:53,613 - INFO - [Task 4 | ep 3 | step 325] loss=2.0696 c=0.7125 r=0.7826 | si=0.3173 | CI_T0=3.46% | CI_T1=7.16% | CI_T2=40.10% | CI_T3=35.17% | CI_T4=96.70%
2026-02-11 22:03:13,297 - INFO - [Task 4 | ep 3 | step 350] loss=1.8941 c=0.6322 r=0.7046 | si=0.3117 | CI_T0=10.81% | CI_T1=6.18% | CI_T2=31.09% | CI_T3=37.19% | CI_T4=96.36%
2026-02-11 22:03:37,662 - INFO - [After Task 4] Task-IL : T0=99.91% | T1=98.33% | T2=99.68% | T3=99.70% | T4=98.69% | Avg=99.26%
2026-02-11 22:03:37,662 - INFO - [After Task 4] Class-IL: T0=17.35% | T1=7.10% | T2=36.50% | T3=41.59% | T4=95.06% | Avg=39.52%
2026-02-11 22:03:37,662 - INFO - ========== GROUP DIFFERENCES ==========
2026-02-11 22:03:37,662 - INFO - Seen tasks: 0..4 | valid_out_dim=10
2026-02-11 22:03:39,667 - INFO - [Group=Task0] CI_acc=17.35% | corr_slice_max=4.787 | best_other_max=6.182 | gap=-1.395
2026-02-11 22:03:39,667 - INFO - [Group=Task0] winner_task_dist: W0=17.4% | W1=0.1% | W2=7.9% | W3=25.6% | W4=48.9%
2026-02-11 22:03:39,667 - INFO - [Group=Task0] slice_strength : S0=4.79 | S1=5.16 | S2=5.30 | S3=5.50 | S4=5.90
2026-02-11 22:03:41,671 - INFO - [Group=Task1] CI_acc=7.10% | corr_slice_max=5.821 | best_other_max=6.741 | gap=-0.921
2026-02-11 22:03:41,671 - INFO - [Group=Task1] winner_task_dist: W0=0.0% | W1=7.1% | W2=30.2% | W3=15.6% | W4=47.1%
2026-02-11 22:03:41,671 - INFO - [Group=Task1] slice_strength : S0=2.52 | S1=5.82 | S2=5.82 | S3=5.25 | S4=6.34
2026-02-11 22:03:43,669 - INFO - [Group=Task2] CI_acc=36.50% | corr_slice_max=6.601 | best_other_max=6.793 | gap=-0.192
2026-02-11 22:03:43,669 - INFO - [Group=Task2] winner_task_dist: W0=0.1% | W1=1.1% | W2=36.5% | W3=2.5% | W4=59.8%
2026-02-11 22:03:43,669 - INFO - [Group=Task2] slice_strength : S0=2.42 | S1=5.20 | S2=6.60 | S3=5.51 | S4=6.71
2026-02-11 22:03:45,672 - INFO - [Group=Task3] CI_acc=41.59% | corr_slice_max=6.589 | best_other_max=6.663 | gap=-0.074
2026-02-11 22:03:45,672 - INFO - [Group=Task3] winner_task_dist: W0=0.2% | W1=1.0% | W2=3.9% | W3=41.6% | W4=53.3%
2026-02-11 22:03:45,672 - INFO - [Group=Task3] slice_strength : S0=2.73 | S1=5.00 | S2=5.69 | S3=6.59 | S4=6.47
2026-02-11 22:03:47,679 - INFO - [Group=Task4] CI_acc=95.06% | corr_slice_max=7.457 | best_other_max=6.473 | gap=0.984
2026-02-11 22:03:47,679 - INFO - [Group=Task4] winner_task_dist: W0=0.1% | W1=0.5% | W2=1.7% | W3=2.4% | W4=95.4%
2026-02-11 22:03:47,679 - INFO - [Group=Task4] slice_strength : S0=2.67 | S1=5.38 | S2=6.21 | S3=6.12 | S4=7.46
2026-02-11 22:03:47,679 - INFO - ======================================
2026-02-11 22:03:47,679 - INFO - ========== FINAL METRICS (Class-IL) ==========
2026-02-11 22:03:47,679 - INFO - Forgetting per task: T0=82.55%, T1=91.53%, T2=62.65%, T3=56.65%, T4=0.00%
2026-02-11 22:03:47,679 - INFO - BWT: -73.34%
2026-02-11 22:03:47,679 - INFO - Final average Class-IL accuracy: 39.52%
