2026-02-11 20:51:25,161 - INFO - Device: cpu
2026-02-11 20:51:25,161 - INFO - Config: {'device': 'cpu', 'lr': 0.005, 'epochs_per_task': 4, 'batch_size': 128, 'lambda_slice': 2.0, 'lambda_feat': 0.5, 'lambda_ssl': 0.5}
2026-02-11 20:51:25,164 - INFO - ========== Task 0: classes [0, 1] ==========
2026-02-11 20:51:32,294 - INFO - [Task 0 | ep 0 | step 0] loss=1.5131 c=0.7889 r=0.0000 ssl=1.4484 | CI_T0=86.11%
2026-02-11 20:51:36,304 - INFO - [Task 0 | ep 0 | step 25] loss=0.0786 c=0.0102 r=0.0000 ssl=0.1368 | CI_T0=99.61%
2026-02-11 20:51:40,317 - INFO - [Task 0 | ep 0 | step 50] loss=0.0281 c=0.0022 r=0.0000 ssl=0.0518 | CI_T0=99.55%
2026-02-11 20:51:44,323 - INFO - [Task 0 | ep 0 | step 75] loss=0.1156 c=0.0555 r=0.0000 ssl=0.1202 | CI_T0=99.78%
2026-02-11 20:51:52,022 - INFO - [Task 0 | ep 1 | step 100] loss=0.0684 c=0.0021 r=0.0000 ssl=0.1326 | CI_T0=99.64%
2026-02-11 20:51:56,058 - INFO - [Task 0 | ep 1 | step 125] loss=0.0263 c=0.0052 r=0.0000 ssl=0.0422 | CI_T0=99.87%
2026-02-11 20:52:00,106 - INFO - [Task 0 | ep 1 | step 150] loss=0.0445 c=0.0145 r=0.0000 ssl=0.0600 | CI_T0=99.83%
2026-02-11 20:52:04,174 - INFO - [Task 0 | ep 1 | step 175] loss=0.0263 c=0.0026 r=0.0000 ssl=0.0473 | CI_T0=99.92%
2026-02-11 20:52:11,724 - INFO - [Task 0 | ep 2 | step 200] loss=0.0950 c=0.0010 r=0.0000 ssl=0.1879 | CI_T0=99.86%
2026-02-11 20:52:15,731 - INFO - [Task 0 | ep 2 | step 225] loss=0.0353 c=0.0110 r=0.0000 ssl=0.0487 | CI_T0=99.90%
2026-02-11 20:52:19,754 - INFO - [Task 0 | ep 2 | step 250] loss=0.0448 c=0.0139 r=0.0000 ssl=0.0618 | CI_T0=99.87%
2026-02-11 20:52:23,758 - INFO - [Task 0 | ep 2 | step 275] loss=0.0207 c=0.0007 r=0.0000 ssl=0.0400 | CI_T0=99.87%
2026-02-11 20:52:31,297 - INFO - [Task 0 | ep 3 | step 300] loss=0.0385 c=0.0039 r=0.0000 ssl=0.0693 | CI_T0=99.83%
2026-02-11 20:52:35,303 - INFO - [Task 0 | ep 3 | step 325] loss=0.0455 c=0.0005 r=0.0000 ssl=0.0900 | CI_T0=99.92%
2026-02-11 20:52:39,320 - INFO - [Task 0 | ep 3 | step 350] loss=0.0085 c=0.0008 r=0.0000 ssl=0.0154 | CI_T0=99.93%
2026-02-11 20:52:43,340 - INFO - [Task 0 | ep 3 | step 375] loss=0.0467 c=0.0011 r=0.0000 ssl=0.0912 | CI_T0=99.92%
2026-02-11 20:52:47,723 - INFO - [After Task 0] Task-IL : T0=99.91% | Avg=99.91%
2026-02-11 20:52:47,723 - INFO - [After Task 0] Class-IL: T0=99.91% | Avg=99.91%
2026-02-11 20:52:47,723 - INFO - ========== GROUP DIFFERENCES ==========
2026-02-11 20:52:47,723 - INFO - Seen tasks: 0..0 | valid_out_dim=2
2026-02-11 20:52:49,729 - INFO - [Group=Task0] CI_acc=99.91% | corr_slice_max=4.575 | best_other_max=nan | gap=nan
2026-02-11 20:52:49,729 - INFO - [Group=Task0] winner_task_dist: W0=100.0%
2026-02-11 20:52:49,729 - INFO - [Group=Task0] slice_strength : S0=4.58
2026-02-11 20:52:49,730 - INFO - ======================================
2026-02-11 20:52:49,730 - INFO - ========== Task 1: classes [2, 3] ==========
2026-02-11 20:53:00,660 - INFO - [Task 1 | ep 0 | step 0] loss=5.2931 c=3.3059 r=1.5974 ssl=0.7795 | CI_T0=94.30% | CI_T1=9.35%
2026-02-11 20:53:08,561 - INFO - [Task 1 | ep 0 | step 25] loss=1.5714 c=0.3155 r=1.1986 ssl=0.1145 | CI_T0=23.34% | CI_T1=93.52%
2026-02-11 20:53:16,505 - INFO - [Task 1 | ep 0 | step 50] loss=1.5610 c=0.2544 r=1.2633 ssl=0.0866 | CI_T0=11.34% | CI_T1=95.23%
2026-02-11 20:53:24,462 - INFO - [Task 1 | ep 0 | step 75] loss=1.2582 c=0.1748 r=1.0624 ssl=0.0421 | CI_T0=5.51% | CI_T1=96.09%
2026-02-11 20:53:35,958 - INFO - [Task 1 | ep 1 | step 100] loss=1.2660 c=0.2079 r=1.0371 ssl=0.0420 | CI_T0=1.48% | CI_T1=95.97%
2026-02-11 20:53:43,947 - INFO - [Task 1 | ep 1 | step 125] loss=1.1172 c=0.1454 r=0.9071 ssl=0.1293 | CI_T0=20.03% | CI_T1=96.28%
2026-02-11 20:53:51,914 - INFO - [Task 1 | ep 1 | step 150] loss=1.0755 c=0.1549 r=0.8936 ssl=0.0541 | CI_T0=6.89% | CI_T1=97.16%
2026-02-11 20:53:59,885 - INFO - [Task 1 | ep 1 | step 175] loss=1.0773 c=0.1729 r=0.8880 ssl=0.0329 | CI_T0=6.74% | CI_T1=96.81%
2026-02-11 20:54:11,391 - INFO - [Task 1 | ep 2 | step 200] loss=0.9330 c=0.1620 r=0.7559 ssl=0.0301 | CI_T0=9.08% | CI_T1=97.22%
2026-02-11 20:54:19,379 - INFO - [Task 1 | ep 2 | step 225] loss=0.8863 c=0.1197 r=0.7380 ssl=0.0571 | CI_T0=2.94% | CI_T1=97.98%
2026-02-11 20:54:27,330 - INFO - [Task 1 | ep 2 | step 250] loss=0.9766 c=0.2055 r=0.7510 ssl=0.0401 | CI_T0=18.35% | CI_T1=97.28%
2026-02-11 20:54:35,282 - INFO - [Task 1 | ep 2 | step 275] loss=0.9869 c=0.1400 r=0.8194 ssl=0.0551 | CI_T0=8.31% | CI_T1=97.36%
2026-02-11 20:54:46,793 - INFO - [Task 1 | ep 3 | step 300] loss=0.9651 c=0.1065 r=0.8083 ssl=0.1006 | CI_T0=18.88% | CI_T1=97.09%
2026-02-11 20:54:54,788 - INFO - [Task 1 | ep 3 | step 325] loss=0.9678 c=0.1187 r=0.8398 ssl=0.0185 | CI_T0=9.26% | CI_T1=97.86%
2026-02-11 20:55:02,735 - INFO - [Task 1 | ep 3 | step 350] loss=0.9237 c=0.1315 r=0.7632 ssl=0.0581 | CI_T0=1.78% | CI_T1=97.86%
2026-02-11 20:55:10,731 - INFO - [Task 1 | ep 3 | step 375] loss=1.1594 c=0.1317 r=1.0164 ssl=0.0227 | CI_T0=6.25% | CI_T1=97.79%
2026-02-11 20:55:19,050 - INFO - [After Task 1] Task-IL : T0=99.76% | T1=98.19% | Avg=98.98%
2026-02-11 20:55:19,050 - INFO - [After Task 1] Class-IL: T0=5.53% | T1=98.14% | Avg=51.84%
2026-02-11 20:55:19,050 - INFO - ========== GROUP DIFFERENCES ==========
2026-02-11 20:55:19,050 - INFO - Seen tasks: 0..1 | valid_out_dim=4
2026-02-11 20:55:21,047 - INFO - [Group=Task0] CI_acc=5.53% | corr_slice_max=4.535 | best_other_max=5.526 | gap=-0.991
2026-02-11 20:55:21,047 - INFO - [Group=Task0] winner_task_dist: W0=5.5% | W1=94.5%
2026-02-11 20:55:21,047 - INFO - [Group=Task0] slice_strength : S0=4.53 | S1=5.53
2026-02-11 20:55:23,072 - INFO - [Group=Task1] CI_acc=98.14% | corr_slice_max=6.626 | best_other_max=2.786 | gap=3.840
2026-02-11 20:55:23,072 - INFO - [Group=Task1] winner_task_dist: W0=0.0% | W1=100.0%
2026-02-11 20:55:23,072 - INFO - [Group=Task1] slice_strength : S0=2.79 | S1=6.63
2026-02-11 20:55:23,072 - INFO - ======================================
2026-02-11 20:55:23,072 - INFO - ========== Task 2: classes [4, 5] ==========
2026-02-11 20:55:38,019 - INFO - [Task 2 | ep 0 | step 0] loss=7.3810 c=6.1349 r=0.8953 ssl=0.7016 | CI_T0=7.28% | CI_T1=97.02% | CI_T2=0.00%
2026-02-11 20:55:49,930 - INFO - [Task 2 | ep 0 | step 25] loss=1.6537 c=0.6618 r=0.9579 ssl=0.0679 | CI_T0=8.94% | CI_T1=35.93% | CI_T2=86.36%
2026-02-11 20:56:01,816 - INFO - [Task 2 | ep 0 | step 50] loss=1.2742 c=0.4150 r=0.8065 ssl=0.1054 | CI_T0=1.33% | CI_T1=24.78% | CI_T2=95.36%
2026-02-11 20:56:13,736 - INFO - [Task 2 | ep 0 | step 75] loss=1.2745 c=0.3328 r=0.9271 ssl=0.0293 | CI_T0=0.81% | CI_T1=17.90% | CI_T2=96.40%
2026-02-11 20:56:29,085 - INFO - [Task 2 | ep 1 | step 100] loss=1.1672 c=0.2509 r=0.9066 ssl=0.0194 | CI_T0=0.62% | CI_T1=17.74% | CI_T2=96.94%
2026-02-11 20:56:40,874 - INFO - [Task 2 | ep 1 | step 125] loss=0.9232 c=0.2278 r=0.6800 ssl=0.0307 | CI_T0=0.25% | CI_T1=13.17% | CI_T2=98.00%
2026-02-11 20:56:52,578 - INFO - [Task 2 | ep 1 | step 150] loss=1.1343 c=0.2939 r=0.8296 ssl=0.0217 | CI_T0=0.83% | CI_T1=11.91% | CI_T2=98.13%
2026-02-11 20:57:07,843 - INFO - [Task 2 | ep 2 | step 175] loss=0.9049 c=0.1800 r=0.6772 ssl=0.0954 | CI_T0=1.55% | CI_T1=5.23% | CI_T2=97.51%
2026-02-11 20:57:19,582 - INFO - [Task 2 | ep 2 | step 200] loss=0.9495 c=0.1816 r=0.7395 ssl=0.0566 | CI_T0=0.33% | CI_T1=8.73% | CI_T2=98.20%
2026-02-11 20:57:31,307 - INFO - [Task 2 | ep 2 | step 225] loss=0.9080 c=0.1673 r=0.7148 ssl=0.0519 | CI_T0=0.23% | CI_T1=4.57% | CI_T2=96.87%
2026-02-11 20:57:43,072 - INFO - [Task 2 | ep 2 | step 250] loss=0.7711 c=0.1429 r=0.6130 ssl=0.0304 | CI_T0=0.07% | CI_T1=5.23% | CI_T2=98.40%
2026-02-11 20:57:58,431 - INFO - [Task 2 | ep 3 | step 275] loss=0.8724 c=0.1302 r=0.7313 ssl=0.0217 | CI_T0=0.22% | CI_T1=4.95% | CI_T2=98.69%
2026-02-11 20:58:10,243 - INFO - [Task 2 | ep 3 | step 300] loss=0.8532 c=0.1233 r=0.7245 ssl=0.0108 | CI_T0=0.51% | CI_T1=6.52% | CI_T2=98.79%
2026-02-11 20:58:22,048 - INFO - [Task 2 | ep 3 | step 325] loss=0.7624 c=0.1140 r=0.6373 ssl=0.0220 | CI_T0=0.43% | CI_T1=2.57% | CI_T2=97.81%
2026-02-11 20:58:34,591 - INFO - [After Task 2] Task-IL : T0=99.95% | T1=97.75% | T2=98.83% | Avg=98.84%
2026-02-11 20:58:34,591 - INFO - [After Task 2] Class-IL: T0=0.38% | T1=6.56% | T2=98.83% | Avg=35.26%
2026-02-11 20:58:34,591 - INFO - ========== GROUP DIFFERENCES ==========
2026-02-11 20:58:34,591 - INFO - Seen tasks: 0..2 | valid_out_dim=6
2026-02-11 20:58:36,612 - INFO - [Group=Task0] CI_acc=0.38% | corr_slice_max=4.780 | best_other_max=6.893 | gap=-2.113
2026-02-11 20:58:36,612 - INFO - [Group=Task0] winner_task_dist: W0=0.4% | W1=4.5% | W2=95.1%
2026-02-11 20:58:36,612 - INFO - [Group=Task0] slice_strength : S0=4.78 | S1=5.41 | S2=6.88
2026-02-11 20:58:38,609 - INFO - [Group=Task1] CI_acc=6.56% | corr_slice_max=6.349 | best_other_max=7.944 | gap=-1.595
2026-02-11 20:58:38,609 - INFO - [Group=Task1] winner_task_dist: W0=0.0% | W1=6.6% | W2=93.4%
2026-02-11 20:58:38,609 - INFO - [Group=Task1] slice_strength : S0=2.80 | S1=6.35 | S2=7.94
2026-02-11 20:58:40,616 - INFO - [Group=Task2] CI_acc=98.83% | corr_slice_max=8.964 | best_other_max=6.011 | gap=2.953
2026-02-11 20:58:40,618 - INFO - [Group=Task2] winner_task_dist: W0=0.0% | W1=0.0% | W2=100.0%
2026-02-11 20:58:40,618 - INFO - [Group=Task2] slice_strength : S0=2.44 | S1=6.01 | S2=8.96
2026-02-11 20:58:40,618 - INFO - ======================================
2026-02-11 20:58:40,618 - INFO - ========== Task 3: classes [6, 7] ==========
2026-02-11 20:58:59,307 - INFO - [Task 3 | ep 0 | step 0] loss=10.5751 c=8.2884 r=2.0510 ssl=0.4712 | CI_T0=0.97% | CI_T1=6.18% | CI_T2=98.45% | CI_T3=0.00%
2026-02-11 20:59:15,001 - INFO - [Task 3 | ep 0 | step 25] loss=1.9559 c=0.6389 r=1.2748 ssl=0.0844 | CI_T0=0.01% | CI_T1=2.21% | CI_T2=64.49% | CI_T3=84.15%
2026-02-11 20:59:30,706 - INFO - [Task 3 | ep 0 | step 50] loss=1.6193 c=0.5401 r=1.0700 ssl=0.0184 | CI_T0=0.00% | CI_T1=0.72% | CI_T2=56.18% | CI_T3=90.90%
2026-02-11 20:59:46,455 - INFO - [Task 3 | ep 0 | step 75] loss=1.1797 c=0.3888 r=0.7804 ssl=0.0210 | CI_T0=0.01% | CI_T1=0.73% | CI_T2=63.07% | CI_T3=92.50%
2026-02-11 21:00:05,744 - INFO - [Task 3 | ep 1 | step 100] loss=1.0991 c=0.3721 r=0.7185 ssl=0.0170 | CI_T0=0.00% | CI_T1=2.20% | CI_T2=60.78% | CI_T3=93.29%
2026-02-11 21:00:21,538 - INFO - [Task 3 | ep 1 | step 125] loss=1.1494 c=0.3041 r=0.8395 ssl=0.0117 | CI_T0=0.02% | CI_T1=0.93% | CI_T2=54.36% | CI_T3=95.86%
2026-02-11 21:00:37,364 - INFO - [Task 3 | ep 1 | step 150] loss=1.2667 c=0.2746 r=0.9816 ssl=0.0210 | CI_T0=0.00% | CI_T1=0.81% | CI_T2=46.87% | CI_T3=97.46%
2026-02-11 21:00:53,120 - INFO - [Task 3 | ep 1 | step 175] loss=1.1120 c=0.2241 r=0.8683 ssl=0.0391 | CI_T0=0.01% | CI_T1=1.80% | CI_T2=45.23% | CI_T3=98.64%
2026-02-11 21:01:12,439 - INFO - [Task 3 | ep 2 | step 200] loss=0.9555 c=0.1846 r=0.7678 ssl=0.0061 | CI_T0=0.00% | CI_T1=2.35% | CI_T2=33.69% | CI_T3=98.64%
2026-02-11 21:01:28,270 - INFO - [Task 3 | ep 2 | step 225] loss=0.9393 c=0.2071 r=0.7201 ssl=0.0240 | CI_T0=0.00% | CI_T1=1.83% | CI_T2=39.64% | CI_T3=98.20%
2026-02-11 21:01:44,027 - INFO - [Task 3 | ep 2 | step 250] loss=0.8438 c=0.1724 r=0.6624 ssl=0.0181 | CI_T0=0.00% | CI_T1=0.98% | CI_T2=30.13% | CI_T3=98.78%
2026-02-11 21:01:59,822 - INFO - [Task 3 | ep 2 | step 275] loss=0.7978 c=0.1373 r=0.6558 ssl=0.0093 | CI_T0=0.00% | CI_T1=1.21% | CI_T2=31.15% | CI_T3=98.96%
2026-02-11 21:02:19,248 - INFO - [Task 3 | ep 3 | step 300] loss=0.8266 c=0.1629 r=0.6588 ssl=0.0099 | CI_T0=0.00% | CI_T1=0.87% | CI_T2=32.76% | CI_T3=98.66%
2026-02-11 21:02:35,072 - INFO - [Task 3 | ep 3 | step 325] loss=0.8368 c=0.1313 r=0.6856 ssl=0.0397 | CI_T0=0.00% | CI_T1=0.70% | CI_T2=27.74% | CI_T3=99.51%
2026-02-11 21:02:50,912 - INFO - [Task 3 | ep 3 | step 350] loss=1.1552 c=0.1241 r=1.0185 ssl=0.0252 | CI_T0=0.00% | CI_T1=1.51% | CI_T2=26.19% | CI_T3=99.62%
2026-02-11 21:03:06,691 - INFO - [Task 3 | ep 3 | step 375] loss=0.7452 c=0.1114 r=0.6286 ssl=0.0105 | CI_T0=0.00% | CI_T1=0.63% | CI_T2=28.18% | CI_T3=99.28%
2026-02-11 21:03:23,018 - INFO - [After Task 3] Task-IL : T0=99.95% | T1=97.89% | T2=98.03% | T3=99.19% | Avg=98.77%
2026-02-11 21:03:23,018 - INFO - [After Task 3] Class-IL: T0=0.00% | T1=0.69% | T2=29.56% | T3=98.99% | Avg=32.31%
2026-02-11 21:03:23,018 - INFO - ========== GROUP DIFFERENCES ==========
2026-02-11 21:03:23,018 - INFO - Seen tasks: 0..3 | valid_out_dim=8
2026-02-11 21:03:25,007 - INFO - [Group=Task0] CI_acc=0.00% | corr_slice_max=4.753 | best_other_max=8.558 | gap=-3.805
2026-02-11 21:03:25,007 - INFO - [Group=Task0] winner_task_dist: W0=0.0% | W1=0.0% | W2=4.7% | W3=95.3%
2026-02-11 21:03:25,007 - INFO - [Group=Task0] slice_strength : S0=4.75 | S1=5.70 | S2=6.96 | S3=8.53
2026-02-11 21:03:27,007 - INFO - [Group=Task1] CI_acc=0.69% | corr_slice_max=6.589 | best_other_max=9.061 | gap=-2.473
2026-02-11 21:03:27,007 - INFO - [Group=Task1] winner_task_dist: W0=0.0% | W1=0.7% | W2=30.0% | W3=69.3%
2026-02-11 21:03:27,007 - INFO - [Group=Task1] slice_strength : S0=2.77 | S1=6.59 | S2=7.81 | S3=8.74
2026-02-11 21:03:29,012 - INFO - [Group=Task2] CI_acc=29.56% | corr_slice_max=8.822 | best_other_max=9.386 | gap=-0.565
2026-02-11 21:03:29,012 - INFO - [Group=Task2] winner_task_dist: W0=0.0% | W1=0.0% | W2=29.6% | W3=70.4%
2026-02-11 21:03:29,012 - INFO - [Group=Task2] slice_strength : S0=2.41 | S1=6.08 | S2=8.82 | S3=9.37
2026-02-11 21:03:31,005 - INFO - [Group=Task3] CI_acc=98.99% | corr_slice_max=10.871 | best_other_max=8.036 | gap=2.835
2026-02-11 21:03:31,005 - INFO - [Group=Task3] winner_task_dist: W0=0.0% | W1=0.0% | W2=0.3% | W3=99.7%
2026-02-11 21:03:31,005 - INFO - [Group=Task3] slice_strength : S0=2.81 | S1=5.89 | S2=8.03 | S3=10.87
2026-02-11 21:03:31,005 - INFO - ======================================
2026-02-11 21:03:31,005 - INFO - ========== Task 4: classes [8, 9] ==========
2026-02-11 21:03:53,602 - INFO - [Task 4 | ep 0 | step 0] loss=11.9917 c=9.8102 r=2.0729 ssl=0.2172 | CI_T0=0.00% | CI_T1=1.97% | CI_T2=36.36% | CI_T3=98.91% | CI_T4=0.00%
2026-02-11 21:04:13,166 - INFO - [Task 4 | ep 0 | step 25] loss=1.9689 c=0.6003 r=1.3582 ssl=0.0206 | CI_T0=0.00% | CI_T1=0.00% | CI_T2=1.82% | CI_T3=34.66% | CI_T4=86.18%
2026-02-11 21:04:32,717 - INFO - [Task 4 | ep 0 | step 50] loss=1.4305 c=0.5051 r=0.9063 ssl=0.0381 | CI_T0=0.00% | CI_T1=0.00% | CI_T2=0.89% | CI_T3=31.60% | CI_T4=93.67%
2026-02-11 21:04:52,259 - INFO - [Task 4 | ep 0 | step 75] loss=1.2244 c=0.4251 r=0.7906 ssl=0.0174 | CI_T0=0.00% | CI_T1=0.00% | CI_T2=0.56% | CI_T3=44.47% | CI_T4=94.03%
2026-02-11 21:05:15,321 - INFO - [Task 4 | ep 1 | step 100] loss=1.2101 c=0.3948 r=0.8103 ssl=0.0099 | CI_T0=0.00% | CI_T1=0.00% | CI_T2=1.42% | CI_T3=45.30% | CI_T4=95.21%
2026-02-11 21:05:35,027 - INFO - [Task 4 | ep 1 | step 125] loss=1.1699 c=0.3329 r=0.8327 ssl=0.0087 | CI_T0=0.00% | CI_T1=0.00% | CI_T2=0.92% | CI_T3=39.79% | CI_T4=96.35%
2026-02-11 21:05:54,680 - INFO - [Task 4 | ep 1 | step 150] loss=1.0536 c=0.3040 r=0.7459 ssl=0.0074 | CI_T0=0.00% | CI_T1=0.00% | CI_T2=0.33% | CI_T3=43.63% | CI_T4=96.46%
2026-02-11 21:06:14,340 - INFO - [Task 4 | ep 1 | step 175] loss=1.1644 c=0.2704 r=0.8797 ssl=0.0287 | CI_T0=0.00% | CI_T1=0.00% | CI_T2=0.46% | CI_T3=42.05% | CI_T4=96.93%
2026-02-11 21:06:37,425 - INFO - [Task 4 | ep 2 | step 200] loss=1.0701 c=0.2289 r=0.8374 ssl=0.0077 | CI_T0=0.00% | CI_T1=0.00% | CI_T2=0.73% | CI_T3=33.69% | CI_T4=97.26%
2026-02-11 21:06:56,910 - INFO - [Task 4 | ep 2 | step 225] loss=0.9278 c=0.2257 r=0.6936 ssl=0.0170 | CI_T0=0.00% | CI_T1=0.00% | CI_T2=0.45% | CI_T3=32.32% | CI_T4=96.95%
2026-02-11 21:07:16,481 - INFO - [Task 4 | ep 2 | step 250] loss=0.9462 c=0.2114 r=0.7318 ssl=0.0057 | CI_T0=0.00% | CI_T1=0.00% | CI_T2=1.60% | CI_T3=28.63% | CI_T4=97.96%
2026-02-11 21:07:36,172 - INFO - [Task 4 | ep 2 | step 275] loss=0.8167 c=0.1773 r=0.6364 ssl=0.0061 | CI_T0=0.00% | CI_T1=0.00% | CI_T2=0.50% | CI_T3=32.82% | CI_T4=97.94%
2026-02-11 21:07:59,385 - INFO - [Task 4 | ep 3 | step 300] loss=0.9772 c=0.1992 r=0.7572 ssl=0.0413 | CI_T0=0.00% | CI_T1=0.00% | CI_T2=0.04% | CI_T3=32.93% | CI_T4=98.23%
2026-02-11 21:08:19,042 - INFO - [Task 4 | ep 3 | step 325] loss=0.7493 c=0.1397 r=0.6065 ssl=0.0063 | CI_T0=0.00% | CI_T1=0.00% | CI_T2=0.55% | CI_T3=26.74% | CI_T4=98.03%
2026-02-11 21:08:38,877 - INFO - [Task 4 | ep 3 | step 350] loss=1.0643 c=0.1830 r=0.8769 ssl=0.0089 | CI_T0=0.00% | CI_T1=0.00% | CI_T2=0.17% | CI_T3=23.51% | CI_T4=98.34%
2026-02-11 21:08:59,873 - INFO - [After Task 4] Task-IL : T0=99.81% | T1=97.80% | T2=97.60% | T3=98.94% | T4=98.34% | Avg=98.50%
2026-02-11 21:08:59,873 - INFO - [After Task 4] Class-IL: T0=0.00% | T1=0.00% | T2=0.11% | T3=31.27% | T4=98.13% | Avg=25.90%
2026-02-11 21:08:59,873 - INFO - ========== GROUP DIFFERENCES ==========
2026-02-11 21:08:59,873 - INFO - Seen tasks: 0..4 | valid_out_dim=10
2026-02-11 21:09:01,963 - INFO - [Group=Task0] CI_acc=0.00% | corr_slice_max=4.883 | best_other_max=10.470 | gap=-5.588
2026-02-11 21:09:01,963 - INFO - [Group=Task0] winner_task_dist: W0=0.0% | W1=0.0% | W2=0.0% | W3=0.5% | W4=99.4%
2026-02-11 21:09:01,963 - INFO - [Group=Task0] slice_strength : S0=4.88 | S1=5.57 | S2=6.86 | S3=8.32 | S4=10.47
2026-02-11 21:09:04,038 - INFO - [Group=Task1] CI_acc=0.00% | corr_slice_max=6.290 | best_other_max=11.110 | gap=-4.820
2026-02-11 21:09:04,038 - INFO - [Group=Task1] winner_task_dist: W0=0.0% | W1=0.0% | W2=0.1% | W3=1.0% | W4=98.9%
2026-02-11 21:09:04,038 - INFO - [Group=Task1] slice_strength : S0=2.71 | S1=6.29 | S2=7.67 | S3=8.61 | S4=11.11
2026-02-11 21:09:06,096 - INFO - [Group=Task2] CI_acc=0.11% | corr_slice_max=8.851 | best_other_max=11.314 | gap=-2.463
2026-02-11 21:09:06,096 - INFO - [Group=Task2] winner_task_dist: W0=0.0% | W1=0.0% | W2=0.1% | W3=1.5% | W4=98.3%
2026-02-11 21:09:06,096 - INFO - [Group=Task2] slice_strength : S0=2.49 | S1=5.98 | S2=8.85 | S3=9.32 | S4=11.31
2026-02-11 21:09:08,126 - INFO - [Group=Task3] CI_acc=31.27% | corr_slice_max=10.723 | best_other_max=11.349 | gap=-0.626
2026-02-11 21:09:08,126 - INFO - [Group=Task3] winner_task_dist: W0=0.0% | W1=0.0% | W2=0.0% | W3=31.3% | W4=68.7%
2026-02-11 21:09:08,126 - INFO - [Group=Task3] slice_strength : S0=2.60 | S1=5.79 | S2=8.11 | S3=10.72 | S4=11.35
2026-02-11 21:09:10,162 - INFO - [Group=Task4] CI_acc=98.13% | corr_slice_max=12.106 | best_other_max=9.354 | gap=2.752
2026-02-11 21:09:10,162 - INFO - [Group=Task4] winner_task_dist: W0=0.0% | W1=0.0% | W2=0.0% | W3=0.2% | W4=99.8%
2026-02-11 21:09:10,162 - INFO - [Group=Task4] slice_strength : S0=2.90 | S1=5.75 | S2=7.98 | S3=9.33 | S4=12.11
2026-02-11 21:09:10,162 - INFO - ======================================
2026-02-11 21:09:10,162 - INFO - ========== FINAL METRICS (Class-IL) ==========
2026-02-11 21:09:10,162 - INFO - Forgetting per task: T0=99.91%, T1=98.14%, T2=98.72%, T3=67.72%, T4=0.00%
2026-02-11 21:09:10,162 - INFO - BWT: -91.12%
2026-02-11 21:09:10,162 - INFO - Final average Class-IL accuracy: 25.90%
