2026-02-11 17:33:31,531 - INFO - Device: cpu
2026-02-11 17:33:31,531 - INFO - Config: {'device': 'cpu', 'lr': 0.005, 'epochs_per_task': 4, 'batch_size': 128, 'lambda_slice': 2.0, 'lambda_feat': 0.5, 'use_cosine_head': True, 'seed': 42, 'freeze_backbone_after_task': -1, 'ewc_lambda': 0.0, 'si_lambda': 1.0, 'use_attention_backbone': False, 'use_adapters': False, 'lambda_slice_balance': 0.0, 'lambda_slice_margin': 0.0, 'slice_margin': 0.5, 'use_task_inference': False, 'lambda_task_inference': 1.0}
2026-02-11 17:33:31,534 - INFO - ========== Training Task 0: classes [0, 1] ==========
2026-02-11 17:33:38,684 - INFO - [Task 0 | ep 0 | step 0] loss=0.8633 c=0.8633 r=0.0000 | CI_T0=95.74%
2026-02-11 17:33:42,719 - INFO - [Task 0 | ep 0 | step 25] loss=0.0014 c=0.0014 r=0.0000 | CI_T0=99.93%
2026-02-11 17:33:46,760 - INFO - [Task 0 | ep 0 | step 50] loss=0.0007 c=0.0007 r=0.0000 | CI_T0=99.85%
2026-02-11 17:33:50,801 - INFO - [Task 0 | ep 0 | step 75] loss=0.0003 c=0.0003 r=0.0000 | CI_T0=99.97%
2026-02-11 17:33:58,384 - INFO - [Task 0 | ep 1 | step 100] loss=0.0003 c=0.0003 r=0.0000 | CI_T0=99.94%
2026-02-11 17:34:02,433 - INFO - [Task 0 | ep 1 | step 125] loss=0.0005 c=0.0005 r=0.0000 | CI_T0=99.94%
2026-02-11 17:34:06,478 - INFO - [Task 0 | ep 1 | step 150] loss=0.0003 c=0.0003 r=0.0000 | CI_T0=99.92%
2026-02-11 17:34:10,548 - INFO - [Task 0 | ep 1 | step 175] loss=0.0002 c=0.0002 r=0.0000 | CI_T0=99.94%
2026-02-11 17:34:18,114 - INFO - [Task 0 | ep 2 | step 200] loss=0.0001 c=0.0001 r=0.0000 | CI_T0=99.97%
2026-02-11 17:34:22,148 - INFO - [Task 0 | ep 2 | step 225] loss=0.0001 c=0.0001 r=0.0000 | CI_T0=99.94%
2026-02-11 17:34:26,183 - INFO - [Task 0 | ep 2 | step 250] loss=0.0003 c=0.0003 r=0.0000 | CI_T0=99.96%
2026-02-11 17:34:30,205 - INFO - [Task 0 | ep 2 | step 275] loss=0.0003 c=0.0003 r=0.0000 | CI_T0=99.97%
2026-02-11 17:34:37,769 - INFO - [Task 0 | ep 3 | step 300] loss=0.0001 c=0.0001 r=0.0000 | CI_T0=99.96%
2026-02-11 17:34:41,829 - INFO - [Task 0 | ep 3 | step 325] loss=0.0001 c=0.0001 r=0.0000 | CI_T0=99.96%
2026-02-11 17:34:45,855 - INFO - [Task 0 | ep 3 | step 350] loss=0.0005 c=0.0005 r=0.0000 | CI_T0=99.98%
2026-02-11 17:34:49,889 - INFO - [Task 0 | ep 3 | step 375] loss=0.0008 c=0.0008 r=0.0000 | CI_T0=99.98%
2026-02-11 17:34:50,259 - INFO - SI: stored omega for task 0
2026-02-11 17:34:54,258 - INFO - [After Task 0] Task-IL : T0=99.91% | Avg=99.91%
2026-02-11 17:34:54,258 - INFO - [After Task 0] Class-IL: T0=99.91% | Avg=99.91%
2026-02-11 17:34:54,258 - INFO - ========== GROUP DIFFERENCES ==========
2026-02-11 17:34:54,258 - INFO - Seen tasks: 0..0 | valid_out_dim=2
2026-02-11 17:34:56,258 - INFO - [Group=Task0] CI_acc=99.91% | corr_slice_max=5.001 | best_other_max=nan | gap=nan
2026-02-11 17:34:56,258 - INFO - [Group=Task0] winner_task_dist: W0=100.0%
2026-02-11 17:34:56,258 - INFO - [Group=Task0] slice_strength : S0=5.00
2026-02-11 17:34:56,258 - INFO - ======================================
2026-02-11 17:34:56,258 - INFO - ========== Training Task 1: classes [2, 3] ==========
2026-02-11 17:35:07,243 - INFO - [Task 1 | ep 0 | step 0] loss=6.6880 c=4.1526 r=2.5354 | CI_T0=99.98% | CI_T1=10.51%
2026-02-11 17:35:15,215 - INFO - [Task 1 | ep 0 | step 25] loss=1.4622 c=0.1783 r=1.2824 | si=0.0016 | CI_T0=29.46% | CI_T1=95.14%
2026-02-11 17:35:23,164 - INFO - [Task 1 | ep 0 | step 50] loss=1.0923 c=0.1054 r=0.9847 | si=0.0023 | CI_T0=12.97% | CI_T1=97.54%
2026-02-11 17:35:31,113 - INFO - [Task 1 | ep 0 | step 75] loss=1.0126 c=0.1114 r=0.8985 | si=0.0026 | CI_T0=12.10% | CI_T1=98.19%
2026-02-11 17:35:42,585 - INFO - [Task 1 | ep 1 | step 100] loss=0.9807 c=0.1193 r=0.8583 | si=0.0031 | CI_T0=29.66% | CI_T1=98.06%
2026-02-11 17:35:50,566 - INFO - [Task 1 | ep 1 | step 125] loss=0.7498 c=0.1170 r=0.6293 | si=0.0035 | CI_T0=8.79% | CI_T1=98.43%
2026-02-11 17:35:58,543 - INFO - [Task 1 | ep 1 | step 150] loss=0.9330 c=0.0916 r=0.8374 | si=0.0039 | CI_T0=3.06% | CI_T1=98.23%
2026-02-11 17:36:06,535 - INFO - [Task 1 | ep 1 | step 175] loss=1.0601 c=0.0770 r=0.9786 | si=0.0044 | CI_T0=12.01% | CI_T1=98.82%
2026-02-11 17:36:18,046 - INFO - [Task 1 | ep 2 | step 200] loss=1.1364 c=0.1264 r=1.0052 | si=0.0048 | CI_T0=8.53% | CI_T1=98.90%
2026-02-11 17:36:25,988 - INFO - [Task 1 | ep 2 | step 225] loss=1.1248 c=0.0664 r=1.0532 | si=0.0052 | CI_T0=2.53% | CI_T1=99.11%
2026-02-11 17:36:33,955 - INFO - [Task 1 | ep 2 | step 250] loss=0.7282 c=0.0721 r=0.6504 | si=0.0057 | CI_T0=10.54% | CI_T1=99.07%
2026-02-11 17:36:41,938 - INFO - [Task 1 | ep 2 | step 275] loss=0.7128 c=0.0821 r=0.6246 | si=0.0061 | CI_T0=10.65% | CI_T1=99.13%
2026-02-11 17:36:53,408 - INFO - [Task 1 | ep 3 | step 300] loss=0.6844 c=0.0775 r=0.6004 | si=0.0066 | CI_T0=21.27% | CI_T1=98.95%
2026-02-11 17:37:01,343 - INFO - [Task 1 | ep 3 | step 325] loss=0.7212 c=0.0741 r=0.6402 | si=0.0070 | CI_T0=4.74% | CI_T1=99.26%
2026-02-11 17:37:09,343 - INFO - [Task 1 | ep 3 | step 350] loss=0.6976 c=0.0819 r=0.6083 | si=0.0074 | CI_T0=9.45% | CI_T1=99.30%
2026-02-11 17:37:17,316 - INFO - [Task 1 | ep 3 | step 375] loss=1.2796 c=0.0529 r=1.2188 | si=0.0078 | CI_T0=11.46% | CI_T1=99.30%
2026-02-11 17:37:17,599 - INFO - SI: stored omega for task 1
2026-02-11 17:37:25,649 - INFO - [After Task 1] Task-IL : T0=99.91% | T1=99.02% | Avg=99.46%
2026-02-11 17:37:25,649 - INFO - [After Task 1] Class-IL: T0=9.83% | T1=99.02% | Avg=54.43%
2026-02-11 17:37:25,649 - INFO - ========== GROUP DIFFERENCES ==========
2026-02-11 17:37:25,649 - INFO - Seen tasks: 0..1 | valid_out_dim=4
2026-02-11 17:37:27,651 - INFO - [Group=Task0] CI_acc=9.83% | corr_slice_max=4.980 | best_other_max=6.032 | gap=-1.052
2026-02-11 17:37:27,651 - INFO - [Group=Task0] winner_task_dist: W0=9.8% | W1=90.2%
2026-02-11 17:37:27,651 - INFO - [Group=Task0] slice_strength : S0=4.98 | S1=6.03
2026-02-11 17:37:29,663 - INFO - [Group=Task1] CI_acc=99.02% | corr_slice_max=7.107 | best_other_max=2.720 | gap=4.387
2026-02-11 17:37:29,663 - INFO - [Group=Task1] winner_task_dist: W0=0.0% | W1=100.0%
2026-02-11 17:37:29,663 - INFO - [Group=Task1] slice_strength : S0=2.72 | S1=7.11
2026-02-11 17:37:29,663 - INFO - ======================================
2026-02-11 17:37:29,663 - INFO - ========== Training Task 2: classes [4, 5] ==========
2026-02-11 17:37:44,672 - INFO - [Task 2 | ep 0 | step 0] loss=8.7020 c=6.4707 r=2.2234 | si=0.0078 | CI_T0=10.28% | CI_T1=99.13% | CI_T2=0.00%
2026-02-11 17:37:56,606 - INFO - [Task 2 | ep 0 | step 25] loss=1.5548 c=0.4820 r=0.9861 | si=0.0868 | CI_T0=1.00% | CI_T1=29.22% | CI_T2=91.62%
2026-02-11 17:38:08,538 - INFO - [Task 2 | ep 0 | step 50] loss=1.5832 c=0.3362 r=1.1453 | si=0.1016 | CI_T0=2.93% | CI_T1=42.25% | CI_T2=93.77%
2026-02-11 17:38:20,463 - INFO - [Task 2 | ep 0 | step 75] loss=1.1365 c=0.2707 r=0.7582 | si=0.1076 | CI_T0=0.32% | CI_T1=36.32% | CI_T2=95.16%
2026-02-11 17:38:35,947 - INFO - [Task 2 | ep 1 | step 100] loss=1.2562 c=0.2272 r=0.9132 | si=0.1157 | CI_T0=3.87% | CI_T1=30.73% | CI_T2=97.28%
2026-02-11 17:38:47,829 - INFO - [Task 2 | ep 1 | step 125] loss=1.0789 c=0.2085 r=0.7505 | si=0.1199 | CI_T0=0.35% | CI_T1=28.43% | CI_T2=98.23%
2026-02-11 17:38:59,681 - INFO - [Task 2 | ep 1 | step 150] loss=1.0236 c=0.1616 r=0.7367 | si=0.1253 | CI_T0=3.54% | CI_T1=26.94% | CI_T2=99.09%
2026-02-11 17:39:15,014 - INFO - [Task 2 | ep 2 | step 175] loss=0.9558 c=0.1594 r=0.6725 | si=0.1240 | CI_T0=6.25% | CI_T1=26.16% | CI_T2=99.25%
2026-02-11 17:39:26,817 - INFO - [Task 2 | ep 2 | step 200] loss=0.8300 c=0.1586 r=0.5439 | si=0.1276 | CI_T0=1.29% | CI_T1=28.62% | CI_T2=99.26%
2026-02-11 17:39:38,714 - INFO - [Task 2 | ep 2 | step 225] loss=0.8344 c=0.1727 r=0.5331 | si=0.1286 | CI_T0=6.98% | CI_T1=24.73% | CI_T2=99.49%
2026-02-11 17:39:50,582 - INFO - [Task 2 | ep 2 | step 250] loss=1.0602 c=0.1525 r=0.7749 | si=0.1328 | CI_T0=8.67% | CI_T1=22.37% | CI_T2=99.55%
2026-02-11 17:40:06,028 - INFO - [Task 2 | ep 3 | step 275] loss=0.8729 c=0.1454 r=0.5915 | si=0.1361 | CI_T0=2.26% | CI_T1=27.09% | CI_T2=99.69%
2026-02-11 17:40:17,864 - INFO - [Task 2 | ep 3 | step 300] loss=1.1875 c=0.1481 r=0.8954 | si=0.1440 | CI_T0=2.22% | CI_T1=26.87% | CI_T2=99.43%
2026-02-11 17:40:29,716 - INFO - [Task 2 | ep 3 | step 325] loss=0.9667 c=0.1051 r=0.7195 | si=0.1420 | CI_T0=3.28% | CI_T1=23.55% | CI_T2=99.68%
2026-02-11 17:40:30,216 - INFO - SI: stored omega for task 2
2026-02-11 17:40:42,305 - INFO - [After Task 2] Task-IL : T0=99.91% | T1=98.48% | T2=99.84% | Avg=99.41%
2026-02-11 17:40:42,305 - INFO - [After Task 2] Class-IL: T0=3.69% | T1=23.02% | T2=99.57% | Avg=42.09%
2026-02-11 17:40:42,305 - INFO - ========== GROUP DIFFERENCES ==========
2026-02-11 17:40:42,305 - INFO - Seen tasks: 0..2 | valid_out_dim=6
2026-02-11 17:40:44,316 - INFO - [Group=Task0] CI_acc=3.69% | corr_slice_max=5.018 | best_other_max=7.002 | gap=-1.984
2026-02-11 17:40:44,316 - INFO - [Group=Task0] winner_task_dist: W0=3.7% | W1=8.3% | W2=88.0%
2026-02-11 17:40:44,317 - INFO - [Group=Task0] slice_strength : S0=5.02 | S1=6.02 | S2=6.96
2026-02-11 17:40:46,332 - INFO - [Group=Task1] CI_acc=23.02% | corr_slice_max=7.046 | best_other_max=7.944 | gap=-0.898
2026-02-11 17:40:46,332 - INFO - [Group=Task1] winner_task_dist: W0=0.0% | W1=23.0% | W2=77.0%
2026-02-11 17:40:46,332 - INFO - [Group=Task1] slice_strength : S0=2.51 | S1=7.05 | S2=7.94
2026-02-11 17:40:48,326 - INFO - [Group=Task2] CI_acc=99.57% | corr_slice_max=8.702 | best_other_max=6.152 | gap=2.550
2026-02-11 17:40:48,326 - INFO - [Group=Task2] winner_task_dist: W0=0.0% | W1=0.3% | W2=99.7%
2026-02-11 17:40:48,326 - INFO - [Group=Task2] slice_strength : S0=2.51 | S1=6.15 | S2=8.70
2026-02-11 17:40:48,326 - INFO - ======================================
2026-02-11 17:40:48,327 - INFO - ========== Training Task 3: classes [6, 7] ==========
2026-02-11 17:41:07,033 - INFO - [Task 3 | ep 0 | step 0] loss=9.6883 c=8.0727 r=1.4729 | si=0.1426 | CI_T0=3.17% | CI_T1=23.72% | CI_T2=99.22% | CI_T3=0.00%
2026-02-11 17:41:22,889 - INFO - [Task 3 | ep 0 | step 25] loss=1.9509 c=0.3780 r=1.3072 | si=0.2657 | CI_T0=3.40% | CI_T1=13.20% | CI_T2=61.29% | CI_T3=97.39%
2026-02-11 17:41:38,683 - INFO - [Task 3 | ep 0 | step 50] loss=1.3527 c=0.2879 r=0.7992 | si=0.2656 | CI_T0=1.88% | CI_T1=12.38% | CI_T2=73.85% | CI_T3=96.88%
2026-02-11 17:41:54,580 - INFO - [Task 3 | ep 0 | step 75] loss=1.4267 c=0.2729 r=0.8947 | si=0.2590 | CI_T0=0.33% | CI_T1=10.74% | CI_T2=75.29% | CI_T3=97.92%
2026-02-11 17:42:13,972 - INFO - [Task 3 | ep 1 | step 100] loss=1.2158 c=0.2720 r=0.6884 | si=0.2555 | CI_T0=0.54% | CI_T1=19.48% | CI_T2=73.76% | CI_T3=98.17%
2026-02-11 17:42:29,854 - INFO - [Task 3 | ep 1 | step 125] loss=1.3724 c=0.2550 r=0.8593 | si=0.2582 | CI_T0=0.96% | CI_T1=13.80% | CI_T2=77.60% | CI_T3=98.66%
2026-02-11 17:42:45,719 - INFO - [Task 3 | ep 1 | step 150] loss=1.4969 c=0.2391 r=0.9960 | si=0.2618 | CI_T0=1.15% | CI_T1=11.20% | CI_T2=77.71% | CI_T3=98.72%
2026-02-11 17:43:01,601 - INFO - [Task 3 | ep 1 | step 175] loss=1.2101 c=0.2355 r=0.7095 | si=0.2650 | CI_T0=0.31% | CI_T1=14.29% | CI_T2=77.52% | CI_T3=98.69%
2026-02-11 17:43:21,137 - INFO - [Task 3 | ep 2 | step 200] loss=1.1702 c=0.2124 r=0.6882 | si=0.2696 | CI_T0=0.61% | CI_T1=14.54% | CI_T2=74.60% | CI_T3=98.94%
2026-02-11 17:43:37,065 - INFO - [Task 3 | ep 2 | step 225] loss=1.2178 c=0.2065 r=0.7420 | si=0.2693 | CI_T0=1.03% | CI_T1=12.22% | CI_T2=74.43% | CI_T3=98.89%
2026-02-11 17:43:53,005 - INFO - [Task 3 | ep 2 | step 250] loss=1.1097 c=0.1872 r=0.6500 | si=0.2726 | CI_T0=1.75% | CI_T1=13.28% | CI_T2=75.03% | CI_T3=99.47%
2026-02-11 17:44:08,967 - INFO - [Task 3 | ep 2 | step 275] loss=1.1794 c=0.2230 r=0.6862 | si=0.2702 | CI_T0=0.92% | CI_T1=19.23% | CI_T2=74.12% | CI_T3=99.24%
2026-02-11 17:44:28,377 - INFO - [Task 3 | ep 3 | step 300] loss=1.1727 c=0.1969 r=0.7009 | si=0.2749 | CI_T0=1.44% | CI_T1=5.67% | CI_T2=72.81% | CI_T3=99.51%
2026-02-11 17:44:44,283 - INFO - [Task 3 | ep 3 | step 325] loss=1.0794 c=0.1927 r=0.6141 | si=0.2726 | CI_T0=0.55% | CI_T1=16.25% | CI_T2=73.16% | CI_T3=99.40%
2026-02-11 17:45:00,076 - INFO - [Task 3 | ep 3 | step 350] loss=1.2593 c=0.1817 r=0.8043 | si=0.2734 | CI_T0=0.65% | CI_T1=12.64% | CI_T2=72.45% | CI_T3=99.42%
2026-02-11 17:45:15,933 - INFO - [Task 3 | ep 3 | step 375] loss=1.0573 c=0.1770 r=0.6114 | si=0.2689 | CI_T0=1.33% | CI_T1=22.68% | CI_T2=73.90% | CI_T3=99.21%
2026-02-11 17:45:16,260 - INFO - SI: stored omega for task 3
2026-02-11 17:45:32,310 - INFO - [After Task 3] Task-IL : T0=99.91% | T1=98.53% | T2=99.52% | T3=99.90% | Avg=99.46%
2026-02-11 17:45:32,310 - INFO - [After Task 3] Class-IL: T0=0.33% | T1=20.13% | T2=74.81% | T3=98.24% | Avg=48.38%
2026-02-11 17:45:32,310 - INFO - ========== GROUP DIFFERENCES ==========
2026-02-11 17:45:32,310 - INFO - Seen tasks: 0..3 | valid_out_dim=8
2026-02-11 17:45:34,310 - INFO - [Group=Task0] CI_acc=0.33% | corr_slice_max=5.525 | best_other_max=7.571 | gap=-2.046
2026-02-11 17:45:34,311 - INFO - [Group=Task0] winner_task_dist: W0=0.3% | W1=0.9% | W2=28.3% | W3=70.5%
2026-02-11 17:45:34,311 - INFO - [Group=Task0] slice_strength : S0=5.52 | S1=6.23 | S2=6.96 | S3=7.41
2026-02-11 17:45:36,308 - INFO - [Group=Task1] CI_acc=20.13% | corr_slice_max=7.136 | best_other_max=8.271 | gap=-1.135
2026-02-11 17:45:36,308 - INFO - [Group=Task1] winner_task_dist: W0=0.0% | W1=20.1% | W2=39.4% | W3=40.5%
2026-02-11 17:45:36,308 - INFO - [Group=Task1] slice_strength : S0=2.87 | S1=7.14 | S2=7.51 | S3=7.39
2026-02-11 17:45:38,311 - INFO - [Group=Task2] CI_acc=74.81% | corr_slice_max=8.433 | best_other_max=7.690 | gap=0.742
2026-02-11 17:45:38,311 - INFO - [Group=Task2] winner_task_dist: W0=0.0% | W1=0.5% | W2=74.9% | W3=24.6%
2026-02-11 17:45:38,311 - INFO - [Group=Task2] slice_strength : S0=2.80 | S1=6.20 | S2=8.43 | S3=7.41
2026-02-11 17:45:40,345 - INFO - [Group=Task3] CI_acc=98.24% | corr_slice_max=9.559 | best_other_max=7.645 | gap=1.915
2026-02-11 17:45:40,345 - INFO - [Group=Task3] winner_task_dist: W0=0.0% | W1=0.0% | W2=1.8% | W3=98.2%
2026-02-11 17:45:40,345 - INFO - [Group=Task3] slice_strength : S0=2.80 | S1=5.96 | S2=7.60 | S3=9.56
2026-02-11 17:45:40,345 - INFO - ======================================
2026-02-11 17:45:40,345 - INFO - ========== Training Task 4: classes [8, 9] ==========
2026-02-11 17:46:03,063 - INFO - [Task 4 | ep 0 | step 0] loss=11.3031 c=8.7774 r=2.2548 | si=0.2709 | CI_T0=0.05% | CI_T1=27.30% | CI_T2=80.21% | CI_T3=98.50% | CI_T4=0.00%
2026-02-11 17:46:22,934 - INFO - [Task 4 | ep 0 | step 25] loss=2.4247 c=0.5680 r=1.4101 | si=0.4466 | CI_T0=0.17% | CI_T1=9.12% | CI_T2=17.07% | CI_T3=28.08% | CI_T4=94.09%
2026-02-11 17:46:42,775 - INFO - [Task 4 | ep 0 | step 50] loss=1.9985 c=0.6291 r=0.9247 | si=0.4447 | CI_T0=0.78% | CI_T1=1.29% | CI_T2=18.44% | CI_T3=44.54% | CI_T4=95.23%
2026-02-11 17:47:02,461 - INFO - [Task 4 | ep 0 | step 75] loss=1.8273 c=0.4955 r=0.8977 | si=0.4341 | CI_T0=0.43% | CI_T1=1.01% | CI_T2=27.69% | CI_T3=45.95% | CI_T4=96.08%
2026-02-11 17:47:25,850 - INFO - [Task 4 | ep 1 | step 100] loss=1.5149 c=0.3975 r=0.6819 | si=0.4356 | CI_T0=0.87% | CI_T1=1.74% | CI_T2=31.12% | CI_T3=45.88% | CI_T4=96.51%
2026-02-11 17:47:45,622 - INFO - [Task 4 | ep 1 | step 125] loss=1.6159 c=0.3499 r=0.8350 | si=0.4310 | CI_T0=0.11% | CI_T1=0.86% | CI_T2=26.30% | CI_T3=46.61% | CI_T4=96.32%
2026-02-11 17:48:05,483 - INFO - [Task 4 | ep 1 | step 150] loss=1.5821 c=0.3975 r=0.7532 | si=0.4314 | CI_T0=0.77% | CI_T1=0.79% | CI_T2=24.98% | CI_T3=41.64% | CI_T4=96.88%
2026-02-11 17:48:25,311 - INFO - [Task 4 | ep 1 | step 175] loss=1.5264 c=0.3497 r=0.7409 | si=0.4358 | CI_T0=1.06% | CI_T1=1.25% | CI_T2=27.33% | CI_T3=42.28% | CI_T4=97.69%
2026-02-11 17:48:48,676 - INFO - [Task 4 | ep 2 | step 200] loss=1.5543 c=0.3947 r=0.7271 | si=0.4324 | CI_T0=0.61% | CI_T1=0.47% | CI_T2=23.74% | CI_T3=46.02% | CI_T4=97.87%
2026-02-11 17:49:08,478 - INFO - [Task 4 | ep 2 | step 225] loss=1.5534 c=0.4114 r=0.7095 | si=0.4325 | CI_T0=0.45% | CI_T1=2.38% | CI_T2=29.79% | CI_T3=44.84% | CI_T4=97.70%
2026-02-11 17:49:28,324 - INFO - [Task 4 | ep 2 | step 250] loss=1.3643 c=0.3485 r=0.5887 | si=0.4271 | CI_T0=0.67% | CI_T1=1.16% | CI_T2=24.57% | CI_T3=45.20% | CI_T4=97.84%
2026-02-11 17:49:48,210 - INFO - [Task 4 | ep 2 | step 275] loss=1.8621 c=0.3854 r=1.0520 | si=0.4247 | CI_T0=0.02% | CI_T1=2.18% | CI_T2=27.10% | CI_T3=37.01% | CI_T4=97.57%
2026-02-11 17:50:11,596 - INFO - [Task 4 | ep 3 | step 300] loss=1.6107 c=0.4490 r=0.7289 | si=0.4328 | CI_T0=0.54% | CI_T1=1.25% | CI_T2=30.26% | CI_T3=43.60% | CI_T4=97.91%
2026-02-11 17:50:31,462 - INFO - [Task 4 | ep 3 | step 325] loss=1.4002 c=0.3546 r=0.6157 | si=0.4299 | CI_T0=5.00% | CI_T1=1.79% | CI_T2=25.67% | CI_T3=37.67% | CI_T4=97.82%
2026-02-11 17:50:51,308 - INFO - [Task 4 | ep 3 | step 350] loss=1.5262 c=0.3041 r=0.7897 | si=0.4324 | CI_T0=1.28% | CI_T1=1.83% | CI_T2=28.33% | CI_T3=36.89% | CI_T4=98.40%
2026-02-11 17:50:51,832 - INFO - SI: stored omega for task 4
2026-02-11 17:51:11,806 - INFO - [After Task 4] Task-IL : T0=99.91% | T1=97.89% | T2=99.52% | T3=99.50% | T4=99.14% | Avg=99.19%
2026-02-11 17:51:11,806 - INFO - [After Task 4] Class-IL: T0=4.30% | T1=0.88% | T2=25.29% | T3=42.75% | T4=97.53% | Avg=34.15%
2026-02-11 17:51:11,806 - INFO - ========== GROUP DIFFERENCES ==========
2026-02-11 17:51:11,806 - INFO - Seen tasks: 0..4 | valid_out_dim=10
2026-02-11 17:51:13,816 - INFO - [Group=Task0] CI_acc=4.30% | corr_slice_max=5.372 | best_other_max=8.032 | gap=-2.660
2026-02-11 17:51:13,816 - INFO - [Group=Task0] winner_task_dist: W0=4.3% | W1=0.3% | W2=7.2% | W3=17.4% | W4=70.7%
2026-02-11 17:51:13,816 - INFO - [Group=Task0] slice_strength : S0=5.37 | S1=6.12 | S2=6.81 | S3=6.92 | S4=7.90
2026-02-11 17:51:15,816 - INFO - [Group=Task1] CI_acc=0.88% | corr_slice_max=6.735 | best_other_max=8.710 | gap=-1.975
2026-02-11 17:51:15,816 - INFO - [Group=Task1] winner_task_dist: W0=0.0% | W1=0.9% | W2=26.0% | W3=15.4% | W4=57.7%
2026-02-11 17:51:15,816 - INFO - [Group=Task1] slice_strength : S0=2.79 | S1=6.73 | S2=7.53 | S3=6.98 | S4=8.32
2026-02-11 17:51:17,808 - INFO - [Group=Task2] CI_acc=25.29% | corr_slice_max=8.363 | best_other_max=9.049 | gap=-0.686
2026-02-11 17:51:17,808 - INFO - [Group=Task2] winner_task_dist: W0=0.0% | W1=0.0% | W2=25.3% | W3=1.9% | W4=72.8%
2026-02-11 17:51:17,808 - INFO - [Group=Task2] slice_strength : S0=2.56 | S1=5.89 | S2=8.36 | S3=7.26 | S4=9.01
2026-02-11 17:51:19,814 - INFO - [Group=Task3] CI_acc=42.75% | corr_slice_max=8.666 | best_other_max=8.712 | gap=-0.046
2026-02-11 17:51:19,814 - INFO - [Group=Task3] winner_task_dist: W0=0.0% | W1=0.0% | W2=1.7% | W3=42.7% | W4=55.6%
2026-02-11 17:51:19,814 - INFO - [Group=Task3] slice_strength : S0=2.77 | S1=5.64 | S2=7.15 | S3=8.67 | S4=8.57
2026-02-11 17:51:21,811 - INFO - [Group=Task4] CI_acc=97.53% | corr_slice_max=9.937 | best_other_max=8.343 | gap=1.594
2026-02-11 17:51:21,811 - INFO - [Group=Task4] winner_task_dist: W0=0.0% | W1=0.1% | W2=0.7% | W3=1.5% | W4=97.8%
2026-02-11 17:51:21,811 - INFO - [Group=Task4] slice_strength : S0=2.94 | S1=6.25 | S2=7.79 | S3=8.03 | S4=9.94
2026-02-11 17:51:21,811 - INFO - ======================================
2026-02-11 17:51:21,811 - INFO - ========== FINAL METRICS (Class-IL) ==========
2026-02-11 17:51:21,811 - INFO - Forgetting per task: T0=95.60%, T1=98.14%, T2=74.28%, T3=55.49%, T4=0.00%
2026-02-11 17:51:21,811 - INFO - BWT: -80.88%
2026-02-11 17:51:21,811 - INFO - Final average Class-IL accuracy: 34.15%
