2026-02-13 01:00:39,806 - INFO - Device: cuda
2026-02-13 01:00:39,806 - INFO - Config: {'device': 'cuda', 'lr': 0.005, 'epochs_per_task': 4, 'batch_size': 128, 'lambda_slice': 2.0, 'lambda_feat': 0.5, 'vae_epochs': 5, 'vae_n_fake_per_task': 32, 'lambda_adv_feat': 0.1, 'lambda_adv_slice': 0.1, 'lambda_ac': 0.1, 'ac_min_std': 1.0}
2026-02-13 01:00:39,892 - INFO - ========== Task 0: classes [0, 1] ==========
2026-02-13 01:01:09,492 - INFO - [Task 0 | ep 0 | step 0] loss=0.8626 | CI_T0=96.85%
2026-02-13 01:01:13,890 - INFO - [Task 0 | ep 0 | step 25] loss=0.0311 | CI_T0=99.83%
2026-02-13 01:01:18,283 - INFO - [Task 0 | ep 0 | step 50] loss=0.0042 | CI_T0=99.86%
2026-02-13 01:01:22,675 - INFO - [Task 0 | ep 0 | step 75] loss=0.0349 | CI_T0=99.88%
2026-02-13 01:01:30,901 - INFO - [Task 0 | ep 1 | step 100] loss=0.0008 | CI_T0=99.93%
2026-02-13 01:01:35,301 - INFO - [Task 0 | ep 1 | step 125] loss=0.0199 | CI_T0=99.93%
2026-02-13 01:01:39,699 - INFO - [Task 0 | ep 1 | step 150] loss=0.0004 | CI_T0=99.96%
2026-02-13 01:01:44,098 - INFO - [Task 0 | ep 1 | step 175] loss=0.0004 | CI_T0=99.97%
2026-02-13 01:01:52,397 - INFO - [Task 0 | ep 2 | step 200] loss=0.0001 | CI_T0=99.96%
2026-02-13 01:01:56,742 - INFO - [Task 0 | ep 2 | step 225] loss=0.0001 | CI_T0=99.96%
2026-02-13 01:02:01,187 - INFO - [Task 0 | ep 2 | step 250] loss=0.0001 | CI_T0=99.94%
2026-02-13 01:02:05,573 - INFO - [Task 0 | ep 2 | step 275] loss=0.0002 | CI_T0=99.97%
2026-02-13 01:02:13,869 - INFO - [Task 0 | ep 3 | step 300] loss=0.0003 | CI_T0=100.00%
2026-02-13 01:02:18,289 - INFO - [Task 0 | ep 3 | step 325] loss=0.0001 | CI_T0=99.98%
2026-02-13 01:02:22,729 - INFO - [Task 0 | ep 3 | step 350] loss=0.0001 | CI_T0=99.99%
2026-02-13 01:02:27,115 - INFO - [Task 0 | ep 3 | step 375] loss=0.0001 | CI_T0=99.98%
2026-02-13 01:02:31,809 - INFO - [After Task 0] Task-IL : T0=99.91% | Avg=99.91%
2026-02-13 01:02:31,810 - INFO - [After Task 0] Class-IL: T0=99.91% | Avg=99.91%
2026-02-13 01:02:31,810 - INFO - ========== GROUP DIFFERENCES ==========
2026-02-13 01:02:31,810 - INFO - Seen tasks: 0..0 | valid_out_dim=2
2026-02-13 01:02:33,965 - INFO - [Group=Task0] CI_acc=99.91% | corr_slice_max=5.153 | best_other_max=nan | gap=nan
2026-02-13 01:02:33,967 - INFO - [Group=Task0] winner_task_dist: W0=100.0%
2026-02-13 01:02:33,967 - INFO - [Group=Task0] slice_strength : S0=5.15
2026-02-13 01:02:33,967 - INFO - ======================================
2026-02-13 01:02:33,967 - INFO - ========== Task 1: classes [2, 3] ==========
2026-02-13 01:03:07,689 - INFO - [Task 1 | ep 0 | step 0] loss=7.0251 | CI_T0=97.86% | CI_T1=6.76%
2026-02-13 01:03:16,465 - INFO - [Task 1 | ep 0 | step 25] loss=2.1748 | CI_T0=38.54% | CI_T1=86.98%
2026-02-13 01:03:25,365 - INFO - [Task 1 | ep 0 | step 50] loss=2.4388 | CI_T0=9.57% | CI_T1=55.14%
2026-02-13 01:03:34,165 - INFO - [Task 1 | ep 0 | step 75] loss=2.5077 | CI_T0=20.57% | CI_T1=73.07%
2026-02-13 01:03:46,811 - INFO - [Task 1 | ep 1 | step 100] loss=2.4476 | CI_T0=15.38% | CI_T1=70.00%
2026-02-13 01:03:55,809 - INFO - [Task 1 | ep 1 | step 125] loss=2.7972 | CI_T0=24.89% | CI_T1=70.15%
2026-02-13 01:04:04,808 - INFO - [Task 1 | ep 1 | step 150] loss=3.0743 | CI_T0=22.69% | CI_T1=80.17%
2026-02-13 01:04:13,779 - INFO - [Task 1 | ep 1 | step 175] loss=3.0159 | CI_T0=28.32% | CI_T1=85.25%
2026-02-13 01:04:26,439 - INFO - [Task 1 | ep 2 | step 200] loss=2.7781 | CI_T0=29.82% | CI_T1=82.73%
2026-02-13 01:04:35,244 - INFO - [Task 1 | ep 2 | step 225] loss=2.2127 | CI_T0=38.69% | CI_T1=75.17%
2026-02-13 01:04:44,109 - INFO - [Task 1 | ep 2 | step 250] loss=2.3076 | CI_T0=33.81% | CI_T1=78.40%
2026-02-13 01:04:52,947 - INFO - [Task 1 | ep 2 | step 275] loss=2.6143 | CI_T0=37.99% | CI_T1=79.35%
2026-02-13 01:05:05,726 - INFO - [Task 1 | ep 3 | step 300] loss=3.3778 | CI_T0=28.25% | CI_T1=79.48%
2026-02-13 01:05:14,707 - INFO - [Task 1 | ep 3 | step 325] loss=2.6086 | CI_T0=33.47% | CI_T1=84.55%
2026-02-13 01:05:23,574 - INFO - [Task 1 | ep 3 | step 350] loss=2.5702 | CI_T0=19.60% | CI_T1=90.67%
2026-02-13 01:05:32,493 - INFO - [Task 1 | ep 3 | step 375] loss=2.4305 | CI_T0=24.73% | CI_T1=86.81%
2026-02-13 01:05:41,438 - INFO - [After Task 1] Task-IL : T0=97.49% | T1=95.89% | Avg=96.69%
2026-02-13 01:05:41,440 - INFO - [After Task 1] Class-IL: T0=25.96% | T1=86.68% | Avg=56.32%
2026-02-13 01:05:41,440 - INFO - ========== GROUP DIFFERENCES ==========
2026-02-13 01:05:41,440 - INFO - Seen tasks: 0..1 | valid_out_dim=4
2026-02-13 01:05:43,619 - INFO - [Group=Task0] CI_acc=25.96% | corr_slice_max=3.179 | best_other_max=3.946 | gap=-0.767
2026-02-13 01:05:43,621 - INFO - [Group=Task0] winner_task_dist: W0=26.5% | W1=73.5%
2026-02-13 01:05:43,621 - INFO - [Group=Task0] slice_strength : S0=3.18 | S1=3.95
2026-02-13 01:05:45,786 - INFO - [Group=Task1] CI_acc=86.68% | corr_slice_max=3.506 | best_other_max=2.209 | gap=1.297
2026-02-13 01:05:45,788 - INFO - [Group=Task1] winner_task_dist: W0=11.8% | W1=88.2%
2026-02-13 01:05:45,788 - INFO - [Group=Task1] slice_strength : S0=2.21 | S1=3.51
2026-02-13 01:05:45,788 - INFO - ======================================
2026-02-13 01:05:45,788 - INFO - ========== Task 2: classes [4, 5] ==========
2026-02-13 01:06:23,414 - INFO - [Task 2 | ep 0 | step 0] loss=8.1632 | CI_T0=45.83% | CI_T1=77.55% | CI_T2=0.30%
2026-02-13 01:06:36,591 - INFO - [Task 2 | ep 0 | step 25] loss=2.2388 | CI_T0=70.03% | CI_T1=16.14% | CI_T2=86.23%
2026-02-13 01:06:49,619 - INFO - [Task 2 | ep 0 | step 50] loss=2.0553 | CI_T0=41.37% | CI_T1=13.92% | CI_T2=93.33%
2026-02-13 01:07:02,762 - INFO - [Task 2 | ep 0 | step 75] loss=2.5611 | CI_T0=20.77% | CI_T1=7.06% | CI_T2=94.78%
2026-02-13 01:07:19,746 - INFO - [Task 2 | ep 1 | step 100] loss=2.8963 | CI_T0=15.23% | CI_T1=13.21% | CI_T2=94.23%
2026-02-13 01:07:33,002 - INFO - [Task 2 | ep 1 | step 125] loss=3.1076 | CI_T0=14.28% | CI_T1=20.95% | CI_T2=94.95%
2026-02-13 01:07:46,068 - INFO - [Task 2 | ep 1 | step 150] loss=2.8132 | CI_T0=35.98% | CI_T1=19.24% | CI_T2=91.10%
2026-02-13 01:08:02,969 - INFO - [Task 2 | ep 2 | step 175] loss=2.8603 | CI_T0=32.56% | CI_T1=17.52% | CI_T2=87.06%
2026-02-13 01:08:15,976 - INFO - [Task 2 | ep 2 | step 200] loss=2.7396 | CI_T0=30.47% | CI_T1=11.74% | CI_T2=81.87%
2026-02-13 01:08:29,096 - INFO - [Task 2 | ep 2 | step 225] loss=2.7357 | CI_T0=32.37% | CI_T1=15.70% | CI_T2=90.69%
2026-02-13 01:08:42,261 - INFO - [Task 2 | ep 2 | step 250] loss=2.8883 | CI_T0=59.21% | CI_T1=13.96% | CI_T2=92.43%
2026-02-13 01:08:59,266 - INFO - [Task 2 | ep 3 | step 275] loss=2.9045 | CI_T0=22.52% | CI_T1=8.58% | CI_T2=77.47%
2026-02-13 01:09:12,386 - INFO - [Task 2 | ep 3 | step 300] loss=3.2359 | CI_T0=42.95% | CI_T1=17.79% | CI_T2=87.52%
2026-02-13 01:09:25,709 - INFO - [Task 2 | ep 3 | step 325] loss=2.9407 | CI_T0=63.64% | CI_T1=13.53% | CI_T2=79.91%
2026-02-13 01:09:39,185 - INFO - [After Task 2] Task-IL : T0=89.69% | T1=84.18% | T2=99.09% | Avg=90.99%
2026-02-13 01:09:39,186 - INFO - [After Task 2] Class-IL: T0=57.83% | T1=14.59% | T2=81.43% | Avg=51.28%
2026-02-13 01:09:39,186 - INFO - ========== GROUP DIFFERENCES ==========
2026-02-13 01:09:39,186 - INFO - Seen tasks: 0..2 | valid_out_dim=6
2026-02-13 01:09:41,370 - INFO - [Group=Task0] CI_acc=57.83% | corr_slice_max=3.199 | best_other_max=3.020 | gap=0.179
2026-02-13 01:09:41,371 - INFO - [Group=Task0] winner_task_dist: W0=58.5% | W1=2.8% | W2=38.7%
2026-02-13 01:09:41,371 - INFO - [Group=Task0] slice_strength : S0=3.20 | S1=1.80 | S2=2.94
2026-02-13 01:09:43,534 - INFO - [Group=Task1] CI_acc=14.59% | corr_slice_max=2.926 | best_other_max=4.485 | gap=-1.559
2026-02-13 01:09:43,535 - INFO - [Group=Task1] winner_task_dist: W0=11.1% | W1=14.7% | W2=74.2%
2026-02-13 01:09:43,535 - INFO - [Group=Task1] slice_strength : S0=2.81 | S1=2.93 | S2=4.33
2026-02-13 01:09:45,721 - INFO - [Group=Task2] CI_acc=81.43% | corr_slice_max=5.115 | best_other_max=4.317 | gap=0.798
2026-02-13 01:09:45,721 - INFO - [Group=Task2] winner_task_dist: W0=17.4% | W1=1.1% | W2=81.5%
2026-02-13 01:09:45,721 - INFO - [Group=Task2] slice_strength : S0=4.24 | S1=2.61 | S2=5.12
2026-02-13 01:09:45,721 - INFO - ======================================
2026-02-13 01:09:45,722 - INFO - ========== Task 3: classes [6, 7] ==========
2026-02-13 01:10:27,991 - INFO - [Task 3 | ep 0 | step 0] loss=8.5772 | CI_T0=46.76% | CI_T1=19.37% | CI_T2=87.71% | CI_T3=0.00%
2026-02-13 01:10:45,308 - INFO - [Task 3 | ep 0 | step 25] loss=2.3925 | CI_T0=68.44% | CI_T1=13.46% | CI_T2=39.12% | CI_T3=92.59%
2026-02-13 01:11:02,800 - INFO - [Task 3 | ep 0 | step 50] loss=2.2018 | CI_T0=61.47% | CI_T1=30.59% | CI_T2=40.31% | CI_T3=98.55%
2026-02-13 01:11:20,287 - INFO - [Task 3 | ep 0 | step 75] loss=2.4313 | CI_T0=45.52% | CI_T1=29.96% | CI_T2=42.11% | CI_T3=98.83%
2026-02-13 01:11:41,389 - INFO - [Task 3 | ep 1 | step 100] loss=2.4530 | CI_T0=46.79% | CI_T1=22.63% | CI_T2=51.97% | CI_T3=98.32%
2026-02-13 01:11:58,651 - INFO - [Task 3 | ep 1 | step 125] loss=2.4679 | CI_T0=58.47% | CI_T1=27.28% | CI_T2=56.51% | CI_T3=98.36%
2026-02-13 01:12:16,114 - INFO - [Task 3 | ep 1 | step 150] loss=2.3761 | CI_T0=44.34% | CI_T1=28.94% | CI_T2=58.98% | CI_T3=97.67%
2026-02-13 01:12:33,475 - INFO - [Task 3 | ep 1 | step 175] loss=2.7436 | CI_T0=53.09% | CI_T1=25.75% | CI_T2=48.54% | CI_T3=98.63%
2026-02-13 01:12:54,962 - INFO - [Task 3 | ep 2 | step 200] loss=2.5546 | CI_T0=50.91% | CI_T1=30.16% | CI_T2=52.62% | CI_T3=98.42%
2026-02-13 01:13:12,486 - INFO - [Task 3 | ep 2 | step 225] loss=2.7865 | CI_T0=57.00% | CI_T1=25.47% | CI_T2=54.56% | CI_T3=98.63%
2026-02-13 01:13:30,060 - INFO - [Task 3 | ep 2 | step 250] loss=2.7053 | CI_T0=80.73% | CI_T1=29.05% | CI_T2=41.51% | CI_T3=99.00%
2026-02-13 01:13:47,424 - INFO - [Task 3 | ep 2 | step 275] loss=2.6911 | CI_T0=63.86% | CI_T1=30.81% | CI_T2=49.23% | CI_T3=98.55%
2026-02-13 01:14:08,842 - INFO - [Task 3 | ep 3 | step 300] loss=2.8973 | CI_T0=82.54% | CI_T1=31.29% | CI_T2=29.24% | CI_T3=98.02%
2026-02-13 01:14:26,429 - INFO - [Task 3 | ep 3 | step 325] loss=2.6697 | CI_T0=77.17% | CI_T1=31.93% | CI_T2=29.33% | CI_T3=97.64%
2026-02-13 01:14:43,952 - INFO - [Task 3 | ep 3 | step 350] loss=2.7793 | CI_T0=77.37% | CI_T1=30.10% | CI_T2=48.47% | CI_T3=98.70%
2026-02-13 01:15:01,436 - INFO - [Task 3 | ep 3 | step 375] loss=2.8536 | CI_T0=46.23% | CI_T1=35.06% | CI_T2=52.38% | CI_T3=97.47%
2026-02-13 01:15:19,093 - INFO - [After Task 3] Task-IL : T0=99.39% | T1=94.17% | T2=95.36% | T3=99.45% | Avg=97.09%
2026-02-13 01:15:19,094 - INFO - [After Task 3] Class-IL: T0=45.11% | T1=39.32% | T2=52.83% | T3=97.53% | Avg=58.70%
2026-02-13 01:15:19,094 - INFO - ========== GROUP DIFFERENCES ==========
2026-02-13 01:15:19,094 - INFO - Seen tasks: 0..3 | valid_out_dim=8
2026-02-13 01:15:21,287 - INFO - [Group=Task0] CI_acc=45.11% | corr_slice_max=4.485 | best_other_max=4.680 | gap=-0.195
2026-02-13 01:15:21,289 - INFO - [Group=Task0] winner_task_dist: W0=45.1% | W1=2.0% | W2=1.7% | W3=51.3%
2026-02-13 01:15:21,289 - INFO - [Group=Task0] slice_strength : S0=4.48 | S1=3.09 | S2=2.30 | S3=4.48
2026-02-13 01:15:23,456 - INFO - [Group=Task1] CI_acc=39.32% | corr_slice_max=3.640 | best_other_max=4.316 | gap=-0.676
2026-02-13 01:15:23,457 - INFO - [Group=Task1] winner_task_dist: W0=6.7% | W1=39.4% | W2=12.8% | W3=41.1%
2026-02-13 01:15:23,457 - INFO - [Group=Task1] slice_strength : S0=2.34 | S1=3.64 | S2=3.08 | S3=3.89
2026-02-13 01:15:25,628 - INFO - [Group=Task2] CI_acc=52.83% | corr_slice_max=4.903 | best_other_max=4.878 | gap=0.025
2026-02-13 01:15:25,629 - INFO - [Group=Task2] winner_task_dist: W0=3.6% | W1=5.6% | W2=53.1% | W3=37.7%
2026-02-13 01:15:25,629 - INFO - [Group=Task2] slice_strength : S0=2.23 | S1=2.75 | S2=4.90 | S3=4.58
2026-02-13 01:15:27,807 - INFO - [Group=Task3] CI_acc=97.53% | corr_slice_max=6.673 | best_other_max=4.524 | gap=2.149
2026-02-13 01:15:27,808 - INFO - [Group=Task3] winner_task_dist: W0=0.5% | W1=0.6% | W2=1.3% | W3=97.6%
2026-02-13 01:15:27,808 - INFO - [Group=Task3] slice_strength : S0=3.02 | S1=2.80 | S2=4.22 | S3=6.67
2026-02-13 01:15:27,808 - INFO - ======================================
2026-02-13 01:15:27,808 - INFO - ========== Task 4: classes [8, 9] ==========
2026-02-13 01:16:14,307 - INFO - [Task 4 | ep 0 | step 0] loss=9.7510 | CI_T0=70.91% | CI_T1=37.43% | CI_T2=59.98% | CI_T3=98.79% | CI_T4=0.01%
2026-02-13 01:16:36,067 - INFO - [Task 4 | ep 0 | step 25] loss=3.1205 | CI_T0=13.58% | CI_T1=7.56% | CI_T2=15.84% | CI_T3=27.51% | CI_T4=83.70%
2026-02-13 01:16:57,711 - INFO - [Task 4 | ep 0 | step 50] loss=2.7269 | CI_T0=19.79% | CI_T1=10.37% | CI_T2=15.18% | CI_T3=35.18% | CI_T4=95.15%
2026-02-13 01:17:19,338 - INFO - [Task 4 | ep 0 | step 75] loss=2.6897 | CI_T0=55.68% | CI_T1=16.73% | CI_T2=25.75% | CI_T3=31.90% | CI_T4=96.57%
2026-02-13 01:17:45,022 - INFO - [Task 4 | ep 1 | step 100] loss=2.7648 | CI_T0=45.22% | CI_T1=15.42% | CI_T2=24.06% | CI_T3=34.34% | CI_T4=95.98%
2026-02-13 01:18:06,677 - INFO - [Task 4 | ep 1 | step 125] loss=2.7945 | CI_T0=48.45% | CI_T1=16.76% | CI_T2=19.94% | CI_T3=31.02% | CI_T4=95.87%
2026-02-13 01:18:28,431 - INFO - [Task 4 | ep 1 | step 150] loss=2.7609 | CI_T0=69.06% | CI_T1=14.94% | CI_T2=16.26% | CI_T3=28.25% | CI_T4=95.77%
2026-02-13 01:18:50,165 - INFO - [Task 4 | ep 1 | step 175] loss=2.8722 | CI_T0=71.46% | CI_T1=19.45% | CI_T2=24.32% | CI_T3=31.26% | CI_T4=96.13%
2026-02-13 01:19:15,673 - INFO - [Task 4 | ep 2 | step 200] loss=2.7601 | CI_T0=49.15% | CI_T1=14.00% | CI_T2=16.31% | CI_T3=28.12% | CI_T4=97.13%
2026-02-13 01:19:37,291 - INFO - [Task 4 | ep 2 | step 225] loss=3.1908 | CI_T0=37.46% | CI_T1=21.50% | CI_T2=22.59% | CI_T3=17.85% | CI_T4=93.69%
2026-02-13 01:19:58,915 - INFO - [Task 4 | ep 2 | step 250] loss=3.0747 | CI_T0=69.53% | CI_T1=18.97% | CI_T2=27.28% | CI_T3=24.01% | CI_T4=95.85%
2026-02-13 01:20:20,711 - INFO - [Task 4 | ep 2 | step 275] loss=2.8240 | CI_T0=59.86% | CI_T1=19.47% | CI_T2=24.12% | CI_T3=50.95% | CI_T4=93.90%
2026-02-13 01:20:46,393 - INFO - [Task 4 | ep 3 | step 300] loss=2.9790 | CI_T0=35.04% | CI_T1=16.43% | CI_T2=25.36% | CI_T3=34.67% | CI_T4=95.49%
2026-02-13 01:21:08,167 - INFO - [Task 4 | ep 3 | step 325] loss=2.8830 | CI_T0=74.93% | CI_T1=12.58% | CI_T2=29.33% | CI_T3=45.84% | CI_T4=92.61%
2026-02-13 01:21:29,947 - INFO - [Task 4 | ep 3 | step 350] loss=3.0167 | CI_T0=52.61% | CI_T1=12.24% | CI_T2=30.29% | CI_T3=41.46% | CI_T4=95.86%
2026-02-13 01:21:52,042 - INFO - [After Task 4] Task-IL : T0=99.76% | T1=80.02% | T2=97.39% | T3=92.25% | T4=97.78% | Avg=93.44%
2026-02-13 01:21:52,043 - INFO - [After Task 4] Class-IL: T0=45.39% | T1=13.61% | T2=23.75% | T3=53.07% | T4=91.68% | Avg=45.50%
2026-02-13 01:21:52,044 - INFO - ========== GROUP DIFFERENCES ==========
2026-02-13 01:21:52,044 - INFO - Seen tasks: 0..4 | valid_out_dim=10
2026-02-13 01:21:54,244 - INFO - [Group=Task0] CI_acc=45.39% | corr_slice_max=5.206 | best_other_max=5.442 | gap=-0.236
2026-02-13 01:21:54,245 - INFO - [Group=Task0] winner_task_dist: W0=45.4% | W1=0.1% | W2=2.1% | W3=7.1% | W4=45.2%
2026-02-13 01:21:54,247 - INFO - [Group=Task0] slice_strength : S0=5.21 | S1=2.12 | S2=3.17 | S3=4.25 | S4=5.32
2026-02-13 01:21:56,426 - INFO - [Group=Task1] CI_acc=13.61% | corr_slice_max=3.250 | best_other_max=5.506 | gap=-2.255
2026-02-13 01:21:56,427 - INFO - [Group=Task1] winner_task_dist: W0=5.9% | W1=13.8% | W2=14.0% | W3=9.2% | W4=57.1%
2026-02-13 01:21:56,427 - INFO - [Group=Task1] slice_strength : S0=2.67 | S1=3.25 | S2=3.91 | S3=3.60 | S4=5.27
2026-02-13 01:21:58,614 - INFO - [Group=Task2] CI_acc=23.75% | corr_slice_max=5.073 | best_other_max=6.363 | gap=-1.290
2026-02-13 01:21:58,615 - INFO - [Group=Task2] winner_task_dist: W0=0.3% | W1=1.1% | W2=23.8% | W3=8.4% | W4=66.4%
2026-02-13 01:21:58,616 - INFO - [Group=Task2] slice_strength : S0=2.49 | S1=2.42 | S2=5.07 | S3=4.97 | S4=6.26
2026-02-13 01:22:00,804 - INFO - [Group=Task3] CI_acc=53.07% | corr_slice_max=5.748 | best_other_max=5.805 | gap=-0.057
2026-02-13 01:22:00,806 - INFO - [Group=Task3] winner_task_dist: W0=0.8% | W1=0.3% | W2=2.6% | W3=53.3% | W4=43.1%
2026-02-13 01:22:00,806 - INFO - [Group=Task3] slice_strength : S0=2.69 | S1=1.81 | S2=3.56 | S3=5.75 | S4=5.78
2026-02-13 01:22:02,992 - INFO - [Group=Task4] CI_acc=91.68% | corr_slice_max=7.311 | best_other_max=5.836 | gap=1.475
2026-02-13 01:22:02,993 - INFO - [Group=Task4] winner_task_dist: W0=0.3% | W1=0.3% | W2=1.4% | W3=5.6% | W4=92.4%
2026-02-13 01:22:02,993 - INFO - [Group=Task4] slice_strength : S0=2.72 | S1=2.39 | S2=4.22 | S3=5.47 | S4=7.31
2026-02-13 01:22:02,993 - INFO - ======================================
2026-02-13 01:22:02,993 - INFO - ========== FINAL METRICS (Class-IL) ==========
2026-02-13 01:22:02,993 - INFO - Forgetting per task: T0=54.52%, T1=73.07%, T2=57.68%, T3=44.46%, T4=0.00%
2026-02-13 01:22:02,993 - INFO - BWT: -57.43%
2026-02-13 01:22:02,993 - INFO - Final average Class-IL accuracy: 45.50%
