2026-02-11 21:27:34,921 - INFO - Device: cpu
2026-02-11 21:27:34,921 - INFO - Config: {'device': 'cpu', 'lr': 0.005, 'epochs_per_task': 4, 'batch_size': 128, 'lambda_slice': 2.0, 'lambda_feat': 0.5, 'new_weight': 0.8}
2026-02-11 21:27:34,923 - INFO - ========== Task 0: classes [0, 1] ==========
2026-02-11 21:27:42,041 - INFO - [Task 0 | ep 0 | step 0] loss=0.8633 c=0.8633 r=0.0000 | CI_T0=95.74%
2026-02-11 21:27:46,007 - INFO - [Task 0 | ep 0 | step 25] loss=0.0014 c=0.0014 r=0.0000 | CI_T0=99.93%
2026-02-11 21:27:49,991 - INFO - [Task 0 | ep 0 | step 50] loss=0.0007 c=0.0007 r=0.0000 | CI_T0=99.85%
2026-02-11 21:27:53,984 - INFO - [Task 0 | ep 0 | step 75] loss=0.0003 c=0.0003 r=0.0000 | CI_T0=99.97%
2026-02-11 21:28:01,585 - INFO - [Task 0 | ep 1 | step 100] loss=0.0003 c=0.0003 r=0.0000 | CI_T0=99.94%
2026-02-11 21:28:05,601 - INFO - [Task 0 | ep 1 | step 125] loss=0.0005 c=0.0005 r=0.0000 | CI_T0=99.94%
2026-02-11 21:28:09,574 - INFO - [Task 0 | ep 1 | step 150] loss=0.0003 c=0.0003 r=0.0000 | CI_T0=99.92%
2026-02-11 21:28:13,603 - INFO - [Task 0 | ep 1 | step 175] loss=0.0002 c=0.0002 r=0.0000 | CI_T0=99.94%
2026-02-11 21:28:21,121 - INFO - [Task 0 | ep 2 | step 200] loss=0.0001 c=0.0001 r=0.0000 | CI_T0=99.97%
2026-02-11 21:28:25,096 - INFO - [Task 0 | ep 2 | step 225] loss=0.0001 c=0.0001 r=0.0000 | CI_T0=99.94%
2026-02-11 21:28:29,062 - INFO - [Task 0 | ep 2 | step 250] loss=0.0003 c=0.0003 r=0.0000 | CI_T0=99.96%
2026-02-11 21:28:33,045 - INFO - [Task 0 | ep 2 | step 275] loss=0.0003 c=0.0003 r=0.0000 | CI_T0=99.97%
2026-02-11 21:28:40,540 - INFO - [Task 0 | ep 3 | step 300] loss=0.0001 c=0.0001 r=0.0000 | CI_T0=99.96%
2026-02-11 21:28:44,530 - INFO - [Task 0 | ep 3 | step 325] loss=0.0001 c=0.0001 r=0.0000 | CI_T0=99.96%
2026-02-11 21:28:48,513 - INFO - [Task 0 | ep 3 | step 350] loss=0.0005 c=0.0005 r=0.0000 | CI_T0=99.98%
2026-02-11 21:28:52,496 - INFO - [Task 0 | ep 3 | step 375] loss=0.0008 c=0.0008 r=0.0000 | CI_T0=99.98%
2026-02-11 21:28:56,877 - INFO - [After Task 0] Task-IL : T0=99.91% | Avg=99.91%
2026-02-11 21:28:56,877 - INFO - [After Task 0] Class-IL: T0=99.91% | Avg=99.91%
2026-02-11 21:28:56,877 - INFO - ========== GROUP DIFFERENCES ==========
2026-02-11 21:28:56,877 - INFO - Seen tasks: 0..0 | valid_out_dim=2
2026-02-11 21:28:58,875 - INFO - [Group=Task0] CI_acc=99.91% | corr_slice_max=5.001 | best_other_max=nan | gap=nan
2026-02-11 21:28:58,875 - INFO - [Group=Task0] winner_task_dist: W0=100.0%
2026-02-11 21:28:58,875 - INFO - [Group=Task0] slice_strength : S0=5.00
2026-02-11 21:28:58,875 - INFO - ======================================
2026-02-11 21:28:58,875 - INFO - ========== Task 1: classes [2, 3] ==========
2026-02-11 21:29:09,828 - INFO - [Task 1 | ep 0 | step 0] loss=6.7009 c=4.1655 r=2.5354 | CI_T0=99.98% | CI_T1=10.41%
2026-02-11 21:29:17,827 - INFO - [Task 1 | ep 0 | step 25] loss=1.6423 c=0.2730 r=1.3692 | CI_T0=16.56% | CI_T1=95.82%
2026-02-11 21:29:25,782 - INFO - [Task 1 | ep 0 | step 50] loss=1.2082 c=0.1898 r=1.0185 | CI_T0=2.36% | CI_T1=97.41%
2026-02-11 21:29:33,711 - INFO - [Task 1 | ep 0 | step 75] loss=1.0641 c=0.1751 r=0.8890 | CI_T0=9.62% | CI_T1=97.83%
2026-02-11 21:29:45,220 - INFO - [Task 1 | ep 1 | step 100] loss=1.0847 c=0.1829 r=0.9017 | CI_T0=17.01% | CI_T1=97.75%
2026-02-11 21:29:53,178 - INFO - [Task 1 | ep 1 | step 125] loss=0.8472 c=0.1939 r=0.6533 | CI_T0=8.36% | CI_T1=98.29%
2026-02-11 21:30:01,172 - INFO - [Task 1 | ep 1 | step 150] loss=1.0062 c=0.1492 r=0.8570 | CI_T0=0.04% | CI_T1=97.97%
2026-02-11 21:30:09,114 - INFO - [Task 1 | ep 1 | step 175] loss=1.1723 c=0.1350 r=1.0372 | CI_T0=10.63% | CI_T1=98.55%
2026-02-11 21:30:20,643 - INFO - [Task 1 | ep 2 | step 200] loss=1.2389 c=0.2043 r=1.0346 | CI_T0=7.92% | CI_T1=98.65%
2026-02-11 21:30:28,595 - INFO - [Task 1 | ep 2 | step 225] loss=1.1149 c=0.1113 r=1.0036 | CI_T0=0.70% | CI_T1=98.84%
2026-02-11 21:30:36,541 - INFO - [Task 1 | ep 2 | step 250] loss=0.8451 c=0.1261 r=0.7189 | CI_T0=11.03% | CI_T1=98.68%
2026-02-11 21:30:44,504 - INFO - [Task 1 | ep 2 | step 275] loss=0.7469 c=0.1441 r=0.6029 | CI_T0=7.94% | CI_T1=98.99%
2026-02-11 21:30:56,005 - INFO - [Task 1 | ep 3 | step 300] loss=0.7815 c=0.1335 r=0.6480 | CI_T0=14.75% | CI_T1=98.88%
2026-02-11 21:31:03,950 - INFO - [Task 1 | ep 3 | step 325] loss=0.8077 c=0.1150 r=0.6928 | CI_T0=0.05% | CI_T1=99.03%
2026-02-11 21:31:11,876 - INFO - [Task 1 | ep 3 | step 350] loss=0.6907 c=0.1339 r=0.5568 | CI_T0=1.00% | CI_T1=99.18%
2026-02-11 21:31:19,864 - INFO - [Task 1 | ep 3 | step 375] loss=1.3320 c=0.0909 r=1.2410 | CI_T0=7.11% | CI_T1=99.17%
2026-02-11 21:31:28,180 - INFO - [After Task 1] Task-IL : T0=99.91% | T1=98.92% | Avg=99.41%
2026-02-11 21:31:28,180 - INFO - [After Task 1] Class-IL: T0=6.15% | T1=98.92% | Avg=52.53%
2026-02-11 21:31:28,180 - INFO - ========== GROUP DIFFERENCES ==========
2026-02-11 21:31:28,180 - INFO - Seen tasks: 0..1 | valid_out_dim=4
2026-02-11 21:31:30,184 - INFO - [Group=Task0] CI_acc=6.15% | corr_slice_max=5.030 | best_other_max=6.586 | gap=-1.556
2026-02-11 21:31:30,184 - INFO - [Group=Task0] winner_task_dist: W0=6.1% | W1=93.9%
2026-02-11 21:31:30,184 - INFO - [Group=Task0] slice_strength : S0=5.03 | S1=6.59
2026-02-11 21:31:32,187 - INFO - [Group=Task1] CI_acc=98.92% | corr_slice_max=7.848 | best_other_max=2.651 | gap=5.197
2026-02-11 21:31:32,187 - INFO - [Group=Task1] winner_task_dist: W0=0.0% | W1=100.0%
2026-02-11 21:31:32,187 - INFO - [Group=Task1] slice_strength : S0=2.65 | S1=7.85
2026-02-11 21:31:32,187 - INFO - ======================================
2026-02-11 21:31:32,187 - INFO - ========== Task 2: classes [4, 5] ==========
2026-02-11 21:31:47,114 - INFO - [Task 2 | ep 0 | step 0] loss=9.4304 c=7.2157 r=2.2147 | CI_T0=12.52% | CI_T1=99.19% | CI_T2=0.00%
2026-02-11 21:31:58,931 - INFO - [Task 2 | ep 0 | step 25] loss=2.3306 c=0.7157 r=1.6149 | CI_T0=1.37% | CI_T1=9.78% | CI_T2=96.52%
2026-02-11 21:32:10,750 - INFO - [Task 2 | ep 0 | step 50] loss=2.1137 c=0.7083 r=1.4053 | CI_T0=2.98% | CI_T1=28.32% | CI_T2=95.95%
2026-02-11 21:32:22,522 - INFO - [Task 2 | ep 0 | step 75] loss=1.5927 c=0.5770 r=1.0157 | CI_T0=0.86% | CI_T1=26.96% | CI_T2=98.07%
2026-02-11 21:32:37,885 - INFO - [Task 2 | ep 1 | step 100] loss=1.7388 c=0.5147 r=1.2241 | CI_T0=6.47% | CI_T1=22.83% | CI_T2=98.70%
2026-02-11 21:32:49,569 - INFO - [Task 2 | ep 1 | step 125] loss=1.4016 c=0.4564 r=0.9451 | CI_T0=0.52% | CI_T1=20.63% | CI_T2=99.14%
2026-02-11 21:33:01,277 - INFO - [Task 2 | ep 1 | step 150] loss=1.3165 c=0.3809 r=0.9356 | CI_T0=2.27% | CI_T1=17.95% | CI_T2=99.55%
2026-02-11 21:33:16,569 - INFO - [Task 2 | ep 2 | step 175] loss=1.2130 c=0.3636 r=0.8494 | CI_T0=6.39% | CI_T1=15.26% | CI_T2=99.52%
2026-02-11 21:33:28,346 - INFO - [Task 2 | ep 2 | step 200] loss=1.0984 c=0.3509 r=0.7475 | CI_T0=0.69% | CI_T1=19.20% | CI_T2=99.65%
2026-02-11 21:33:40,081 - INFO - [Task 2 | ep 2 | step 225] loss=1.0606 c=0.3720 r=0.6886 | CI_T0=2.38% | CI_T1=16.74% | CI_T2=99.76%
2026-02-11 21:33:51,845 - INFO - [Task 2 | ep 2 | step 250] loss=1.2589 c=0.3640 r=0.8948 | CI_T0=10.90% | CI_T1=11.46% | CI_T2=99.75%
2026-02-11 21:34:07,153 - INFO - [Task 2 | ep 3 | step 275] loss=1.0761 c=0.3259 r=0.7501 | CI_T0=1.49% | CI_T1=15.92% | CI_T2=99.88%
2026-02-11 21:34:18,916 - INFO - [Task 2 | ep 3 | step 300] loss=1.3075 c=0.3384 r=0.9691 | CI_T0=0.78% | CI_T1=14.23% | CI_T2=99.87%
2026-02-11 21:34:30,742 - INFO - [Task 2 | ep 3 | step 325] loss=1.0627 c=0.2523 r=0.8103 | CI_T0=0.49% | CI_T1=15.29% | CI_T2=99.90%
2026-02-11 21:34:43,143 - INFO - [After Task 2] Task-IL : T0=99.91% | T1=97.65% | T2=99.84% | Avg=99.13%
2026-02-11 21:34:43,143 - INFO - [After Task 2] Class-IL: T0=1.13% | T1=10.53% | T2=99.79% | Avg=37.15%
2026-02-11 21:34:43,143 - INFO - ========== GROUP DIFFERENCES ==========
2026-02-11 21:34:43,143 - INFO - Seen tasks: 0..2 | valid_out_dim=6
2026-02-11 21:34:45,142 - INFO - [Group=Task0] CI_acc=1.13% | corr_slice_max=5.137 | best_other_max=8.447 | gap=-3.310
2026-02-11 21:34:45,142 - INFO - [Group=Task0] winner_task_dist: W0=1.1% | W1=3.3% | W2=95.6%
2026-02-11 21:34:45,143 - INFO - [Group=Task0] slice_strength : S0=5.14 | S1=6.61 | S2=8.43
2026-02-11 21:34:47,134 - INFO - [Group=Task1] CI_acc=10.53% | corr_slice_max=7.579 | best_other_max=9.607 | gap=-2.028
2026-02-11 21:34:47,134 - INFO - [Group=Task1] winner_task_dist: W0=0.0% | W1=10.5% | W2=89.4%
2026-02-11 21:34:47,134 - INFO - [Group=Task1] slice_strength : S0=2.54 | S1=7.58 | S2=9.61
2026-02-11 21:34:49,132 - INFO - [Group=Task2] CI_acc=99.79% | corr_slice_max=10.361 | best_other_max=6.694 | gap=3.666
2026-02-11 21:34:49,132 - INFO - [Group=Task2] winner_task_dist: W0=0.0% | W1=0.1% | W2=99.9%
2026-02-11 21:34:49,132 - INFO - [Group=Task2] slice_strength : S0=2.56 | S1=6.69 | S2=10.36
2026-02-11 21:34:49,132 - INFO - ======================================
2026-02-11 21:34:49,133 - INFO - ========== Task 3: classes [6, 7] ==========
2026-02-11 21:35:07,851 - INFO - [Task 3 | ep 0 | step 0] loss=11.0704 c=9.4846 r=1.5858 | CI_T0=0.63% | CI_T1=12.12% | CI_T2=99.78% | CI_T3=0.00%
2026-02-11 21:35:23,557 - INFO - [Task 3 | ep 0 | step 25] loss=2.9140 c=0.6707 r=2.2433 | CI_T0=0.57% | CI_T1=8.92% | CI_T2=35.20% | CI_T3=98.63%
2026-02-11 21:35:39,227 - INFO - [Task 3 | ep 0 | step 50] loss=2.0906 c=0.6214 r=1.4692 | CI_T0=0.06% | CI_T1=7.55% | CI_T2=60.34% | CI_T3=98.86%
2026-02-11 21:35:54,935 - INFO - [Task 3 | ep 0 | step 75] loss=2.0983 c=0.6174 r=1.4808 | CI_T0=0.02% | CI_T1=7.05% | CI_T2=61.94% | CI_T3=99.00%
2026-02-11 21:36:14,162 - INFO - [Task 3 | ep 1 | step 100] loss=1.8664 c=0.5359 r=1.3305 | CI_T0=0.01% | CI_T1=15.21% | CI_T2=62.72% | CI_T3=99.37%
2026-02-11 21:36:29,864 - INFO - [Task 3 | ep 1 | step 125] loss=1.9215 c=0.5318 r=1.3897 | CI_T0=0.00% | CI_T1=14.11% | CI_T2=59.46% | CI_T3=99.61%
2026-02-11 21:36:45,547 - INFO - [Task 3 | ep 1 | step 150] loss=2.1274 c=0.5241 r=1.6033 | CI_T0=0.01% | CI_T1=11.98% | CI_T2=58.06% | CI_T3=99.64%
2026-02-11 21:37:01,267 - INFO - [Task 3 | ep 1 | step 175] loss=1.6842 c=0.4828 r=1.2014 | CI_T0=0.00% | CI_T1=15.52% | CI_T2=54.96% | CI_T3=99.73%
2026-02-11 21:37:20,538 - INFO - [Task 3 | ep 2 | step 200] loss=1.5110 c=0.4358 r=1.0752 | CI_T0=0.01% | CI_T1=20.05% | CI_T2=49.13% | CI_T3=99.85%
2026-02-11 21:37:36,204 - INFO - [Task 3 | ep 2 | step 225] loss=1.6778 c=0.4746 r=1.2032 | CI_T0=0.00% | CI_T1=23.31% | CI_T2=50.10% | CI_T3=99.88%
2026-02-11 21:37:51,913 - INFO - [Task 3 | ep 2 | step 250] loss=1.3845 c=0.4380 r=0.9466 | CI_T0=0.00% | CI_T1=15.08% | CI_T2=50.06% | CI_T3=99.89%
2026-02-11 21:38:07,634 - INFO - [Task 3 | ep 2 | step 275] loss=1.4586 c=0.4557 r=1.0029 | CI_T0=0.00% | CI_T1=19.05% | CI_T2=45.88% | CI_T3=99.94%
2026-02-11 21:38:26,845 - INFO - [Task 3 | ep 3 | step 300] loss=1.4636 c=0.4526 r=1.0110 | CI_T0=0.00% | CI_T1=13.46% | CI_T2=44.78% | CI_T3=99.93%
2026-02-11 21:38:42,644 - INFO - [Task 3 | ep 3 | step 325] loss=1.2500 c=0.3940 r=0.8560 | CI_T0=0.00% | CI_T1=16.36% | CI_T2=42.65% | CI_T3=99.93%
2026-02-11 21:38:58,345 - INFO - [Task 3 | ep 3 | step 350] loss=1.4064 c=0.3857 r=1.0207 | CI_T0=0.00% | CI_T1=15.43% | CI_T2=43.06% | CI_T3=99.95%
2026-02-11 21:39:14,056 - INFO - [Task 3 | ep 3 | step 375] loss=1.1847 c=0.3726 r=0.8122 | CI_T0=0.00% | CI_T1=17.01% | CI_T2=43.57% | CI_T3=99.95%
2026-02-11 21:39:30,319 - INFO - [After Task 3] Task-IL : T0=99.91% | T1=98.19% | T2=99.84% | T3=99.95% | Avg=99.47%
2026-02-11 21:39:30,319 - INFO - [After Task 3] Class-IL: T0=0.00% | T1=14.89% | T2=40.88% | T3=99.90% | Avg=38.92%
2026-02-11 21:39:30,319 - INFO - ========== GROUP DIFFERENCES ==========
2026-02-11 21:39:30,319 - INFO - Seen tasks: 0..3 | valid_out_dim=8
2026-02-11 21:39:32,313 - INFO - [Group=Task0] CI_acc=0.00% | corr_slice_max=5.511 | best_other_max=10.267 | gap=-4.756
2026-02-11 21:39:32,313 - INFO - [Group=Task0] winner_task_dist: W0=0.0% | W1=0.3% | W2=6.1% | W3=93.6%
2026-02-11 21:39:32,313 - INFO - [Group=Task0] slice_strength : S0=5.51 | S1=6.99 | S2=8.43 | S3=10.22
2026-02-11 21:39:34,305 - INFO - [Group=Task1] CI_acc=14.89% | corr_slice_max=8.074 | best_other_max=10.086 | gap=-2.012
2026-02-11 21:39:34,305 - INFO - [Group=Task1] winner_task_dist: W0=0.0% | W1=14.9% | W2=24.5% | W3=60.6%
2026-02-11 21:39:34,305 - INFO - [Group=Task1] slice_strength : S0=3.01 | S1=8.07 | S2=8.63 | S3=9.49
2026-02-11 21:39:36,305 - INFO - [Group=Task2] CI_acc=40.88% | corr_slice_max=9.417 | best_other_max=9.938 | gap=-0.521
2026-02-11 21:39:36,305 - INFO - [Group=Task2] winner_task_dist: W0=0.0% | W1=0.8% | W2=40.9% | W3=58.3%
2026-02-11 21:39:36,305 - INFO - [Group=Task2] slice_strength : S0=2.85 | S1=7.00 | S2=9.42 | S3=9.75
2026-02-11 21:39:38,307 - INFO - [Group=Task3] CI_acc=99.90% | corr_slice_max=12.111 | best_other_max=8.585 | gap=3.525
2026-02-11 21:39:38,307 - INFO - [Group=Task3] winner_task_dist: W0=0.0% | W1=0.0% | W2=0.1% | W3=99.9%
2026-02-11 21:39:38,307 - INFO - [Group=Task3] slice_strength : S0=2.78 | S1=6.64 | S2=8.56 | S3=12.11
2026-02-11 21:39:38,307 - INFO - ======================================
2026-02-11 21:39:38,307 - INFO - ========== Task 4: classes [8, 9] ==========
2026-02-11 21:40:01,013 - INFO - [Task 4 | ep 0 | step 0] loss=13.9179 c=11.0291 r=2.8889 | CI_T0=0.00% | CI_T1=18.81% | CI_T2=45.69% | CI_T3=99.94% | CI_T4=0.00%
2026-02-11 21:40:20,648 - INFO - [Task 4 | ep 0 | step 25] loss=3.4355 c=0.7484 r=2.6871 | CI_T0=0.00% | CI_T1=1.65% | CI_T2=4.44% | CI_T3=16.69% | CI_T4=95.08%
2026-02-11 21:40:40,279 - INFO - [Task 4 | ep 0 | step 50] loss=2.7386 c=1.0240 r=1.7146 | CI_T0=0.00% | CI_T1=0.09% | CI_T2=1.31% | CI_T3=21.97% | CI_T4=97.49%
2026-02-11 21:40:59,823 - INFO - [Task 4 | ep 0 | step 75] loss=2.4170 c=0.7739 r=1.6431 | CI_T0=0.00% | CI_T1=0.01% | CI_T2=2.41% | CI_T3=22.71% | CI_T4=98.01%
2026-02-11 21:41:22,935 - INFO - [Task 4 | ep 1 | step 100] loss=2.0863 c=0.7146 r=1.3717 | CI_T0=0.00% | CI_T1=0.01% | CI_T2=2.21% | CI_T3=18.57% | CI_T4=98.32%
2026-02-11 21:41:42,529 - INFO - [Task 4 | ep 1 | step 125] loss=2.1813 c=0.6222 r=1.5591 | CI_T0=0.00% | CI_T1=0.00% | CI_T2=2.67% | CI_T3=18.99% | CI_T4=98.53%
2026-02-11 21:42:02,217 - INFO - [Task 4 | ep 1 | step 150] loss=2.0232 c=0.6550 r=1.3682 | CI_T0=0.00% | CI_T1=0.00% | CI_T2=2.83% | CI_T3=13.17% | CI_T4=98.79%
2026-02-11 21:42:21,873 - INFO - [Task 4 | ep 1 | step 175] loss=1.8680 c=0.5879 r=1.2801 | CI_T0=0.00% | CI_T1=0.00% | CI_T2=2.54% | CI_T3=14.33% | CI_T4=99.02%
2026-02-11 21:42:45,102 - INFO - [Task 4 | ep 2 | step 200] loss=1.8220 c=0.6203 r=1.2017 | CI_T0=0.00% | CI_T1=0.00% | CI_T2=2.54% | CI_T3=11.90% | CI_T4=99.03%
2026-02-11 21:43:04,839 - INFO - [Task 4 | ep 2 | step 225] loss=1.8151 c=0.6402 r=1.1749 | CI_T0=0.00% | CI_T1=0.00% | CI_T2=2.48% | CI_T3=12.68% | CI_T4=99.23%
2026-02-11 21:43:24,581 - INFO - [Task 4 | ep 2 | step 250] loss=1.6218 c=0.5767 r=1.0451 | CI_T0=0.00% | CI_T1=0.00% | CI_T2=2.05% | CI_T3=10.74% | CI_T4=99.16%
2026-02-11 21:43:44,231 - INFO - [Task 4 | ep 2 | step 275] loss=2.0098 c=0.6287 r=1.3810 | CI_T0=0.00% | CI_T1=0.01% | CI_T2=2.50% | CI_T3=10.66% | CI_T4=99.26%
2026-02-11 21:44:07,377 - INFO - [Task 4 | ep 3 | step 300] loss=1.7913 c=0.6414 r=1.1499 | CI_T0=0.00% | CI_T1=0.00% | CI_T2=2.00% | CI_T3=14.96% | CI_T4=99.39%
2026-02-11 21:44:27,090 - INFO - [Task 4 | ep 3 | step 325] loss=1.4652 c=0.5082 r=0.9569 | CI_T0=0.00% | CI_T1=0.00% | CI_T2=1.74% | CI_T3=9.84% | CI_T4=99.47%
2026-02-11 21:44:46,663 - INFO - [Task 4 | ep 3 | step 350] loss=1.5108 c=0.4567 r=1.0541 | CI_T0=0.00% | CI_T1=0.01% | CI_T2=2.58% | CI_T3=12.06% | CI_T4=99.48%
2026-02-11 21:45:06,983 - INFO - [After Task 4] Task-IL : T0=99.91% | T1=98.38% | T2=99.73% | T3=99.50% | T4=99.04% | Avg=99.31%
2026-02-11 21:45:06,983 - INFO - [After Task 4] Class-IL: T0=0.00% | T1=0.00% | T2=2.29% | T3=15.31% | T4=99.04% | Avg=23.33%
2026-02-11 21:45:06,983 - INFO - ========== GROUP DIFFERENCES ==========
2026-02-11 21:45:06,983 - INFO - Seen tasks: 0..4 | valid_out_dim=10
2026-02-11 21:45:08,980 - INFO - [Group=Task0] CI_acc=0.00% | corr_slice_max=5.399 | best_other_max=12.069 | gap=-6.670
2026-02-11 21:45:08,980 - INFO - [Group=Task0] winner_task_dist: W0=0.0% | W1=0.0% | W2=0.0% | W3=0.9% | W4=99.1%
2026-02-11 21:45:08,980 - INFO - [Group=Task0] slice_strength : S0=5.40 | S1=6.75 | S2=8.22 | S3=9.19 | S4=12.07
2026-02-11 21:45:10,998 - INFO - [Group=Task1] CI_acc=0.00% | corr_slice_max=7.547 | best_other_max=12.102 | gap=-4.555
2026-02-11 21:45:10,998 - INFO - [Group=Task1] winner_task_dist: W0=0.0% | W1=0.0% | W2=2.1% | W3=3.2% | W4=94.7%
2026-02-11 21:45:10,998 - INFO - [Group=Task1] slice_strength : S0=2.71 | S1=7.55 | S2=9.11 | S3=8.87 | S4=12.08
2026-02-11 21:45:13,000 - INFO - [Group=Task2] CI_acc=2.29% | corr_slice_max=9.997 | best_other_max=12.951 | gap=-2.954
2026-02-11 21:45:13,000 - INFO - [Group=Task2] winner_task_dist: W0=0.0% | W1=0.0% | W2=2.3% | W3=0.2% | W4=97.5%
2026-02-11 21:45:13,000 - INFO - [Group=Task2] slice_strength : S0=2.52 | S1=6.59 | S2=10.00 | S3=9.23 | S4=12.95
2026-02-11 21:45:15,007 - INFO - [Group=Task3] CI_acc=15.31% | corr_slice_max=10.296 | best_other_max=12.376 | gap=-2.080
2026-02-11 21:45:15,007 - INFO - [Group=Task3] winner_task_dist: W0=0.0% | W1=0.0% | W2=0.0% | W3=15.3% | W4=84.7%
2026-02-11 21:45:15,007 - INFO - [Group=Task3] slice_strength : S0=2.71 | S1=6.46 | S2=8.86 | S3=10.30 | S4=12.37
2026-02-11 21:45:17,004 - INFO - [Group=Task4] CI_acc=99.04% | corr_slice_max=13.733 | best_other_max=9.976 | gap=3.758
2026-02-11 21:45:17,004 - INFO - [Group=Task4] winner_task_dist: W0=0.0% | W1=0.0% | W2=0.0% | W3=0.1% | W4=99.9%
2026-02-11 21:45:17,004 - INFO - [Group=Task4] slice_strength : S0=2.88 | S1=6.92 | S2=9.35 | S3=9.78 | S4=13.73
2026-02-11 21:45:17,004 - INFO - ======================================
2026-02-11 21:45:17,005 - INFO - ========== FINAL METRICS (Class-IL) ==========
2026-02-11 21:45:17,005 - INFO - Forgetting per task: T0=99.91%, T1=98.92%, T2=97.49%, T3=84.59%, T4=0.00%
2026-02-11 21:45:17,005 - INFO - BWT: -95.23%
2026-02-11 21:45:17,005 - INFO - Final average Class-IL accuracy: 23.33%
