2026-02-11 19:25:19,975 - INFO - Device: cpu
2026-02-11 19:25:19,975 - INFO - Config: {'device': 'cpu', 'lr': 0.005, 'epochs_per_task': 4, 'batch_size': 128, 'lambda_slice': 2.0, 'lambda_feat': 0.5, 'use_cosine_head': True, 'seed': 42, 'freeze_backbone_after_task': -1, 'ewc_lambda': 0.0, 'si_lambda': 0.0, 'use_attention_backbone': False, 'use_adapters': False, 'lambda_slice_balance': 0.0, 'lambda_slice_margin': 0.0, 'slice_margin': 0.5, 'use_task_inference': True, 'lambda_task_inference': 1.0}
2026-02-11 19:25:19,978 - INFO - ========== Training Task 0: classes [0, 1] ==========
2026-02-11 19:25:27,531 - INFO - [Task 0 | ep 0 | step 0] loss=0.7131 c=0.7131 r=0.0000 | CI_T0=96.32%
2026-02-11 19:25:31,754 - INFO - [Task 0 | ep 0 | step 25] loss=0.0003 c=0.0003 r=0.0000 | CI_T0=99.55%
2026-02-11 19:25:35,874 - INFO - [Task 0 | ep 0 | step 50] loss=0.0073 c=0.0073 r=0.0000 | CI_T0=99.87%
2026-02-11 19:25:39,972 - INFO - [Task 0 | ep 0 | step 75] loss=0.0055 c=0.0055 r=0.0000 | CI_T0=99.79%
2026-02-11 19:25:47,716 - INFO - [Task 0 | ep 1 | step 100] loss=0.0009 c=0.0009 r=0.0000 | CI_T0=99.94%
2026-02-11 19:25:51,827 - INFO - [Task 0 | ep 1 | step 125] loss=0.0014 c=0.0014 r=0.0000 | CI_T0=99.92%
2026-02-11 19:25:55,954 - INFO - [Task 0 | ep 1 | step 150] loss=0.0003 c=0.0003 r=0.0000 | CI_T0=99.95%
2026-02-11 19:26:00,046 - INFO - [Task 0 | ep 1 | step 175] loss=0.0026 c=0.0026 r=0.0000 | CI_T0=99.94%
2026-02-11 19:26:07,664 - INFO - [Task 0 | ep 2 | step 200] loss=0.0003 c=0.0003 r=0.0000 | CI_T0=99.95%
2026-02-11 19:26:11,773 - INFO - [Task 0 | ep 2 | step 225] loss=0.0018 c=0.0018 r=0.0000 | CI_T0=99.96%
2026-02-11 19:26:15,849 - INFO - [Task 0 | ep 2 | step 250] loss=0.0067 c=0.0067 r=0.0000 | CI_T0=99.97%
2026-02-11 19:26:19,930 - INFO - [Task 0 | ep 2 | step 275] loss=0.0003 c=0.0003 r=0.0000 | CI_T0=99.94%
2026-02-11 19:26:27,797 - INFO - [Task 0 | ep 3 | step 300] loss=0.0004 c=0.0004 r=0.0000 | CI_T0=99.94%
2026-02-11 19:26:31,965 - INFO - [Task 0 | ep 3 | step 325] loss=0.0215 c=0.0215 r=0.0000 | CI_T0=99.97%
2026-02-11 19:26:36,119 - INFO - [Task 0 | ep 3 | step 350] loss=0.0003 c=0.0003 r=0.0000 | CI_T0=99.95%
2026-02-11 19:26:40,226 - INFO - [Task 0 | ep 3 | step 375] loss=0.0000 c=0.0000 r=0.0000 | CI_T0=99.99%
2026-02-11 19:26:44,705 - INFO - [After Task 0] Task-IL : T0=99.95% | Avg=99.95%
2026-02-11 19:26:44,705 - INFO - [After Task 0] Class-IL: T0=99.95% | Avg=99.95%
2026-02-11 19:26:44,706 - INFO - ========== GROUP DIFFERENCES ==========
2026-02-11 19:26:44,706 - INFO - Seen tasks: 0..0 | valid_out_dim=2
2026-02-11 19:26:46,787 - INFO - [Group=Task0] CI_acc=99.95% | corr_slice_max=5.541 | best_other_max=nan | gap=nan
2026-02-11 19:26:46,787 - INFO - [Group=Task0] winner_task_dist: W0=100.0%
2026-02-11 19:26:46,787 - INFO - [Group=Task0] slice_strength : S0=5.54
2026-02-11 19:26:46,787 - INFO - ======================================
2026-02-11 19:26:46,788 - INFO - ========== Training Task 1: classes [2, 3] ==========
2026-02-11 19:26:58,024 - INFO - [Task 1 | ep 0 | step 0] loss=19.5859 c=4.7118 r=3.5093 | taskInf=11.3648 | CI_T0=99.98% | CI_T1=0.70%
2026-02-11 19:27:05,950 - INFO - [Task 1 | ep 0 | step 25] loss=5.1117 c=0.7572 r=3.8244 | taskInf=0.5301 | CI_T0=53.09% | CI_T1=66.96%
2026-02-11 19:27:13,961 - INFO - [Task 1 | ep 0 | step 50] loss=3.5008 c=0.4007 r=2.8573 | taskInf=0.2427 | CI_T0=52.74% | CI_T1=76.95%
2026-02-11 19:27:22,130 - INFO - [Task 1 | ep 0 | step 75] loss=4.1520 c=0.2504 r=3.7083 | taskInf=0.1933 | CI_T0=52.73% | CI_T1=81.72%
2026-02-11 19:27:33,939 - INFO - [Task 1 | ep 1 | step 100] loss=3.7644 c=0.3430 r=3.1958 | taskInf=0.2257 | CI_T0=52.87% | CI_T1=79.26%
2026-02-11 19:27:42,161 - INFO - [Task 1 | ep 1 | step 125] loss=3.3439 c=0.2218 r=2.9107 | taskInf=0.2114 | CI_T0=50.83% | CI_T1=94.96%
2026-02-11 19:27:50,361 - INFO - [Task 1 | ep 1 | step 150] loss=3.8651 c=0.2751 r=3.3904 | taskInf=0.1996 | CI_T0=51.69% | CI_T1=85.47%
2026-02-11 19:27:58,625 - INFO - [Task 1 | ep 1 | step 175] loss=3.2081 c=0.3662 r=2.6053 | taskInf=0.2366 | CI_T0=52.03% | CI_T1=86.79%
2026-02-11 19:28:10,220 - INFO - [Task 1 | ep 2 | step 200] loss=3.5379 c=0.2253 r=3.0927 | taskInf=0.2199 | CI_T0=42.28% | CI_T1=94.54%
2026-02-11 19:28:18,217 - INFO - [Task 1 | ep 2 | step 225] loss=3.3941 c=0.2399 r=2.9531 | taskInf=0.2011 | CI_T0=52.84% | CI_T1=81.13%
2026-02-11 19:28:26,156 - INFO - [Task 1 | ep 2 | step 250] loss=3.1387 c=0.2150 r=2.7196 | taskInf=0.2041 | CI_T0=52.07% | CI_T1=85.46%
2026-02-11 19:28:34,034 - INFO - [Task 1 | ep 2 | step 275] loss=3.3644 c=0.1536 r=3.0116 | taskInf=0.1993 | CI_T0=51.52% | CI_T1=92.64%
2026-02-11 19:28:45,393 - INFO - [Task 1 | ep 3 | step 300] loss=3.5148 c=0.2186 r=3.0800 | taskInf=0.2163 | CI_T0=52.10% | CI_T1=91.26%
2026-02-11 19:28:53,439 - INFO - [Task 1 | ep 3 | step 325] loss=3.8734 c=0.2684 r=3.3987 | taskInf=0.2063 | CI_T0=52.26% | CI_T1=87.18%
2026-02-11 19:29:01,493 - INFO - [Task 1 | ep 3 | step 350] loss=3.3235 c=0.2376 r=2.8585 | taskInf=0.2275 | CI_T0=46.99% | CI_T1=93.74%
2026-02-11 19:29:09,526 - INFO - [Task 1 | ep 3 | step 375] loss=4.0659 c=0.2106 r=3.6445 | taskInf=0.2108 | CI_T0=51.81% | CI_T1=92.17%
2026-02-11 19:29:17,981 - INFO - [After Task 1] Task-IL : T0=53.66% | T1=99.31% | Avg=76.49%
2026-02-11 19:29:17,981 - INFO - [After Task 1] Class-IL: T0=52.25% | T1=92.26% | Avg=72.25%
2026-02-11 19:29:17,981 - INFO - ========== GROUP DIFFERENCES ==========
2026-02-11 19:29:17,981 - INFO - Seen tasks: 0..1 | valid_out_dim=4
2026-02-11 19:29:20,009 - INFO - [Group=Task0] CI_acc=52.25% | corr_slice_max=2.748 | best_other_max=3.941 | gap=-1.194
2026-02-11 19:29:20,009 - INFO - [Group=Task0] winner_task_dist: W0=52.3% | W1=47.7%
2026-02-11 19:29:20,009 - INFO - [Group=Task0] slice_strength : S0=2.75 | S1=3.94
2026-02-11 19:29:22,047 - INFO - [Group=Task1] CI_acc=92.26% | corr_slice_max=5.939 | best_other_max=1.703 | gap=4.236
2026-02-11 19:29:22,047 - INFO - [Group=Task1] winner_task_dist: W0=7.1% | W1=92.9%
2026-02-11 19:29:22,047 - INFO - [Group=Task1] slice_strength : S0=1.70 | S1=5.94
2026-02-11 19:29:22,047 - INFO - ======================================
2026-02-11 19:29:22,047 - INFO - ========== Training Task 2: classes [4, 5] ==========
2026-02-11 19:29:37,061 - INFO - [Task 2 | ep 0 | step 0] loss=21.2727 c=5.7505 r=4.2663 | taskInf=11.2560 | CI_T0=0.00% | CI_T1=99.48% | CI_T2=0.00%
2026-02-11 19:29:49,176 - INFO - [Task 2 | ep 0 | step 25] loss=5.9307 c=0.1661 r=5.7011 | taskInf=0.0634 | CI_T0=0.00% | CI_T1=0.02% | CI_T2=97.23%
2026-02-11 19:30:01,519 - INFO - [Task 2 | ep 0 | step 50] loss=5.6397 c=0.1799 r=5.2899 | taskInf=0.1699 | CI_T0=12.76% | CI_T1=0.14% | CI_T2=95.42%
2026-02-11 19:30:13,923 - INFO - [Task 2 | ep 0 | step 75] loss=5.2260 c=0.2342 r=4.7409 | taskInf=0.2509 | CI_T0=53.05% | CI_T1=2.98% | CI_T2=92.04%
2026-02-11 19:30:29,769 - INFO - [Task 2 | ep 1 | step 100] loss=4.8210 c=0.2288 r=4.2950 | taskInf=0.2972 | CI_T0=52.93% | CI_T1=5.00% | CI_T2=93.58%
2026-02-11 19:30:41,688 - INFO - [Task 2 | ep 1 | step 125] loss=4.9891 c=0.1311 r=4.5844 | taskInf=0.2736 | CI_T0=0.00% | CI_T1=0.00% | CI_T2=98.65%
2026-02-11 19:30:53,651 - INFO - [Task 2 | ep 1 | step 150] loss=4.7606 c=0.2382 r=4.1562 | taskInf=0.3662 | CI_T0=40.98% | CI_T1=13.51% | CI_T2=95.52%
2026-02-11 19:31:08,919 - INFO - [Task 2 | ep 2 | step 175] loss=4.6284 c=0.2217 r=3.9893 | taskInf=0.4174 | CI_T0=51.91% | CI_T1=1.06% | CI_T2=98.40%
2026-02-11 19:31:22,796 - INFO - [Task 2 | ep 2 | step 200] loss=4.6587 c=0.2039 r=4.0521 | taskInf=0.4028 | CI_T0=39.76% | CI_T1=0.09% | CI_T2=97.81%
2026-02-11 19:31:36,041 - INFO - [Task 2 | ep 2 | step 225] loss=4.6384 c=0.2361 r=3.9634 | taskInf=0.4388 | CI_T0=8.05% | CI_T1=0.33% | CI_T2=99.17%
2026-02-11 19:31:47,874 - INFO - [Task 2 | ep 2 | step 250] loss=4.5080 c=0.1875 r=3.8934 | taskInf=0.4271 | CI_T0=47.95% | CI_T1=0.81% | CI_T2=99.48%
2026-02-11 19:32:03,258 - INFO - [Task 2 | ep 3 | step 275] loss=4.1070 c=0.1835 r=3.4615 | taskInf=0.4621 | CI_T0=0.66% | CI_T1=0.38% | CI_T2=99.58%
2026-02-11 19:32:15,221 - INFO - [Task 2 | ep 3 | step 300] loss=4.3985 c=0.1716 r=3.7614 | taskInf=0.4655 | CI_T0=26.08% | CI_T1=0.32% | CI_T2=99.43%
2026-02-11 19:32:27,136 - INFO - [Task 2 | ep 3 | step 325] loss=3.8516 c=0.1397 r=3.2468 | taskInf=0.4651 | CI_T0=14.45% | CI_T1=0.61% | CI_T2=99.69%
2026-02-11 19:32:39,734 - INFO - [After Task 2] Task-IL : T0=53.66% | T1=85.80% | T2=99.68% | Avg=79.71%
2026-02-11 19:32:39,734 - INFO - [After Task 2] Class-IL: T0=0.00% | T1=0.78% | T2=99.68% | Avg=33.49%
2026-02-11 19:32:39,734 - INFO - ========== GROUP DIFFERENCES ==========
2026-02-11 19:32:39,734 - INFO - Seen tasks: 0..2 | valid_out_dim=6
2026-02-11 19:32:41,734 - INFO - [Group=Task0] CI_acc=0.00% | corr_slice_max=1.875 | best_other_max=3.906 | gap=-2.031
2026-02-11 19:32:41,734 - INFO - [Group=Task0] winner_task_dist: W0=0.0% | W1=4.6% | W2=95.4%
2026-02-11 19:32:41,734 - INFO - [Group=Task0] slice_strength : S0=1.87 | S1=2.00 | S2=3.89
2026-02-11 19:32:43,688 - INFO - [Group=Task1] CI_acc=0.78% | corr_slice_max=3.621 | best_other_max=5.500 | gap=-1.878
2026-02-11 19:32:43,689 - INFO - [Group=Task1] winner_task_dist: W0=4.6% | W1=0.8% | W2=94.7%
2026-02-11 19:32:43,689 - INFO - [Group=Task1] slice_strength : S0=1.01 | S1=3.62 | S2=5.49
2026-02-11 19:32:45,652 - INFO - [Group=Task2] CI_acc=99.68% | corr_slice_max=6.637 | best_other_max=3.604 | gap=3.033
2026-02-11 19:32:45,652 - INFO - [Group=Task2] winner_task_dist: W0=0.0% | W1=0.0% | W2=100.0%
2026-02-11 19:32:45,652 - INFO - [Group=Task2] slice_strength : S0=0.34 | S1=3.59 | S2=6.64
2026-02-11 19:32:45,653 - INFO - ======================================
2026-02-11 19:32:45,653 - INFO - ========== Training Task 3: classes [6, 7] ==========
2026-02-11 19:33:04,224 - INFO - [Task 3 | ep 0 | step 0] loss=19.8309 c=6.0142 r=3.3490 | taskInf=10.4676 | CI_T0=52.89% | CI_T1=44.91% | CI_T2=73.43% | CI_T3=0.00%
2026-02-11 19:33:19,781 - INFO - [Task 3 | ep 0 | step 25] loss=9.1873 c=2.8153 r=4.3129 | taskInf=2.0591 | CI_T0=47.47% | CI_T1=16.10% | CI_T2=79.61% | CI_T3=14.85%
2026-02-11 19:33:35,414 - INFO - [Task 3 | ep 0 | step 50] loss=5.7902 c=0.2614 r=4.9827 | taskInf=0.5462 | CI_T0=0.00% | CI_T1=0.00% | CI_T2=0.02% | CI_T3=97.86%
2026-02-11 19:33:51,088 - INFO - [Task 3 | ep 0 | step 75] loss=5.5193 c=0.2483 r=4.7259 | taskInf=0.5452 | CI_T0=0.00% | CI_T1=0.00% | CI_T2=0.04% | CI_T3=99.53%
2026-02-11 19:34:10,234 - INFO - [Task 3 | ep 1 | step 100] loss=5.1750 c=0.2883 r=4.2726 | taskInf=0.6141 | CI_T0=0.00% | CI_T1=0.00% | CI_T2=0.00% | CI_T3=99.69%
2026-02-11 19:34:25,840 - INFO - [Task 3 | ep 1 | step 125] loss=5.0678 c=0.3414 r=4.0534 | taskInf=0.6730 | CI_T0=0.00% | CI_T1=0.00% | CI_T2=0.00% | CI_T3=99.75%
2026-02-11 19:34:41,482 - INFO - [Task 3 | ep 1 | step 150] loss=5.0213 c=0.2584 r=4.1405 | taskInf=0.6224 | CI_T0=0.00% | CI_T1=0.00% | CI_T2=0.00% | CI_T3=99.75%
2026-02-11 19:34:57,043 - INFO - [Task 3 | ep 1 | step 175] loss=5.0740 c=0.2233 r=4.2779 | taskInf=0.5729 | CI_T0=0.00% | CI_T1=0.00% | CI_T2=0.00% | CI_T3=99.86%
2026-02-11 19:35:16,081 - INFO - [Task 3 | ep 2 | step 200] loss=4.9089 c=0.2092 r=4.1017 | taskInf=0.5979 | CI_T0=0.00% | CI_T1=0.00% | CI_T2=0.00% | CI_T3=99.87%
2026-02-11 19:35:31,695 - INFO - [Task 3 | ep 2 | step 225] loss=4.8587 c=0.3018 r=3.9069 | taskInf=0.6499 | CI_T0=0.00% | CI_T1=0.00% | CI_T2=0.00% | CI_T3=99.79%
2026-02-11 19:35:47,367 - INFO - [Task 3 | ep 2 | step 250] loss=4.8840 c=0.2625 r=3.9929 | taskInf=0.6286 | CI_T0=0.00% | CI_T1=0.00% | CI_T2=0.00% | CI_T3=99.88%
2026-02-11 19:36:03,064 - INFO - [Task 3 | ep 2 | step 275] loss=4.7328 c=0.2235 r=3.9050 | taskInf=0.6043 | CI_T0=0.00% | CI_T1=0.00% | CI_T2=0.00% | CI_T3=99.93%
2026-02-11 19:36:22,284 - INFO - [Task 3 | ep 3 | step 300] loss=4.7379 c=0.2851 r=3.7800 | taskInf=0.6728 | CI_T0=0.00% | CI_T1=0.01% | CI_T2=0.00% | CI_T3=99.89%
2026-02-11 19:36:37,907 - INFO - [Task 3 | ep 3 | step 325] loss=4.6938 c=0.2703 r=3.7554 | taskInf=0.6682 | CI_T0=0.00% | CI_T1=0.00% | CI_T2=0.00% | CI_T3=99.93%
2026-02-11 19:36:53,655 - INFO - [Task 3 | ep 3 | step 350] loss=4.7348 c=0.2390 r=3.8294 | taskInf=0.6664 | CI_T0=0.00% | CI_T1=0.00% | CI_T2=0.00% | CI_T3=99.95%
2026-02-11 19:37:09,305 - INFO - [Task 3 | ep 3 | step 375] loss=4.6048 c=0.2386 r=3.6856 | taskInf=0.6805 | CI_T0=0.00% | CI_T1=0.00% | CI_T2=0.00% | CI_T3=99.94%
2026-02-11 19:37:25,660 - INFO - [After Task 3] Task-IL : T0=53.66% | T1=77.96% | T2=93.22% | T3=99.70% | Avg=81.14%
2026-02-11 19:37:25,660 - INFO - [After Task 3] Class-IL: T0=0.00% | T1=0.00% | T2=0.00% | T3=99.70% | Avg=24.92%
2026-02-11 19:37:25,660 - INFO - ========== GROUP DIFFERENCES ==========
2026-02-11 19:37:25,660 - INFO - Seen tasks: 0..3 | valid_out_dim=8
2026-02-11 19:37:27,655 - INFO - [Group=Task0] CI_acc=0.00% | corr_slice_max=1.860 | best_other_max=5.500 | gap=-3.640
2026-02-11 19:37:27,655 - INFO - [Group=Task0] winner_task_dist: W0=0.0% | W1=0.8% | W2=0.0% | W3=99.2%
2026-02-11 19:37:27,655 - INFO - [Group=Task0] slice_strength : S0=1.86 | S1=2.39 | S2=1.90 | S3=5.50
2026-02-11 19:37:29,668 - INFO - [Group=Task1] CI_acc=0.00% | corr_slice_max=2.013 | best_other_max=6.302 | gap=-4.289
2026-02-11 19:37:29,668 - INFO - [Group=Task1] winner_task_dist: W0=0.0% | W1=0.0% | W2=0.0% | W3=100.0%
2026-02-11 19:37:29,668 - INFO - [Group=Task1] slice_strength : S0=0.55 | S1=2.01 | S2=2.64 | S3=6.30
2026-02-11 19:37:31,663 - INFO - [Group=Task2] CI_acc=0.00% | corr_slice_max=2.695 | best_other_max=6.598 | gap=-3.903
2026-02-11 19:37:31,663 - INFO - [Group=Task2] winner_task_dist: W0=0.0% | W1=0.0% | W2=0.0% | W3=100.0%
2026-02-11 19:37:31,663 - INFO - [Group=Task2] slice_strength : S0=0.29 | S1=2.10 | S2=2.69 | S3=6.60
2026-02-11 19:37:33,671 - INFO - [Group=Task3] CI_acc=99.70% | corr_slice_max=6.641 | best_other_max=3.377 | gap=3.264
2026-02-11 19:37:33,671 - INFO - [Group=Task3] winner_task_dist: W0=0.0% | W1=0.0% | W2=0.0% | W3=100.0%
2026-02-11 19:37:33,671 - INFO - [Group=Task3] slice_strength : S0=0.60 | S1=2.24 | S2=3.03 | S3=6.64
2026-02-11 19:37:33,671 - INFO - ======================================
2026-02-11 19:37:33,672 - INFO - ========== Training Task 4: classes [8, 9] ==========
2026-02-11 19:37:56,354 - INFO - [Task 4 | ep 0 | step 0] loss=22.6109 c=6.5000 r=3.8113 | taskInf=12.2996 | CI_T0=46.47% | CI_T1=0.05% | CI_T2=2.41% | CI_T3=86.65% | CI_T4=0.00%
2026-02-11 19:38:15,915 - INFO - [Task 4 | ep 0 | step 25] loss=12.2328 c=4.0996 r=4.4689 | taskInf=3.6643 | CI_T0=51.64% | CI_T1=1.39% | CI_T2=1.56% | CI_T3=84.18% | CI_T4=0.00%
2026-02-11 19:38:35,469 - INFO - [Task 4 | ep 0 | step 50] loss=8.2739 c=2.1802 r=4.4947 | taskInf=1.5990 | CI_T0=0.00% | CI_T1=3.56% | CI_T2=0.64% | CI_T3=44.73% | CI_T4=25.76%
2026-02-11 19:38:54,902 - INFO - [Task 4 | ep 0 | step 75] loss=6.7425 c=0.9775 r=4.8634 | taskInf=0.9016 | CI_T0=0.00% | CI_T1=0.04% | CI_T2=0.00% | CI_T3=0.00% | CI_T4=83.44%
2026-02-11 19:39:17,773 - INFO - [Task 4 | ep 1 | step 100] loss=6.2885 c=0.5873 r=4.8635 | taskInf=0.8376 | CI_T0=0.00% | CI_T1=0.00% | CI_T2=0.00% | CI_T3=0.00% | CI_T4=95.31%
2026-02-11 19:39:37,163 - INFO - [Task 4 | ep 1 | step 125] loss=6.0127 c=0.4258 r=4.7658 | taskInf=0.8211 | CI_T0=0.00% | CI_T1=0.00% | CI_T2=0.00% | CI_T3=0.00% | CI_T4=97.63%
2026-02-11 19:39:56,694 - INFO - [Task 4 | ep 1 | step 150] loss=5.9570 c=0.4153 r=4.7320 | taskInf=0.8097 | CI_T0=0.00% | CI_T1=0.00% | CI_T2=0.00% | CI_T3=0.00% | CI_T4=98.12%
2026-02-11 19:40:16,167 - INFO - [Task 4 | ep 1 | step 175] loss=5.9268 c=0.3588 r=4.7744 | taskInf=0.7936 | CI_T0=0.00% | CI_T1=0.00% | CI_T2=0.00% | CI_T3=0.00% | CI_T4=98.45%
2026-02-11 19:40:39,061 - INFO - [Task 4 | ep 2 | step 200] loss=5.7599 c=0.3701 r=4.5690 | taskInf=0.8208 | CI_T0=0.00% | CI_T1=0.00% | CI_T2=0.00% | CI_T3=0.00% | CI_T4=98.73%
2026-02-11 19:40:58,373 - INFO - [Task 4 | ep 2 | step 225] loss=5.7108 c=0.3984 r=4.4762 | taskInf=0.8361 | CI_T0=0.00% | CI_T1=0.00% | CI_T2=0.00% | CI_T3=0.01% | CI_T4=98.90%
2026-02-11 19:41:17,739 - INFO - [Task 4 | ep 2 | step 250] loss=5.5489 c=0.3512 r=4.3499 | taskInf=0.8477 | CI_T0=0.00% | CI_T1=0.00% | CI_T2=0.00% | CI_T3=0.00% | CI_T4=99.07%
2026-02-11 19:41:37,210 - INFO - [Task 4 | ep 2 | step 275] loss=5.5216 c=0.3567 r=4.2989 | taskInf=0.8661 | CI_T0=0.00% | CI_T1=0.00% | CI_T2=0.00% | CI_T3=0.00% | CI_T4=99.25%
2026-02-11 19:42:00,263 - INFO - [Task 4 | ep 3 | step 300] loss=5.5265 c=0.3536 r=4.2987 | taskInf=0.8741 | CI_T0=0.00% | CI_T1=0.00% | CI_T2=0.00% | CI_T3=0.00% | CI_T4=99.31%
2026-02-11 19:42:19,826 - INFO - [Task 4 | ep 3 | step 325] loss=5.6460 c=0.3992 r=4.3859 | taskInf=0.8609 | CI_T0=0.00% | CI_T1=0.00% | CI_T2=0.00% | CI_T3=0.00% | CI_T4=99.37%
2026-02-11 19:42:39,447 - INFO - [Task 4 | ep 3 | step 350] loss=5.3283 c=0.3212 r=4.1545 | taskInf=0.8526 | CI_T0=0.00% | CI_T1=0.00% | CI_T2=0.00% | CI_T3=0.00% | CI_T4=99.53%
2026-02-11 19:42:59,781 - INFO - [After Task 4] Task-IL : T0=53.66% | T1=61.85% | T2=93.92% | T3=78.50% | T4=99.04% | Avg=77.39%
2026-02-11 19:42:59,781 - INFO - [After Task 4] Class-IL: T0=0.00% | T1=0.00% | T2=0.00% | T3=0.00% | T4=99.04% | Avg=19.81%
2026-02-11 19:42:59,781 - INFO - ========== GROUP DIFFERENCES ==========
2026-02-11 19:42:59,781 - INFO - Seen tasks: 0..4 | valid_out_dim=10
2026-02-11 19:43:01,766 - INFO - [Group=Task0] CI_acc=0.00% | corr_slice_max=1.525 | best_other_max=5.200 | gap=-3.675
2026-02-11 19:43:01,766 - INFO - [Group=Task0] winner_task_dist: W0=0.0% | W1=0.0% | W2=0.0% | W3=0.0% | W4=100.0%
2026-02-11 19:43:01,766 - INFO - [Group=Task0] slice_strength : S0=1.52 | S1=1.62 | S2=1.48 | S3=2.46 | S4=5.20
2026-02-11 19:43:03,768 - INFO - [Group=Task1] CI_acc=0.00% | corr_slice_max=1.406 | best_other_max=5.860 | gap=-4.454
2026-02-11 19:43:03,768 - INFO - [Group=Task1] winner_task_dist: W0=0.0% | W1=0.0% | W2=0.0% | W3=0.0% | W4=100.0%
2026-02-11 19:43:03,768 - INFO - [Group=Task1] slice_strength : S0=0.58 | S1=1.41 | S2=1.85 | S3=3.20 | S4=5.86
2026-02-11 19:43:05,767 - INFO - [Group=Task2] CI_acc=0.00% | corr_slice_max=2.157 | best_other_max=6.595 | gap=-4.438
2026-02-11 19:43:05,767 - INFO - [Group=Task2] winner_task_dist: W0=0.0% | W1=0.0% | W2=0.0% | W3=0.0% | W4=100.0%
2026-02-11 19:43:05,767 - INFO - [Group=Task2] slice_strength : S0=0.16 | S1=1.55 | S2=2.16 | S3=3.88 | S4=6.60
2026-02-11 19:43:07,783 - INFO - [Group=Task3] CI_acc=0.00% | corr_slice_max=3.161 | best_other_max=5.986 | gap=-2.826
2026-02-11 19:43:07,783 - INFO - [Group=Task3] winner_task_dist: W0=0.0% | W1=0.0% | W2=0.0% | W3=0.0% | W4=100.0%
2026-02-11 19:43:07,783 - INFO - [Group=Task3] slice_strength : S0=0.28 | S1=1.71 | S2=2.26 | S3=3.16 | S4=5.99
2026-02-11 19:43:09,789 - INFO - [Group=Task4] CI_acc=99.04% | corr_slice_max=6.321 | best_other_max=3.497 | gap=2.824
2026-02-11 19:43:09,789 - INFO - [Group=Task4] winner_task_dist: W0=0.0% | W1=0.0% | W2=0.0% | W3=0.0% | W4=100.0%
2026-02-11 19:43:09,789 - INFO - [Group=Task4] slice_strength : S0=0.65 | S1=2.04 | S2=2.62 | S3=3.35 | S4=6.32
2026-02-11 19:43:09,789 - INFO - ======================================
2026-02-11 19:43:09,789 - INFO - ========== FINAL METRICS (Class-IL) ==========
2026-02-11 19:43:09,789 - INFO - Forgetting per task: T0=99.95%, T1=92.26%, T2=99.68%, T3=99.70%, T4=0.00%
2026-02-11 19:43:09,789 - INFO - BWT: -97.90%
2026-02-11 19:43:09,789 - INFO - Final average Class-IL accuracy: 19.81%
