2026-02-11 20:46:37,397 - INFO - Device: cuda
2026-02-11 20:46:37,398 - INFO - LR=0.005, EPOCHS_PER_TASK=4, BATCH_SIZE=128
2026-02-11 20:46:37,400 - INFO - LAMBDA_SLICE=2.0, LAMBDA_FEAT=0.5, USE_COSINE_HEAD=True
2026-02-11 20:46:37,407 - INFO - ========== Training Task 0: classes [0, 1] ==========
2026-02-11 20:46:39,679 - INFO - [Task 0 | ep 0 | step 0] loss=0.8633 c=0.8633 r=0.0000 | CI_T0=97.18%
2026-02-11 20:46:42,435 - INFO - [Task 0 | ep 0 | step 25] loss=0.0014 c=0.0014 r=0.0000 | CI_T0=99.93%
2026-02-11 20:46:46,041 - INFO - [Task 0 | ep 0 | step 50] loss=0.0007 c=0.0007 r=0.0000 | CI_T0=99.84%
2026-02-11 20:46:48,929 - INFO - [Task 0 | ep 0 | step 75] loss=0.0003 c=0.0003 r=0.0000 | CI_T0=99.97%
2026-02-11 20:46:51,745 - INFO - [Task 0 | ep 1 | step 100] loss=0.0003 c=0.0003 r=0.0000 | CI_T0=99.93%
2026-02-11 20:46:54,416 - INFO - [Task 0 | ep 1 | step 125] loss=0.0005 c=0.0005 r=0.0000 | CI_T0=99.94%
2026-02-11 20:46:58,074 - INFO - [Task 0 | ep 1 | step 150] loss=0.0003 c=0.0003 r=0.0000 | CI_T0=99.94%
2026-02-11 20:47:00,809 - INFO - [Task 0 | ep 1 | step 175] loss=0.0002 c=0.0002 r=0.0000 | CI_T0=99.98%
2026-02-11 20:47:03,615 - INFO - [Task 0 | ep 2 | step 200] loss=0.0001 c=0.0001 r=0.0000 | CI_T0=99.97%
2026-02-11 20:47:06,381 - INFO - [Task 0 | ep 2 | step 225] loss=0.0001 c=0.0001 r=0.0000 | CI_T0=99.93%
2026-02-11 20:47:09,799 - INFO - [Task 0 | ep 2 | step 250] loss=0.0008 c=0.0008 r=0.0000 | CI_T0=99.98%
2026-02-11 20:47:12,822 - INFO - [Task 0 | ep 2 | step 275] loss=0.0002 c=0.0002 r=0.0000 | CI_T0=99.98%
2026-02-11 20:47:15,585 - INFO - [Task 0 | ep 3 | step 300] loss=0.0002 c=0.0002 r=0.0000 | CI_T0=99.98%
2026-02-11 20:47:18,335 - INFO - [Task 0 | ep 3 | step 325] loss=0.0001 c=0.0001 r=0.0000 | CI_T0=99.98%
2026-02-11 20:47:21,231 - INFO - [Task 0 | ep 3 | step 350] loss=0.0007 c=0.0007 r=0.0000 | CI_T0=99.92%
2026-02-11 20:47:24,609 - INFO - [Task 0 | ep 3 | step 375] loss=0.0049 c=0.0049 r=0.0000 | CI_T0=99.99%
2026-02-11 20:47:25,795 - INFO - [After Task 0] Task-IL : T0=99.90% | Avg=99.90%
2026-02-11 20:47:25,796 - INFO - [After Task 0] Class-IL: T0=99.90% | Avg=99.90%
2026-02-11 20:47:25,796 - INFO - ========== GROUP DIFFERENCES ==========
2026-02-11 20:47:25,797 - INFO - Seen tasks: 0..0 | valid_out_dim=2
2026-02-11 20:47:26,230 - INFO - [Group=Task0] CI_acc=99.90% | corr_slice_max=4.738 | best_other_max=nan | gap=nan
2026-02-11 20:47:26,231 - INFO - [Group=Task0] winner_task_dist: W0=100.0%
2026-02-11 20:47:26,233 - INFO - [Group=Task0] slice_strength : S0=4.74
2026-02-11 20:47:26,234 - INFO - ======================================
2026-02-11 20:47:26,235 - INFO - ========== Training Task 1: classes [2, 3] ==========
2026-02-11 20:47:30,621 - INFO - [Task 1 | ep 0 | step 0] loss=7.0903 c=3.8743 r=3.2161 | CI_T0=99.82% | CI_T1=21.14%
2026-02-11 20:47:36,268 - INFO - [Task 1 | ep 0 | step 25] loss=1.2504 c=0.1038 r=1.1465 | CI_T0=4.13% | CI_T1=95.30%
2026-02-11 20:47:40,969 - INFO - [Task 1 | ep 0 | step 50] loss=0.9128 c=0.1191 r=0.7936 | CI_T0=12.76% | CI_T1=97.67%
2026-02-11 20:47:45,717 - INFO - [Task 1 | ep 0 | step 75] loss=0.7966 c=0.0726 r=0.7240 | CI_T0=4.37% | CI_T1=97.92%
2026-02-11 20:47:51,655 - INFO - [Task 1 | ep 1 | step 100] loss=0.7499 c=0.0774 r=0.6724 | CI_T0=4.34% | CI_T1=98.32%
2026-02-11 20:47:56,392 - INFO - [Task 1 | ep 1 | step 125] loss=0.9335 c=0.0641 r=0.8693 | CI_T0=0.33% | CI_T1=98.75%
2026-02-11 20:48:02,131 - INFO - [Task 1 | ep 1 | step 150] loss=0.5985 c=0.0643 r=0.5342 | CI_T0=8.27% | CI_T1=98.88%
2026-02-11 20:48:06,909 - INFO - [Task 1 | ep 1 | step 175] loss=0.6033 c=0.1267 r=0.4766 | CI_T0=14.76% | CI_T1=98.72%
2026-02-11 20:48:12,535 - INFO - [Task 1 | ep 2 | step 200] loss=0.7881 c=0.0873 r=0.7008 | CI_T0=5.71% | CI_T1=99.01%
2026-02-11 20:48:17,509 - INFO - [Task 1 | ep 2 | step 225] loss=0.5586 c=0.0483 r=0.5103 | CI_T0=9.73% | CI_T1=99.12%
2026-02-11 20:48:22,366 - INFO - [Task 1 | ep 2 | step 250] loss=0.7121 c=0.1090 r=0.6030 | CI_T0=9.46% | CI_T1=99.15%
2026-02-11 20:48:28,142 - INFO - [Task 1 | ep 2 | step 275] loss=0.8456 c=0.0585 r=0.7871 | CI_T0=5.32% | CI_T1=99.18%
2026-02-11 20:48:32,988 - INFO - [Task 1 | ep 3 | step 300] loss=0.6077 c=0.0481 r=0.5596 | CI_T0=16.72% | CI_T1=99.34%
2026-02-11 20:48:38,778 - INFO - [Task 1 | ep 3 | step 325] loss=0.6453 c=0.0471 r=0.5982 | CI_T0=2.01% | CI_T1=99.13%
2026-02-11 20:48:43,693 - INFO - [Task 1 | ep 3 | step 350] loss=0.7668 c=0.0620 r=0.7047 | CI_T0=3.41% | CI_T1=99.38%
2026-02-11 20:48:48,463 - INFO - [Task 1 | ep 3 | step 375] loss=0.6773 c=0.0375 r=0.6398 | CI_T0=0.47% | CI_T1=99.44%
2026-02-11 20:48:51,089 - INFO - [After Task 1] Task-IL : T0=99.90% | T1=99.27% | Avg=99.59%
2026-02-11 20:48:51,091 - INFO - [After Task 1] Class-IL: T0=0.29% | T1=99.22% | Avg=49.76%
2026-02-11 20:48:51,091 - INFO - ========== GROUP DIFFERENCES ==========
2026-02-11 20:48:51,093 - INFO - Seen tasks: 0..1 | valid_out_dim=4
2026-02-11 20:48:51,645 - INFO - [Group=Task0] CI_acc=0.29% | corr_slice_max=4.638 | best_other_max=5.716 | gap=-1.078
2026-02-11 20:48:51,646 - INFO - [Group=Task0] winner_task_dist: W0=0.3% | W1=99.7%
2026-02-11 20:48:51,648 - INFO - [Group=Task0] slice_strength : S0=4.64 | S1=5.72
2026-02-11 20:48:52,053 - INFO - [Group=Task1] CI_acc=99.22% | corr_slice_max=7.041 | best_other_max=2.054 | gap=4.988
2026-02-11 20:48:52,054 - INFO - [Group=Task1] winner_task_dist: W0=0.0% | W1=100.0%
2026-02-11 20:48:52,055 - INFO - [Group=Task1] slice_strength : S0=2.05 | S1=7.04
2026-02-11 20:48:52,056 - INFO - ======================================
2026-02-11 20:48:52,057 - INFO - ========== Training Task 2: classes [4, 5] ==========
2026-02-11 20:48:58,196 - INFO - [Task 2 | ep 0 | step 0] loss=7.9422 c=6.3017 r=1.6405 | CI_T0=0.36% | CI_T1=99.46% | CI_T2=0.00%
2026-02-11 20:49:05,798 - INFO - [Task 2 | ep 0 | step 25] loss=1.3419 c=0.5174 r=0.8245 | CI_T0=1.60% | CI_T1=31.07% | CI_T2=87.99%
2026-02-11 20:49:12,472 - INFO - [Task 2 | ep 0 | step 50] loss=1.3205 c=0.2932 r=1.0273 | CI_T0=4.12% | CI_T1=41.87% | CI_T2=94.91%
2026-02-11 20:49:20,086 - INFO - [Task 2 | ep 0 | step 75] loss=0.7188 c=0.2067 r=0.5121 | CI_T0=1.00% | CI_T1=35.98% | CI_T2=97.68%
2026-02-11 20:49:26,856 - INFO - [Task 2 | ep 1 | step 100] loss=1.0082 c=0.1678 r=0.8404 | CI_T0=0.02% | CI_T1=30.02% | CI_T2=97.89%
2026-02-11 20:49:34,246 - INFO - [Task 2 | ep 1 | step 125] loss=0.7375 c=0.1944 r=0.5431 | CI_T0=0.16% | CI_T1=29.90% | CI_T2=98.90%
2026-02-11 20:49:41,777 - INFO - [Task 2 | ep 1 | step 150] loss=1.0502 c=0.1348 r=0.9154 | CI_T0=0.02% | CI_T1=32.80% | CI_T2=98.87%
2026-02-11 20:49:48,574 - INFO - [Task 2 | ep 2 | step 175] loss=0.5901 c=0.1171 r=0.4730 | CI_T0=1.24% | CI_T1=26.85% | CI_T2=99.66%
2026-02-11 20:49:56,289 - INFO - [Task 2 | ep 2 | step 200] loss=0.5724 c=0.1145 r=0.4579 | CI_T0=3.10% | CI_T1=24.26% | CI_T2=99.69%
2026-02-11 20:50:03,047 - INFO - [Task 2 | ep 2 | step 225] loss=0.6729 c=0.1117 r=0.5612 | CI_T0=3.43% | CI_T1=19.73% | CI_T2=99.66%
2026-02-11 20:50:10,643 - INFO - [Task 2 | ep 2 | step 250] loss=0.5442 c=0.1233 r=0.4209 | CI_T0=0.49% | CI_T1=25.20% | CI_T2=99.75%
2026-02-11 20:50:17,813 - INFO - [Task 2 | ep 3 | step 275] loss=0.6320 c=0.0888 r=0.5432 | CI_T0=0.13% | CI_T1=25.02% | CI_T2=99.78%
2026-02-11 20:50:25,058 - INFO - [Task 2 | ep 3 | step 300] loss=0.5312 c=0.0800 r=0.4512 | CI_T0=0.96% | CI_T1=24.31% | CI_T2=99.83%
2026-02-11 20:50:32,724 - INFO - [Task 2 | ep 3 | step 325] loss=0.7696 c=0.0821 r=0.6875 | CI_T0=0.12% | CI_T1=21.09% | CI_T2=99.84%
2026-02-11 20:50:35,678 - INFO - [After Task 2] Task-IL : T0=99.95% | T1=98.80% | T2=99.83% | Avg=99.53%
2026-02-11 20:50:35,679 - INFO - [After Task 2] Class-IL: T0=0.34% | T1=18.12% | T2=99.61% | Avg=39.36%
2026-02-11 20:50:35,681 - INFO - ========== GROUP DIFFERENCES ==========
2026-02-11 20:50:35,682 - INFO - Seen tasks: 0..2 | valid_out_dim=6
2026-02-11 20:50:36,156 - INFO - [Group=Task0] CI_acc=0.34% | corr_slice_max=4.967 | best_other_max=6.911 | gap=-1.944
2026-02-11 20:50:36,157 - INFO - [Group=Task0] winner_task_dist: W0=0.3% | W1=3.0% | W2=96.6%
2026-02-11 20:50:36,159 - INFO - [Group=Task0] slice_strength : S0=4.97 | S1=5.72 | S2=6.90
2026-02-11 20:50:36,582 - INFO - [Group=Task1] CI_acc=18.07% | corr_slice_max=6.942 | best_other_max=8.407 | gap=-1.465
2026-02-11 20:50:36,583 - INFO - [Group=Task1] winner_task_dist: W0=0.0% | W1=18.1% | W2=81.9%
2026-02-11 20:50:36,585 - INFO - [Group=Task1] slice_strength : S0=2.22 | S1=6.94 | S2=8.41
2026-02-11 20:50:36,998 - INFO - [Group=Task2] CI_acc=99.67% | corr_slice_max=9.389 | best_other_max=6.014 | gap=3.375
2026-02-11 20:50:36,999 - INFO - [Group=Task2] winner_task_dist: W0=0.0% | W1=0.2% | W2=99.8%
2026-02-11 20:50:37,001 - INFO - [Group=Task2] slice_strength : S0=2.21 | S1=6.01 | S2=9.39
2026-02-11 20:50:37,001 - INFO - ======================================
2026-02-11 20:50:37,002 - INFO - ========== Training Task 3: classes [6, 7] ==========
2026-02-11 20:50:46,224 - INFO - [Task 3 | ep 0 | step 0] loss=9.8133 c=8.5969 r=1.2164 | CI_T0=0.06% | CI_T1=19.02% | CI_T2=99.91% | CI_T3=0.00%
2026-02-11 20:50:55,527 - INFO - [Task 3 | ep 0 | step 25] loss=1.5188 c=0.4158 r=1.1030 | CI_T0=0.00% | CI_T1=15.75% | CI_T2=59.18% | CI_T3=95.21%
2026-02-11 20:51:04,743 - INFO - [Task 3 | ep 0 | step 50] loss=1.1196 c=0.3080 r=0.8117 | CI_T0=0.00% | CI_T1=13.49% | CI_T2=75.59% | CI_T3=94.93%
2026-02-11 20:51:14,429 - INFO - [Task 3 | ep 0 | step 75] loss=0.8224 c=0.2473 r=0.5751 | CI_T0=0.00% | CI_T1=8.87% | CI_T2=74.43% | CI_T3=97.11%
2026-02-11 20:51:24,256 - INFO - [Task 3 | ep 1 | step 100] loss=0.7901 c=0.2251 r=0.5650 | CI_T0=0.00% | CI_T1=11.07% | CI_T2=74.29% | CI_T3=98.05%
2026-02-11 20:51:33,424 - INFO - [Task 3 | ep 1 | step 125] loss=0.6806 c=0.1846 r=0.4960 | CI_T0=0.00% | CI_T1=11.29% | CI_T2=70.50% | CI_T3=98.45%
2026-02-11 20:51:42,752 - INFO - [Task 3 | ep 1 | step 150] loss=0.7890 c=0.1724 r=0.6166 | CI_T0=0.00% | CI_T1=9.31% | CI_T2=68.94% | CI_T3=98.81%
2026-02-11 20:51:52,637 - INFO - [Task 3 | ep 1 | step 175] loss=0.7103 c=0.1563 r=0.5540 | CI_T0=0.00% | CI_T1=10.36% | CI_T2=66.39% | CI_T3=99.11%
2026-02-11 20:52:02,504 - INFO - [Task 3 | ep 2 | step 200] loss=0.6691 c=0.1350 r=0.5341 | CI_T0=0.00% | CI_T1=9.44% | CI_T2=63.79% | CI_T3=99.42%
2026-02-11 20:52:11,978 - INFO - [Task 3 | ep 2 | step 225] loss=0.7039 c=0.1217 r=0.5822 | CI_T0=0.00% | CI_T1=7.48% | CI_T2=63.12% | CI_T3=99.51%
2026-02-11 20:52:20,901 - INFO - [Task 3 | ep 2 | step 250] loss=0.7109 c=0.1177 r=0.5932 | CI_T0=0.00% | CI_T1=7.15% | CI_T2=62.54% | CI_T3=99.57%
2026-02-11 20:52:30,666 - INFO - [Task 3 | ep 2 | step 275] loss=0.5880 c=0.1399 r=0.4481 | CI_T0=0.00% | CI_T1=7.45% | CI_T2=55.55% | CI_T3=99.72%
2026-02-11 20:52:40,560 - INFO - [Task 3 | ep 3 | step 300] loss=0.6487 c=0.1084 r=0.5402 | CI_T0=0.00% | CI_T1=7.94% | CI_T2=55.64% | CI_T3=99.70%
2026-02-11 20:52:50,239 - INFO - [Task 3 | ep 3 | step 325] loss=0.5734 c=0.1072 r=0.4662 | CI_T0=0.00% | CI_T1=5.68% | CI_T2=56.29% | CI_T3=99.70%
2026-02-11 20:52:59,126 - INFO - [Task 3 | ep 3 | step 350] loss=0.6159 c=0.0891 r=0.5268 | CI_T0=0.00% | CI_T1=4.70% | CI_T2=53.45% | CI_T3=99.77%
2026-02-11 20:53:08,893 - INFO - [Task 3 | ep 3 | step 375] loss=0.6898 c=0.0995 r=0.5902 | CI_T0=0.00% | CI_T1=6.36% | CI_T2=54.39% | CI_T3=99.86%
2026-02-11 20:53:12,143 - INFO - [After Task 3] Task-IL : T0=99.90% | T1=98.59% | T2=99.83% | T3=99.84% | Avg=99.54%
2026-02-11 20:53:12,144 - INFO - [After Task 3] Class-IL: T0=0.00% | T1=5.47% | T2=54.07% | T3=99.48% | Avg=39.76%
2026-02-11 20:53:12,147 - INFO - ========== GROUP DIFFERENCES ==========
2026-02-11 20:53:12,149 - INFO - Seen tasks: 0..3 | valid_out_dim=8
2026-02-11 20:53:12,577 - INFO - [Group=Task0] CI_acc=0.00% | corr_slice_max=5.170 | best_other_max=9.122 | gap=-3.952
2026-02-11 20:53:12,579 - INFO - [Group=Task0] winner_task_dist: W0=0.0% | W1=0.0% | W2=4.8% | W3=95.2%
2026-02-11 20:53:12,579 - INFO - [Group=Task0] slice_strength : S0=5.17 | S1=5.92 | S2=7.06 | S3=9.09
2026-02-11 20:53:12,999 - INFO - [Group=Task1] CI_acc=5.05% | corr_slice_max=7.123 | best_other_max=9.643 | gap=-2.520
2026-02-11 20:53:13,001 - INFO - [Group=Task1] winner_task_dist: W0=0.0% | W1=5.1% | W2=40.4% | W3=54.5%
2026-02-11 20:53:13,002 - INFO - [Group=Task1] slice_strength : S0=2.22 | S1=7.12 | S2=8.52 | S3=9.00
2026-02-11 20:53:13,563 - INFO - [Group=Task2] CI_acc=54.85% | corr_slice_max=9.585 | best_other_max=9.357 | gap=0.228
2026-02-11 20:53:13,566 - INFO - [Group=Task2] winner_task_dist: W0=0.0% | W1=0.0% | W2=54.9% | W3=45.1%
2026-02-11 20:53:13,567 - INFO - [Group=Task2] slice_strength : S0=2.23 | S1=6.04 | S2=9.59 | S3=9.34
2026-02-11 20:53:14,196 - INFO - [Group=Task3] CI_acc=99.48% | corr_slice_max=11.192 | best_other_max=8.249 | gap=2.943
2026-02-11 20:53:14,198 - INFO - [Group=Task3] winner_task_dist: W0=0.0% | W1=0.0% | W2=0.4% | W3=99.6%
2026-02-11 20:53:14,199 - INFO - [Group=Task3] slice_strength : S0=2.64 | S1=5.78 | S2=8.24 | S3=11.19
2026-02-11 20:53:14,200 - INFO - ======================================
2026-02-11 20:53:14,201 - INFO - ========== Training Task 4: classes [8, 9] ==========
2026-02-11 20:53:25,032 - INFO - [Task 4 | ep 0 | step 0] loss=12.3622 c=10.2803 r=2.0819 | CI_T0=0.00% | CI_T1=6.09% | CI_T2=54.53% | CI_T3=99.86% | CI_T4=0.00%
2026-02-11 20:53:36,801 - INFO - [Task 4 | ep 0 | step 25] loss=1.7687 c=0.4807 r=1.2880 | CI_T0=0.00% | CI_T1=0.12% | CI_T2=0.70% | CI_T3=34.90% | CI_T4=93.47%
2026-02-11 20:53:48,488 - INFO - [Task 4 | ep 0 | step 50] loss=1.0968 c=0.3974 r=0.6995 | CI_T0=0.00% | CI_T1=0.02% | CI_T2=1.08% | CI_T3=46.64% | CI_T4=94.47%
2026-02-11 20:54:00,501 - INFO - [Task 4 | ep 0 | step 75] loss=1.0793 c=0.4090 r=0.6702 | CI_T0=0.00% | CI_T1=0.02% | CI_T2=0.32% | CI_T3=48.40% | CI_T4=95.66%
2026-02-11 20:54:12,341 - INFO - [Task 4 | ep 1 | step 100] loss=0.9848 c=0.3302 r=0.6545 | CI_T0=0.00% | CI_T1=0.01% | CI_T2=0.23% | CI_T3=44.98% | CI_T4=96.67%
2026-02-11 20:54:24,241 - INFO - [Task 4 | ep 1 | step 125] loss=0.8398 c=0.3061 r=0.5337 | CI_T0=0.00% | CI_T1=0.00% | CI_T2=0.26% | CI_T3=43.94% | CI_T4=97.09%
2026-02-11 20:54:36,025 - INFO - [Task 4 | ep 1 | step 150] loss=0.7563 c=0.2673 r=0.4890 | CI_T0=0.00% | CI_T1=0.00% | CI_T2=0.13% | CI_T3=41.45% | CI_T4=97.72%
2026-02-11 20:54:47,837 - INFO - [Task 4 | ep 1 | step 175] loss=0.6737 c=0.1966 r=0.4771 | CI_T0=0.00% | CI_T1=0.00% | CI_T2=0.09% | CI_T3=37.24% | CI_T4=98.23%
2026-02-11 20:54:59,925 - INFO - [Task 4 | ep 2 | step 200] loss=0.6877 c=0.1989 r=0.4888 | CI_T0=0.00% | CI_T1=0.00% | CI_T2=0.24% | CI_T3=36.64% | CI_T4=98.42%
2026-02-11 20:55:11,785 - INFO - [Task 4 | ep 2 | step 225] loss=0.7857 c=0.2120 r=0.5737 | CI_T0=0.00% | CI_T1=0.00% | CI_T2=0.39% | CI_T3=37.91% | CI_T4=98.54%
2026-02-11 20:55:23,638 - INFO - [Task 4 | ep 2 | step 250] loss=0.9362 c=0.1448 r=0.7914 | CI_T0=0.00% | CI_T1=0.00% | CI_T2=0.16% | CI_T3=33.95% | CI_T4=98.72%
2026-02-11 20:55:35,409 - INFO - [Task 4 | ep 2 | step 275] loss=0.8115 c=0.1764 r=0.6352 | CI_T0=0.00% | CI_T1=0.00% | CI_T2=0.30% | CI_T3=33.71% | CI_T4=98.85%
2026-02-11 20:55:47,449 - INFO - [Task 4 | ep 3 | step 300] loss=0.6552 c=0.1518 r=0.5034 | CI_T0=0.00% | CI_T1=0.00% | CI_T2=0.13% | CI_T3=31.15% | CI_T4=99.03%
2026-02-11 20:55:59,684 - INFO - [Task 4 | ep 3 | step 325] loss=0.6117 c=0.1618 r=0.4499 | CI_T0=0.00% | CI_T1=0.00% | CI_T2=0.16% | CI_T3=32.14% | CI_T4=99.05%
2026-02-11 20:56:11,655 - INFO - [Task 4 | ep 3 | step 350] loss=0.6520 c=0.1541 r=0.4980 | CI_T0=0.00% | CI_T1=0.00% | CI_T2=0.28% | CI_T3=26.30% | CI_T4=99.14%
2026-02-11 20:56:16,284 - INFO - [After Task 4] Task-IL : T0=99.90% | T1=98.70% | T2=99.72% | T3=99.74% | T4=99.06% | Avg=99.42%
2026-02-11 20:56:16,285 - INFO - [After Task 4] Class-IL: T0=0.00% | T1=0.00% | T2=0.11% | T3=29.27% | T4=99.06% | Avg=25.69%
2026-02-11 20:56:16,286 - INFO - ========== GROUP DIFFERENCES ==========
2026-02-11 20:56:16,288 - INFO - Seen tasks: 0..4 | valid_out_dim=10
2026-02-11 20:56:16,745 - INFO - [Group=Task0] CI_acc=0.00% | corr_slice_max=5.066 | best_other_max=10.666 | gap=-5.600
2026-02-11 20:56:16,746 - INFO - [Group=Task0] winner_task_dist: W0=0.0% | W1=0.0% | W2=0.0% | W3=8.6% | W4=91.4%
2026-02-11 20:56:16,748 - INFO - [Group=Task0] slice_strength : S0=5.07 | S1=5.87 | S2=7.10 | S3=8.92 | S4=10.63
2026-02-11 20:56:17,180 - INFO - [Group=Task1] CI_acc=0.00% | corr_slice_max=6.943 | best_other_max=11.580 | gap=-4.637
2026-02-11 20:56:17,181 - INFO - [Group=Task1] winner_task_dist: W0=0.0% | W1=0.0% | W2=0.1% | W3=6.0% | W4=94.0%
2026-02-11 20:56:17,181 - INFO - [Group=Task1] slice_strength : S0=2.10 | S1=6.94 | S2=8.32 | S3=9.02 | S4=11.54
2026-02-11 20:56:17,583 - INFO - [Group=Task2] CI_acc=0.11% | corr_slice_max=9.392 | best_other_max=12.287 | gap=-2.895
2026-02-11 20:56:17,585 - INFO - [Group=Task2] winner_task_dist: W0=0.0% | W1=0.0% | W2=0.1% | W3=0.5% | W4=99.4%
2026-02-11 20:56:17,586 - INFO - [Group=Task2] slice_strength : S0=2.11 | S1=6.03 | S2=9.39 | S3=9.41 | S4=12.29
2026-02-11 20:56:18,000 - INFO - [Group=Task3] CI_acc=29.48% | corr_slice_max=10.967 | best_other_max=11.692 | gap=-0.725
2026-02-11 20:56:18,001 - INFO - [Group=Task3] winner_task_dist: W0=0.0% | W1=0.0% | W2=0.0% | W3=29.5% | W4=70.5%
2026-02-11 20:56:18,003 - INFO - [Group=Task3] slice_strength : S0=2.52 | S1=5.76 | S2=8.09 | S3=10.97 | S4=11.69
2026-02-11 20:56:18,452 - INFO - [Group=Task4] CI_acc=99.06% | corr_slice_max=12.952 | best_other_max=10.245 | gap=2.708
2026-02-11 20:56:18,452 - INFO - [Group=Task4] winner_task_dist: W0=0.0% | W1=0.0% | W2=0.0% | W3=0.0% | W4=100.0%
2026-02-11 20:56:18,453 - INFO - [Group=Task4] slice_strength : S0=2.21 | S1=6.07 | S2=8.35 | S3=10.16 | S4=12.95
2026-02-11 20:56:18,455 - INFO - ======================================
2026-02-11 20:56:18,456 - INFO - ========== FINAL METRICS (Class-IL) ==========
2026-02-11 20:56:18,457 - INFO - Forgetting per task: T0=99.90%, T1=99.22%, T2=99.50%, T3=70.21%, T4=0.00%
2026-02-11 20:56:18,458 - INFO - BWT: -92.21%
2026-02-11 20:56:18,459 - INFO - Final average Class-IL accuracy: 25.69%
